Sheet: ReadMe
D1: of:=HYPERLINK("#REQUIREMENTS"; "• REQUIREMENTS") -> • REQUIREMENTS
D2: of:=HYPERLINK("#USING_THIS_SHEET"; "• USING THIS SHEET") -> • USING THIS SHEET
D3: of:=HYPERLINK("#LICENSE"; "• LICENSE") -> • LICENSE
D4: of:=HYPERLINK("#CHANGES"; "• CHANGES") -> • CHANGES
A5: Character Helper | D5: of:=HYPERLINK("#TODO"; "• TODO") -> • TODO
A6: of:=HYPERLINK("https://github.com/bblackmoor/kalos"; "Version "&META_VERSION) -> Version 4.0.30.x
A7: of:=HYPERLINK("https://www.kaloscomics.com/") -> https://www.kaloscomics.com/
A9: of:=HYPERLINK("#A1"; "Top 🡅") -> Top 🡅
A10: Requirements
A11: 1) A Kalos Mechanism game, such as Bulletproof Blues
B12: You should also read the "Using This Sheet" section, below.
A14: 2) LibreOffice
B15: LibreOffice 7.4.5.1 (or newer)
B16: of:=HYPERLINK("https://www.libreoffice.org/") -> https://www.libreoffice.org/
A18: 3) Fonts
B19: Barlow family
B20: of:=HYPERLINK("https://fonts.google.com/specimen/Barlow") -> https://fonts.google.com/specimen/Barlow
B21: of:=HYPERLINK("https://fonts.google.com/specimen/Barlow+Condensed") -> https://fonts.google.com/specimen/Barlow+Condensed
B22: of:=HYPERLINK("https://fonts.google.com/specimen/Barlow+Semi+Condensed") -> https://fonts.google.com/specimen/Barlow+Semi+Condensed
B23: Engebrechtre family
B24: of:=HYPERLINK("https://typodermicfonts.com/engebrechtre/") -> https://typodermicfonts.com/engebrechtre/
A26: of:=HYPERLINK("#A1"; "Top 🡅") -> Top 🡅
A27: Using This Sheet
A28: 1) Do this first
B29: Before you use this sheet, save it as a new file name.
A30: of:=(HYPERLINK("#A1"; "Top 🡅")) -> Top 🡅 | B30: 🡄 Ctrl+click this link. It will take you to the top of the current sheet.
B31: 🡄 Type into cells like this. This cell is an input field.
B32: 🡄 Click cells like this and select something. This cell is a select box.
B33: 🡄 Click cells like this, and copy by pressing Ctrl+c. This cell has data for you to copy and paste elsewhere.
B34: Do not click or edit any other cells.
A36: 2) Disable regular expressions
B37: In order for the lookup tables to work correctly, regular expressions in formulas must be disabled.
B38: This setting is located at menu item Tools >> Options >> LibreOffice Calc >> Calculate
B39: Select "No wildcards or regular expressions in formulas."
A41: of:=HYPERLINK("#A1"; "Top 🡅") -> Top 🡅
A42: License
A43: Copyright 2012-2023 Brandon Blackmoor
A44: This work is licensed under a Creative Commons Attribution-ShareAlike 4.0 License.
A45: of:=HYPERLINK("https://creativecommons.org/licenses/by-sa/4.0/") -> https://creativecommons.org/licenses/by-sa/4.0/
A47: of:=HYPERLINK("#A1"; "Top 🡅") -> Top 🡅
A48: Changes
A49: 4.0.30.x | B49: 2023-06-20 | C49: Complete review of power descriptions.
A50: 4.0.29.x | B50: 2023-05-31 | C50: Adding cost pyramid to power cost.
A51: 4.0.28.x | B51: 2023-05-17 | C51: Removing attributes and rebalancing.
A52: 4.0.28 | B52: 2023-05-15 | C52: Fixing more AV Planner bugs. Fixed Duplication error.
A53: 4.0.27 | B53: 2023-05-15 | C53: Fixing AV Planner bug.
A54: 4.0.26 | B54: 2023-05-14 | C54: Adjusting "AV Planner" tab.
A55: 4.0.25 | B55: 2023-05-13 | C55: Testing with characters.
A56: 4.0.24 | B56: 2023-05-12 | C56: Changed Mulish font to Barlow.
A57: 4.0.23 | B57: 2023-05-11 | C57: Added "AV Planner" tab.
A58: 4.0.22 | B58: 2023-05-10 | C58: Added “Weak” as an attribute descriptor; added "Class X, Y, etc." as attribute descriptors.
A59: 4.0.21 | B59: 2023-02-04 | C59: Fixing Equipment bugs.
A60: 4.0.20 | B60: 2023-01-25 | C60: Added Explosives And Grenades to Equipment. Cleanup and testing.
A61: 4.0.19 | B61: 2023-01-05 | C61: Added more to Equipment sheet.
A62: 4.0.18 | B62: 2023-01-05 | C62: Cleaning up Equipment print values and various other bugs.
A63: 4.0.17 | B63: 2022-12-29 | C63: Changing newlines to CHAR(13)&CHAR(10).
A64: 4.0.16 | B64: 2022-12-27 | C64: Added Armor, still working on Equipment.
A65: of:="4.0.15" -> 4.0.15 | B65: 2022-12-24 | C65: Intermediate save.
A66: of:="4.0.14" -> 4.0.14 | B66: 2022-12-21 | C66: Complete redesign of cell styles.
A67: of:="4.0.13" -> 4.0.13 | B67: 2022-12-16 | C67: Complete recalculation of benchmarks.
A68: of:="4.0.12" -> 4.0.12 | B68: 2022-05-17 | C68: Cleaning up unused tables; extending attribute tables to 21+; adding MediaWiki export code.
A69: of:="4.0.11" -> 4.0.11 | B69: 2022-05-06 | C69: Updating Tables sheet to add wiki table formatting.
A70: of:="4.0.10" -> 4.0.10 | B70: 2022-05-04 | C70: Updating character sheets. Magic tab is hidden for now. (Abracadabra! It's gone!)
A71: of:="4.0.9" -> 4.0.9 | B71: 2022-05-02 | C71: Updating gift and power descriptions.
A72: of:="4.0.8" -> 4.0.8 | B72: 2022-04-25 | C72: Sweeping changes pertaining to equipment.
A73: of:="4.0.7" -> 4.0.7 | B73: 2022-04-03 | C73: Removed [Detect] Element, made so many other changes...
A74: of:="4.0.6" -> 4.0.6 | B74: 2022-03-30 | C74: Changed Epithet to Concept. Added Health, Health Drain, Health Theft, Super Health. Changed all costs to Triangular Number Sequence.
A75: of:="4.0.5" -> 4.0.5 | B75: 2022-03-24 | C75: Minor fix to PrintSheets.
A76: of:="4.0.4" -> 4.0.4 | B76: 2022-03-24 | C76: Minor fix to TextSheet, WikiSheet.
A77: of:="4.0.3" -> 4.0.3 | B77: 2022-03-23 | C77: Added power boosts.
A78: of:="4.0.2" -> 4.0.2 | B78: 2022-03-10 | C78: Changed Vulnerability to Weakness.
A79: of:="4.0.1" -> 4.0.1 | B79: 2022-02-22 | C79: Fixed several IS_SUPERHEROIC related bugs.
A80: of:="4.0" -> 4.0 | B80: 2022-02-22 | C80: Testing version 4.
A81: of:="3.57" -> 3.57 | B81: 2022-02-21 | C81: Added Extra Action to Plot Points. Added Ultra-powers to Reference Sheet. Fixed print ranges. Fixed Text Sheet and Wiki Sheet. Cleaned up modern equipment table. Fixed Teleportation and Tunneling. Removed Power Modifiers tab.
A82: of:="3.56" -> 3.56 | B82: 2022-02-17 | C82: Updates for Plot Points, cleaning up powers, cleaning up Print Sheet tab.
A83: of:="3.55" -> 3.55 | B83: 2022-02-03 | C83: Removing Willpower.
A84: of:="3.54" -> 3.54 | B84: 2022-02-03 | C84: Adding powers to Reference Sheet tab.
A85: of:="3.53" -> 3.53 | B85: 2022-01-31 | C85: Revising PrintSheet tab.
A86: of:="3.52" -> 3.52 | B86: 2022-01-24 | C86: Adding "Superheroic" time period
A87: of:="3.51" -> 3.51 | B87: 2022-01-24 | C87: Revising various tables.
A88: of:="3.50" -> 3.50 | B88: 2022-01-24 | C88: Refining Power Level charts.
A89: of:="3.49" -> 3.49 | B89: 2022-01-26 | C89: Adding mediawiki table format for some charts.
A90: of:="3.48" -> 3.48 | B90: 2022-01-24 | C90: Reverting power costs.
A91: of:="3.47" -> 3.47 | B91: 2022-01-24 | C91: Revising attribute and power costs.
A92: of:="3.46" -> 3.46 | B92: 2022-01-22 | C92: Removing bar graph from Endurance and Willpower; revised Magic tab.
A93: of:="3.45" -> 3.45 | B93: 2022-01-20 | C93: Replace +POWER_LEVEL with +SKILL_BONUS in Movement, etc.
A94: of:="3.44" -> 3.44 | B94: 2022-01-19 | C94: Modifying attribute cost to be a "lazy caterer" sequence
A95: of:="3.43" -> 3.43 | B95: 2022-01-19 | C95: Reverting the removal of Power Level, because it is needed for Growth, etc.
A96: of:="3.40" -> 3.40 | B96: 2022-01-12 | C96: Further 4.0 refinements. (Will update the version number to 4 soon.)
A97: of:="3.39" -> 3.39 | B97: 2022-01-06 | C97: Further 4.0 refinements. (Will update the version number to 4 soon.)
A98: of:="3.38" -> 3.38 | B98: 2021-12-29 | C98: Adding Willpower. Making Endurance and Willpower figured attributes.
A99: of:="3.37" -> 3.37 | B99: 2021-12-18 | C99: Minor edits.
A100: of:="3.36" -> 3.36 | B100: 2021-12-10 | C100: Modified reference sheets on the back of the PrintSheet sheets; added Magic tab.
A101: of:="3.35" -> 3.35 | B101: 2021-12-07 | C101: Modified Heroic starting points (Attributes start at 2). Revised Alternate Forms.
A102: of:="3.34" -> 3.34 | B102: 2021-11-27 | C102: Added additional tables for Archaic, Modern, Futuristic.
A103: of:="3.32" -> 3.32 | B103: 2021-11-23 | C103: Added Revised Print character sheets. Added Archetype and Folk options to the Background tab. Added a Settings tab.
A104: of:="3.31" -> 3.31 | B104: 2021-10-23 | C104: Unified superheroic and heroic scales. Added option for heroic scale characters. Added options for archaic and futuristic characters.
A105: of:="3.28" -> 3.28 | B105: 2021-10-01 | C105: Corrected back of printable character sheets.
A106: of:="3.27" -> 3.27 | B106: 2020-09-24 | C106: Added "Obsessed" to Complications; stripped quotation marks from file name links.
A107: of:="3.26" -> 3.26 | B107: 2020-09-22 | C107: Correcting capitalization in Equipment table.
A108: of:="3.25" -> 3.25 | B108: 2020-08-25 | C108: Removing Plot Points from Attributes tab.
A109: of:="3.24" -> 3.24 | B109: 2020-08-24 | C109: Revised Equipment tab.
A110: of:="3.23" -> 3.23 | B110: 2020-08-22 | C110: Making TextSheet and WikiSheet more user friendly.
A111: of:="3.22" -> 3.22 | B111: 2020-07-26 | C111: Simplifying layout.
A112: of:="3.21" -> 3.21 | B112: 2020-07-13 | C112: Changed "Explosive" powers to "Area". Added "Selective Area" powers.
A113: of:="3.20" -> 3.20 | B113: 2020-05-20 | C113: Revised layout of Powers tab.
A114: of:="3.19" -> 3.19 | B114: 2020-05-14 | C114: Revised Print Sheets.
A115: of:="3.18" -> 3.18 | B115: 2020-05-12 | C115: Second printing: changed "close combat" to "hand-to-hand combat"; added power modifiers (Increased Area, Increased Range); merged "reaction" into "free action".
A116: of:="3.17" -> 3.17 | B116: 2020-03-22 | C116: Added Bulletproof power.
A117: of:="3.16" -> 3.16 | B117: 2020-02-25 | C117: Minor change on PrintSheet 1, 2, & 3; minor change to Density Control note on Tables tab.
A118: of:="3.15" -> 3.15 | B118: 2020-02-25 | C118: Minor correction on Powers tab.
A119: of:="3.14" -> 3.14 | B119: 2020-02-24 | C119: Corrected Haste multiplier; made small change to TextSheet and WikiSheet.
A120: of:="3.13" -> 3.13 | B120: 2020-02-09 | C120: Various minor changes.
A121: of:="3.12" -> 3.12 | B121: 2020-02-09 | C121: Revised WikiSheet.
A122: of:="3.11" -> 3.11 | B122: 2020-02-08 | C122: Revised TextSheet.
A123: of:="3.10" -> 3.10 | B123: 2020-02-08 | C123: Revised WikiSheet.
A124: of:="3.9" -> 3.9 | B124: 2020-02-06 | C124: Revised WikiSheet.
A125: of:="3.8" -> 3.8 | B125: 2020-02-06 | C125: Revised WikiSheet.
A126: of:="3.7" -> 3.7 | B126: 2020-02-06 | C126: Revised WikiSheet.
A127: of:="3.6" -> 3.6 | B127: 2020-02-06 | C127: Revised WikiSheet.
A128: of:="3.5" -> 3.5 | B128: 2019-11-30 | C128: Revised back of print character sheets.
A129: of:="3.4" -> 3.4 | B129: 2019-11-24 | C129: Changed Modification Resistance to Alteration Resistance; made Regeneration a standard action.
A130: of:="3.3" -> 3.3 | B130: 2019-11-21 | C130: Modified Power Level general effect progression; many bug fixes.
A131: of:="3.2" -> 3.2 | B131: 2019-11-13 | C131: Added intermediate Teleportation and Tunneling; fixed Super-flight bug; clarified Telekinesis.
A132: of:="3.1" -> 3.1 | B132: 2019-11-03 | C132: Modified “break out of it” type powers; added intermediate Flight; added “escape” to Plot Points; added “disarming” maneuver.
A133: of:="3" -> 3 | B133: 2019-05-31 | C133: Massive rewrite for version Bulletproof Blues 3.0.
A134: of:="2.7si" -> 2.7si | B134: 2016-08-07 | C134: Corrected typos; fixed bug on Advantages tab.
A135: of:="2.6si" -> 2.6si | B135: 2015-08-28 | C135: Added Charming to Advantages; changed “henchmen” to “lackeys”; added “si” to version number, indicating metric conversion.
A136: of:="2.5b" -> 2.5b | B136: 2015-08-05 | C136: Added Immortality to Motivations.
A137: of:="2.5a" -> 2.5a | B137: 2015-06-09 | C137: Minor layout correction on PrintSheets.
A138: of:="2.5" -> 2.5 | B138: 2014-06-16 | C138: Bug fixes; update to LibreOffice 4.3.2.2.
A139: of:="2.4" -> 2.4 | B139: 2014-06-16 | C139: Added Benchmarks tab. Added notes for Growth and Increased Density.
A140: of:="2.3" -> 2.3 | B140: 2014-06-14 | C140: Modified equipment table.
A141: of:="2.2" -> 2.2 | B141: 2014-05-29 | C141: Bugfix on TextSheet tab.
A142: of:="2.1" -> 2.1 | B142: 2014-05-29 | C142: Bugfix on Powers tab.
A143: of:="2" -> 2 | B143: 2014-05-28 | C143: Added advantages: Daredevil, Grifter, Intuition, Professor, Savant, Sleuth, Wily. Added expertise: Demolition, Leadership, Tactics. Revised gender list. Revised PrintSheet. Added PrintSheet2, PrintSheet3.
A144: of:="1.15" -> 1.15 | B144: 2013-11-18 | C144: Added Piloting skill group; added Aerial Combat expertise; added Equipment tab; added Extreme Earth universe; added Natural origin; added The Pawn archetype.
A145: of:="1.14" -> 1.14 | B145: 2013-09-30 | C145: Fixed bug in total calculation.
A146: of:="1.13" -> 1.13 | B146: 2013-04-23 | C146: Changes to Combat skill.
A147: of:="1.12" -> 1.12 | B147: 2013-03-29 | C147: Fixed print size for PrintSheet tab.
A148: of:="1.11" -> 1.11 | B148: 2013-02-10 | C148: Added rank numbers to WikiSheet for accessibility.
A149: of:="1.10" -> 1.10 | B149: 2013-01-24 | C149: Added Powers and Abilities section on Background tab.
A150: of:="1.9" -> 1.9 | B150: 2013-01-20 | C150: Fixed bug on Attributes; added advantages to power list.
A151: of:="1.8" -> 1.8 | B151: 2013-01-07 | C151: Adjusted Plot Point calculation.
A152: of:="1.7" -> 1.7 | B152: 2013-01-02 | C152: Added a comment for Quotation.
A153: of:="1.6" -> 1.6 | B153: 2012-12-31 | C153: Added missing table data for [Attribute] Drain.
A154: of:="1.5" -> 1.5 | B154: 2012-12-29 | C154: Added additional examples of expertise.
A155: of:="1.4" -> 1.4 | B155: 2012-12-28 | C155: Modified power display names; changed Paralysis to Hold.
A156: of:="1.3" -> 1.3 | B156: 2012-12-19 | C156: Modified defined ranges.
A157: of:="1.2" -> 1.2 | B157: 2012-12-09 | C157: Modified Skills tab and Expertise.
A158: of:="1.1" -> 1.1 | B158: 2012-12-06 | C158: Added History, etc., to character sheets.
A159: of:="1" -> 1 | B159: 2012-11-26 | C159: Initial version.
A161: of:=HYPERLINK("#A1"; "Top 🡅") -> Top 🡅
A162: To Do
A163: Replace VLOOKUP with INDEX MATCH
A165: of:=HYPERLINK("#A1"; "Top 🡅") -> Top 🡅
A166: End Of Sheet

Sheet: Background
A1: Background
A2: of:=POINT_SUMMARY -> Skills 43 + Gifts 22 + Powers 119 = 184 / 65
A4: Character Information
A5: Character Name | B5: Fist Of Justice
A6: Real Name | B6: Andrew Wegman
A7: Player Name | B7: Leslie
A8: Concept | B8: "The weed of crime bears bitter fruit!"
A9: of:=ORIGIN_TITLE -> Origin | B9: Zenith | D9: of:=ORIGIN_DESCRIPTION -> The character was born human but has transcended their own humanity.
A10: Archetype(s) | B10: Shadow | D10: of:=ARCHETYPE_DESCRIPTION -> The character can go where no one else can go.
A12: Description
A13: Age
A14: Nationality | B14: American
A15: Height
A16: Weight
A17: Hair
A18: Eyes
A19: Gender
A20: Sexuality
A21: Appearance
A22: Personality
A24: Motivations and Complications
A25: Motivations | B25: Justice | D25: of:=IF([.B25]=""; ""; MOTIVATION_1_DESCRIPTION) -> The character seeks to ensure that misdeeds are met with appropriate punishment.
B26: Adventure | D26: of:=IF([.B26]=""; ""; MOTIVATION_2_DESCRIPTION) -> The character has an adventurous spirit and rarely turns down a quest.
A27: Complications | B27: Weakness | D27: of:=IF([.B28]=""; COMPLICATION_1_DESCRIPTION; "") -> When the character is exposed to an otherwise harmless environment or substance, they incur a skill penalty (-3 AV, -3 DV).
D29: of:=IF([.B30]=""; COMPLICATION_2_DESCRIPTION; "") -> 
A32: Game Settings | B32: The GM will give you these numbers
A33: Power Level | B33: 5 | D33: of:=POWER_LEVEL_SUMMARY -> Damage: 1d6+5
Range: 600 m/1 km
Max Area: 10 m radius
Transformation Limits: min height 20 μm; max height 20 m, mass 100 t; max bonus +3
A34: Character Points | B34: 65
A35: Spent | B35: of:=-CP_SPENT -> -184
A36: Unspent | B36: of:=CP_UNSPENT -> -119
A38: Summary | B38: of:="Skills "&SKILL_COST&" + Gifts "&GIFT_COST&" + Powers "&POWER_COST&" = "&CP_SPENT&" / "&CP_TOTAL -> Skills 43 + Gifts 22 + Powers 119 = 184 / 65
A39: Last Updated | B39: of:=TODAY() -> 2023-07-01
A41: of:=HYPERLINK("#A1"; "Top 🡅") -> Top 🡅
A42: End Of Sheet

Sheet: Skills
A1: Skills
A2: of:=POINT_SUMMARY -> Skills 43 + Gifts 22 + Powers 119 = 184 / 65
A4: Cost | C4: Skill | D4: Level | F4: Description
A5: of:=IF([Calc.D229]>0;[Calc.D229];"") -> 6 | C5: of:=[$Data.A616] -> Athletics | D5: 6 | E5: of:=IF(AND([Calc.C229]>0;[Calc.C229]<=10); VLOOKUP([Calc.C229];SKILL_LEVEL_CHART;3;FALSE()); "") -> Awesome | F5: of:=VLOOKUP([.C5];SKILL_CHART;2;FALSE()) -> Climbing, gymnastics, riding, running, swimming, throwing objects
A6: of:=IF([Calc.D230]>0;[Calc.D230];"") -> 7 | C6: of:=[$Data.A617] -> Computing | D6: 7 | E6: of:=IF(AND([Calc.C230]>0;[Calc.C230]<=10); VLOOKUP([Calc.C230];SKILL_LEVEL_CHART;3;FALSE()); "") -> Epic | F6: of:=VLOOKUP([.C6];SKILL_CHART;2;FALSE()) -> Artificial intelligence, forensics, programming, security systems, sensor operation
A7: of:=IF([Calc.D231]>0;[Calc.D231];"") -> 8 | C7: of:=[$Data.A618] -> Culture | D7: 8 | E7: of:=IF(AND([Calc.C231]>0;[Calc.C231]<=10); VLOOKUP([Calc.C231];SKILL_LEVEL_CHART;3;FALSE()); "") -> Legendary | F7: of:=VLOOKUP([.C7];SKILL_CHART;2;FALSE()) -> Art, fashion, history, music, philosophy, politics, popular media, religion
A8: of:=IF([Calc.D232]>0;[Calc.D232];"") -> 9 | C8: of:=[$Data.A619] -> Deception | D8: 9 | E8: of:=IF(AND([Calc.C232]>0;[Calc.C232]<=10); VLOOKUP([Calc.C232];SKILL_LEVEL_CHART;3;FALSE()); "") -> Unearthly | F8: of:=VLOOKUP([.C8];SKILL_CHART;2;FALSE()) -> Bluffing, disguise, lying, sales
A9: of:=IF([Calc.D233]>0;[Calc.D233];"") -> 10 | C9: of:=[$Data.A620] -> Diplomacy | D9: 10 | E9: of:=IF(AND([Calc.C233]>0;[Calc.C233]<=10); VLOOKUP([Calc.C233];SKILL_LEVEL_CHART;3;FALSE()); "") -> Cosmic | F9: of:=VLOOKUP([.C9];SKILL_CHART;2;FALSE()) -> Carousing, conversation, etiquette, negotiation, streetwise
A10: of:=IF([Calc.D234]>0;[Calc.D234];"") ->  | C10: of:=[$Data.A621] -> Engineering | E10: of:=IF(AND([Calc.C234]>0;[Calc.C234]<=10); VLOOKUP([Calc.C234];SKILL_LEVEL_CHART;3;FALSE()); "") ->  | F10: of:=VLOOKUP([.C10];SKILL_CHART;2;FALSE()) -> Architecture, carpentry, cartography, cooking, demolitions, electronics
A11: of:=IF([Calc.D235]>0;[Calc.D235];"") ->  | C11: of:=[$Data.A622] -> Finesse | E11: of:=IF(AND([Calc.C235]>0;[Calc.C235]<=10); VLOOKUP([Calc.C235];SKILL_LEVEL_CHART;3;FALSE()); "") ->  | F11: of:=VLOOKUP([.C11];SKILL_CHART;2;FALSE()) -> Disabling a trap, forgery, lockpicking, pickpocketing, sleight of hand
A12: of:=IF([Calc.D236]>0;[Calc.D236];"") ->  | C12: of:=[$Data.A623] -> Gambling | E12: of:=IF(AND([Calc.C236]>0;[Calc.C236]<=10); VLOOKUP([Calc.C236];SKILL_LEVEL_CHART;3;FALSE()); "") ->  | F12: of:=VLOOKUP([.C12];SKILL_CHART;2;FALSE()) -> Card games, dice games, dominoes, formal combat, races, sporting events
A13: of:=IF([Calc.D237]>0;[Calc.D237];"") ->  | C13: of:=[$Data.A624] -> Hand-to-hand Combat | E13: of:=IF(AND([Calc.C237]>0;[Calc.C237]<=10); VLOOKUP([Calc.C237];SKILL_LEVEL_CHART;3;FALSE()); "") ->  | F13: of:=VLOOKUP([.C13];SKILL_CHART;2;FALSE()) -> Axes, clubs, hand-to-hand powers, spears, swords, unarmed strikes
A14: of:=IF([Calc.D238]>0;[Calc.D238];"") ->  | C14: of:=[$Data.A625] -> Investigation | E14: of:=IF(AND([Calc.C238]>0;[Calc.C238]<=10); VLOOKUP([Calc.C238];SKILL_LEVEL_CHART;3;FALSE()); "") ->  | F14: of:=VLOOKUP([.C14];SKILL_CHART;2;FALSE()) -> Analyzing evidence, collecting evidence, identifying clues
A15: of:=IF([Calc.D239]>0;[Calc.D239];"") ->  | C15: of:=[$Data.A626] -> Manipulation | E15: of:=IF(AND([Calc.C239]>0;[Calc.C239]<=10); VLOOKUP([Calc.C239];SKILL_LEVEL_CHART;3;FALSE()); "") ->  | F15: of:=VLOOKUP([.C15];SKILL_CHART;2;FALSE()) -> Bribery, fast talk, interrogation, intimidation, leadership, persuasion, seduction
A16: of:=IF([Calc.D240]>0;[Calc.D240];"") ->  | C16: of:=[$Data.A627] -> Medicine | E16: of:=IF(AND([Calc.C240]>0;[Calc.C240]<=10); VLOOKUP([Calc.C240];SKILL_LEVEL_CHART;3;FALSE()); "") ->  | F16: of:=VLOOKUP([.C16];SKILL_CHART;2;FALSE()) -> Diagnosis, field medicine, pharmacology, surgery
A17: of:=IF([Calc.D241]>0;[Calc.D241];"") ->  | C17: of:=[$Data.A628] -> Mental Combat | E17: of:=IF(AND([Calc.C241]>0;[Calc.C241]<=10); VLOOKUP([Calc.C241];SKILL_LEVEL_CHART;3;FALSE()); "") ->  | F17: of:=VLOOKUP([.C17];SKILL_CHART;2;FALSE()) -> Defending against mental attacks, phantasms, mind control, telepathy
A18: of:=IF([Calc.D242]>0;[Calc.D242];"") ->  | C18: of:=[$Data.A629] -> Occultism | E18: of:=IF(AND([Calc.C242]>0;[Calc.C242]<=10); VLOOKUP([Calc.C242];SKILL_LEVEL_CHART;3;FALSE()); "") ->  | F18: of:=VLOOKUP([.C18];SKILL_CHART;2;FALSE()) -> Analyzing artifacts, remembering obscure lore, deciphering ancient texts
A19: of:=IF([Calc.D243]>0;[Calc.D243];"") ->  | C19: of:=[$Data.A630] -> Performance | E19: of:=IF(AND([Calc.C243]>0;[Calc.C243]<=10); VLOOKUP([Calc.C243];SKILL_LEVEL_CHART;3;FALSE()); "") ->  | F19: of:=VLOOKUP([.C19];SKILL_CHART;2;FALSE()) -> Comedy, dancing, music, painting, theater, writing novels, writing poetry
A20: of:=IF([Calc.D244]>0;[Calc.D244];"") ->  | C20: of:=[$Data.A631] -> Piloting | E20: of:=IF(AND([Calc.C244]>0;[Calc.C244]<=10); VLOOKUP([Calc.C244];SKILL_LEVEL_CHART;3;FALSE()); "") ->  | F20: of:=VLOOKUP([.C20];SKILL_CHART;2;FALSE()) -> Aircraft, drones, ground vehicles, heavy machinery, spacecraft, watercraft; navigation
A21: of:=IF([Calc.D245]>0;[Calc.D245];"") ->  | C21: of:=[$Data.A632] -> Ranged Combat | E21: of:=IF(AND([Calc.C245]>0;[Calc.C245]<=10); VLOOKUP([Calc.C245];SKILL_LEVEL_CHART;3;FALSE()); "") ->  | F21: of:=VLOOKUP([.C21];SKILL_CHART;2;FALSE()) -> Bows, crossbows, pistols, ranged powers, rifles, shotguns, thrown weapons
A22: of:=IF([Calc.D246]>0;[Calc.D246];"") ->  | C22: of:=[$Data.A633] -> Science | E22: of:=IF(AND([Calc.C246]>0;[Calc.C246]<=10); VLOOKUP([Calc.C246];SKILL_LEVEL_CHART;3;FALSE()); "") ->  | F22: of:=VLOOKUP([.C22];SKILL_CHART;2;FALSE()) -> Anthropology, biology, chemistry, geology, mathematics, physics, psychology
A23: of:=IF([Calc.D247]>0;[Calc.D247];"") -> 1 | C23: of:=[$Data.A634] -> Self-control | D23: 1 | E23: of:=IF(AND([Calc.C247]>0;[Calc.C247]<=10); VLOOKUP([Calc.C247];SKILL_LEVEL_CHART;3;FALSE()); "") -> Weak | F23: of:=VLOOKUP([.C23];SKILL_CHART;2;FALSE()) -> Abstinence, concentration, meditation, resisting unhealthy influences
A24: of:=IF([Calc.D248]>0;[Calc.D248];"") ->  | C24: of:=[$Data.A635] -> Stealth | E24: of:=IF(AND([Calc.C248]>0;[Calc.C248]<=10); VLOOKUP([Calc.C248];SKILL_LEVEL_CHART;3;FALSE()); "") ->  | F24: of:=VLOOKUP([.C24];SKILL_CHART;2;FALSE()) -> Hiding, shadowing, sneaking, stalking
A25: of:=IF([Calc.D249]>0;[Calc.D249];"") -> 2 | C25: of:=[$Data.A636] -> Survival | D25: 2 | E25: of:=IF(AND([Calc.C249]>0;[Calc.C249]<=10); VLOOKUP([Calc.C249];SKILL_LEVEL_CHART;3;FALSE()); "") -> Typical | F25: of:=VLOOKUP([.C25];SKILL_CHART;2;FALSE()) -> Foraging, hunting, orienteering, scavenging, tracking
A26: of:=IF([Calc.D250]>0;[Calc.D250];"") ->  | C26: of:=[$Data.A637] -> Warfare | E26: of:=IF(AND([Calc.C250]>0;[Calc.C250]<=10); VLOOKUP([Calc.C250];SKILL_LEVEL_CHART;3;FALSE()); "") ->  | F26: of:=VLOOKUP([.C26];SKILL_CHART;2;FALSE()) -> Command and control, guerrilla warfare, logistics, military doctrine, strategy, tactics
A27: of:=SKILL_COST -> 43 | C27: Total
A29: Athletics | E29: Movement
A30: of:=STRENGTH_SUMMARY ->  | E30: of:=MOVEMENT_TEXT -> 
A32: of:=HYPERLINK("#A1"; "Top 🡅") -> Top 🡅
A33: End Of Sheet

Sheet: Gifts
A1: Gifts
A2: of:=POINT_SUMMARY -> Skills 43 + Gifts 22 + Powers 119 = 184 / 65
A4: Cost | C4: Gift
A5: of:=IF([Calc.D124]>0; [Calc.D124]; "") -> 1 | C5: Team Player | E5: of:=IF([.C5]="";"";VLOOKUP([.C5];GIFT_CHART;3;FALSE())) -> Once per scene, the character can grant a skill bonus (+3 AV, +3 DV) to all of their allies
A6: of:=IF([Calc.D125]>0; [Calc.D125]; "") -> 1 | C6: Unsettling | E6: of:=IF([.C6]="";"";VLOOKUP([.C6];GIFT_CHART;3;FALSE())) -> The character can gain a skill bonus (+3 AV, +3 DV) on Manipulation skill rolls pertaining to intimidation and interrogation
A7: of:=IF([Calc.D126]>0; [Calc.D126]; "") -> 1 | C7: Vehicles | E7: of:=IF([.C7]="";"";VLOOKUP([.C7];GIFT_CHART;3;FALSE())) -> The character has an assortment of vehicles at their disposal
A8: of:=IF([Calc.D127]>0; [Calc.D127]; "") -> 1 | C8: Wealthy | E8: of:=IF([.C8]="";"";VLOOKUP([.C8];GIFT_CHART;3;FALSE())) -> The character can solve problems by throwing money at them
A9: of:=IF([Calc.D128]>0; [Calc.D128]; "") -> 1 | C9: Weightless Combat | E9: of:=IF([.C9]="";"";VLOOKUP([.C9];GIFT_CHART;3;FALSE())) -> The character can fight or perform tasks while weightless without the associated penalties
A10: of:=IF([Calc.D129]>0; [Calc.D129]; "") -> 1 | C10: Disarming Expert | E10: of:=IF([.C10]="";"";VLOOKUP([.C10];GIFT_CHART;3;FALSE())) -> The character can make disarming attacks without the associated penalty
A11: of:=IF([Calc.D130]>0; [Calc.D130]; "") -> 1 | C11: Escape Artist | E11: of:=IF([.C11]="";"";VLOOKUP([.C11];GIFT_CHART;3;FALSE())) -> The character receives a skill bonus (+6 AV, +6 DV) when attempting to break out of a grapple or the Hold power
A12: of:=IF([Calc.D131]>0; [Calc.D131]; "") -> 1 | C12: Expert Reputation | E12: of:=IF([.C12]="";"";VLOOKUP([.C12];GIFT_CHART;3;FALSE())) -> The character can sometimes gain favors from strangers who are familiar with their work
A13: of:=IF([Calc.D132]>0; [Calc.D132]; "") -> 1 | C13: Famous | E13: of:=IF([.C13]="";"";VLOOKUP([.C13];GIFT_CHART;3;FALSE())) -> The character can sometimes gain favors from strangers who recognize them
A14: of:=IF([Calc.D133]>0; [Calc.D133]; "") -> 1 | C14: Fascinating | E14: of:=IF([.C14]="";"";VLOOKUP([.C14];GIFT_CHART;3;FALSE())) -> The character can sometimes gain favors from admirers
A15: of:=IF([Calc.D134]>0; [Calc.D134]; "") -> 1 | C15: Headquarters | E15: of:=IF([.C15]="";"";VLOOKUP([.C15];GIFT_CHART;3;FALSE())) -> The character has one or more bases of operation, equipped with supplies and workshops reasonable for the character's background and skills
A16: of:=IF([Calc.D135]>0; [Calc.D135]; "") -> 1 | C16: Iron Fists | E16: of:=IF([.C16]="";"";VLOOKUP([.C16];GIFT_CHART;3;FALSE())) -> The character's unarmed hand-to-hand normal attacks deal points of Health damage equal to the character's Athletics
A17: of:=IF([Calc.D136]>0; [Calc.D136]; "") -> 1 | C17: Linguist | E17: of:=IF([.C17]="";"";VLOOKUP([.C17];GIFT_CHART;3;FALSE())) -> The character is fluent in dozens of languages, and they are capable of quickly deciphering new languages when they encounter them
A18: of:=IF([Calc.D137]>0; [Calc.D137]; "") -> 1 | C18: Mental Calculator | E18: of:=IF([.C18]="";"";VLOOKUP([.C18];GIFT_CHART;3;FALSE())) -> The character can solve complex mathematical equations by thinking about them briefly
A19: of:=IF([Calc.D138]>0; [Calc.D138]; "") -> 1 | C19: Minions | E19: of:=IF([.C19]="";"";VLOOKUP([.C19];GIFT_CHART;3;FALSE())) -> The character has an assortment of minor, mostly nameless lackeys of marginal usefulness
A20: of:=IF([Calc.D139]>0; [Calc.D139]; "") -> 1 | C20: Perfect Recall | E20: of:=IF([.C20]="";"";VLOOKUP([.C20];GIFT_CHART;3;FALSE())) -> The character can perfectly remember any event, document, or recording which the character has clearly seen or heard
A21: of:=IF([Calc.D140]>0; [Calc.D140]; "") -> 1 | C21: Quick Change | E21: of:=IF([.C21]="";"";VLOOKUP([.C21];GIFT_CHART;3;FALSE())) -> The character can change their entire outfit with a quick action
A22: of:=IF([Calc.D141]>0; [Calc.D141]; "") -> 1 | C22: Ranged Disarm | E22: of:=IF([.C22]="";"";VLOOKUP([.C22];GIFT_CHART;3;FALSE())) -> The character can make a disarming attack with a ranged weapon, with the usual associated penalties
A23: of:=IF([Calc.D142]>0; [Calc.D142]; "") -> 1 | C23: Scrounger | E23: of:=IF([.C23]="";"";VLOOKUP([.C23];GIFT_CHART;3;FALSE())) -> The character can find shelter, food, and personal essentials enough to provide for themselves and a small number of friends
A24: of:=IF([Calc.D143]>0; [Calc.D143]; "") -> 1 | C24: Second Identity | E24: of:=IF([.C24]="";"";VLOOKUP([.C24];GIFT_CHART;3;FALSE())) -> The character has a second, completely legitimate identity which will withstand even the most focused scrutiny
A25: of:=IF([Calc.D144]>0; [Calc.D144]; "") -> 1 | C25: Sense Auras | E25: of:=IF([.C25]="";"";VLOOKUP([.C25];GIFT_CHART;3;FALSE())) -> The character can see the invisible emanations around people
A26: of:=IF([Calc.D145]>0; [Calc.D145]; "") -> 1 | C26: Sharpshooter | E26: of:=IF([.C26]="";"";VLOOKUP([.C26];GIFT_CHART;3;FALSE())) -> The character may ignore cover in ranged combat, as long as they can see part of the target
A27: of:=GIFT_COST -> 22 | C27: of:="Total"&IF([Calc.D146]=SUM([.A5:.A26]);"";" ("&[Calc.D146]-SUM([.A5:.A26])&" points unused)") -> Total
A29: of:=HYPERLINK("#A1"; "Top 🡅") -> Top 🡅
A30: End Of Sheet

Sheet: Powers
A1: Powers
A2: of:=POINT_SUMMARY -> Skills 43 + Gifts 22 + Powers 119 = 184 / 65 | H2: Ranged | J2: Area | L2: Seeking | N2: Selective
C3: of:=IF(POWER_WARNING="";"";POWER_WARNING) -> Purchase a prerequisite for Super Reflection (Reflection).

A4: Cost | C4: Power | E4: Custom Name | F4: Note | P4: xRange | R4: xArea | T4: xSprint
A5: of:=IF([Calc.EB164]>0; [Calc.EB164]; "") -> 5 | C5: Stretching | F5: Oriental mysticism | H5: Y | J5: Y | L5: - | N5: - | P5: x100 | R5: x1 | T5: x1
A6: of:=IF([Calc.EB165]>0; [Calc.EB165]; "") -> 2 | C6: Density Control | F6: Oriental mysticism | H6: - | J6: - | L6: - | N6: - | P6: x1 | R6: x1 | T6: x1
A7: of:=IF([Calc.EB166]>0; [Calc.EB166]; "") -> 4 | C7: Duplication | E7: Psychic Invisibility | F7: Oriental mysticism | H7: - | J7: Y | L7: Y | N7: - | P7: x1 | R7: x1 | T7: x1
A8: of:=IF([Calc.EB167]>0; [Calc.EB167]; "") ->  | C8: Super Reflection | H8: - | J8: - | L8: - | N8: - | P8: x1,000 | R8: x100,000 | T8: x100
A9: of:=IF([Calc.EB168]>0; [Calc.EB168]; "") ->  | H9: - | J9: - | L9: - | N9: - | P9: x1 | R9: x10,000 | T9: x10,000
A10: of:=IF([Calc.EB169]>0; [Calc.EB169]; "") -> 8 | C10: Haste | H10: - | J10: Y | L10: - | N10: - | P10: x1 | R10: x1,000 | T10: x1,000,000
A11: of:=IF([Calc.EB170]>0; [Calc.EB170]; "") -> 11 | C11: Shrinking | E11: U-p cn | F11: U-p n | H11: - | J11: - | L11: Y | N11: - | P11: x10,000 | R11: x100 | T11: x100,000,000
A12: of:=IF([Calc.EB171]>0; [Calc.EB171]; "") -> 23 | C12: Ultra-power | H12: Y | J12: Y | L12: Y | N12: Y | P12: x10 | R12: x100 | T12: x10,000,000,000
A13: of:=IF([Calc.EB172]>0; [Calc.EB172]; "") -> 7 | C13: Command [Subject] | H13: - | J13: - | L13: - | N13: - | P13: x1 | R13: x1 | T13: x1
A14: of:=IF([Calc.EB173]>0; [Calc.EB173]; "") -> 8 | C14: [Element] Form | H14: - | J14: - | L14: - | N14: - | P14: x1 | R14: x1 | T14: x1
A15: of:=IF([Calc.EB174]>0; [Calc.EB174]; "") -> 9 | C15: [Element] Immunity | H15: - | J15: - | L15: Y | N15: - | P15: x1 | R15: x1 | T15: x1
A16: of:=IF([Calc.EB175]>0; [Calc.EB175]; "") -> 10 | C16: [Element] Wall | H16: - | J16: - | L16: - | N16: - | P16: x1 | R16: x1 | T16: x1
A17: of:=IF([Calc.EB176]>0; [Calc.EB176]; "") -> 11 | C17: Sense [Element] | H17: - | J17: - | L17: - | N17: - | P17: x1 | R17: x1 | T17: x1
A18: of:=IF([Calc.EB177]>0; [Calc.EB177]; "") -> 21 | C18: [Transformation] Ray | E18: sr cn | F18: sr n | H18: Y | J18: Y | L18: Y | N18: Y | P18: x100,000 | R18: x10 | T18: x10,000
A19: of:=POWER_COST -> 119 | C19: Total
A21: of:=IF(HAS_ULTRA; "Ultra-power: "&ULTRA_NAME; "Ultra-power (inactive)") -> Ultra-power: 
A22: of:=IF([Calc.B182]=""; ""; IF(HAS_ULTRA; RIGHT([Calc.B182]; LEN([Calc.B182])-2); "")) -> 
C23: of:=IF(ULTRA_WARNING="";"";ULTRA_WARNING) -> 
C24: Power | E24: Custom Name | F24: Note
C25: Speed Theft | E25: UP CN 1 | F25: UP n 1
C26: Power Theft
C27: Teleportation Attack
C28: [Element] Form
C29: Flight | E29: UP CN 5 | F29: UP N 5
C30: Teleportation
C31: [Transformation] Ray
C32: Reflection
C33: Power Drain
C34: Teleportation | E34: UP CN 10 | F34: UP N 10
A36: Power Reference
A37: Power | C37: Endurance Theft
C38: of:=[Calc.R200] -> 
C39: of:=[Calc.S200] -> 
C40: of:=IF([Calc.L200]=""; ""; "Prerequisites: "&[Calc.L200]&IF([Calc.O200]=""; [Calc.N200]; ", "&[Calc.M200]&[Calc.P200])) -> 
A42: of:=HYPERLINK("#A1"; "Top 🡅") -> Top 🡅
A43: End Of Sheet

Sheet: Equipment
A1: Equipment
A2: of:=POINT_SUMMARY -> Skills 43 + Gifts 22 + Powers 119 = 184 / 65
A4: Era | B4: Modern
A6: Armor
B8: Heavy Tactical Armor (Level 2, 5 DR)
B9: Custom Name
B10: Bulletproof Vest
B11: of:=[Calc.I58] -> Bulletproof Vest (Level 2, 5 DR) 
A15: Armor Options | D15: Custom Name
A26: Shield | D26: Custom Name
B28: of:=[Calc.I75] -> 
A30: Shield Options | D30: Custom Name
A41: Hand-to-hand Weapons | D41: Custom Name
A46: Ranged Weapons | D46: Custom Name
B47: Heavy Tactical Sidearm (Level 3, 1d6+3 Damage, Short range) | D47: Colt 1911
B48: Heavy Tactical Sidearm (Level 3, 1d6+3 Damage, Short range) | D48: Colt 1911
A51: Explosives And Grenades | D51: Custom Name
A56: Field Kits | D56: Custom Name
B57: Field Kit (Level 2) | D57: Lockpicks
A61: Other Equipment
A73: of:=HYPERLINK("#A1"; "Top 🡅") -> Top 🡅
A74: End Of Sheet

Sheet: PrintSheet1
A1: of:=IF(NAME="";"";NAME) -> Fist Of Justice
A7: of:=IF(CONCEPT="";IF(ORIGIN="";"";ORIGIN&" ")&IF(ARCHETYPE="";"";ARCHETYPE);CONCEPT) -> "The weed of crime bears bitter fruit!"
A10: Name | F10: of:=IF(REAL_NAME="";"";REAL_NAME) -> Andrew Wegman | X10: Hair | AB10: of:=IF(HAIR="";"";HAIR) ->  | AQ10: Height | AW10: of:=IF(HEIGHT="";"";HEIGHT) -> 
A13: Player | F13: of:=IF(PLAYER_NAME="";"";PLAYER_NAME) -> Leslie | X13: Eyes | AB13: of:=IF(EYES="";"";EYES) ->  | AQ13: Weight | AW13: of:=IF(WEIGHT="";"";WEIGHT) -> 
AG17: Skills | BM17: Gifts
AG21: of:=[$Calc.A229] -> Athletics (6) | AY21: of:=[$Calc.A240] -> Medicine (0) | BM21: of:=PRINT_GIFT -> Team Player
Unsettling
Vehicles
Wealthy
Weightless Combat
Disarming Expert
Escape Artist
Expert Reputation
Famous
Fascinating
Headquarters
Iron Fists
Linguist
Mental Calculator
Minions
Perfect Recall
Quick Change
Ranged Disarm
Scrounger
Second Identity
Sense Auras
Sharpshooter
AG24: of:=[$Calc.A230] -> Computing (7) | AY24: of:=[$Calc.A241] -> Mental Combat (0)
A25: Damage Resist | M25: of:=DAMAGE_RESISTANCE -> 0
AG27: of:=[$Calc.A231] -> Culture (8) | AY27: of:=[$Calc.A242] -> Occultism (0)
A28: Alteration Resist | M28: of:=ALTERATION_RESISTANCE -> 0
AG30: of:=[$Calc.A232] -> Deception (9) | AY30: of:=[$Calc.A243] -> Performance (0)
A31: Mental Resist | M31: of:=MENTAL_RESISTANCE -> 0
AG33: of:=[$Calc.A233] -> Diplomacy (10) | AY33: of:=[$Calc.A244] -> Piloting (0)
A35: Endurance | M35: of:=ENDURANCE -> 13
AG36: of:=[$Calc.A234] -> Engineering (0) | AY36: of:=[$Calc.A245] -> Ranged Combat (0)
A39: Health | M39: of:=HEALTH -> 14 | AG39: of:=[$Calc.A245] -> Ranged Combat (0) | AY39: of:=[$Calc.A246] -> Science (0)
AG42: of:=[$Calc.A236] -> Gambling (0) | AY42: of:=[$Calc.A247] -> Self-control (1)
A43: of:=STRENGTH_SUMMARY -> 
AG45: of:=[$Calc.A237] -> Hand-to-hand Combat (0) | AY45: of:=[$Calc.A248] -> Stealth (0)
AG48: of:=[$Calc.A238] -> Investigation (0) | AY48: of:=[$Calc.A249] -> Survival (2)
A50: of:=MOVEMENT_TEXT -> 
AG51: of:=[$Calc.A239] -> Manipulation (0) | AY51: of:=[$Calc.A250] -> Warfare (0)
A55: Power Level | AG55: Powers
A59: Power Level | M59: of:=POWER_LEVEL -> 5 | AG59: of:=[Calc.Y164] -> Stretching | BE59: of:=[Calc.Y171] -> Ultra-power
AG62: of:=IF([Calc.DT164]="";"";[Calc.DT164])&IF(OR([Calc.DT164]="";[Calc.DU164]="");"";", ")&IF([Calc.DU164]="";"";[Calc.DU164]) -> Quick action, Ranged (600 m/100 km), Ranged (600 m/100 km), Personal power, Oriental mysticism; 20 m reach | BE62: of:=IF([Calc.DT171]="";"";[Calc.DT171])&IF(OR([Calc.DT171]="";[Calc.DU171]="");"";", ")&IF([Calc.DU171]="";"";[Calc.DU171]) -> Quick action, Ranged (600 m/10 km), Ranged (600 m/10 km), , Selective, , Selective, Personal power
A63: Damage | M63: of:=PL_DAMAGE_RAW -> 1d6+5
A66: Range | M66: of:=PL_RANGE_RAW -> 600 m/1 km | AG66: of:=[Calc.Y165] -> Density Control | BE66: of:=[Calc.Y172] -> Command [Subject]
A69: Max Area | M69: of:=PL_AREA_RAW -> 10 m radius | AG69: of:=IF([Calc.DT165]="";"";[Calc.DT165])&IF(OR([Calc.DT165]="";[Calc.DU165]="");"";", ")&IF([Calc.DU165]="";"";[Calc.DU165]) -> Quick action, Personal power, Oriental mysticism; Mass 5,000 kg, Athletics +3 | BE69: of:=IF([Calc.DT172]="";"";[Calc.DT172])&IF(OR([Calc.DT172]="";[Calc.DU172]="");"";", ")&IF([Calc.DU172]="";"";[Calc.DU172]) -> Standard action, Ranged (600 m/1,000 m), Ranged (600 m/1,000 m), Mental attack
A72: Transformation | M72: of:=PL_TRANSFORM_RAW -> min height 20 μm; max height 20 m, mass 100 t; max bonus +3
AG73: of:=[Calc.Y166] -> Psychic Invisibility | BE73: of:=[Calc.Y173] -> [Element] Form
AG76: of:=IF([Calc.DT166]="";"";[Calc.DT166])&IF(OR([Calc.DT166]="";[Calc.DU166]="");"";", ")&IF([Calc.DU166]="";"";[Calc.DU166]) -> Quick action, Personal power, Oriental mysticism; 20 duplicates | BE76: of:=IF([Calc.DT173]="";"";[Calc.DT173])&IF(OR([Calc.DT173]="";[Calc.DU173]="");"";", ")&IF([Calc.DU173]="";"";[Calc.DU173]) -> Quick action, Personal power
AG80: of:=[Calc.Y167] ->  | BE80: of:=[Calc.Y174] -> [Element] Immunity
A83: Equipment | AG83: of:=IF([Calc.DT167]="";"";[Calc.DT167])&IF(OR([Calc.DT167]="";[Calc.DU167]="");"";", ")&IF([Calc.DU167]="";"";[Calc.DU167]) ->  | BE83: of:=IF([Calc.DT174]="";"";[Calc.DT174])&IF(OR([Calc.DT174]="";[Calc.DU174]="");"";", ")&IF([Calc.DU174]="";"";[Calc.DU174]) -> Constant, Personal power
A87: of:=PRINT_EQUIPMENT -> Bulletproof Vest (Level 2, 5 DR) 
Colt 1911 (Level 3, 1d6+3 Damage, Short range)
Colt 1911 (Level 3, 1d6+3 Damage, Short range)
Lockpicks (Level 2) | AG87: of:=[Calc.Y168] ->  | BE87: of:=[Calc.Y175] -> [Element] Wall
AG90: of:=IF([Calc.DT168]="";"";[Calc.DT168])&IF(OR([Calc.DT168]="";[Calc.DU168]="");"";", ")&IF([Calc.DU168]="";"";[Calc.DU168]) ->  | BE90: of:=IF([Calc.DT175]="";"";[Calc.DT175])&IF(OR([Calc.DT175]="";[Calc.DU175]="");"";", ")&IF([Calc.DU175]="";"";[Calc.DU175]) -> Standard action, Ranged (600 m/1,000 m), Ranged (600 m/1,000 m), Environmental power
AG94: of:=[Calc.Y169] -> Haste | BE94: of:=[Calc.Y176] -> Sense [Element]
AG97: of:=IF([Calc.DT169]="";"";[Calc.DT169])&IF(OR([Calc.DT169]="";[Calc.DU169]="");"";", ")&IF([Calc.DU169]="";"";[Calc.DU169]) -> Constant, Personal power, x2,000 multiplier | BE97: of:=IF([Calc.DT176]="";"";[Calc.DT176])&IF(OR([Calc.DT176]="";[Calc.DU176]="");"";", ")&IF([Calc.DU176]="";"";[Calc.DU176]) -> Quick action, Personal power
AG101: of:=[Calc.Y170] -> U-p cn | BE101: of:=[Calc.Y177] -> sr cn
AG104: of:=IF([Calc.DT170]="";"";[Calc.DT170])&IF(OR([Calc.DT170]="";[Calc.DU170]="");"";", ")&IF([Calc.DU170]="";"";[Calc.DU170]) -> Quick action, Personal power, U-p n; Min height 20 μm, Athletics +3 | BE104: of:=IF([Calc.DT177]="";"";[Calc.DT177])&IF(OR([Calc.DT177]="";[Calc.DU177]="");"";", ")&IF([Calc.DU177]="";"";[Calc.DU177]) -> Standard action, Ranged (600 m/100,000 km), Ranged (600 m/100,000 km), , Selective, , Selective, Alteration attack, sr n
AF108: of:=IF(HAS_ULTRA;IF(ULTRA_NAME="";"Ultra-power";"Ultra-power: "&ULTRA_NAME);"") -> Ultra-power
AG112: of:=[Calc.Y186] ->  | BE112: of:=[Calc.Y189] -> Teleportation
AG115: of:=IF([Calc.P186]="";"";[Calc.P186])&IF(OR([Calc.P186]="";[Calc.M186]="");"";", ")&IF([Calc.M186]="";"";[Calc.M186]) -> 0 | BE115: of:=IF([Calc.P189]="";"";[Calc.P189])&IF(OR([Calc.P189]="";[Calc.M189]="");"";", ")&IF([Calc.M189]="";"";[Calc.M189]) -> 1
AG119: of:=[Calc.Y186] ->  | BE119: of:=[Calc.Y190] -> [Transformation] Ray
AG122: of:=IF([Calc.P186]="";"";[Calc.P186])&IF(OR([Calc.P186]="";[Calc.M186]="");"";", ")&IF([Calc.M186]="";"";[Calc.M186]) -> 0 | BE122: of:=IF([Calc.P190]="";"";[Calc.P190])&IF(OR([Calc.P190]="";[Calc.M190]="");"";", ")&IF([Calc.M190]="";"";[Calc.M190]) -> 1
A126: Motivations & Complications | AG126: of:=[Calc.Y186] ->  | BE126: of:=[Calc.Y191] -> Reflection
AG129: of:=IF([Calc.P186]="";"";[Calc.P186])&IF(OR([Calc.P186]="";[Calc.M186]="");"";", ")&IF([Calc.M186]="";"";[Calc.M186]) -> 0 | BE129: of:=IF([Calc.P191]="";"";[Calc.P191])&IF(OR([Calc.P191]="";[Calc.M191]="");"";", ")&IF([Calc.M191]="";"";[Calc.M191]) -> 1
A130: of:=PRINT_MOTIVATION -> Justice: The character seeks to ensure that misdeeds are met with appropriate punishment.
Adventure: The character has an adventurous spirit and rarely turns down a quest.
Weakness: When the character is exposed to an otherwise harmless environment or substance, they incur a skill penalty (-3 AV, -3 DV).
AG133: of:=[Calc.Y187] -> [Element] Form | BE133: of:=[Calc.Y192] -> Power Drain
AG136: of:=IF([Calc.P187]="";"";[Calc.P187])&IF(OR([Calc.P187]="";[Calc.M187]="");"";", ")&IF([Calc.M187]="";"";[Calc.M187]) -> 1 | BE136: of:=IF([Calc.P192]="";"";[Calc.P192])&IF(OR([Calc.P192]="";[Calc.M192]="");"";", ")&IF([Calc.M192]="";"";[Calc.M192]) -> 1
AG140: of:=[Calc.Y188] -> UP CN 5 | BE140: of:=[Calc.Y193] -> UP CN 10
AG143: of:=IF([Calc.P188]="";"";[Calc.P188])&IF(OR([Calc.P188]="";[Calc.M188]="");"";", ")&IF([Calc.M188]="";"";[Calc.M188]) -> 1 | BE143: of:=IF([Calc.P193]="";"";[Calc.P193])&IF(OR([Calc.P193]="";[Calc.M193]="");"";", ")&IF([Calc.M193]="";"";[Calc.M193]) -> 1
A150: of:=POINT_SUMMARY -> Skills 43 + Gifts 22 + Powers 119 = 184 / 65 | AG150: of:=META_FILENAME&" (Character Last Updated: "&TEXT(LAST_UPDATED;"YYYY-MM-DD")&")" -> Kalos-Mechanism-Character-Helper.fods (Character Last Updated: 2023-07-01)
A152: Rolling Dice
A157: Character AV | W157: Opposed Task DV | AP157: Unopposed Task DV
C160: 2d6 | Q160: vs | Y160: of:=SKILL_BONUS -> 3 | AP160: of:=DV_MODERATE -> 9 | AR160: Moderately difficult | BF160: Perform a familiar task under hostile conditions, or an unfamiliar task under ordinary conditions
A168: + [Skill Level] | W168: + [Skill Level] | AP168: of:=DV_REMARKABLE -> 12 | AR168: Remarkably difficult | BF168: Perform an unfamiliar task under hostile conditions
A171: + [Equipment (up to Skill Level)] | W171: + [Equipment (up to Skill Level)]
AP174: of:=DV_EXTREME -> 15 | AR174: Extremely difficult | BF174: Perform an esoteric task under ordinary conditions
C176: On a tie, the character who initiated the action wins the contest.
C179: If a task is too difficult, try focusing the team.
C182: Failure should never make the game less interesting.
A186: Bonuses And Penalties
F191: of:="Only the highest bonus applies. Penalties are cumulative. Bonuses and ttack penalties apply to one roll. Defense penalties apply until the beginning of the character's next turn." -> Only the highest bonus applies. Penalties are cumulative. Bonuses and ttack penalties apply to one roll. Defense penalties apply until the beginning of the character's next turn.
F198: Circumstance | AE198: AV | AJ198: DV | AP198: Notes
F201: Skill bonus | AE201: of:="+"&SKILL_BONUS&" AV" -> +3 AV | AJ201: of:="+"&SKILL_BONUS&" DV" -> +3 DV | AP201: e.g., hidden, invisible, prone in ranged combat, etc.
F204: Skill penalty | AE204: of:="-"&SKILL_BONUS&" AV" -> -3 AV | AJ204: of:="-"&SKILL_BONUS&" DV" -> -3 DV | AP204: e.g., distracted, restrained, sprinting, disarming attack, etc.
F207: Trade accuracy for safety | AE207: Varies | AJ207: Varies | AP207: -/+1 AV penalty/bonus for each +/-1 DV bonus/penalty
F210: Trade accuracy for damage | AE210: Varies | AJ210: Varies | AP210: -/+1 AV penalty/bonus for each +/-1 damage bonus/penalty
F214: Character is prone in ranged combat | AE214: of:="+"&SKILL_BONUS&" AV" -> +3 AV | AJ214: of:="+"&SKILL_BONUS&" DV" -> +3 DV | AP214: (standard skill bonus)
F217: Character is prone in hand-to-hand combat | AE217: of:="-"&SKILL_BONUS&" AV" -> -3 AV | AJ217: of:="-"&SKILL_BONUS&" DV" -> -3 DV | AP217: (standard skill penalty)
F221: Character is restrained | AE221: of:="-"&SKILL_BONUS&" AV" -> -3 AV | AJ221: of:="-"&SKILL_BONUS&" DV" -> -3 DV | AP221: (standard skill penalty)
F224: Character is helpless | AE224: AV 0 | AJ224: DV 0
F228: Character is dodging | AE228: of:="-"&SKILL_MAJOR_BONUS&" AV" -> -6 AV | AJ228: of:="+"&SKILL_MAJOR_BONUS&" AV" -> +6 AV
F231: Character's team is focusing on the task | AE231: of:="+"&SKILL_BONUS&" AV" -> +3 AV | AJ231: of:="+"&SKILL_BONUS&" DV" -> +3 DV | AP231: Only the highest AV applies; +3 damage bonus
F234: Character is attempting a sweep attack | AE234: Varies | AP234: -1 AV penalty for each adjacent target
F237: Character is attempting a takedown attack | AE237: of:="-"&SKILL_BONUS&" AV" -> -3 AV | AJ237: of:="-"&SKILL_BONUS&" DV" -> -3 DV | AP237: (standard skill penalty)
F241: Character is sprinting | AE241: of:="-"&SKILL_BONUS&" AV" -> -3 AV | AJ241: of:="-"&SKILL_BONUS&" DV" -> -3 DV | AP241: (standard skill penalty)
F244: Character is terrified | AE244: of:="-"&SKILL_BONUS&" AV" -> -3 AV | AJ244: of:="-"&SKILL_BONUS&" DV" -> -3 DV | AP244: Target must cower or flee (defender's choice)
A248: Damage | AO248: Actions
A253: Damage | W253: Resistance | AP253: On Your Turn
C256: 1d6 | Q256: − | Y256: of:=RESISTANCE_BASE -> 3 | AP256: Move, either walking, swimming, or using a movement power Attempt one standard action Take as many quick actions as the GM deems reasonable
A264: + [Equipment Level] | W264: + [Equipment Level] | AP264: Any Time
A267: or [Power Level] | W267: or [Power Level] | AP267: As many anytime actions as the GM deems reasonable
A272: If the attack is Normal | AP272: Recover
A275: The remaining points of damage are deducted from the target's Health (or Endurance, if it is a stunning attack). | AP275: Recover all lost Endurance by resting for an hour. Recover half of lost Health by resting for an hour. Recover all lost Health with a night's rest.
A281: If the attack is Mental or Alteration
A284: Half of the remaining points of damage are applied to the target (round down, even if the fraction is more than one-half, to a minimum of 1). | AP284: "Break out" of ongoing effects
AP287: of:="To ""break out"" of an attack with an ongoing effect, the target must use a standard action to attempt an Athletics roll against "& DV_BASE &" + Power Level or "& DV_BASE &" + Equipment Level of the attacker." -> To "break out" of an attack with an ongoing effect, the target must use a standard action to attempt an Athletics roll against 6 + Power Level or 6 + Equipment Level of the attacker.

Sheet: PrintSheet1_2
A1: of:=IF(NAME="";"";NAME) -> Fist Of Justice
A7: of:=IF(CONCEPT="";IF(ORIGIN="";"";ORIGIN&" ")&IF(ARCHETYPE="";"";ARCHETYPE);CONCEPT) -> "The weed of crime bears bitter fruit!"
A10: Name | F10: of:=IF(REAL_NAME="";"";REAL_NAME) -> Andrew Wegman | X10: Hair | AB10: of:=IF(HAIR="";"";HAIR) ->  | AQ10: Height | AW10: of:=IF(HEIGHT="";"";HEIGHT) -> 
A13: Player | F13: of:=IF(PLAYER_NAME="";"";PLAYER_NAME) -> Leslie | X13: Eyes | AB13: of:=IF(EYES="";"";EYES) ->  | AQ13: Weight | AW13: of:=IF(WEIGHT="";"";WEIGHT) -> 
AF17: Skills | BE17: Gifts
A21: Power Level | M21: of:=POWER_LEVEL -> 5 | Q21: of:=STRENGTH_SUMMARY ->  | AG21: of:=PRINT_SKILL -> Athletics (6)
Computing (7)
Culture (8)
Deception (9)
Diplomacy (10)
Engineering (0)
Finesse (0)
Gambling (0)
Hand-to-hand Combat (0)
Investigation (0)
Manipulation (0)
Medicine (0)
Mental Combat (0)
Occultism (0)
Performance (0)
Piloting (0)
Ranged Combat (0)
Science (0)
Self-control (1)
Stealth (0)
Survival (2) | BE21: of:=PRINT_GIFT -> Team Player
Unsettling
Vehicles
Wealthy
Weightless Combat
Disarming Expert
Escape Artist
Expert Reputation
Famous
Fascinating
Headquarters
Iron Fists
Linguist
Mental Calculator
Minions
Perfect Recall
Quick Change
Ranged Disarm
Scrounger
Second Identity
Sense Auras
Sharpshooter
A26: Endurance | M26: of:=ENDURANCE -> 13
A30: Health | M30: of:=HEALTH -> 14
Q37: of:=POWER_LEVEL_SUMMARY -> Damage: 1d6+5
Range: 600 m/1 km
Max Area: 10 m radius
Transformation Limits: min height 20 μm; max height 20 m, mass 100 t; max bonus +3
A51: Damage Resist | M51: of:=DAMAGE_RESISTANCE -> 0
A54: Alteration Resist | M54: of:=ALTERATION_RESISTANCE -> 0
AF55: Powers
A57: Mental Resist | M57: of:=MENTAL_RESISTANCE -> 0
AG59: of:=[Calc.Y164] -> Stretching | BE59: of:=[Calc.Y171] -> Ultra-power
A61: Movement
AG62: of:=IF([Calc.DT164]="";"";[Calc.DT164])&IF(OR([Calc.DT164]="";[Calc.DU164]="");"";", ")&IF([Calc.DU164]="";"";[Calc.DU164]) -> Quick action, Ranged (600 m/100 km), Ranged (600 m/100 km), Personal power, Oriental mysticism; 20 m reach | BE62: of:=IF([Calc.DT171]="";"";[Calc.DT171])&IF(OR([Calc.DT171]="";[Calc.DU171]="");"";", ")&IF([Calc.DU171]="";"";[Calc.DU171]) -> Quick action, Ranged (600 m/10 km), Ranged (600 m/10 km), , Selective, , Selective, Personal power
A65: of:=MOVEMENT_TEXT -> 
AG66: of:=[Calc.Y165] -> Density Control | BE66: of:=[Calc.Y172] -> Command [Subject]
AG69: of:=IF([Calc.DT165]="";"";[Calc.DT165])&IF(OR([Calc.DT165]="";[Calc.DU165]="");"";", ")&IF([Calc.DU165]="";"";[Calc.DU165]) -> Quick action, Personal power, Oriental mysticism; Mass 5,000 kg, Athletics +3 | BE69: of:=IF([Calc.DT172]="";"";[Calc.DT172])&IF(OR([Calc.DT172]="";[Calc.DU172]="");"";", ")&IF([Calc.DU172]="";"";[Calc.DU172]) -> Standard action, Ranged (600 m/1,000 m), Ranged (600 m/1,000 m), Mental attack
AG73: of:=[Calc.Y166] -> Psychic Invisibility | BE73: of:=[Calc.Y173] -> [Element] Form
AG76: of:=IF([Calc.DT166]="";"";[Calc.DT166])&IF(OR([Calc.DT166]="";[Calc.DU166]="");"";", ")&IF([Calc.DU166]="";"";[Calc.DU166]) -> Quick action, Personal power, Oriental mysticism; 20 duplicates | BE76: of:=IF([Calc.DT173]="";"";[Calc.DT173])&IF(OR([Calc.DT173]="";[Calc.DU173]="");"";", ")&IF([Calc.DU173]="";"";[Calc.DU173]) -> Quick action, Personal power
AG80: of:=[Calc.Y167] ->  | BE80: of:=[Calc.Y174] -> [Element] Immunity
AG83: of:=IF([Calc.DT167]="";"";[Calc.DT167])&IF(OR([Calc.DT167]="";[Calc.DU167]="");"";", ")&IF([Calc.DU167]="";"";[Calc.DU167]) ->  | BE83: of:=IF([Calc.DT174]="";"";[Calc.DT174])&IF(OR([Calc.DT174]="";[Calc.DU174]="");"";", ")&IF([Calc.DU174]="";"";[Calc.DU174]) -> Constant, Personal power
A87: Equipment | AG87: of:=[Calc.Y168] ->  | BE87: of:=[Calc.Y175] -> [Element] Wall
AG90: of:=IF([Calc.DT168]="";"";[Calc.DT168])&IF(OR([Calc.DT168]="";[Calc.DU168]="");"";", ")&IF([Calc.DU168]="";"";[Calc.DU168]) ->  | BE90: of:=IF([Calc.DT175]="";"";[Calc.DT175])&IF(OR([Calc.DT175]="";[Calc.DU175]="");"";", ")&IF([Calc.DU175]="";"";[Calc.DU175]) -> Standard action, Ranged (600 m/1,000 m), Ranged (600 m/1,000 m), Environmental power
A91: of:=PRINT_EQUIPMENT -> Bulletproof Vest (Level 2, 5 DR) 
Colt 1911 (Level 3, 1d6+3 Damage, Short range)
Colt 1911 (Level 3, 1d6+3 Damage, Short range)
Lockpicks (Level 2)
AG94: of:=[Calc.Y169] -> Haste | BE94: of:=[Calc.Y176] -> Sense [Element]
AG97: of:=IF([Calc.DT169]="";"";[Calc.DT169])&IF(OR([Calc.DT169]="";[Calc.DU169]="");"";", ")&IF([Calc.DU169]="";"";[Calc.DU169]) -> Constant, Personal power, x2,000 multiplier | BE97: of:=IF([Calc.DT176]="";"";[Calc.DT176])&IF(OR([Calc.DT176]="";[Calc.DU176]="");"";", ")&IF([Calc.DU176]="";"";[Calc.DU176]) -> Quick action, Personal power
AG101: of:=[Calc.Y170] -> U-p cn | BE101: of:=[Calc.Y177] -> sr cn
AG104: of:=IF([Calc.DT170]="";"";[Calc.DT170])&IF(OR([Calc.DT170]="";[Calc.DU170]="");"";", ")&IF([Calc.DU170]="";"";[Calc.DU170]) -> Quick action, Personal power, U-p n; Min height 20 μm, Athletics +3 | BE104: of:=IF([Calc.DT177]="";"";[Calc.DT177])&IF(OR([Calc.DT177]="";[Calc.DU177]="");"";", ")&IF([Calc.DU177]="";"";[Calc.DU177]) -> Standard action, Ranged (600 m/100,000 km), Ranged (600 m/100,000 km), , Selective, , Selective, Alteration attack, sr n
AF108: of:=IF(HAS_ULTRA;IF(ULTRA_NAME="";"Ultra-power";"Ultra-power: "&ULTRA_NAME);"") -> Ultra-power
AG112: of:=[Calc.Y186] ->  | BE112: of:=[Calc.Y189] -> Teleportation
AG115: of:=IF([Calc.P186]="";"";[Calc.P186])&IF(OR([Calc.P186]="";[Calc.M186]="");"";", ")&IF([Calc.M186]="";"";[Calc.M186]) -> 0 | BE115: of:=IF([Calc.P189]="";"";[Calc.P189])&IF(OR([Calc.P189]="";[Calc.M189]="");"";", ")&IF([Calc.M189]="";"";[Calc.M189]) -> 1
AG119: of:=[Calc.Y186] ->  | BE119: of:=[Calc.Y190] -> [Transformation] Ray
AG122: of:=IF([Calc.P186]="";"";[Calc.P186])&IF(OR([Calc.P186]="";[Calc.M186]="");"";", ")&IF([Calc.M186]="";"";[Calc.M186]) -> 0 | BE122: of:=IF([Calc.P190]="";"";[Calc.P190])&IF(OR([Calc.P190]="";[Calc.M190]="");"";", ")&IF([Calc.M190]="";"";[Calc.M190]) -> 1
A126: Motivations & Complications | AG126: of:=[Calc.Y186] ->  | BE126: of:=[Calc.Y191] -> Reflection
AG129: of:=IF([Calc.P186]="";"";[Calc.P186])&IF(OR([Calc.P186]="";[Calc.M186]="");"";", ")&IF([Calc.M186]="";"";[Calc.M186]) -> 0 | BE129: of:=IF([Calc.P191]="";"";[Calc.P191])&IF(OR([Calc.P191]="";[Calc.M191]="");"";", ")&IF([Calc.M191]="";"";[Calc.M191]) -> 1
A130: of:=PRINT_MOTIVATION -> Justice: The character seeks to ensure that misdeeds are met with appropriate punishment.
Adventure: The character has an adventurous spirit and rarely turns down a quest.
Weakness: When the character is exposed to an otherwise harmless environment or substance, they incur a skill penalty (-3 AV, -3 DV).
AG133: of:=[Calc.Y187] -> [Element] Form | BE133: of:=[Calc.Y192] -> Power Drain
AG136: of:=IF([Calc.P187]="";"";[Calc.P187])&IF(OR([Calc.P187]="";[Calc.M187]="");"";", ")&IF([Calc.M187]="";"";[Calc.M187]) -> 1 | BE136: of:=IF([Calc.P192]="";"";[Calc.P192])&IF(OR([Calc.P192]="";[Calc.M192]="");"";", ")&IF([Calc.M192]="";"";[Calc.M192]) -> 1
AG140: of:=[Calc.Y188] -> UP CN 5 | BE140: of:=[Calc.Y193] -> UP CN 10
AG143: of:=IF([Calc.P188]="";"";[Calc.P188])&IF(OR([Calc.P188]="";[Calc.M188]="");"";", ")&IF([Calc.M188]="";"";[Calc.M188]) -> 1 | BE143: of:=IF([Calc.P193]="";"";[Calc.P193])&IF(OR([Calc.P193]="";[Calc.M193]="");"";", ")&IF([Calc.M193]="";"";[Calc.M193]) -> 1
A150: of:=POINT_SUMMARY -> Skills 43 + Gifts 22 + Powers 119 = 184 / 65 | AG150: of:=META_FILENAME&" (Character Last Updated: "&TEXT(LAST_UPDATED;"YYYY-MM-DD")&")" -> Kalos-Mechanism-Character-Helper.fods (Character Last Updated: 2023-07-01)
A152: Rolling Dice
A157: Character AV | W157: Opposed Task DV | AP157: Unopposed Task DV
C160: 2d6 | Q160: vs | Y160: 3 | AP160: of:=DV_MODERATE -> 9 | AR160: Moderately difficult | BF160: Perform a familiar task under hostile conditions, or an unfamiliar task under ordinary conditions
A168: + [Skill Level] | W168: + [Skill Level] | AP168: of:=DV_REMARKABLE -> 12 | AR168: Remarkably difficult | BF168: Perform an unfamiliar task under hostile conditions
A171: + [Equipment (up to Skill Level)] | W171: + [Equipment (up to Skill Level)]
AP174: of:=DV_EXTREME -> 15 | AR174: Extremely difficult | BF174: Perform an esoteric task under ordinary conditions
C176: On a tie, the character who initiated the action wins the contest.
C179: If a task is too difficult, try focusing the team.
C182: Failure should never make the game less interesting.
A186: Bonuses And Penalties
F191: Only the highest bonus applies. Penalties are cumulative, to a maximum of -6.
F195: Circumstance | AE195: AV | AJ195: DV | AP195: Notes
F198: Skill bonus | AE198: +3 AV | AJ198: +3 DV | AP198: e.g., hidden, invisible, prone in ranged combat, etc.
F201: Skill penalty | AE201: -3 AV | AJ201: -3 DV | AP201: e.g., distracted, restrained, sprinting, disarming attack, etc.
F204: Trade accuracy for safety | AE204: Varies | AJ204: Varies | AP204: -/+1 AV penalty/bonus for each +/-1 DV bonus/penalty
F207: Trade accuracy for damage | AE207: Varies | AJ207: Varies | AP207: -/+1 AV penalty/bonus for each +/-1 damage bonus/penalty
F211: Character is prone in ranged combat | AE211: +3 AV | AJ211: +3 DV | AP211: (standard skill bonus)
F214: Character is prone in hand-to-hand combat | AE214: -3 AV | AJ214: -3 DV | AP214: (standard skill penalty)
F218: Character is restrained | AE218: -3 AV | AJ218: -3 DV | AP218: (standard skill penalty)
F221: Character is helpless | AE221: AV 0 | AJ221: DV 0
F225: Character is dodging | AE225: -6 AV | AJ225: +6 DV
F228: Character's team is focusing on the task | AE228: +3 AV | AJ228: +3 DV | AP228: Only the highest AV applies; +3 damage bonus
F231: Character is attempting a sweep attack | AE231: Varies | AP231: -1 AV penalty for each adjacent target
F234: Character is attempting a takedown attack | AE234: -3 AV | AJ234: -3 DV | AP234: (standard skill penalty)
F238: Character is sprinting | AE238: -3 AV | AJ238: -3 DV | AP238: (standard skill penalty)
F241: Character is terrified | AE241: -3 AV | AJ241: -3 DV | AP241: Target must cower or flee (defender's choice)
A245: Damage | AO245: Actions
A250: Damage | W250: Resistance | AP250: On Your Turn
C253: 1d6 | Q253: − | Y253: 3 | AP253: One move action One standard action As many quick actions as the GM deems reasonable
A261: + [Equipment Level] | W261: + [Equipment Level] | AP261: Any Time
A264: or [Power Level] | W264: or [Power Level] | AP264: As many free actions as the GM deems reasonable
A269: If the attack is Normal | AP269: Recover
A272: The remaining points of damage are deducted from the target's Health (or Endurance, if it is a stunning attack). | AP272: Recover all lost Endurance by resting for an hour. Recover half of lost Health by resting for an hour. Recover all lost Health with a night's rest.
A278: If the attack is Mental or Alteration
A281: Half of the remaining points of damage are applied to the target (round down, even if the fraction is more than one-half, to a minimum of 1). | AP281: "Break out" of ongoing effects
AP284: To "break out" of an alteration attack with an ongoing effect, the target must use a standard action to attempt an Athletics roll against 3 + Power Level or 3 + Equipment Level of the attacker.

Sheet: ReferenceSheets
A1: Gift Reference
A5: of:=GIFT_REFERENCE1 -> Team Player
Once per scene, the character can grant a skill bonus (+3 AV, +3 DV) to all of their allies

Unsettling
The character can gain a skill bonus (+3 AV, +3 DV) on Manipulation skill rolls pertaining to intimidation and interrogation

Vehicles
The character has an assortment of vehicles at their disposal

Wealthy
The character can solve problems by throwing money at them

Weightless Combat
The character can fight or perform tasks while weightless without the associated penalties

Disarming Expert
The character can make disarming attacks without the associated penalty

Escape Artist
The character receives a skill bonus (+6 AV, +6 DV) when attempting to break out of a grapple or the Hold power

Expert Reputation
The character can sometimes gain favors from strangers who are familiar with their work

Famous
The character can sometimes gain favors from strangers who recognize them

Fascinating
The character can sometimes gain favors from admirers

Headquarters
The character has one or more bases of operation, equipped with supplies and workshops reasonable for the character's background and skills

 | AO5: of:=GIFT_REFERENCE2 -> Iron Fists
The character's unarmed hand-to-hand normal attacks deal points of Health damage equal to the character's Athletics

Linguist
The character is fluent in dozens of languages, and they are capable of quickly deciphering new languages when they encounter them

Mental Calculator
The character can solve complex mathematical equations by thinking about them briefly

Minions
The character has an assortment of minor, mostly nameless lackeys of marginal usefulness

Perfect Recall
The character can perfectly remember any event, document, or recording which the character has clearly seen or heard

Quick Change
The character can change their entire outfit with a quick action

Ranged Disarm
The character can make a disarming attack with a ranged weapon, with the usual associated penalties

Scrounger
The character can find shelter, food, and personal essentials enough to provide for themselves and a small number of friends

Second Identity
The character has a second, completely legitimate identity which will withstand even the most focused scrutiny

Sense Auras
The character can see the invisible emanations around people

Sharpshooter
The character may ignore cover in ranged combat, as long as they can see part of the target


A155: Powers Reference
A159: of:=POWER_CONCAT1 -> Stretching
Quick action, Ranged (600 m/100 km), Ranged (600 m/100 km), Personal power
Oriental mysticism; 20 m reach
65

Density Control
Quick action, Personal power
Oriental mysticism; Mass 5,000 kg, Athletics +3
18

Psychic Invisibility
Quick action, Personal power
Oriental mysticism; 20 duplicates
20

Haste
Constant, Personal power
x2,000 multiplier
32

U-p cn
Quick action, Personal power
U-p n; Min height 20 μm, Athletics +3
58

 | AO159: of:=POWER_CONCAT2 -> Ultra-power
Quick action, Ranged (600 m/10 km), Ranged (600 m/10 km), , Selective, , Selective, Personal power

81

Command [Subject]
Standard action, Ranged (600 m/1,000 m), Ranged (600 m/1,000 m), Mental attack

12

[Element] Form
Quick action, Personal power

21

[Element] Immunity
Constant, Personal power

22

[Element] Wall
Standard action, Ranged (600 m/1,000 m), Ranged (600 m/1,000 m), Environmental power

23

Sense [Element]
Quick action, Personal power

56

sr cn
Standard action, Ranged (600 m/100,000 km), Ranged (600 m/100,000 km), , Selective, , Selective, Alteration attack
sr n
78


A309: of:=IF(ULTRA_NAME="";"Ultra-power";ULTRA_NAME)&" Powers Reference" -> Ultra-power Powers Reference
A313: of:=ULTRA_CONCAT1 -> 00000 | AO313: of:=ULTRA_CONCAT2 -> 01000

Sheet: NoteSheet
A1: Notes | AO1: Notes
A155: Notes | AO155: Notes

Sheet: TextSheets
A1: Text Character Sheets
A3: Text Sheet
A4: This sheet is plain text.
A5: Click and copy the highlighted cell below.
A6: Paste the copied text into your favorite text editor.
A7: of:=COM.MICROSOFT.CONCAT([TextSheetCalc.A3:.A121]) -> 
A9: Wiki Sheet
A10: This sheet is formatted as wikitext, which is used by Wikipedia and the Kalos Universe.
A11: Click and copy the highlighted cell below.
A12: Paste the copied text into your favorite wiki.
A13: of:=COM.MICROSOFT.CONCAT([WikiSheetCalc.A3:.A209]) -> 
A15: of:=HYPERLINK("#A1"; "Top 🡅") -> Top 🡅
A16: End Of Sheet

Sheet: TextSheetCalc
A1: Text Character Sheet
A3: of:==IF([.B3]=""; ""; [.B3]&CHAR(13)&CHAR(10)) -> FIST OF JUSTICE
 | B3: of:=UPPER(NAME) -> FIST OF JUSTICE
A4: of:==IF([.B4]=""; ""; [.B4]&CHAR(13)&CHAR(10)) -> "The weed of crime bears bitter fruit!"
 | B4: of:=IF(CONCEPT="";IF(ORIGIN="";"";ORIGIN&" ")&IF(ARCHETYPE="";"";ARCHETYPE);CONCEPT) -> "The weed of crime bears bitter fruit!"
A5: of:==IF([.B5]=""; ""; [.B5]&CHAR(13)&CHAR(10)) -> Real Name: Andrew Wegman
 | B5: of:=IF(REAL_NAME="";"";"Real Name: "&REAL_NAME) -> Real Name: Andrew Wegman
A6: of:==IF([.B6]=""; ""; [.B6]&CHAR(13)&CHAR(10)) -> Player: Leslie
 | B6: of:=IF(PLAYER_NAME="";"";"Player: "&PLAYER_NAME) -> Player: Leslie
A7: of:==IF([.B7]=""; ""; [.B7]&CHAR(13)&CHAR(10)) ->  | B7: of:="" -> 
A8: of:==IF([.B8]=""; ""; [.B8]&CHAR(13)&CHAR(10)) -> Origin: Zenith
 | B8: of:=IF(ORIGIN="";"";ORIGIN_TITLE&": "&ORIGIN) -> Origin: Zenith
A9: of:==IF([.B9]=""; ""; [.B9]&CHAR(13)&CHAR(10)) -> Archetype: Shadow
 | B9: of:=IF(ARCHETYPE="";"";"Archetype: "&ARCHETYPE) -> Archetype: Shadow
A10: of:==IF([.B10]=""; ""; [.B10]&CHAR(13)&CHAR(10)) ->  | B10: of:="" -> 
A11: of:==IF([.B11]=""; ""; [.B11]&CHAR(13)&CHAR(10)) -> DESCRIPTION
 | B11: DESCRIPTION
A12: of:==IF([.B12]=""; ""; [.B12]&CHAR(13)&CHAR(10)) ->  | B12: of:=IF(AGE="";"";"Age: "&AGE) -> 
A13: of:==IF([.B13]=""; ""; [.B13]&CHAR(13)&CHAR(10)) -> Nationality: American
 | B13: of:=IF(NATIONALITY="";"";"Nationality: "&NATIONALITY) -> Nationality: American
A14: of:==IF([.B14]=""; ""; [.B14]&CHAR(13)&CHAR(10)) ->  | B14: of:=IF(HEIGHT="";"";"Height: "&HEIGHT) -> 
A15: of:==IF([.B15]=""; ""; [.B15]&CHAR(13)&CHAR(10)) ->  | B15: of:=IF(WEIGHT="";"";"Weight: "&WEIGHT) -> 
A16: of:==IF([.B16]=""; ""; [.B16]&CHAR(13)&CHAR(10)) ->  | B16: of:=IF(HAIR="";"";"Hair: "&HAIR) -> 
A17: of:==IF([.B17]=""; ""; [.B17]&CHAR(13)&CHAR(10)) ->  | B17: of:=IF(EYES="";"";"Eyes: "&EYES) -> 
A18: of:==IF([.B18]=""; ""; [.B18]&CHAR(13)&CHAR(10)) ->  | B18: of:=IF(GENDER="";"";"Gender: "&GENDER) -> 
A19: of:==IF([.B19]=""; ""; [.B19]&CHAR(13)&CHAR(10)) ->  | B19: of:=IF(SEXUALITY="";"";"Sexuality: "&SEXUALITY) -> 
A20: of:==IF([.B20]=""; ""; [.B20]&CHAR(13)&CHAR(10)) ->  | B20: of:="" -> 
A21: of:==IF([.B21]=""; ""; [.B21]&CHAR(13)&CHAR(10)) ->  | B21: of:=IF(DESCRIPTION="";"";DESCRIPTION) -> 
A22: of:==IF([.B22]=""; ""; [.B22]&CHAR(13)&CHAR(10)) ->  | B22: of:="" -> 
A23: of:==IF([.B23]=""; ""; [.B23]&CHAR(13)&CHAR(10)) -> Power Level: 5
 | B23: of:="Power Level: "&POWER_LEVEL -> Power Level: 5
A24: of:==IF([.B24]=""; ""; [.B24]&CHAR(13)&CHAR(10)) -> Endurance: 13
 | B24: of:="Endurance: "&ENDURANCE -> Endurance: 13
A25: of:==IF([.B25]=""; ""; [.B25]&CHAR(13)&CHAR(10)) -> Health: 14
 | B25: of:="Health: "&HEALTH -> Health: 14
A26: of:==IF([.B26]=""; ""; [.B26]&CHAR(13)&CHAR(10)) ->  | B26: of:="" -> 
A27: of:==IF([.B27]=""; ""; [.B27]&CHAR(13)&CHAR(10)) ->     Normal Lift: 3,000 kg (spy satellite, passenger bus, dump truck, houseboat, private jet)
 | B27: of:="    "&LIFT_NORMAL_SUMMARY ->     Normal Lift: 3,000 kg (spy satellite, passenger bus, dump truck, houseboat, private jet)
A28: of:==IF([.B28]=""; ""; [.B28]&CHAR(13)&CHAR(10)) ->     Max Lift: 10 t (monster truck, elephant, school bus, cargo helicopter, garbage truck)
 | B28: of:="    "&LIFT_MAX_SUMMARY ->     Max Lift: 10 t (monster truck, elephant, school bus, cargo helicopter, garbage truck)
A29: of:==IF([.B29]=""; ""; [.B29]&CHAR(13)&CHAR(10)) ->     Throw 10 kg: 100 m
 | B29: of:="    "&THROW_SUMMARY ->     Throw 10 kg: 100 m
A30: of:==IF([.B30]=""; ""; [.B30]&CHAR(13)&CHAR(10)) ->  | B30: of:="    "&jump_text -> 
A31: of:==IF([.B31]=""; ""; [.B31]&CHAR(13)&CHAR(10)) ->  | B31: of:="" -> 
A32: of:==IF([.B32]=""; ""; [.B32]&CHAR(13)&CHAR(10)) ->     Damage: 1d6+5
 | B32: of:=IF(PL_DAMAGE_TEXT="";"";"    "&PL_DAMAGE_TEXT) ->     Damage: 1d6+5
A33: of:==IF([.B33]=""; ""; [.B33]&CHAR(13)&CHAR(10)) ->     R''3: 20
 | B33: of:=IF(PL_R3_TEXT="";"";"    "&PL_R3_TEXT) ->     R''3: 20
A34: of:==IF([.B34]=""; ""; [.B34]&CHAR(13)&CHAR(10)) ->     Range: 600 m/1 km
 | B34: of:=IF(PL_RANGE_TEXT="";"";"    "&PL_RANGE_TEXT) ->     Range: 600 m/1 km
A35: of:==IF([.B35]=""; ""; [.B35]&CHAR(13)&CHAR(10)) ->     Max Area: 10 m radius
 | B35: of:=IF(PL_AREA_TEXT="";"";"    "&PL_AREA_TEXT) ->     Max Area: 10 m radius
A36: of:==IF([.B36]=""; ""; [.B36]&CHAR(13)&CHAR(10)) ->     Max Bonus: +3
 | B36: of:=IF(PL_BONUS_TEXT="";"";"    "&PL_BONUS_TEXT) ->     Max Bonus: +3
A37: of:==IF([.B37]=""; ""; [.B37]&CHAR(13)&CHAR(10)) ->  | B37: of:="" -> 
A38: of:==IF([.B38]=""; ""; [.B38]&CHAR(13)&CHAR(10)) -> SKILLS
 | B38: SKILLS
A39: of:==IF([.B39]=""; ""; [.B39]&CHAR(13)&CHAR(10)) -> Athletics (6)
Computing (7)
Culture (8)
Deception (9)
Diplomacy (10)
Engineering (0)
Finesse (0)
Gambling (0)
Hand-to-hand Combat (0)
Investigation (0)
Manipulation (0)
Medicine (0)
Mental Combat (0)
Occultism (0)
Performance (0)
Piloting (0)
Ranged Combat (0)
Science (0)
Self-control (1)
Stealth (0)
Survival (2)
 | B39: of:=PRINT_SKILL -> Athletics (6)
Computing (7)
Culture (8)
Deception (9)
Diplomacy (10)
Engineering (0)
Finesse (0)
Gambling (0)
Hand-to-hand Combat (0)
Investigation (0)
Manipulation (0)
Medicine (0)
Mental Combat (0)
Occultism (0)
Performance (0)
Piloting (0)
Ranged Combat (0)
Science (0)
Self-control (1)
Stealth (0)
Survival (2)
A40: of:==IF([.B40]=""; ""; [.B40]&CHAR(13)&CHAR(10)) ->  | B40: of:="" -> 
A41: of:==IF([.B41]=""; ""; [.B41]&CHAR(13)&CHAR(10)) -> GIFTS
 | B41: GIFTS
A42: of:==IF([.B42]=""; ""; [.B42]&CHAR(13)&CHAR(10)) -> Team Player
Unsettling
Vehicles
Wealthy
Weightless Combat
Disarming Expert
Escape Artist
Expert Reputation
Famous
Fascinating
Headquarters
Iron Fists
Linguist
Mental Calculator
Minions
Perfect Recall
Quick Change
Ranged Disarm
Scrounger
Second Identity
Sense Auras
Sharpshooter
 | B42: of:=PRINT_GIFT -> Team Player
Unsettling
Vehicles
Wealthy
Weightless Combat
Disarming Expert
Escape Artist
Expert Reputation
Famous
Fascinating
Headquarters
Iron Fists
Linguist
Mental Calculator
Minions
Perfect Recall
Quick Change
Ranged Disarm
Scrounger
Second Identity
Sense Auras
Sharpshooter
A43: of:==IF([.B43]=""; ""; [.B43]&CHAR(13)&CHAR(10)) ->  | B43: of:="" -> 
A44: of:==IF([.B44]=""; ""; [.B44]&CHAR(13)&CHAR(10)) -> POWERS
 | B44: POWERS
A45: of:==IF([.B45]=""; ""; [.B45]&CHAR(13)&CHAR(10)) -> Stretching
 | B45: of:=[Calc.Y164] -> Stretching
A46: of:==IF([.B46]=""; ""; [.B46]&CHAR(13)&CHAR(10)) -> Quick action, Ranged (600 m/100 km), Ranged (600 m/100 km), Personal power, Oriental mysticism; 20 m reach
 | B46: of:=IF([Calc.DT164]="";"";[Calc.DT164])&IF(OR([Calc.DT164]="";[Calc.DU164]="");"";", ")&IF([Calc.DU164]="";"";[Calc.DU164]) -> Quick action, Ranged (600 m/100 km), Ranged (600 m/100 km), Personal power, Oriental mysticism; 20 m reach
A47: of:==IF([.B47]=""; ""; [.B47]&CHAR(13)&CHAR(10)) -> Density Control
 | B47: of:=[Calc.Y165] -> Density Control
A48: of:==IF([.B48]=""; ""; [.B48]&CHAR(13)&CHAR(10)) -> Quick action, Personal power, Oriental mysticism; Mass 5,000 kg, Athletics +3
 | B48: of:=IF([Calc.DT165]="";"";[Calc.DT165])&IF(OR([Calc.DT165]="";[Calc.DU165]="");"";", ")&IF([Calc.DU165]="";"";[Calc.DU165]) -> Quick action, Personal power, Oriental mysticism; Mass 5,000 kg, Athletics +3
A49: of:==IF([.B49]=""; ""; [.B49]&CHAR(13)&CHAR(10)) -> Psychic Invisibility
 | B49: of:=[Calc.Y166] -> Psychic Invisibility
A50: of:==IF([.B50]=""; ""; [.B50]&CHAR(13)&CHAR(10)) -> Quick action, Personal power, Oriental mysticism; 20 duplicates
 | B50: of:=IF([Calc.DT166]="";"";[Calc.DT166])&IF(OR([Calc.DT166]="";[Calc.DU166]="");"";", ")&IF([Calc.DU166]="";"";[Calc.DU166]) -> Quick action, Personal power, Oriental mysticism; 20 duplicates
A51: of:==IF([.B51]=""; ""; [.B51]&CHAR(13)&CHAR(10)) ->  | B51: of:=[Calc.Y167] -> 
A52: of:==IF([.B52]=""; ""; [.B52]&CHAR(13)&CHAR(10)) ->  | B52: of:=IF([Calc.DT167]="";"";[Calc.DT167])&IF(OR([Calc.DT167]="";[Calc.DU167]="");"";", ")&IF([Calc.DU167]="";"";[Calc.DU167]) -> 
A53: of:==IF([.B53]=""; ""; [.B53]&CHAR(13)&CHAR(10)) ->  | B53: of:=[Calc.Y168] -> 
A54: of:==IF([.B54]=""; ""; [.B54]&CHAR(13)&CHAR(10)) ->  | B54: of:=IF([Calc.DT168]="";"";[Calc.DT168])&IF(OR([Calc.DT168]="";[Calc.DU168]="");"";", ")&IF([Calc.DU168]="";"";[Calc.DU168]) -> 
A55: of:==IF([.B55]=""; ""; [.B55]&CHAR(13)&CHAR(10)) -> Haste
 | B55: of:=[Calc.Y169] -> Haste
A56: of:==IF([.B56]=""; ""; [.B56]&CHAR(13)&CHAR(10)) -> Constant, Personal power, x2,000 multiplier
 | B56: of:=IF([Calc.DT169]="";"";[Calc.DT169])&IF(OR([Calc.DT169]="";[Calc.DU169]="");"";", ")&IF([Calc.DU169]="";"";[Calc.DU169]) -> Constant, Personal power, x2,000 multiplier
A57: of:==IF([.B57]=""; ""; [.B57]&CHAR(13)&CHAR(10)) -> U-p cn
 | B57: of:=[Calc.Y170] -> U-p cn
A58: of:==IF([.B58]=""; ""; [.B58]&CHAR(13)&CHAR(10)) -> Quick action, Personal power, U-p n; Min height 20 μm, Athletics +3
 | B58: of:=IF([Calc.DT170]="";"";[Calc.DT170])&IF(OR([Calc.DT170]="";[Calc.DU170]="");"";", ")&IF([Calc.DU170]="";"";[Calc.DU170]) -> Quick action, Personal power, U-p n; Min height 20 μm, Athletics +3
A59: of:==IF([.B59]=""; ""; [.B59]&CHAR(13)&CHAR(10)) -> Ultra-power
 | B59: of:=[Calc.Y171] -> Ultra-power
A60: of:==IF([.B60]=""; ""; [.B60]&CHAR(13)&CHAR(10)) -> Quick action, Ranged (600 m/10 km), Ranged (600 m/10 km), , Selective, , Selective, Personal power
 | B60: of:=IF([Calc.DT171]="";"";[Calc.DT171])&IF(OR([Calc.DT171]="";[Calc.DU171]="");"";", ")&IF([Calc.DU171]="";"";[Calc.DU171]) -> Quick action, Ranged (600 m/10 km), Ranged (600 m/10 km), , Selective, , Selective, Personal power
A61: of:==IF([.B61]=""; ""; [.B61]&CHAR(13)&CHAR(10)) -> Command [Subject]
 | B61: of:=[Calc.Y172] -> Command [Subject]
A62: of:==IF([.B62]=""; ""; [.B62]&CHAR(13)&CHAR(10)) -> Standard action, Ranged (600 m/1,000 m), Ranged (600 m/1,000 m), Mental attack
 | B62: of:=IF([Calc.DT172]="";"";[Calc.DT172])&IF(OR([Calc.DT172]="";[Calc.DU172]="");"";", ")&IF([Calc.DU172]="";"";[Calc.DU172]) -> Standard action, Ranged (600 m/1,000 m), Ranged (600 m/1,000 m), Mental attack
A63: of:==IF([.B63]=""; ""; [.B63]&CHAR(13)&CHAR(10)) -> [Element] Form
 | B63: of:=[Calc.Y173] -> [Element] Form
A64: of:==IF([.B64]=""; ""; [.B64]&CHAR(13)&CHAR(10)) -> Quick action, Personal power
 | B64: of:=IF([Calc.DT173]="";"";[Calc.DT173])&IF(OR([Calc.DT173]="";[Calc.DU173]="");"";", ")&IF([Calc.DU173]="";"";[Calc.DU173]) -> Quick action, Personal power
A65: of:==IF([.B65]=""; ""; [.B65]&CHAR(13)&CHAR(10)) -> [Element] Immunity
 | B65: of:=[Calc.Y174] -> [Element] Immunity
A66: of:==IF([.B66]=""; ""; [.B66]&CHAR(13)&CHAR(10)) -> Constant, Personal power
 | B66: of:=IF([Calc.DT174]="";"";[Calc.DT174])&IF(OR([Calc.DT174]="";[Calc.DU174]="");"";", ")&IF([Calc.DU174]="";"";[Calc.DU174]) -> Constant, Personal power
A67: of:==IF([.B67]=""; ""; [.B67]&CHAR(13)&CHAR(10)) -> [Element] Wall
 | B67: of:=[Calc.Y175] -> [Element] Wall
A68: of:==IF([.B68]=""; ""; [.B68]&CHAR(13)&CHAR(10)) -> Standard action, Ranged (600 m/1,000 m), Ranged (600 m/1,000 m), Environmental power
 | B68: of:=IF([Calc.DT175]="";"";[Calc.DT175])&IF(OR([Calc.DT175]="";[Calc.DU175]="");"";", ")&IF([Calc.DU175]="";"";[Calc.DU175]) -> Standard action, Ranged (600 m/1,000 m), Ranged (600 m/1,000 m), Environmental power
A69: of:==IF([.B69]=""; ""; [.B69]&CHAR(13)&CHAR(10)) -> Sense [Element]
 | B69: of:=[Calc.Y176] -> Sense [Element]
A70: of:==IF([.B70]=""; ""; [.B70]&CHAR(13)&CHAR(10)) -> Quick action, Personal power
 | B70: of:=IF([Calc.DT176]="";"";[Calc.DT176])&IF(OR([Calc.DT176]="";[Calc.DU176]="");"";", ")&IF([Calc.DU176]="";"";[Calc.DU176]) -> Quick action, Personal power
A71: of:==IF([.B71]=""; ""; [.B71]&CHAR(13)&CHAR(10)) -> sr cn
 | B71: of:=[Calc.Y177] -> sr cn
A72: of:==IF([.B72]=""; ""; [.B72]&CHAR(13)&CHAR(10)) -> Standard action, Ranged (600 m/100,000 km), Ranged (600 m/100,000 km), , Selective, , Selective, Alteration attack, sr n
 | B72: of:=IF([Calc.DT177]="";"";[Calc.DT177])&IF(OR([Calc.DT177]="";[Calc.DU177]="");"";", ")&IF([Calc.DU177]="";"";[Calc.DU177]) -> Standard action, Ranged (600 m/100,000 km), Ranged (600 m/100,000 km), , Selective, , Selective, Alteration attack, sr n
A73: of:==IF([.B73]=""; ""; [.B73]&CHAR(13)&CHAR(10)) ->  | B73: of:="" -> 
A74: of:==IF([.B74]=""; ""; [.B74]&CHAR(13)&CHAR(10)) -> ULTRA-POWER
 | B74: of:=IF(HAS_ULTRA;IF(ULTRA_NAME="";"ULTRA-POWER";"ULTRA-POWER: "&UPPER(ULTRA_NAME));"") -> ULTRA-POWER
A75: of:==IF([.B75]=""; ""; [.B75]&CHAR(13)&CHAR(10)) ->  | B75: of:=[Calc.Y186] -> 
A76: of:==IF([.B76]=""; ""; [.B76]&CHAR(13)&CHAR(10)) -> 0
 | B76: of:=IF([Calc.P186]="";"";[Calc.P186])&IF(OR([Calc.P186]="";[Calc.M186]="");"";", ")&IF([Calc.M186]="";"";[Calc.M186]) -> 0
A77: of:==IF([.B77]=""; ""; [.B77]&CHAR(13)&CHAR(10)) ->  | B77: of:=[Calc.Y186] -> 
A78: of:==IF([.B78]=""; ""; [.B78]&CHAR(13)&CHAR(10)) -> 0
 | B78: of:=IF([Calc.P186]="";"";[Calc.P186])&IF(OR([Calc.P186]="";[Calc.M186]="");"";", ")&IF([Calc.M186]="";"";[Calc.M186]) -> 0
A79: of:==IF([.B79]=""; ""; [.B79]&CHAR(13)&CHAR(10)) ->  | B79: of:=[Calc.Y186] -> 
A80: of:==IF([.B80]=""; ""; [.B80]&CHAR(13)&CHAR(10)) -> 0
 | B80: of:=IF([Calc.P186]="";"";[Calc.P186])&IF(OR([Calc.P186]="";[Calc.M186]="");"";", ")&IF([Calc.M186]="";"";[Calc.M186]) -> 0
A81: of:==IF([.B81]=""; ""; [.B81]&CHAR(13)&CHAR(10)) -> [Element] Form
 | B81: of:=[Calc.Y187] -> [Element] Form
A82: of:==IF([.B82]=""; ""; [.B82]&CHAR(13)&CHAR(10)) -> 1
 | B82: of:=IF([Calc.P187]="";"";[Calc.P187])&IF(OR([Calc.P187]="";[Calc.M187]="");"";", ")&IF([Calc.M187]="";"";[Calc.M187]) -> 1
A83: of:==IF([.B83]=""; ""; [.B83]&CHAR(13)&CHAR(10)) -> UP CN 5
 | B83: of:=[Calc.Y188] -> UP CN 5
A84: of:==IF([.B84]=""; ""; [.B84]&CHAR(13)&CHAR(10)) -> 1
 | B84: of:=IF([Calc.P188]="";"";[Calc.P188])&IF(OR([Calc.P188]="";[Calc.M188]="");"";", ")&IF([Calc.M188]="";"";[Calc.M188]) -> 1
A85: of:==IF([.B85]=""; ""; [.B85]&CHAR(13)&CHAR(10)) -> Teleportation
 | B85: of:=[Calc.Y189] -> Teleportation
A86: of:==IF([.B86]=""; ""; [.B86]&CHAR(13)&CHAR(10)) -> 1
 | B86: of:=IF([Calc.P189]="";"";[Calc.P189])&IF(OR([Calc.P189]="";[Calc.M189]="");"";", ")&IF([Calc.M189]="";"";[Calc.M189]) -> 1
A87: of:==IF([.B87]=""; ""; [.B87]&CHAR(13)&CHAR(10)) -> [Transformation] Ray
 | B87: of:=[Calc.Y190] -> [Transformation] Ray
A88: of:==IF([.B88]=""; ""; [.B88]&CHAR(13)&CHAR(10)) -> 1
 | B88: of:=IF([Calc.P190]="";"";[Calc.P190])&IF(OR([Calc.P190]="";[Calc.M190]="");"";", ")&IF([Calc.M190]="";"";[Calc.M190]) -> 1
A89: of:==IF([.B89]=""; ""; [.B89]&CHAR(13)&CHAR(10)) -> Reflection
 | B89: of:=[Calc.Y191] -> Reflection
A90: of:==IF([.B90]=""; ""; [.B90]&CHAR(13)&CHAR(10)) -> 1
 | B90: of:=IF([Calc.P191]="";"";[Calc.P191])&IF(OR([Calc.P191]="";[Calc.M191]="");"";", ")&IF([Calc.M191]="";"";[Calc.M191]) -> 1
A91: of:==IF([.B91]=""; ""; [.B91]&CHAR(13)&CHAR(10)) ->  | B91: of:="" -> 
A92: of:==IF([.B92]=""; ""; [.B92]&CHAR(13)&CHAR(10)) -> MOVEMENT
 | B92: MOVEMENT
A93: of:==IF([.B93]=""; ""; [.B93]&CHAR(13)&CHAR(10)) -> Run
 | B93: Run
A94: of:==IF([.B94]=""; ""; [.B94]&CHAR(13)&CHAR(10)) ->     Base: 100 m
 | B94: of:="    Base: "&[Calc.C154] ->     Base: 100 m
A95: of:==IF([.B95]=""; ""; [.B95]&CHAR(13)&CHAR(10)) ->  | B95: of:="    Max Move: "&[Calc.E154]&" ("&[Calc.G154]&")" -> 
A96: of:==IF([.B96]=""; ""; [.B96]&CHAR(13)&CHAR(10)) -> Swim
 | B96: Swim
A97: of:==IF([.B97]=""; ""; [.B97]&CHAR(13)&CHAR(10)) ->  | B97: of:="    Base: "&[Calc.C155] -> 
A98: of:==IF([.B98]=""; ""; [.B98]&CHAR(13)&CHAR(10)) ->  | B98: of:="    Max Move: "&[Calc.E155]&" ("&[Calc.G155]&")" -> 
A99: of:==IF([.B99]=""; ""; [.B99]&CHAR(13)&CHAR(10)) ->  | B99: of:="Jump: "&#REF! -> 
A100: of:==IF([.B100]=""; ""; [.B100]&CHAR(13)&CHAR(10)) ->  | B100: of:=IF(HAS_FLIGHT;"Fly";"") -> 
A101: of:==IF([.B101]=""; ""; [.B101]&CHAR(13)&CHAR(10)) ->  | B101: of:=IF(HAS_FLIGHT;"    Base: "&[Calc.C156];"") -> 
A102: of:==IF([.B102]=""; ""; [.B102]&CHAR(13)&CHAR(10)) ->  | B102: of:=IF(HAS_FLIGHT;"    Max Move: "&[Calc.E156]&" ("&[Calc.G156]&")";"") -> 
A103: of:==IF([.B103]=""; ""; [.B103]&CHAR(13)&CHAR(10)) ->  | B103: of:=IF(HAS_TELEPORTATION;"Teleport";"") -> 
A104: of:==IF([.B104]=""; ""; [.B104]&CHAR(13)&CHAR(10)) ->  | B104: of:=IF(HAS_TELEPORTATION;"    Base: "&[Calc.C157];"") -> 
A105: of:==IF([.B105]=""; ""; [.B105]&CHAR(13)&CHAR(10)) ->  | B105: of:=IF(HAS_TELEPORTATION;"    Max Move: "&[Calc.E157];"") -> 
A106: of:==IF([.B106]=""; ""; [.B106]&CHAR(13)&CHAR(10)) ->  | B106: of:=IF(HAS_TUNNELING;"Tunnel";"") -> 
A107: of:==IF([.B107]=""; ""; [.B107]&CHAR(13)&CHAR(10)) ->  | B107: of:=IF(HAS_TUNNELING;"    Base: "&[Calc.C158];"") -> 
A108: of:==IF([.B108]=""; ""; [.B108]&CHAR(13)&CHAR(10)) ->  | B108: of:=IF(HAS_TUNNELING;"    Sprint: "&[Calc.E158]&" ("&[Calc.G158]&")";"") -> 
A109: of:==IF([.B109]=""; ""; [.B109]&CHAR(13)&CHAR(10)) ->  | B109: of:="" -> 
A110: of:==IF([.B110]=""; ""; [.B110]&CHAR(13)&CHAR(10)) -> PERSONALITY
 | B110: PERSONALITY
A111: of:==IF([.B111]=""; ""; [.B111]&CHAR(13)&CHAR(10)) ->  | B111: of:=IF(PERSONALITY="";"";PERSONALITY) -> 
A112: of:==IF([.B112]=""; ""; [.B112]&CHAR(13)&CHAR(10)) ->  | B112: of:="" -> 
A113: of:==IF([.B113]=""; ""; [.B113]&CHAR(13)&CHAR(10)) -> MOTIVATIONS
 | B113: MOTIVATIONS
A114: of:==IF([.B114]=""; ""; [.B114]&CHAR(13)&CHAR(10)) -> Justice: The character seeks to ensure that misdeeds are met with appropriate punishment.
 | B114: of:=[Calc.E23] -> Justice: The character seeks to ensure that misdeeds are met with appropriate punishment.
A115: of:==IF([.B115]=""; ""; [.B115]&CHAR(13)&CHAR(10)) -> Adventure: The character has an adventurous spirit and rarely turns down a quest.
 | B115: of:=[Calc.E24] -> Adventure: The character has an adventurous spirit and rarely turns down a quest.
A116: of:==IF([.B116]=""; ""; [.B116]&CHAR(13)&CHAR(10)) ->  | B116: of:="" -> 
A117: of:==IF([.B117]=""; ""; [.B117]&CHAR(13)&CHAR(10)) -> COMPLICATIONS
 | B117: COMPLICATIONS
A118: of:==IF([.B118]=""; ""; [.B118]&CHAR(13)&CHAR(10)) -> Weakness: When the character is exposed to an otherwise harmless environment or substance, they incur a skill penalty (-3 AV, -3 DV).
 | B118: of:=[Calc.E26] -> Weakness: When the character is exposed to an otherwise harmless environment or substance, they incur a skill penalty (-3 AV, -3 DV).
A119: of:==IF([.B119]=""; ""; [.B119]&CHAR(13)&CHAR(10)) ->  | B119: of:=[Calc.E27] -> 
A120: of:==IF([.B120]=""; ""; [.B120]&CHAR(13)&CHAR(10)) ->  | B120: of:="" -> 
A121: of:==IF([.B121]=""; ""; [.B121]&CHAR(13)&CHAR(10)) -> Skills 43 + Gifts 22 + Powers 119 = 184 / 65
 | B121: of:=POINT_SUMMARY -> Skills 43 + Gifts 22 + Powers 119 = 184 / 65
A123: of:=HYPERLINK("#A1"; "Top 🡅") -> Top 🡅
A124: End Of Sheet

Sheet: WikiSheetCalc
A1: Wiki Character Sheet
A3: of:==IF([.B3]=""; ""; [.B3]&CHAR(13)&CHAR(10)) -> ''"The weed of crime bears bitter fruit!"''
 | B3: of:=IF(OR(NOT(CONCEPT="");NOT(ARCHETYPE=""));"''";"")&IF(CONCEPT="";IF(ORIGIN="";"";ORIGIN&" ")&IF(ARCHETYPE="";"";ARCHETYPE);CONCEPT)&IF(OR(NOT(CONCEPT="");NOT(ARCHETYPE=""));"''";"") -> ''"The weed of crime bears bitter fruit!"''
A4: of:==IF([.B4]=""; ""; [.B4]&CHAR(13)&CHAR(10)) ->  | B4: of:="" -> 
A5: of:==IF([.B5]=""; ""; [.B5]&CHAR(13)&CHAR(10)) -> [[File:Fist_Of_Justice.jpg|right|thumb|Fist Of Justice]]
 | B5: of:="[[File:"&SUBSTITUTE(SUBSTITUTE(BASE_NAME;" ";"_");"""";"")&".jpg|right|thumb|"&NAME&"]]" -> [[File:Fist_Of_Justice.jpg|right|thumb|Fist Of Justice]]
A6: of:==IF([.B6]=""; ""; [.B6]&CHAR(13)&CHAR(10)) -> *Character sheet: [[Media:Fist_Of_Justice_BBCSH_4.0.30.x.pdf|PDF]]
 | B6: of:="*Character sheet: [[Media:"&SUBSTITUTE(SUBSTITUTE(BASE_NAME;" ";"_");"""";"")&"_BBCSH_"&META_VERSION&".pdf|PDF]]" -> *Character sheet: [[Media:Fist_Of_Justice_BBCSH_4.0.30.x.pdf|PDF]]
A7: of:==IF([.B7]=""; ""; [.B7]&CHAR(13)&CHAR(10)) -> *Reference sheet: [[Media:Fist_Of_Justice_Reference_BBCSH_4.0.30.x.pdf|PDF]]
 | B7: of:="*Reference sheet: [[Media:"&SUBSTITUTE(SUBSTITUTE(BASE_NAME;" ";"_");"""";"")&"_Reference_BBCSH_"&META_VERSION&".pdf|PDF]]" -> *Reference sheet: [[Media:Fist_Of_Justice_Reference_BBCSH_4.0.30.x.pdf|PDF]]
A8: of:==IF([.B8]=""; ""; [.B8]&CHAR(13)&CHAR(10)) -> *[[Media:Fist_Of_Justice_KMCH_4.0.30.x.ods|Character Helper file]] ([https://www.libreoffice.org/ LibreOffice])
 | B8: of:="*[[Media:"&SUBSTITUTE(SUBSTITUTE(BASE_NAME;" ";"_");"""";"")&"_KMCH_"&META_VERSION&".ods|Character Helper file]] ([https://www.libreoffice.org/ LibreOffice])" -> *[[Media:Fist_Of_Justice_KMCH_4.0.30.x.ods|Character Helper file]] ([https://www.libreoffice.org/ LibreOffice])
A9: of:==IF([.B9]=""; ""; [.B9]&CHAR(13)&CHAR(10)) ->  | B9: of:="" -> 
A10: of:==IF([.B10]=""; ""; [.B10]&CHAR(13)&CHAR(10)) ->  | B10: of:="" -> 
A11: of:==IF([.B11]=""; ""; [.B11]&CHAR(13)&CHAR(10)) -> {|
 | B11: of:="{|" -> {|
A12: of:==IF([.B12]=""; ""; [.B12]&CHAR(13)&CHAR(10)) -> |- class="bb4_tr" 
 | B12: of:="|- class=""bb4_tr"" " -> |- class="bb4_tr" 
A13: of:==IF([.B13]=""; ""; [.B13]&CHAR(13)&CHAR(10)) -> ! align="left" | Real Name
 | B13: of:="! align=""left"" | Real Name" -> ! align="left" | Real Name
A14: of:==IF([.B14]=""; ""; [.B14]&CHAR(13)&CHAR(10)) -> | Andrew Wegman
 | B14: of:="| "&REAL_NAME -> | Andrew Wegman
A15: of:==IF([.B15]=""; ""; [.B15]&CHAR(13)&CHAR(10)) -> |- class="bb4_tr" 
 | B15: of:="|- class=""bb4_tr"" " -> |- class="bb4_tr" 
A16: of:==IF([.B16]=""; ""; [.B16]&CHAR(13)&CHAR(10)) -> ! align="left" | Player
 | B16: of:="! align=""left"" | Player" -> ! align="left" | Player
A17: of:==IF([.B17]=""; ""; [.B17]&CHAR(13)&CHAR(10)) -> | Leslie
 | B17: of:="| "&PLAYER_NAME -> | Leslie
A18: of:==IF([.B18]=""; ""; [.B18]&CHAR(13)&CHAR(10)) -> |- class="bb4_tr" 
 | B18: of:=IF(ORIGIN="";"";"|- class=""bb4_tr"" ") -> |- class="bb4_tr" 
A19: of:==IF([.B19]=""; ""; [.B19]&CHAR(13)&CHAR(10)) -> ! align="left" | Origin
 | B19: of:=IF(ORIGIN="";"";"! align=""left"" | "&ORIGIN_TITLE) -> ! align="left" | Origin
A20: of:==IF([.B20]=""; ""; [.B20]&CHAR(13)&CHAR(10)) -> | Zenith
 | B20: of:=IF(ORIGIN="";"";"| "&ORIGIN) -> | Zenith
A21: of:==IF([.B21]=""; ""; [.B21]&CHAR(13)&CHAR(10)) -> |- class="bb4_tr" 
 | B21: of:=IF(ARCHETYPE="";"";"|- class=""bb4_tr"" ") -> |- class="bb4_tr" 
A22: of:==IF([.B22]=""; ""; [.B22]&CHAR(13)&CHAR(10)) -> ! align="left" | Archetype
 | B22: of:=IF(ARCHETYPE="";"";"! align=""left"" | Archetype") -> ! align="left" | Archetype
A23: of:==IF([.B23]=""; ""; [.B23]&CHAR(13)&CHAR(10)) -> | Shadow
 | B23: of:=IF(ARCHETYPE="";"";"| "&ARCHETYPE) -> | Shadow
A24: of:==IF([.B24]=""; ""; [.B24]&CHAR(13)&CHAR(10)) -> |}
 | B24: of:="|}" -> |}
A25: of:==IF([.B25]=""; ""; [.B25]&CHAR(13)&CHAR(10)) ->  | B25: of:="" -> 
A26: of:==IF([.B26]=""; ""; [.B26]&CHAR(13)&CHAR(10)) -> ==Description==
 | B26: of:="==Description==" -> ==Description==
A27: of:==IF([.B27]=""; ""; [.B27]&CHAR(13)&CHAR(10)) -> {|
 | B27: of:="{|" -> {|
A28: of:==IF([.B28]=""; ""; [.B28]&CHAR(13)&CHAR(10)) -> |- class="bb4_tr" 
 | B28: of:="|- class=""bb4_tr"" " -> |- class="bb4_tr" 
A29: of:==IF([.B29]=""; ""; [.B29]&CHAR(13)&CHAR(10)) -> ! align="left" | Age
 | B29: of:="! align=""left"" | Age" -> ! align="left" | Age
A30: of:==IF([.B30]=""; ""; [.B30]&CHAR(13)&CHAR(10)) -> | 
 | B30: of:="| "&AGE -> | 
A31: of:==IF([.B31]=""; ""; [.B31]&CHAR(13)&CHAR(10)) -> ! align="left" | Nationality
 | B31: of:="! align=""left"" | Nationality" -> ! align="left" | Nationality
A32: of:==IF([.B32]=""; ""; [.B32]&CHAR(13)&CHAR(10)) -> | American
 | B32: of:="| "&NATIONALITY -> | American
A33: of:==IF([.B33]=""; ""; [.B33]&CHAR(13)&CHAR(10)) -> |- class="bb4_tr" 
 | B33: of:="|- class=""bb4_tr"" " -> |- class="bb4_tr" 
A34: of:==IF([.B34]=""; ""; [.B34]&CHAR(13)&CHAR(10)) -> ! align="left" | Height
 | B34: of:="! align=""left"" | Height" -> ! align="left" | Height
A35: of:==IF([.B35]=""; ""; [.B35]&CHAR(13)&CHAR(10)) -> | 
 | B35: of:="| "&HEIGHT -> | 
A36: of:==IF([.B36]=""; ""; [.B36]&CHAR(13)&CHAR(10)) -> ! align="left" | Hair
 | B36: of:="! align=""left"" | Hair" -> ! align="left" | Hair
A37: of:==IF([.B37]=""; ""; [.B37]&CHAR(13)&CHAR(10)) -> | 
 | B37: of:="| "&HAIR -> | 
A38: of:==IF([.B38]=""; ""; [.B38]&CHAR(13)&CHAR(10)) -> |- class="bb4_tr" 
 | B38: of:="|- class=""bb4_tr"" " -> |- class="bb4_tr" 
A39: of:==IF([.B39]=""; ""; [.B39]&CHAR(13)&CHAR(10)) -> ! align="left" | Weight
 | B39: of:="! align=""left"" | Weight" -> ! align="left" | Weight
A40: of:==IF([.B40]=""; ""; [.B40]&CHAR(13)&CHAR(10)) -> | 
 | B40: of:="| "&WEIGHT -> | 
A41: of:==IF([.B41]=""; ""; [.B41]&CHAR(13)&CHAR(10)) -> ! align="left" | Eyes
 | B41: of:="! align=""left"" | Eyes" -> ! align="left" | Eyes
A42: of:==IF([.B42]=""; ""; [.B42]&CHAR(13)&CHAR(10)) -> | 
 | B42: of:="| "&EYES -> | 
A43: of:==IF([.B43]=""; ""; [.B43]&CHAR(13)&CHAR(10)) -> |- class="bb4_tr" 
 | B43: of:="|- class=""bb4_tr"" " -> |- class="bb4_tr" 
A44: of:==IF([.B44]=""; ""; [.B44]&CHAR(13)&CHAR(10)) -> ! align="left" | Gender
 | B44: of:="! align=""left"" | Gender" -> ! align="left" | Gender
A45: of:==IF([.B45]=""; ""; [.B45]&CHAR(13)&CHAR(10)) -> | 
 | B45: of:="| "&GENDER -> | 
A46: of:==IF([.B46]=""; ""; [.B46]&CHAR(13)&CHAR(10)) -> ! align="left" | Sexuality
 | B46: of:="! align=""left"" | Sexuality" -> ! align="left" | Sexuality
A47: of:==IF([.B47]=""; ""; [.B47]&CHAR(13)&CHAR(10)) -> | 
 | B47: of:="| "&SEXUALITY -> | 
A48: of:==IF([.B48]=""; ""; [.B48]&CHAR(13)&CHAR(10)) -> |}
 | B48: of:="|}" -> |}
A49: of:==IF([.B49]=""; ""; [.B49]&CHAR(13)&CHAR(10)) ->  | B49: of:="" -> 
A50: of:==IF([.B50]=""; ""; [.B50]&CHAR(13)&CHAR(10)) ->  | B50: of:=IF(DESCRIPTION="";"";DESCRIPTION) -> 
A51: of:==IF([.B51]=""; ""; [.B51]&CHAR(13)&CHAR(10)) ->  | B51: of:="" -> 
A52: of:==IF([.B52]=""; ""; [.B52]&CHAR(13)&CHAR(10)) -> {|
 | B52: of:="{|" -> {|
A53: of:==IF([.B53]=""; ""; [.B53]&CHAR(13)&CHAR(10)) -> |- class="bb4_tr" 
 | B53: of:="|- class=""bb4_tr"" " -> |- class="bb4_tr" 
A54: of:==IF([.B54]=""; ""; [.B54]&CHAR(13)&CHAR(10)) -> ! align="left" | Endurance
 | B54: of:="! align=""left"" | Endurance" -> ! align="left" | Endurance
A55: of:==IF([.B55]=""; ""; [.B55]&CHAR(13)&CHAR(10)) -> ! align="right" | 13
 | B55: of:="! align=""right"" | "&ENDURANCE -> ! align="right" | 13
A56: of:==IF([.B56]=""; ""; [.B56]&CHAR(13)&CHAR(10)) -> | align="left" | R''3: 20
 | B56: of:="| align=""left"" | "&IF(PL_R3_TEXT="";""; PL_R3_TEXT) -> | align="left" | R''3: 20
A57: of:==IF([.B57]=""; ""; [.B57]&CHAR(13)&CHAR(10)) -> |- class="bb4_tr" 
 | B57: of:="|- class=""bb4_tr"" " -> |- class="bb4_tr" 
A58: of:==IF([.B58]=""; ""; [.B58]&CHAR(13)&CHAR(10)) -> ! align="left" | Health
 | B58: of:="! align=""left"" | Health" -> ! align="left" | Health
A59: of:==IF([.B59]=""; ""; [.B59]&CHAR(13)&CHAR(10)) -> ! align="right" | 14
 | B59: of:="! align=""right"" | "&HEALTH -> ! align="right" | 14
A60: of:==IF([.B60]=""; ""; [.B60]&CHAR(13)&CHAR(10)) -> | align="left" | Range: 600 m/1 km
 | B60: of:="| align=""left"" | "&IF(PL_RANGE_TEXT="";""; PL_RANGE_TEXT) -> | align="left" | Range: 600 m/1 km
A61: of:==IF([.B61]=""; ""; [.B61]&CHAR(13)&CHAR(10)) -> |- class="bb4_tr" 
 | B61: of:="|- class=""bb4_tr"" " -> |- class="bb4_tr" 
A62: of:==IF([.B62]=""; ""; [.B62]&CHAR(13)&CHAR(10)) -> ! align="left" | 
 | B62: of:="! align=""left"" | " -> ! align="left" | 
A63: of:==IF([.B63]=""; ""; [.B63]&CHAR(13)&CHAR(10)) -> ! align="right" | 
 | B63: of:="! align=""right"" | " -> ! align="right" | 
A64: of:==IF([.B64]=""; ""; [.B64]&CHAR(13)&CHAR(10)) -> | align="left" | Max Area: 10 m radius
 | B64: of:="| align=""left"" | "&IF(PL_AREA_TEXT="";""; PL_AREA_TEXT) -> | align="left" | Max Area: 10 m radius
A65: of:==IF([.B65]=""; ""; [.B65]&CHAR(13)&CHAR(10)) -> |- class="bb4_tr" 
 | B65: of:="|- class=""bb4_tr"" " -> |- class="bb4_tr" 
A66: of:==IF([.B66]=""; ""; [.B66]&CHAR(13)&CHAR(10)) -> ! align="left" | 
 | B66: of:="! align=""left"" | " -> ! align="left" | 
A67: of:==IF([.B67]=""; ""; [.B67]&CHAR(13)&CHAR(10)) -> ! align="right" | 
 | B67: of:="! align=""right"" | " -> ! align="right" | 
A68: of:==IF([.B68]=""; ""; [.B68]&CHAR(13)&CHAR(10)) -> | align="left" | Max Bonus: +3
 | B68: of:="| align=""left"" | "&IF(PL_BONUS_TEXT="";""; PL_BONUS_TEXT) -> | align="left" | Max Bonus: +3
A69: of:==IF([.B69]=""; ""; [.B69]&CHAR(13)&CHAR(10)) -> |}
 | B69: |}
A70: of:==IF([.B70]=""; ""; [.B70]&CHAR(13)&CHAR(10)) -> &nbsp;<br />
 | B70: of:="&nbsp;<br />" -> &nbsp;<br />
A71: of:==IF([.B71]=""; ""; [.B71]&CHAR(13)&CHAR(10)) -> ==Skills==
 | B71: of:="==Skills==" -> ==Skills==
A72: of:==IF([.B72]=""; ""; [.B72]&CHAR(13)&CHAR(10)) -> *Athletics (6)
 | B72: of:=IF([Calc.A229]="";"";"*"&[Calc.A229]) -> *Athletics (6)
A73: of:==IF([.B73]=""; ""; [.B73]&CHAR(13)&CHAR(10)) -> *Computing (7)
 | B73: of:=IF([Calc.A230]="";"";"*"&[Calc.A230]) -> *Computing (7)
A74: of:==IF([.B74]=""; ""; [.B74]&CHAR(13)&CHAR(10)) -> *Culture (8)
 | B74: of:=IF([Calc.A231]="";"";"*"&[Calc.A231]) -> *Culture (8)
A75: of:==IF([.B75]=""; ""; [.B75]&CHAR(13)&CHAR(10)) -> *Deception (9)
 | B75: of:=IF([Calc.A232]="";"";"*"&[Calc.A232]) -> *Deception (9)
A76: of:==IF([.B76]=""; ""; [.B76]&CHAR(13)&CHAR(10)) -> *Diplomacy (10)
 | B76: of:=IF([Calc.A233]="";"";"*"&[Calc.A233]) -> *Diplomacy (10)
A77: of:==IF([.B77]=""; ""; [.B77]&CHAR(13)&CHAR(10)) -> *Engineering (0)
 | B77: of:=IF([Calc.A234]="";"";"*"&[Calc.A234]) -> *Engineering (0)
A78: of:==IF([.B78]=""; ""; [.B78]&CHAR(13)&CHAR(10)) -> *Finesse (0)
 | B78: of:=IF([Calc.A235]="";"";"*"&[Calc.A235]) -> *Finesse (0)
A79: of:==IF([.B79]=""; ""; [.B79]&CHAR(13)&CHAR(10)) -> *Gambling (0)
 | B79: of:=IF([Calc.A236]="";"";"*"&[Calc.A236]) -> *Gambling (0)
A80: of:==IF([.B80]=""; ""; [.B80]&CHAR(13)&CHAR(10)) -> *Hand-to-hand Combat (0)
 | B80: of:=IF([Calc.A237]="";"";"*"&[Calc.A237]) -> *Hand-to-hand Combat (0)
A81: of:==IF([.B81]=""; ""; [.B81]&CHAR(13)&CHAR(10)) -> *Investigation (0)
 | B81: of:=IF([Calc.A238]="";"";"*"&[Calc.A238]) -> *Investigation (0)
A82: of:==IF([.B82]=""; ""; [.B82]&CHAR(13)&CHAR(10)) -> *Manipulation (0)
 | B82: of:=IF([Calc.A239]="";"";"*"&[Calc.A239]) -> *Manipulation (0)
A83: of:==IF([.B83]=""; ""; [.B83]&CHAR(13)&CHAR(10)) -> *Medicine (0)
 | B83: of:=IF([Calc.A240]="";"";"*"&[Calc.A240]) -> *Medicine (0)
A84: of:==IF([.B84]=""; ""; [.B84]&CHAR(13)&CHAR(10)) -> *Mental Combat (0)
 | B84: of:=IF([Calc.A241]="";"";"*"&[Calc.A241]) -> *Mental Combat (0)
A85: of:==IF([.B85]=""; ""; [.B85]&CHAR(13)&CHAR(10)) -> *Occultism (0)
 | B85: of:=IF([Calc.A242]="";"";"*"&[Calc.A242]) -> *Occultism (0)
A86: of:==IF([.B86]=""; ""; [.B86]&CHAR(13)&CHAR(10)) -> *Performance (0)
 | B86: of:=IF([Calc.A243]="";"";"*"&[Calc.A243]) -> *Performance (0)
A87: of:==IF([.B87]=""; ""; [.B87]&CHAR(13)&CHAR(10)) -> *Piloting (0)
 | B87: of:=IF([Calc.A244]="";"";"*"&[Calc.A244]) -> *Piloting (0)
A88: of:==IF([.B88]=""; ""; [.B88]&CHAR(13)&CHAR(10)) -> *Ranged Combat (0)
 | B88: of:=IF([Calc.A245]="";"";"*"&[Calc.A245]) -> *Ranged Combat (0)
A89: of:==IF([.B89]=""; ""; [.B89]&CHAR(13)&CHAR(10)) -> *Science (0)
 | B89: of:=IF([Calc.A246]="";"";"*"&[Calc.A246]) -> *Science (0)
A90: of:==IF([.B90]=""; ""; [.B90]&CHAR(13)&CHAR(10)) -> *Self-control (1)
 | B90: of:=IF([Calc.A247]="";"";"*"&[Calc.A247]) -> *Self-control (1)
A91: of:==IF([.B91]=""; ""; [.B91]&CHAR(13)&CHAR(10)) -> *Survival (2)
 | B91: of:=IF([Calc.A249]="";"";"*"&[Calc.A249]) -> *Survival (2)
A92: of:==IF([.B92]=""; ""; [.B92]&CHAR(13)&CHAR(10)) ->  | B92: of:="" -> 
A93: of:==IF([.B93]=""; ""; [.B93]&CHAR(13)&CHAR(10)) -> ==Gifts==
 | B93: of:="==Gifts==" -> ==Gifts==
A94: of:==IF([.B94]=""; ""; [.B94]&CHAR(13)&CHAR(10)) -> *Team Player
 | B94: of:=IF([Calc.A124]="";"";"*"&[Calc.A124]) -> *Team Player
A95: of:==IF([.B95]=""; ""; [.B95]&CHAR(13)&CHAR(10)) -> *Unsettling
 | B95: of:=IF([Calc.A125]="";"";"*"&[Calc.A125]) -> *Unsettling
A96: of:==IF([.B96]=""; ""; [.B96]&CHAR(13)&CHAR(10)) -> *Vehicles
 | B96: of:=IF([Calc.A126]="";"";"*"&[Calc.A126]) -> *Vehicles
A97: of:==IF([.B97]=""; ""; [.B97]&CHAR(13)&CHAR(10)) -> *Wealthy
 | B97: of:=IF([Calc.A127]="";"";"*"&[Calc.A127]) -> *Wealthy
A98: of:==IF([.B98]=""; ""; [.B98]&CHAR(13)&CHAR(10)) -> *Weightless Combat
 | B98: of:=IF([Calc.A128]="";"";"*"&[Calc.A128]) -> *Weightless Combat
A99: of:==IF([.B99]=""; ""; [.B99]&CHAR(13)&CHAR(10)) -> *Disarming Expert
 | B99: of:=IF([Calc.A129]="";"";"*"&[Calc.A129]) -> *Disarming Expert
A100: of:==IF([.B100]=""; ""; [.B100]&CHAR(13)&CHAR(10)) -> *Escape Artist
 | B100: of:=IF([Calc.A130]="";"";"*"&[Calc.A130]) -> *Escape Artist
A101: of:==IF([.B101]=""; ""; [.B101]&CHAR(13)&CHAR(10)) -> *Expert Reputation
 | B101: of:=IF([Calc.A131]="";"";"*"&[Calc.A131]) -> *Expert Reputation
A102: of:==IF([.B102]=""; ""; [.B102]&CHAR(13)&CHAR(10)) -> *Famous
 | B102: of:=IF([Calc.A132]="";"";"*"&[Calc.A132]) -> *Famous
A103: of:==IF([.B103]=""; ""; [.B103]&CHAR(13)&CHAR(10)) -> *Fascinating
 | B103: of:=IF([Calc.A133]="";"";"*"&[Calc.A133]) -> *Fascinating
A104: of:==IF([.B104]=""; ""; [.B104]&CHAR(13)&CHAR(10)) -> *Headquarters
 | B104: of:=IF([Calc.A134]="";"";"*"&[Calc.A134]) -> *Headquarters
A105: of:==IF([.B105]=""; ""; [.B105]&CHAR(13)&CHAR(10)) -> *Iron Fists
 | B105: of:=IF([Calc.A135]="";"";"*"&[Calc.A135]) -> *Iron Fists
A106: of:==IF([.B106]=""; ""; [.B106]&CHAR(13)&CHAR(10)) -> *Linguist
 | B106: of:=IF([Calc.A136]="";"";"*"&[Calc.A136]) -> *Linguist
A107: of:==IF([.B107]=""; ""; [.B107]&CHAR(13)&CHAR(10)) -> *Mental Calculator
 | B107: of:=IF([Calc.A137]="";"";"*"&[Calc.A137]) -> *Mental Calculator
A108: of:==IF([.B108]=""; ""; [.B108]&CHAR(13)&CHAR(10)) -> *Minions
 | B108: of:=IF([Calc.A138]="";"";"*"&[Calc.A138]) -> *Minions
A109: of:==IF([.B109]=""; ""; [.B109]&CHAR(13)&CHAR(10)) -> *Perfect Recall
 | B109: of:=IF([Calc.A139]="";"";"*"&[Calc.A139]) -> *Perfect Recall
A110: of:==IF([.B110]=""; ""; [.B110]&CHAR(13)&CHAR(10)) -> *Quick Change
 | B110: of:=IF([Calc.A140]="";"";"*"&[Calc.A140]) -> *Quick Change
A111: of:==IF([.B111]=""; ""; [.B111]&CHAR(13)&CHAR(10)) -> *Ranged Disarm
 | B111: of:=IF([Calc.A141]="";"";"*"&[Calc.A141]) -> *Ranged Disarm
A112: of:==IF([.B112]=""; ""; [.B112]&CHAR(13)&CHAR(10)) -> *Scrounger
 | B112: of:=IF([Calc.A142]="";"";"*"&[Calc.A142]) -> *Scrounger
A113: of:==IF([.B113]=""; ""; [.B113]&CHAR(13)&CHAR(10)) -> *Second Identity
 | B113: of:=IF([Calc.A143]="";"";"*"&[Calc.A143]) -> *Second Identity
A114: of:==IF([.B114]=""; ""; [.B114]&CHAR(13)&CHAR(10)) ->  | B114: of:="" -> 
A115: of:==IF([.B115]=""; ""; [.B115]&CHAR(13)&CHAR(10)) -> ==Powers==
 | B115: of:="==Powers==" -> ==Powers==
A116: of:==IF([.B116]=""; ""; [.B116]&CHAR(13)&CHAR(10)) -> ;<nowiki>Stretching</nowiki>
:Quick action, Ranged (600 m/100 km), Ranged (600 m/100 km), Personal power
:Oriental mysticism; 20 m reach
 | B116: of:=IF([Calc.Y164]=""; ""; ";"&"<nowiki>"&[Calc.Y164]&"</nowiki>")&IF([Calc.DT164]=""; ""; CHAR(13)&CHAR(10)&":"&[Calc.DT164])&IF([Calc.DU164]=""; ""; CHAR(13)&CHAR(10)&":"&[Calc.DU164]) -> ;<nowiki>Stretching</nowiki>
:Quick action, Ranged (600 m/100 km), Ranged (600 m/100 km), Personal power
:Oriental mysticism; 20 m reach
A117: of:==IF([.B117]=""; ""; [.B117]&CHAR(13)&CHAR(10)) -> ;<nowiki>Density Control</nowiki>
:Quick action, Personal power
:Oriental mysticism; Mass 5,000 kg, Athletics +3
 | B117: of:=IF([Calc.Y165]=""; ""; ";"&"<nowiki>"&[Calc.Y165]&"</nowiki>")&IF([Calc.DT165]=""; ""; CHAR(13)&CHAR(10)&":"&[Calc.DT165])&IF([Calc.DU165]=""; ""; CHAR(13)&CHAR(10)&":"&[Calc.DU165]) -> ;<nowiki>Density Control</nowiki>
:Quick action, Personal power
:Oriental mysticism; Mass 5,000 kg, Athletics +3
A118: of:==IF([.B118]=""; ""; [.B118]&CHAR(13)&CHAR(10)) -> ;<nowiki>Psychic Invisibility</nowiki>
:Quick action, Personal power
:Oriental mysticism; 20 duplicates
 | B118: of:=IF([Calc.Y166]=""; ""; ";"&"<nowiki>"&[Calc.Y166]&"</nowiki>")&IF([Calc.DT166]=""; ""; CHAR(13)&CHAR(10)&":"&[Calc.DT166])&IF([Calc.DU166]=""; ""; CHAR(13)&CHAR(10)&":"&[Calc.DU166]) -> ;<nowiki>Psychic Invisibility</nowiki>
:Quick action, Personal power
:Oriental mysticism; 20 duplicates
A119: of:==IF([.B119]=""; ""; [.B119]&CHAR(13)&CHAR(10)) ->  | B119: of:=IF([Calc.Y167]=""; ""; ";"&"<nowiki>"&[Calc.Y167]&"</nowiki>")&IF([Calc.DT167]=""; ""; CHAR(13)&CHAR(10)&":"&[Calc.DT167])&IF([Calc.DU167]=""; ""; CHAR(13)&CHAR(10)&":"&[Calc.DU167]) -> 
A120: of:==IF([.B120]=""; ""; [.B120]&CHAR(13)&CHAR(10)) ->  | B120: of:=IF([Calc.Y168]=""; ""; ";"&"<nowiki>"&[Calc.Y168]&"</nowiki>")&IF([Calc.DT168]=""; ""; CHAR(13)&CHAR(10)&":"&[Calc.DT168])&IF([Calc.DU168]=""; ""; CHAR(13)&CHAR(10)&":"&[Calc.DU168]) -> 
A121: of:==IF([.B121]=""; ""; [.B121]&CHAR(13)&CHAR(10)) -> ;<nowiki>Haste</nowiki>
:Constant, Personal power
:x2,000 multiplier
 | B121: of:=IF([Calc.Y169]=""; ""; ";"&"<nowiki>"&[Calc.Y169]&"</nowiki>")&IF([Calc.DT169]=""; ""; CHAR(13)&CHAR(10)&":"&[Calc.DT169])&IF([Calc.DU169]=""; ""; CHAR(13)&CHAR(10)&":"&[Calc.DU169]) -> ;<nowiki>Haste</nowiki>
:Constant, Personal power
:x2,000 multiplier
A122: of:==IF([.B122]=""; ""; [.B122]&CHAR(13)&CHAR(10)) -> ;<nowiki>U-p cn</nowiki>
:Quick action, Personal power
:U-p n; Min height 20 μm, Athletics +3
 | B122: of:=IF([Calc.Y170]=""; ""; ";"&"<nowiki>"&[Calc.Y170]&"</nowiki>")&IF([Calc.DT170]=""; ""; CHAR(13)&CHAR(10)&":"&[Calc.DT170])&IF([Calc.DU170]=""; ""; CHAR(13)&CHAR(10)&":"&[Calc.DU170]) -> ;<nowiki>U-p cn</nowiki>
:Quick action, Personal power
:U-p n; Min height 20 μm, Athletics +3
A123: of:==IF([.B123]=""; ""; [.B123]&CHAR(13)&CHAR(10)) -> ;<nowiki>Ultra-power</nowiki>
:Quick action, Ranged (600 m/10 km), Ranged (600 m/10 km), , Selective, , Selective, Personal power
 | B123: of:=IF([Calc.Y171]=""; ""; ";"&"<nowiki>"&[Calc.Y171]&"</nowiki>")&IF([Calc.DT171]=""; ""; CHAR(13)&CHAR(10)&":"&[Calc.DT171])&IF([Calc.DU171]=""; ""; CHAR(13)&CHAR(10)&":"&[Calc.DU171]) -> ;<nowiki>Ultra-power</nowiki>
:Quick action, Ranged (600 m/10 km), Ranged (600 m/10 km), , Selective, , Selective, Personal power
A124: of:==IF([.B124]=""; ""; [.B124]&CHAR(13)&CHAR(10)) -> ;<nowiki>Command [Subject]</nowiki>
:Standard action, Ranged (600 m/1,000 m), Ranged (600 m/1,000 m), Mental attack
 | B124: of:=IF([Calc.Y172]=""; ""; ";"&"<nowiki>"&[Calc.Y172]&"</nowiki>")&IF([Calc.DT172]=""; ""; CHAR(13)&CHAR(10)&":"&[Calc.DT172])&IF([Calc.DU172]=""; ""; CHAR(13)&CHAR(10)&":"&[Calc.DU172]) -> ;<nowiki>Command [Subject]</nowiki>
:Standard action, Ranged (600 m/1,000 m), Ranged (600 m/1,000 m), Mental attack
A125: of:==IF([.B125]=""; ""; [.B125]&CHAR(13)&CHAR(10)) -> ;<nowiki>[Element] Form</nowiki>
:Quick action, Personal power
 | B125: of:=IF([Calc.Y173]=""; ""; ";"&"<nowiki>"&[Calc.Y173]&"</nowiki>")&IF([Calc.DT173]=""; ""; CHAR(13)&CHAR(10)&":"&[Calc.DT173])&IF([Calc.DU173]=""; ""; CHAR(13)&CHAR(10)&":"&[Calc.DU173]) -> ;<nowiki>[Element] Form</nowiki>
:Quick action, Personal power
A126: of:==IF([.B126]=""; ""; [.B126]&CHAR(13)&CHAR(10)) -> ;<nowiki>[Element] Immunity</nowiki>
:Constant, Personal power
 | B126: of:=IF([Calc.Y174]=""; ""; ";"&"<nowiki>"&[Calc.Y174]&"</nowiki>")&IF([Calc.DT174]=""; ""; CHAR(13)&CHAR(10)&":"&[Calc.DT174])&IF([Calc.DU174]=""; ""; CHAR(13)&CHAR(10)&":"&[Calc.DU174]) -> ;<nowiki>[Element] Immunity</nowiki>
:Constant, Personal power
A127: of:==IF([.B127]=""; ""; [.B127]&CHAR(13)&CHAR(10)) -> ;<nowiki>[Element] Wall</nowiki>
:Standard action, Ranged (600 m/1,000 m), Ranged (600 m/1,000 m), Environmental power
 | B127: of:=IF([Calc.Y175]=""; ""; ";"&"<nowiki>"&[Calc.Y175]&"</nowiki>")&IF([Calc.DT175]=""; ""; CHAR(13)&CHAR(10)&":"&[Calc.DT175])&IF([Calc.DU175]=""; ""; CHAR(13)&CHAR(10)&":"&[Calc.DU175]) -> ;<nowiki>[Element] Wall</nowiki>
:Standard action, Ranged (600 m/1,000 m), Ranged (600 m/1,000 m), Environmental power
A128: of:==IF([.B128]=""; ""; [.B128]&CHAR(13)&CHAR(10)) -> ;<nowiki>Sense [Element]</nowiki>
:Quick action, Personal power
 | B128: of:=IF([Calc.Y176]=""; ""; ";"&"<nowiki>"&[Calc.Y176]&"</nowiki>")&IF([Calc.DT176]=""; ""; CHAR(13)&CHAR(10)&":"&[Calc.DT176])&IF([Calc.DU176]=""; ""; CHAR(13)&CHAR(10)&":"&[Calc.DU176]) -> ;<nowiki>Sense [Element]</nowiki>
:Quick action, Personal power
A129: of:==IF([.B129]=""; ""; [.B129]&CHAR(13)&CHAR(10)) -> ;<nowiki>sr cn</nowiki>
:Standard action, Ranged (600 m/100,000 km), Ranged (600 m/100,000 km), , Selective, , Selective, Alteration attack
:sr n
 | B129: of:=IF([Calc.Y177]=""; ""; ";"&"<nowiki>"&[Calc.Y177]&"</nowiki>")&IF([Calc.DT177]=""; ""; CHAR(13)&CHAR(10)&":"&[Calc.DT177])&IF([Calc.DU177]=""; ""; CHAR(13)&CHAR(10)&":"&[Calc.DU177]) -> ;<nowiki>sr cn</nowiki>
:Standard action, Ranged (600 m/100,000 km), Ranged (600 m/100,000 km), , Selective, , Selective, Alteration attack
:sr n
A130: of:==IF([.B130]=""; ""; [.B130]&CHAR(13)&CHAR(10)) ->  | B130: of:="" -> 
A131: of:==IF([.B131]=""; ""; [.B131]&CHAR(13)&CHAR(10)) -> ===Ultra-power===
 | B131: of:=IF(HAS_ULTRA;IF(ULTRA_NAME="";"===Ultra-power===";"===Ultra-power: "&ULTRA_NAME&"===");"") -> ===Ultra-power===
A132: of:==IF([.B132]=""; ""; [.B132]&CHAR(13)&CHAR(10)) -> 
:0
 | B132: of:=IF([Calc.Y186]=""; ""; ";"&"<nowiki>"&[Calc.Y186]&"</nowiki>")&IF([Calc.P186]=""; ""; CHAR(13)&CHAR(10)&":"&[Calc.P186])&IF([Calc.M186]=""; ""; CHAR(13)&CHAR(10)&":"&[Calc.M186]) -> 
:0
A133: of:==IF([.B133]=""; ""; [.B133]&CHAR(13)&CHAR(10)) -> 
:0
 | B133: of:=IF([Calc.Y186]=""; ""; ";"&"<nowiki>"&[Calc.Y186]&"</nowiki>")&IF([Calc.P186]=""; ""; CHAR(13)&CHAR(10)&":"&[Calc.P186])&IF([Calc.M186]=""; ""; CHAR(13)&CHAR(10)&":"&[Calc.M186]) -> 
:0
A134: of:==IF([.B134]=""; ""; [.B134]&CHAR(13)&CHAR(10)) -> 
:0
 | B134: of:=IF([Calc.Y186]=""; ""; ";"&"<nowiki>"&[Calc.Y186]&"</nowiki>")&IF([Calc.P186]=""; ""; CHAR(13)&CHAR(10)&":"&[Calc.P186])&IF([Calc.M186]=""; ""; CHAR(13)&CHAR(10)&":"&[Calc.M186]) -> 
:0
A135: of:==IF([.B135]=""; ""; [.B135]&CHAR(13)&CHAR(10)) -> ;<nowiki>[Element] Form</nowiki>
:1
 | B135: of:=IF([Calc.Y187]=""; ""; ";"&"<nowiki>"&[Calc.Y187]&"</nowiki>")&IF([Calc.P187]=""; ""; CHAR(13)&CHAR(10)&":"&[Calc.P187])&IF([Calc.M187]=""; ""; CHAR(13)&CHAR(10)&":"&[Calc.M187]) -> ;<nowiki>[Element] Form</nowiki>
:1
A136: of:==IF([.B136]=""; ""; [.B136]&CHAR(13)&CHAR(10)) -> ;<nowiki>UP CN 5</nowiki>
:1
 | B136: of:=IF([Calc.Y188]=""; ""; ";"&"<nowiki>"&[Calc.Y188]&"</nowiki>")&IF([Calc.P188]=""; ""; CHAR(13)&CHAR(10)&":"&[Calc.P188])&IF([Calc.M188]=""; ""; CHAR(13)&CHAR(10)&":"&[Calc.M188]) -> ;<nowiki>UP CN 5</nowiki>
:1
A137: of:==IF([.B137]=""; ""; [.B137]&CHAR(13)&CHAR(10)) -> ;<nowiki>Teleportation</nowiki>
:1
 | B137: of:=IF([Calc.Y189]=""; ""; ";"&"<nowiki>"&[Calc.Y189]&"</nowiki>")&IF([Calc.P189]=""; ""; CHAR(13)&CHAR(10)&":"&[Calc.P189])&IF([Calc.M189]=""; ""; CHAR(13)&CHAR(10)&":"&[Calc.M189]) -> ;<nowiki>Teleportation</nowiki>
:1
A138: of:==IF([.B138]=""; ""; [.B138]&CHAR(13)&CHAR(10)) -> ;<nowiki>[Transformation] Ray</nowiki>
:1
 | B138: of:=IF([Calc.Y190]=""; ""; ";"&"<nowiki>"&[Calc.Y190]&"</nowiki>")&IF([Calc.P190]=""; ""; CHAR(13)&CHAR(10)&":"&[Calc.P190])&IF([Calc.M190]=""; ""; CHAR(13)&CHAR(10)&":"&[Calc.M190]) -> ;<nowiki>[Transformation] Ray</nowiki>
:1
A139: of:==IF([.B139]=""; ""; [.B139]&CHAR(13)&CHAR(10)) -> ;<nowiki>Reflection</nowiki>
:1
 | B139: of:=IF([Calc.Y191]=""; ""; ";"&"<nowiki>"&[Calc.Y191]&"</nowiki>")&IF([Calc.P191]=""; ""; CHAR(13)&CHAR(10)&":"&[Calc.P191])&IF([Calc.M191]=""; ""; CHAR(13)&CHAR(10)&":"&[Calc.M191]) -> ;<nowiki>Reflection</nowiki>
:1
A140: of:==IF([.B140]=""; ""; [.B140]&CHAR(13)&CHAR(10)) -> ;<nowiki>Power Drain</nowiki>
:1
 | B140: of:=IF([Calc.Y192]=""; ""; ";"&"<nowiki>"&[Calc.Y192]&"</nowiki>")&IF([Calc.P192]=""; ""; CHAR(13)&CHAR(10)&":"&[Calc.P192])&IF([Calc.M192]=""; ""; CHAR(13)&CHAR(10)&":"&[Calc.M192]) -> ;<nowiki>Power Drain</nowiki>
:1
A141: of:==IF([.B141]=""; ""; [.B141]&CHAR(13)&CHAR(10)) -> ;<nowiki>UP CN 10</nowiki>
:1
 | B141: of:=IF([Calc.Y193]=""; ""; ";"&"<nowiki>"&[Calc.Y193]&"</nowiki>")&IF([Calc.P193]=""; ""; CHAR(13)&CHAR(10)&":"&[Calc.P193])&IF([Calc.M193]=""; ""; CHAR(13)&CHAR(10)&":"&[Calc.M193]) -> ;<nowiki>UP CN 10</nowiki>
:1
A142: of:==IF([.B142]=""; ""; [.B142]&CHAR(13)&CHAR(10)) ->  | B142: of:="" -> 
A143: of:==IF([.B143]=""; ""; [.B143]&CHAR(13)&CHAR(10)) -> ==Equipment==
 | B143: of:=IF(HAS_EQUIPMENT;"==Equipment==";"") -> ==Equipment==
A144: of:==IF([.B144]=""; ""; [.B144]&CHAR(13)&CHAR(10)) -> ;Bulletproof Vest (Level 2, 5 DR)
 | B144: of:=IF([Calc.I45]="";"";";"&[Calc.I45]) -> ;Bulletproof Vest (Level 2, 5 DR)
A145: of:==IF([.B145]=""; ""; [.B145]&CHAR(13)&CHAR(10)) ->  | B145: of:=IF([Calc.I57]="";"";":"&[Calc.I57]) -> 
A146: of:==IF([.B146]=""; ""; [.B146]&CHAR(13)&CHAR(10)) ->  | B146: of:=IF([Calc.I62]="";"";";"&[Calc.I62]) -> 
A147: of:==IF([.B147]=""; ""; [.B147]&CHAR(13)&CHAR(10)) ->  | B147: of:=IF([Calc.I74]="";"";":"&[Calc.I74]) -> 
A148: of:==IF([.B148]=""; ""; [.B148]&CHAR(13)&CHAR(10)) ->  | B148: of:=IF([Calc.I79]="";"";";"&[Calc.I79]) -> 
A149: of:==IF([.B149]=""; ""; [.B149]&CHAR(13)&CHAR(10)) ->  | B149: of:=IF([Calc.I80]="";"";";"&[Calc.I80]) -> 
A150: of:==IF([.B150]=""; ""; [.B150]&CHAR(13)&CHAR(10)) ->  | B150: of:=IF([Calc.I81]="";"";";"&[Calc.I81]) -> 
A151: of:==IF([.B151]=""; ""; [.B151]&CHAR(13)&CHAR(10)) -> ;Colt 1911 (Level 3, 1d6+3 Damage, Short range)
 | B151: of:=IF([Calc.I86]="";"";";"&[Calc.I86]) -> ;Colt 1911 (Level 3, 1d6+3 Damage, Short range)
A152: of:==IF([.B152]=""; ""; [.B152]&CHAR(13)&CHAR(10)) -> ;Colt 1911 (Level 3, 1d6+3 Damage, Short range)
 | B152: of:=IF([Calc.I87]="";"";";"&[Calc.I87]) -> ;Colt 1911 (Level 3, 1d6+3 Damage, Short range)
A153: of:==IF([.B153]=""; ""; [.B153]&CHAR(13)&CHAR(10)) ->  | B153: of:=IF([Calc.I88]="";"";";"&[Calc.I88]) -> 
A154: of:==IF([.B154]=""; ""; [.B154]&CHAR(13)&CHAR(10)) -> ;Lockpicks (Level 2)
 | B154: of:=IF([Calc.I100]="";"";";"&[Calc.I100]) -> ;Lockpicks (Level 2)
A155: of:==IF([.B155]=""; ""; [.B155]&CHAR(13)&CHAR(10)) ->  | B155: of:=IF([Calc.I101]="";"";";"&[Calc.I101]) -> 
A156: of:==IF([.B156]=""; ""; [.B156]&CHAR(13)&CHAR(10)) ->  | B156: of:=IF([Calc.I102]="";"";";"&[Calc.I102]) -> 
A157: of:==IF([.B157]=""; ""; [.B157]&CHAR(13)&CHAR(10)) ->  | B157: of:="" -> 
A158: of:==IF([.B158]=""; ""; [.B158]&CHAR(13)&CHAR(10)) -> ==Movement==
 | B158: of:="==Movement==" -> ==Movement==
A159: of:==IF([.B159]=""; ""; [.B159]&CHAR(13)&CHAR(10)) -> {|
 | B159: of:="{|" -> {|
A160: of:==IF([.B160]=""; ""; [.B160]&CHAR(13)&CHAR(10)) -> |- class="bb4_tr" 
 | B160: of:="|- class=""bb4_tr"" " -> |- class="bb4_tr" 
A161: of:==IF([.B161]=""; ""; [.B161]&CHAR(13)&CHAR(10)) -> ! align="left" | 
 | B161: of:="! align=""left"" | " -> ! align="left" | 
A162: of:==IF([.B162]=""; ""; [.B162]&CHAR(13)&CHAR(10)) -> ! align="center" | Base
 | B162: of:="! align=""center"" | Base" -> ! align="center" | Base
A163: of:==IF([.B163]=""; ""; [.B163]&CHAR(13)&CHAR(10)) -> ! align="center" | Max Move
 | B163: of:="! align=""center"" | Max Move" -> ! align="center" | Max Move
A164: of:==IF([.B164]=""; ""; [.B164]&CHAR(13)&CHAR(10)) -> |- class="bb4_tr" 
 | B164: of:="|- class=""bb4_tr"" " -> |- class="bb4_tr" 
A165: of:==IF([.B165]=""; ""; [.B165]&CHAR(13)&CHAR(10)) -> ! align="left" | Run
 | B165: of:="! align=""left"" | Run" -> ! align="left" | Run
A166: of:==IF([.B166]=""; ""; [.B166]&CHAR(13)&CHAR(10)) -> | align="right" | 100 m
 | B166: of:="| align=""right"" | "&[Calc.C154] -> | align="right" | 100 m
A167: of:==IF([.B167]=""; ""; [.B167]&CHAR(13)&CHAR(10)) ->  | B167: of:="| align=""right"" | "&[Calc.E154]&" ("&[Calc.G154]&")" -> 
A168: of:==IF([.B168]=""; ""; [.B168]&CHAR(13)&CHAR(10)) -> |- class="bb4_tr" 
 | B168: of:="|- class=""bb4_tr"" " -> |- class="bb4_tr" 
A169: of:==IF([.B169]=""; ""; [.B169]&CHAR(13)&CHAR(10)) -> ! align="left" | Swim
 | B169: of:="! align=""left"" | Swim" -> ! align="left" | Swim
A170: of:==IF([.B170]=""; ""; [.B170]&CHAR(13)&CHAR(10)) ->  | B170: of:="| align=""right"" | "&[Calc.C155] -> 
A171: of:==IF([.B171]=""; ""; [.B171]&CHAR(13)&CHAR(10)) ->  | B171: of:="| align=""right"" | "&[Calc.E155]&" ("&[Calc.G155]&")" -> 
A172: of:==IF([.B172]=""; ""; [.B172]&CHAR(13)&CHAR(10)) -> |- class="bb4_tr" 
 | B172: of:="|- class=""bb4_tr"" " -> |- class="bb4_tr" 
A173: of:==IF([.B173]=""; ""; [.B173]&CHAR(13)&CHAR(10)) -> ! align="left" | Jump
 | B173: of:="! align=""left"" | Jump" -> ! align="left" | Jump
A174: of:==IF([.B174]=""; ""; [.B174]&CHAR(13)&CHAR(10)) ->  | B174: of:="| align=""right"" | "&#REF! -> 
A175: of:==IF([.B175]=""; ""; [.B175]&CHAR(13)&CHAR(10)) ->  | B175: of:=IF(HAS_FLIGHT;"|- class=""bb4_tr"" ";"") -> 
A176: of:==IF([.B176]=""; ""; [.B176]&CHAR(13)&CHAR(10)) ->  | B176: of:=IF(HAS_FLIGHT;"! align=""left"" | Fly";"") -> 
A177: of:==IF([.B177]=""; ""; [.B177]&CHAR(13)&CHAR(10)) ->  | B177: of:=IF(HAS_FLIGHT;"| align=""right"" | "&[Calc.C156];"") -> 
A178: of:==IF([.B178]=""; ""; [.B178]&CHAR(13)&CHAR(10)) ->  | B178: of:=IF(HAS_FLIGHT;"| align=""right"" | "&[Calc.E156]&" ("&[Calc.G156]&")";"") -> 
A179: of:==IF([.B179]=""; ""; [.B179]&CHAR(13)&CHAR(10)) ->  | B179: of:=IF(HAS_TELEPORTATION;"|- class=""bb4_tr"" ";"") -> 
A180: of:==IF([.B180]=""; ""; [.B180]&CHAR(13)&CHAR(10)) ->  | B180: of:=IF(HAS_TELEPORTATION;"! align=""left"" | Teleport";"") -> 
A181: of:==IF([.B181]=""; ""; [.B181]&CHAR(13)&CHAR(10)) ->  | B181: of:=IF(HAS_TELEPORTATION;"| align=""right"" | "&[Calc.C157];"") -> 
A182: of:==IF([.B182]=""; ""; [.B182]&CHAR(13)&CHAR(10)) ->  | B182: of:=IF(HAS_TELEPORTATION;"| align=""right"" | "&[Calc.E157];"") -> 
A183: of:==IF([.B183]=""; ""; [.B183]&CHAR(13)&CHAR(10)) ->  | B183: of:=IF(HAS_TUNNELING;"|- class=""bb4_tr"" ";"") -> 
A184: of:==IF([.B184]=""; ""; [.B184]&CHAR(13)&CHAR(10)) ->  | B184: of:=IF(HAS_TUNNELING;"! align=""left"" | Tunnel";"") -> 
A185: of:==IF([.B185]=""; ""; [.B185]&CHAR(13)&CHAR(10)) ->  | B185: of:=IF(HAS_TUNNELING;"| align=""right"" | "&[Calc.C158];"") -> 
A186: of:==IF([.B186]=""; ""; [.B186]&CHAR(13)&CHAR(10)) ->  | B186: of:=IF(HAS_TUNNELING;"| align=""right"" | "&[Calc.E158]&" ("&[Calc.G158]&")";"") -> 
A187: of:==IF([.B187]=""; ""; [.B187]&CHAR(13)&CHAR(10)) -> |}
 | B187: of:="|}" -> |}
A188: of:==IF([.B188]=""; ""; [.B188]&CHAR(13)&CHAR(10)) -> 

 | B188: of:=CHAR(13)&CHAR(10) -> 

A189: of:==IF([.B189]=""; ""; [.B189]&CHAR(13)&CHAR(10)) -> ==Personality==
 | B189: of:="==Personality==" -> ==Personality==
A190: of:==IF([.B190]=""; ""; [.B190]&CHAR(13)&CHAR(10)) ->  | B190: of:=IF(PERSONALITY="";"";PERSONALITY) -> 
A191: of:==IF([.B191]=""; ""; [.B191]&CHAR(13)&CHAR(10)) -> 

 | B191: of:=CHAR(13)&CHAR(10) -> 

A192: of:==IF([.B192]=""; ""; [.B192]&CHAR(13)&CHAR(10)) -> ===Motivations===
 | B192: of:="===Motivations===" -> ===Motivations===
A193: of:==IF([.B193]=""; ""; [.B193]&CHAR(13)&CHAR(10)) -> ;Selected
 | B193: of:=IF([Calc.B22]="";"";";"&[Calc.B22]) -> ;Selected
A194: of:==IF([.B194]=""; ""; [.B194]&CHAR(13)&CHAR(10)) -> :The character seeks to ensure that misdeeds are met with appropriate punishment.
 | B194: of:=IF([Calc.D23]="";"";":"&[Calc.D23]) -> :The character seeks to ensure that misdeeds are met with appropriate punishment.
A195: of:==IF([.B195]=""; ""; [.B195]&CHAR(13)&CHAR(10)) -> ;Adventure
 | B195: of:=IF([Calc.B24]="";"";";"&[Calc.B24]) -> ;Adventure
A196: of:==IF([.B196]=""; ""; [.B196]&CHAR(13)&CHAR(10)) -> :The character has an adventurous spirit and rarely turns down a quest.
 | B196: of:=IF([Calc.D24]="";"";":"&[Calc.D24]) -> :The character has an adventurous spirit and rarely turns down a quest.
A197: of:==IF([.B197]=""; ""; [.B197]&CHAR(13)&CHAR(10)) -> 

 | B197: of:=CHAR(13)&CHAR(10) -> 

A198: of:==IF([.B198]=""; ""; [.B198]&CHAR(13)&CHAR(10)) -> ===Complications===
 | B198: of:="===Complications===" -> ===Complications===
A199: of:==IF([.B199]=""; ""; [.B199]&CHAR(13)&CHAR(10)) -> ;Weakness
 | B199: of:=IF([Calc.B26]="";"";";"&[Calc.B26]) -> ;Weakness
A200: of:==IF([.B200]=""; ""; [.B200]&CHAR(13)&CHAR(10)) -> :When the character is exposed to an otherwise harmless environment or substance, they incur a skill penalty (-3 AV, -3 DV).
 | B200: of:=IF([Calc.D26]="";"";":"&[Calc.D26]) -> :When the character is exposed to an otherwise harmless environment or substance, they incur a skill penalty (-3 AV, -3 DV).
A201: of:==IF([.B201]=""; ""; [.B201]&CHAR(13)&CHAR(10)) ->  | B201: of:=IF([Calc.B27]="";"";";"&[Calc.B27]) -> 
A202: of:==IF([.B202]=""; ""; [.B202]&CHAR(13)&CHAR(10)) ->  | B202: of:=IF([Calc.D27]="";"";":"&[Calc.D27]) -> 
A203: of:==IF([.B203]=""; ""; [.B203]&CHAR(13)&CHAR(10)) -> 

 | B203: of:=CHAR(13)&CHAR(10) -> 

A204: of:==IF([.B204]=""; ""; [.B204]&CHAR(13)&CHAR(10)) -> Skills 43 + Gifts 22 + Powers 119 = 184 / 65
 | B204: of:=POINT_SUMMARY -> Skills 43 + Gifts 22 + Powers 119 = 184 / 65
A205: of:==IF([.B205]=""; ""; [.B205]&CHAR(13)&CHAR(10)) -> 

 | B205: of:=CHAR(13)&CHAR(10) -> 

A206: of:==IF([.B206]=""; ""; [.B206]&CHAR(13)&CHAR(10)) -> {{DEFAULTSORT:Fist Of Justice}}
 | B206: of:=IF(NOT(SORT_NAME="");"{{DEFAULTSORT:"&SORT_NAME&"}}";"") -> {{DEFAULTSORT:Fist Of Justice}}
A207: of:==IF([.B207]=""; ""; [.B207]&CHAR(13)&CHAR(10)) -> [[Category:People]]
 | B207: of:="[[Category:People]]" -> [[Category:People]]
A208: of:==IF([.B208]=""; ""; [.B208]&CHAR(13)&CHAR(10)) -> 

 | B208: of:=CHAR(13)&CHAR(10) -> 

A209: of:==IF([.B209]=""; ""; [.B209]&CHAR(13)&CHAR(10)) -> __NOTOC__
 | B209: __NOTOC__
A211: of:=HYPERLINK("#A1"; "Top 🡅") -> Top 🡅
A212: End Of Sheet

Sheet: Calc
A1: Calculations
A2: of:=HYPERLINK("#BACKGROUND_CALC"; "BACKGROUND_CALC") -> BACKGROUND_CALC | B2: of:=HYPERLINK("#MOVEMENT_CALC"; "MOVEMENT_CALC") -> MOVEMENT_CALC | C2: of:=HYPERLINK("#RESISTANCE_CALC"; "RESISTANCE_CALC") -> RESISTANCE_CALC
A3: of:=HYPERLINK("#EQUIPMENT_CALC"; "EQUIPMENT_CALC") -> EQUIPMENT_CALC | B3: of:=HYPERLINK("#POWER_CALC"; "POWER_CALC") -> POWER_CALC | C3: of:=HYPERLINK("#SKILL_CALC"; "SKILL_CALC") -> SKILL_CALC
A4: of:=HYPERLINK("#GIFT_CALC"; "GIFT_CALC") -> GIFT_CALC | B4: of:=HYPERLINK("#POWER_LEVEL_CALC"; "POWER_LEVEL_CALC") -> POWER_LEVEL_CALC | C4: of:=HYPERLINK("#STRENGTH_CALC"; "STRENGTH_CALC") -> STRENGTH_CALC
A6: of:=HYPERLINK("#A1"; "Top 🡅") -> Top 🡅
A7: Background
A8: of:=HYPERLINK("#BACKGROUND_CALC"; "BACKGROUND_CALC") -> BACKGROUND_CALC
A9: Character Information
B10: Selected | C10: Has | D10: "The" | E10: Sort Name
A11: Character Name | B11: of:=IF([Background.B5]=""; ""; [Background.B5]) -> Fist Of Justice | C11: of:=IF([.B11]=""; FALSE(); TRUE()) -> true | D11: of:=IF(AND([.C11]; LOWER(LEFT([.B11]; 4))="the ")) -> false | E11: of:=IF([.D11]; RIGHT([.B11]; LEN([.B11])-4)&", The"; [.B11]) -> Fist Of Justice
A12: Concept | B12: of:=IF([Background.B8]=""; ""; [Background.B8]) -> "The weed of crime bears bitter fruit!" | C12: of:=IF([.B12]=""; FALSE(); TRUE()) -> true | D12: of:=IF(AND([.C12]; LOWER(LEFT([.B12]; 4))="the ")) -> false | E12: of:=IF([.D12]; RIGHT([.B12]; LEN([.B12])-4)&", The"; [.B12]) -> "The weed of crime bears bitter fruit!"
F13: Description
A14: of:=ORIGIN_TITLE -> Origin | B14: of:=IF([Background.B9]=""; ""; [Background.B9]) -> Zenith | C14: of:=IF([.B14]=""; FALSE(); TRUE()) -> true | D14: of:=IF(AND([.$C14]; LOWER(LEFT([.$B14]; 4))="the ")) -> false | E14: of:=IF([.D14]; RIGHT([.B14]; LEN([.B14])-4)&", The"; [.B14]) -> Zenith | F14: of:=IFERROR(VLOOKUP(ORIGIN; ORIGIN_CHART; 2; FALSE()); "") -> The character was born human but has transcended their own humanity.
A15: Archetype | B15: of:=IF([Background.B10]=""; ""; [Background.B10]) -> Shadow | C15: of:=IF([.B15]=""; FALSE(); TRUE()) -> true | D15: of:=IF(AND([.$C15]; LOWER(LEFT([.$B15]; 4))="the ")) -> false | E15: of:=IF([.D15]; RIGHT([.B15]; LEN([.B15])-4)&", The"; [.B15]) -> Shadow | F15: of:=IFERROR(VLOOKUP(ARCHETYPE; ARCHETYPE_CHART; 2; FALSE()); "") -> The character can go where no one else can go.
A17: Description | B17: Selected | C17: Has
A18: Gender | B18: of:=IF([Background.B19]=""; ""; [Background.B19]) ->  | C18: of:=IF([.B18]=""; FALSE(); TRUE()) -> false
A19: Sexuality | B19: of:=IF([Background.B20]=""; ""; [Background.B20]) ->  | C19: of:=IF([.B19]=""; FALSE(); TRUE()) -> false
A21: Motivations and Complications
B22: Selected | C22: Has | D22: Description | E22: Concat
A23: Motivations | B23: of:=IF([Background.B25]=""; ""; [Background.B25]) -> Justice | C23: of:=IF([.B23]=""; FALSE(); TRUE()) -> true | D23: of:=IFERROR(VLOOKUP(MOTIVATION_1; MOTIVATION_CHART; 3; FALSE()); "") -> The character seeks to ensure that misdeeds are met with appropriate punishment. | E23: of:=IF([.C23]; MOTIVATION_1; "")&IF(MOTIVATION_1_DESCRIPTION=""; ""; ": "&MOTIVATION_1_DESCRIPTION) -> Justice: The character seeks to ensure that misdeeds are met with appropriate punishment.
B24: of:=IF([Background.B26]=""; ""; [Background.B26]) -> Adventure | C24: of:=IF([.B24]=""; FALSE(); TRUE()) -> true | D24: of:=IFERROR(VLOOKUP(MOTIVATION_2; MOTIVATION_CHART; 3; FALSE()); "") -> The character has an adventurous spirit and rarely turns down a quest. | E24: of:=IF([.C23]; MOTIVATION_2; "")&IF(MOTIVATION_2_DESCRIPTION=""; ""; ": "&MOTIVATION_2_DESCRIPTION) -> Adventure: The character has an adventurous spirit and rarely turns down a quest.
A26: Complications | B26: of:=IF([Background.B27]=""; ""; [Background.B27]) -> Weakness | C26: of:=IF([.B26]=""; FALSE(); TRUE()) -> true | D26: of:=IF([Background.B28]=""; IFERROR(VLOOKUP(COMPLICATION_1; COMPLICATION_CHART; 2; FALSE()); ""); [Background.B28]) -> When the character is exposed to an otherwise harmless environment or substance, they incur a skill penalty (-3 AV, -3 DV). | E26: of:=IF([.C26]; COMPLICATION_1; "")&IF(COMPLICATION_1_DESCRIPTION=""; ""; ": "&COMPLICATION_1_DESCRIPTION) -> Weakness: When the character is exposed to an otherwise harmless environment or substance, they incur a skill penalty (-3 AV, -3 DV).
B27: of:=IF([Background.B29]=""; ""; [Background.B29]) ->  | C27: of:=IF([.B27]=""; FALSE(); TRUE()) -> false | D27: of:=IF([Background.B30]=""; IFERROR(VLOOKUP(COMPLICATION_2; COMPLICATION_CHART; 2; FALSE()); ""); [Background.B30]) ->  | E27: of:=IF([.C27]; COMPLICATION_2; "")&IF(COMPLICATION_2_DESCRIPTION=""; ""; ": "&COMPLICATION_2_DESCRIPTION) -> 
E28: of:=COM.MICROSOFT.TEXTJOIN(CHAR(13)&CHAR(10); TRUE(); [.E23:.E24]; [.E26:.E27]) -> Justice: The character seeks to ensure that misdeeds are met with appropriate punishment.
Adventure: The character has an adventurous spirit and rarely turns down a quest.
Weakness: When the character is exposed to an otherwise harmless environment or substance, they incur a skill penalty (-3 AV, -3 DV).
A30: Characteristics
A31: Power Level | B31: of:=IF(AND([$Background.B33]>=0; [$Background.B33]<=10); [$Background.B33]; 0) -> 5
A32: Endurance | B32: of:=IF(ATHLETICS>0; ATHLETICS; 0)+IF(SELF_CONTROL>0; SELF_CONTROL; 0)+ENDURANCE_PADDING -> 13
A33: Health | B33: of:=IF(ATHLETICS>0; ATHLETICS; 0)+IF(SURVIVAL>0; SURVIVAL; 0)+HEALTH_PADDING -> 14
A35: Character Points
A36: Total | B36: of:=[$Background.B34] -> 65
A37: Spent | B37: of:=ROUNDUP(SUM(SKILL_COST;GIFT_COST;POWER_COST);0) -> 184
A38: Unspent | B38: of:=CP_TOTAL-CP_SPENT -> -119
A40: of:=HYPERLINK("#A1"; "Top 🡅") -> Top 🡅
A41: Equipment
A42: of:=HYPERLINK("#EQUIPMENT_CALC"; "EQUIPMENT_CALC") -> EQUIPMENT_CALC
A43: Armor
A44: Display | B44: Selected | C44: Level | D44: DR | E44: (Blank Column) | F44: Cost | G44: Notes | H44: Has | I44: Concat
A45: of:=IF([.H45]; IF([Equipment.B10]=""; [.B45]; [Equipment.B10]); "") -> Bulletproof Vest | B45: of:=IF([.H45]; VLOOKUP([Equipment.B8];ARMOR_CHART;2;FALSE()); "") -> Heavy Tactical Armor | C45: of:=IF([.H45]; VLOOKUP([Equipment.B8]; ARMOR_CHART; 3; FALSE()); "") -> 2 | D45: of:=IF([.H45]; VLOOKUP([Equipment.B8]; ARMOR_CHART; 4; FALSE()); "") -> 5 | F45: of:=IF([.H45]; VLOOKUP([Equipment.B8]; ARMOR_CHART; 6; FALSE()); "") -> 2000 | G45: of:=IF([.H45]; VLOOKUP([Equipment.B8]; ARMOR_CHART; 7; FALSE()); "") -> 0 | H45: of:=IF([Equipment.B8]=""; FALSE(); TRUE()) -> true | I45: of:=IF([.H45]; [.A45]&" (Level "&[.C45]&", "&[.D45]&" DR)"; "") -> Bulletproof Vest (Level 2, 5 DR)
A47: Armor Options | B47: Selected | C47: (Blank Column) | D47: (Blank Column) | E47: (Blank Column) | F47: (Blank Column) | G47: Notes | H47: Has | I47: Concat
A48: of:=IF([.H48]; IF([Equipment.D16]=""; [.B48]; [Equipment.D16]); "") ->  | B48: of:=IF([.H48]; VLOOKUP([Equipment.B16]; ARMOR_ENH_CHART; 2; FALSE()); "") ->  | G48: of:=IF([.H48]; VLOOKUP([Equipment.B16]; ARMOR_ENH_CHART; 7; FALSE()); "") ->  | H48: of:=IF([Equipment.B16]=""; FALSE(); TRUE()) -> false | I48: of:=IF([.H48]; [.A48]; "") -> 
A49: of:=IF([.H49]; IF([Equipment.D17]=""; [.B49]; [Equipment.D17]); "") ->  | B49: of:=IF([.H49]; VLOOKUP([Equipment.B17]; ARMOR_ENH_CHART; 2; FALSE()); "") ->  | G49: of:=IF([.H49]; VLOOKUP([Equipment.B17]; ARMOR_ENH_CHART; 7; FALSE()); "") ->  | H49: of:=IF([Equipment.B17]=""; FALSE(); TRUE()) -> false | I49: of:=IF([.H49]; [.A49]; "") -> 
A50: of:=IF([.H50]; IF([Equipment.D18]=""; [.B50]; [Equipment.D18]); "") ->  | B50: of:=IF([.H50]; VLOOKUP([Equipment.B18]; ARMOR_ENH_CHART; 2; FALSE()); "") ->  | G50: of:=IF([.H50]; VLOOKUP([Equipment.B18]; ARMOR_ENH_CHART; 7; FALSE()); "") ->  | H50: of:=IF([Equipment.B18]=""; FALSE(); TRUE()) -> false | I50: of:=IF([.H50]; [.A50]; "") -> 
A51: of:=IF([.H51]; IF([Equipment.D19]=""; [.B51]; [Equipment.D19]); "") ->  | B51: of:=IF([.H51]; VLOOKUP([Equipment.B19]; ARMOR_ENH_CHART; 2; FALSE()); "") ->  | G51: of:=IF([.H51]; VLOOKUP([Equipment.B19]; ARMOR_ENH_CHART; 7; FALSE()); "") ->  | H51: of:=IF([Equipment.B19]=""; FALSE(); TRUE()) -> false | I51: of:=IF([.H51]; [.A51]; "") -> 
A52: of:=IF([.H52]; IF([Equipment.D20]=""; [.B52]; [Equipment.D20]); "") ->  | B52: of:=IF([.H52]; VLOOKUP([Equipment.B20]; ARMOR_ENH_CHART; 2; FALSE()); "") ->  | G52: of:=IF([.H52]; VLOOKUP([Equipment.B20]; ARMOR_ENH_CHART; 7; FALSE()); "") ->  | H52: of:=IF([Equipment.B20]=""; FALSE(); TRUE()) -> false | I52: of:=IF([.H52]; [.A52]; "") -> 
A53: of:=IF([.H53]; IF([Equipment.D21]=""; [.B53]; [Equipment.D21]); "") ->  | B53: of:=IF([.H53]; VLOOKUP([Equipment.B21]; ARMOR_ENH_CHART; 2; FALSE()); "") ->  | G53: of:=IF([.H53]; VLOOKUP([Equipment.B21]; ARMOR_ENH_CHART; 7; FALSE()); "") ->  | H53: of:=IF([Equipment.B21]=""; FALSE(); TRUE()) -> false | I53: of:=IF([.H53]; [.A53]; "") -> 
A54: of:=IF([.H54]; IF([Equipment.D22]=""; [.B54]; [Equipment.D22]); "") ->  | B54: of:=IF([.H54]; VLOOKUP([Equipment.B22]; ARMOR_ENH_CHART; 2; FALSE()); "") ->  | G54: of:=IF([.H54]; VLOOKUP([Equipment.B22]; ARMOR_ENH_CHART; 7; FALSE()); "") ->  | H54: of:=IF([Equipment.B22]=""; FALSE(); TRUE()) -> false | I54: of:=IF([.H54]; [.A54]; "") -> 
A55: of:=IF([.H55]; IF([Equipment.D23]=""; [.B55]; [Equipment.D23]); "") ->  | B55: of:=IF([.H55]; VLOOKUP([Equipment.B23]; ARMOR_ENH_CHART; 2; FALSE()); "") ->  | G55: of:=IF([.H55]; VLOOKUP([Equipment.B23]; ARMOR_ENH_CHART; 7; FALSE()); "") ->  | H55: of:=IF([Equipment.B23]=""; FALSE(); TRUE()) -> false | I55: of:=IF([.H55]; [.A55]; "") -> 
A56: of:=IF([.H56]; IF([Equipment.B24]=""; ""; [Equipment.B24]); "") ->  | H56: of:=IF([Equipment.B24]=""; FALSE(); TRUE()) -> false | I56: of:=IF([.H56]; [.A56]; "") -> 
G57: of:=IF([.H57]; COM.MICROSOFT.TEXTJOIN(", "; TRUE(); [.G48:.G56]); "") ->  | H57: of:=OR([.H48:.H56]) -> false | I57: of:=IF([.H57]; COM.MICROSOFT.TEXTJOIN(", "; TRUE(); [.I48:.I56]); "") -> 
I58: of:=IF([.H45]; [.I45]&" "&IF([.G45]=""; ""; [.G45])&IF(AND(NOT([.G45]=""); [.H57]); "; "; "")&IF([.H57]=""; ""; [.I57]); "") -> Bulletproof Vest (Level 2, 5 DR) 
A60: Shield
A61: Display | B61: Selected | C61: Level | D61: DR Bonus | E61: (Blank Column) | F61: Cost | G61: Notes | H61: Has | I61: Concat
A62: of:=IF([.H62]; IF([Equipment.D27]=""; [.B62]; [Equipment.D27]); "") ->  | B62: of:=IF([.H62]; IF([Equipment.D27]=""; VLOOKUP([Equipment.B27];SHIELD_CHART;2;FALSE()); [Equipment.D27]); "") ->  | C62: of:=IF([.H62]; VLOOKUP([Equipment.B27]; SHIELD_CHART; 3; FALSE()); "") ->  | D62: of:=IF([.H62]; VLOOKUP([Equipment.B27]; SHIELD_CHART; 4; FALSE()); "") ->  | F62: of:=IF([.H62]; VLOOKUP([Equipment.B27]; SHIELD_CHART; 6; FALSE()); "") ->  | G62: of:=IF([.H62]; VLOOKUP([Equipment.B27]; SHIELD_CHART; 7; FALSE()); "") ->  | H62: of:=IF([Equipment.B27]=""; FALSE(); TRUE()) -> false | I62: of:=IF([.H62]; [.B62]&" (Level "&[.C62]&", "&[.D62]&" DR Bonus)"; "") -> 
A64: Shield Options | B64: Selected | C64: (Blank Column) | D64: (Blank Column) | E64: (Blank Column) | F64: (Blank Column) | G64: Notes | H64: Has | I64: Concat
A65: of:=IF([.H65]; IF([Equipment.D31]=""; [.B65]; [Equipment.D31]); "") ->  | B65: of:=IF([.H65]; VLOOKUP([Equipment.B31]; SHIELD_ENH_CHART; 2; FALSE()); "") ->  | G65: of:=IF([.H65]; VLOOKUP([Equipment.B31]; SHIELD_ENH_CHART; 7; FALSE()); "") ->  | H65: of:=IF([Equipment.B31]=""; FALSE(); TRUE()) -> false | I65: of:=IF([.H65]; [.A65]; "") -> 
A66: of:=IF([.H66]; IF([Equipment.D32]=""; [.B66]; [Equipment.D32]); "") ->  | B66: of:=IF([.H66]; VLOOKUP([Equipment.B32]; SHIELD_ENH_CHART; 2; FALSE()); "") ->  | G66: of:=IF([.H66]; VLOOKUP([Equipment.B32]; SHIELD_ENH_CHART; 7; FALSE()); "") ->  | H66: of:=IF([Equipment.B32]=""; FALSE(); TRUE()) -> false | I66: of:=IF([.H66]; [.A66]; "") -> 
A67: of:=IF([.H67]; IF([Equipment.D33]=""; [.B67]; [Equipment.D33]); "") ->  | B67: of:=IF([.H67]; VLOOKUP([Equipment.B33]; SHIELD_ENH_CHART; 2; FALSE()); "") ->  | G67: of:=IF([.H67]; VLOOKUP([Equipment.B33]; SHIELD_ENH_CHART; 7; FALSE()); "") ->  | H67: of:=IF([Equipment.B33]=""; FALSE(); TRUE()) -> false | I67: of:=IF([.H67]; [.A67]; "") -> 
A68: of:=IF([.H68]; IF([Equipment.D34]=""; [.B68]; [Equipment.D34]); "") ->  | B68: of:=IF([.H68]; VLOOKUP([Equipment.B34]; SHIELD_ENH_CHART; 2; FALSE()); "") ->  | G68: of:=IF([.H68]; VLOOKUP([Equipment.B34]; SHIELD_ENH_CHART; 7; FALSE()); "") ->  | H68: of:=IF([Equipment.B34]=""; FALSE(); TRUE()) -> false | I68: of:=IF([.H68]; [.A68]; "") -> 
A69: of:=IF([.H69]; IF([Equipment.D35]=""; [.B69]; [Equipment.D35]); "") ->  | B69: of:=IF([.H69]; VLOOKUP([Equipment.B35]; SHIELD_ENH_CHART; 2; FALSE()); "") ->  | G69: of:=IF([.H69]; VLOOKUP([Equipment.B35]; SHIELD_ENH_CHART; 7; FALSE()); "") ->  | H69: of:=IF([Equipment.B35]=""; FALSE(); TRUE()) -> false | I69: of:=IF([.H69]; [.A69]; "") -> 
A70: of:=IF([.H70]; IF([Equipment.D36]=""; [.B70]; [Equipment.D36]); "") ->  | B70: of:=IF([.H70]; VLOOKUP([Equipment.B36]; SHIELD_ENH_CHART; 2; FALSE()); "") ->  | G70: of:=IF([.H70]; VLOOKUP([Equipment.B36]; SHIELD_ENH_CHART; 7; FALSE()); "") ->  | H70: of:=IF([Equipment.B36]=""; FALSE(); TRUE()) -> false | I70: of:=IF([.H70]; [.A70]; "") -> 
A71: of:=IF([.H71]; IF([Equipment.D37]=""; [.B71]; [Equipment.D37]); "") ->  | B71: of:=IF([.H71]; VLOOKUP([Equipment.B37]; SHIELD_ENH_CHART; 2; FALSE()); "") ->  | G71: of:=IF([.H71]; VLOOKUP([Equipment.B37]; SHIELD_ENH_CHART; 7; FALSE()); "") ->  | H71: of:=IF([Equipment.B37]=""; FALSE(); TRUE()) -> false | I71: of:=IF([.H71]; [.A71]; "") -> 
A72: of:=IF([.H72]; IF([Equipment.D38]=""; [.B72]; [Equipment.D38]); "") ->  | B72: of:=IF([.H72]; VLOOKUP([Equipment.B38]; SHIELD_ENH_CHART; 2; FALSE()); "") ->  | G72: of:=IF([.H72]; VLOOKUP([Equipment.B38]; SHIELD_ENH_CHART; 7; FALSE()); "") ->  | H72: of:=IF([Equipment.B38]=""; FALSE(); TRUE()) -> false | I72: of:=IF([.H72]; [.A72]; "") -> 
A73: of:=IF([.H73]; IF([Equipment.B39]=""; ""; [Equipment.B39]); "") ->  | H73: of:=IF([Equipment.B39]=""; FALSE(); TRUE()) -> false | I73: of:=IF([.H73]; [.A73]; "") -> 
G74: of:=IF([.H72]; COM.MICROSOFT.TEXTJOIN(", "; TRUE(); [.G65:.G73]); "") ->  | H74: of:=IF(OR([.H65:.H73])) -> false | I74: of:=IF([.H74]; COM.MICROSOFT.TEXTJOIN(", "; TRUE(); [.I65:.I73]); "") -> 
I75: of:=IF([.H62]; [.I62]&" "&IF([.G62]=""; ""; [.G62])&IF(AND(NOT([.G62]=""); [.H74]); "; "; "")&IF([.H74]=""; ""; [.I74]); "") -> 
A77: Hand-to-hand Weapons
A78: Display | B78: Selected | C78: Level | D78: Damage | E78: (Blank Column) | F78: Cost | G78: (Blank Column) | H78: Has | I78: Concat
A79: of:=IF([.H79]; IF([Equipment.D42]=""; [.B79]; [Equipment.D42]); "") ->  | B79: of:=IF([.H79]; VLOOKUP([Equipment.B42];HTH_WEAPON_CHART;2;FALSE()); "") ->  | C79: of:=IF([.H79]; VLOOKUP([Equipment.B42]; HTH_WEAPON_CHART; 3; FALSE()); "") ->  | D79: of:=IF([.H79]; VLOOKUP([Equipment.B42]; HTH_WEAPON_CHART; 4; FALSE()); "") ->  | F79: of:=IF([.H79]; VLOOKUP([Equipment.B42]; HTH_WEAPON_CHART; 6; FALSE()); "") ->  | H79: of:=IF([Equipment.B42]=""; FALSE(); TRUE()) -> false | I79: of:=IF([.H79]; [.A79]&" (Level "&[.C79]&", "&[.D79]&" Damage)"; "") -> 
A80: of:=IF([.H80]; IF([Equipment.D43]=""; [.B80]; [Equipment.D43]); "") ->  | B80: of:=IF([.H80]; VLOOKUP([Equipment.B43];HTH_WEAPON_CHART;2;FALSE()); "") ->  | C80: of:=IF([.H80]; VLOOKUP([Equipment.B43]; HTH_WEAPON_CHART; 3; FALSE()); "") ->  | D80: of:=IF([.H80]; VLOOKUP([Equipment.B43]; HTH_WEAPON_CHART; 4; FALSE()); "") ->  | F80: of:=IF([.H80]; VLOOKUP([Equipment.B43]; HTH_WEAPON_CHART; 6; FALSE()); "") ->  | H80: of:=IF([Equipment.B43]=""; FALSE(); TRUE()) -> false | I80: of:=IF([.H80]; [.A80]&" (Level "&[.C80]&", "&[.D80]&" Damage)"; "") -> 
A81: of:=IF([.H81]; IF([Equipment.D44]=""; [.B81]; [Equipment.D44]); "") ->  | B81: of:=IF([.H81]; VLOOKUP([Equipment.B44];HTH_WEAPON_CHART;2;FALSE()); "") ->  | C81: of:=IF([.H81]; VLOOKUP([Equipment.B44]; HTH_WEAPON_CHART; 3; FALSE()); "") ->  | D81: of:=IF([.H81]; VLOOKUP([Equipment.B44]; HTH_WEAPON_CHART; 4; FALSE()); "") ->  | F81: of:=IF([.H81]; VLOOKUP([Equipment.B44]; HTH_WEAPON_CHART; 6; FALSE()); "") ->  | H81: of:=IF([Equipment.B44]=""; FALSE(); TRUE()) -> false | I81: of:=IF([.H81]; [.A81]&" (Level "&[.C81]&", "&[.D81]&" Damage)"; "") -> 
H82: of:=IF(OR([.H79:.H81]); TRUE(); FALSE()) -> false | I82: of:=IF([.H82]; COM.MICROSOFT.TEXTJOIN(CHAR(13)&CHAR(10); TRUE(); [.I79:.I81]); "") -> 
A84: Ranged Weapons
A85: Display | B85: Selected | C85: Level | D85: Damage | E85: Range | F85: Cost | G85: (Blank Column) | H85: Has | I85: Concat
A86: of:=IF([.H86]; IF([Equipment.D47]=""; [.B86]; [Equipment.D47]); "") -> Colt 1911 | B86: of:=IF([.H86]; VLOOKUP([Equipment.B47]; RANGED_WEAPON_CHART; 2; FALSE()); "") -> Heavy Tactical Sidearm | C86: of:=IF([.H86]; VLOOKUP([Equipment.B47]; RANGED_WEAPON_CHART; 3; FALSE()); "") -> 3 | D86: of:=IF([.H86]; VLOOKUP([Equipment.B47]; RANGED_WEAPON_CHART; 4; FALSE()); "") -> 1d6+3 | E86: of:=IF([.H86]; VLOOKUP([Equipment.B47]; RANGED_WEAPON_CHART; 5; FALSE()); "") -> Short | F86: of:=IF([.H86]; VLOOKUP([Equipment.B47]; RANGED_WEAPON_CHART; 6; FALSE()); "") -> 1200 | H86: of:=IF([Equipment.B47]=""; FALSE(); TRUE()) -> true | I86: of:=IF([.H86]; [.A86]&" (Level "&[.C86]&", "&[.D86]&" Damage, "&[.E86]&" range)"; "") -> Colt 1911 (Level 3, 1d6+3 Damage, Short range)
A87: of:=IF([.H87]; IF([Equipment.D48]=""; [.B87]; [Equipment.D48]); "") -> Colt 1911 | B87: of:=IF([.H87]; VLOOKUP([Equipment.B48]; RANGED_WEAPON_CHART; 2; FALSE()); "") -> Heavy Tactical Sidearm | C87: of:=IF([.H87]; VLOOKUP([Equipment.B48]; RANGED_WEAPON_CHART; 3; FALSE()); "") -> 3 | D87: of:=IF([.H87]; VLOOKUP([Equipment.B48]; RANGED_WEAPON_CHART; 4; FALSE()); "") -> 1d6+3 | E87: of:=IF([.H87]; VLOOKUP([Equipment.B48]; RANGED_WEAPON_CHART; 5; FALSE()); "") -> Short | F87: of:=IF([.H87]; VLOOKUP([Equipment.B48]; RANGED_WEAPON_CHART; 6; FALSE()); "") -> 1200 | H87: of:=IF([Equipment.B48]=""; FALSE(); TRUE()) -> true | I87: of:=IF([.H87]; [.A87]&" (Level "&[.C87]&", "&[.D87]&" Damage, "&[.E87]&" range)"; "") -> Colt 1911 (Level 3, 1d6+3 Damage, Short range)
A88: of:=IF([.H88]; IF([Equipment.D49]=""; [.B88]; [Equipment.D49]); "") ->  | B88: of:=IF([.H88]; VLOOKUP([Equipment.B49]; RANGED_WEAPON_CHART; 2; FALSE()); "") ->  | C88: of:=IF([.H88]; VLOOKUP([Equipment.B49]; RANGED_WEAPON_CHART; 3; FALSE()); "") ->  | D88: of:=IF([.H88]; VLOOKUP([Equipment.B49]; RANGED_WEAPON_CHART; 4; FALSE()); "") ->  | E88: of:=IF([.H88]; VLOOKUP([Equipment.B49]; RANGED_WEAPON_CHART; 5; FALSE()); "") ->  | F88: of:=IF([.H88]; VLOOKUP([Equipment.B49]; RANGED_WEAPON_CHART; 6; FALSE()); "") ->  | H88: of:=IF([Equipment.B49]=""; FALSE(); TRUE()) -> false | I88: of:=IF([.H88]; [.A88]&" (Level "&[.C88]&", "&[.D88]&" Damage, "&[.E88]&" range)"; "") -> 
H89: of:=IF(OR([.H86:.H88])) -> true | I89: of:=IF([.H89]; COM.MICROSOFT.TEXTJOIN(CHAR(13)&CHAR(10); TRUE(); [.I86:.I88]); "") -> Colt 1911 (Level 3, 1d6+3 Damage, Short range)
Colt 1911 (Level 3, 1d6+3 Damage, Short range)
A91: Explosives And Grenades
A92: Display | B92: Selected | C92: Level | D92: Damage | E92: Range | F92: Cost | G92: Notes | H92: Has | I92: Concat
A93: of:=IF([.H93]; IF([Equipment.D52]=""; [.B93]; [Equipment.D52]); "") ->  | B93: of:=IF([.H93]; VLOOKUP([Equipment.B52]; EXPLOSIVE_WEAPON_CHART; 2; FALSE()); "") ->  | C93: of:=IF([.H93]; VLOOKUP([Equipment.B52]; EXPLOSIVE_WEAPON_CHART; 3; FALSE()); "") ->  | D93: of:=IF([.H93]; VLOOKUP([Equipment.B52]; EXPLOSIVE_WEAPON_CHART; 4; FALSE()); "") ->  | E93: of:=IF([.H93]; VLOOKUP([Equipment.B52]; EXPLOSIVE_WEAPON_CHART; 5; FALSE()); "") ->  | F93: of:=IF([.H93]; VLOOKUP([Equipment.B52]; EXPLOSIVE_WEAPON_CHART; 6; FALSE()); "") ->  | G93: of:=IF([.H93]; VLOOKUP([Equipment.B52]; EXPLOSIVE_WEAPON_CHART; 7; FALSE()); "") ->  | H93: of:=IF([Equipment.B52]=""; FALSE(); TRUE()) -> false | I93: of:=IF([.H93];[.A93]&" (Level "&[.C93]&", "&[.D93]&" Damage, "&[.E93]&" range"&IF([.G93]="";"";", "&[.G93])&")";"") -> 
A94: of:=IF([.H94]; IF([Equipment.D53]=""; [.B94]; [Equipment.D53]); "") ->  | B94: of:=IF([.H94]; VLOOKUP([Equipment.B53]; EXPLOSIVE_WEAPON_CHART; 2; FALSE()); "") ->  | C94: of:=IF([.H94]; VLOOKUP([Equipment.B53]; EXPLOSIVE_WEAPON_CHART; 3; FALSE()); "") ->  | D94: of:=IF([.H94]; VLOOKUP([Equipment.B53]; EXPLOSIVE_WEAPON_CHART; 4; FALSE()); "") ->  | E94: of:=IF([.H94]; VLOOKUP([Equipment.B53]; EXPLOSIVE_WEAPON_CHART; 5; FALSE()); "") ->  | F94: of:=IF([.H94]; VLOOKUP([Equipment.B53]; EXPLOSIVE_WEAPON_CHART; 6; FALSE()); "") ->  | G94: of:=IF([.H94]; VLOOKUP([Equipment.B53]; EXPLOSIVE_WEAPON_CHART; 7; FALSE()); "") ->  | H94: of:=IF([Equipment.B53]=""; FALSE(); TRUE()) -> false | I94: of:=IF([.H94];[.A94]&" (Level "&[.C94]&", "&[.D94]&" Damage, "&[.E94]&" range"&IF([.G94]="";"";", "&[.G94])&")";"") -> 
A95: of:=IF([.H95]; IF([Equipment.D54]=""; [.B95]; [Equipment.D54]); "") ->  | B95: of:=IF([.H95]; VLOOKUP([Equipment.B54]; EXPLOSIVE_WEAPON_CHART; 2; FALSE()); "") ->  | C95: of:=IF([.H95]; VLOOKUP([Equipment.B54]; EXPLOSIVE_WEAPON_CHART; 3; FALSE()); "") ->  | D95: of:=IF([.H95]; VLOOKUP([Equipment.B54]; EXPLOSIVE_WEAPON_CHART; 4; FALSE()); "") ->  | E95: of:=IF([.H95]; VLOOKUP([Equipment.B54]; EXPLOSIVE_WEAPON_CHART; 5; FALSE()); "") ->  | F95: of:=IF([.H95]; VLOOKUP([Equipment.B54]; EXPLOSIVE_WEAPON_CHART; 6; FALSE()); "") ->  | G95: of:=IF([.H95]; VLOOKUP([Equipment.B54]; EXPLOSIVE_WEAPON_CHART; 7; FALSE()); "") ->  | H95: of:=IF([Equipment.B54]=""; FALSE(); TRUE()) -> false | I95: of:=IF([.H95];[.A95]&" (Level "&[.C95]&", "&[.D95]&" Damage, "&[.E95]&" range"&IF([.G95]="";"";", "&[.G95])&")";"") -> 
H96: of:=IF(OR([.H93:.H95])) -> false | I96: of:=IF([.H96]; COM.MICROSOFT.TEXTJOIN(CHAR(13)&CHAR(10); TRUE(); [.I93:.I95]); "") -> 
A98: Field Kits
A99: Display | B99: Selected | C99: Level | D99: (Blank Column) | E99: (Blank Column) | F99: Cost | G99: (Blank Column) | H99: Has | I99: Concat
A100: of:=IF([.H100]; IF([Equipment.D57]=""; [.B100]; [Equipment.D57]); "") -> Lockpicks | B100: of:=IF([.H100]; VLOOKUP([Equipment.B57]; FIELD_KIT_CHART; 2; FALSE()); "") -> Field Kit | C100: of:=IF([.H100]; VLOOKUP([Equipment.B57]; FIELD_KIT_CHART; 3; FALSE()); "") -> 2 | F100: of:=IF([.H100]; VLOOKUP([Equipment.B57]; FIELD_KIT_CHART; 6; FALSE()); "") -> 600 | H100: of:=IF([Equipment.B57]=""; FALSE(); TRUE()) -> true | I100: of:=IF([.H100]; [.A100]&" (Level "&[.C100]&")"; "") -> Lockpicks (Level 2)
A101: of:=IF([.H101]; IF([Equipment.D58]=""; [.B101]; [Equipment.D58]); "") ->  | B101: of:=IF([.H101]; VLOOKUP([Equipment.B58]; FIELD_KIT_CHART; 2; FALSE()); "") ->  | C101: of:=IF([.H101]; VLOOKUP([Equipment.B58]; FIELD_KIT_CHART; 3; FALSE()); "") ->  | F101: of:=IF([.H101]; VLOOKUP([Equipment.B58]; FIELD_KIT_CHART; 6; FALSE()); "") ->  | H101: of:=IF([Equipment.B58]=""; FALSE(); TRUE()) -> false | I101: of:=IF([.H101]; [.A101]&" (Level "&[.C101]&")"; "") -> 
A102: of:=IF([.H102]; IF([Equipment.D59]=""; [.B102]; [Equipment.D59]); "") ->  | B102: of:=IF([.H102]; VLOOKUP([Equipment.B59]; FIELD_KIT_CHART; 2; FALSE()); "") ->  | C102: of:=IF([.H102]; VLOOKUP([Equipment.B59]; FIELD_KIT_CHART; 3; FALSE()); "") ->  | F102: of:=IF([.H102]; VLOOKUP([Equipment.B59]; FIELD_KIT_CHART; 6; FALSE()); "") ->  | H102: of:=IF([Equipment.B59]=""; FALSE(); TRUE()) -> false | I102: of:=IF([.H102]; [.A102]&" (Level "&[.C102]&")"; "") -> 
H103: of:=IF(OR([.H100:.H102])) -> true | I103: of:=IF([.H103]; COM.MICROSOFT.TEXTJOIN(CHAR(13)&CHAR(10); TRUE(); [.I100:.I102]); "") -> Lockpicks (Level 2)
A105: Other Equipment
A106: Display | B106: (Blank Column) | C106: (Blank Column) | D106: (Blank Column) | E106: (Blank Column) | F106: (Blank Column) | G106: (Blank Column) | H106: Has | I106: Concat
A107: of:=IF([.H107]; IF([Equipment.B62]=""; ""; [Equipment.B62]); "") ->  | H107: of:=IF([Equipment.B62]=""; FALSE(); TRUE()) -> false | I107: of:=IF([.H107]; [.A107]; "") -> 
A108: of:=IF([.H108]; IF([Equipment.B63]=""; ""; [Equipment.B63]); "") ->  | H108: of:=IF([Equipment.B63]=""; FALSE(); TRUE()) -> false | I108: of:=IF([.H108]; [.A108]; "") -> 
A109: of:=IF([.H109]; IF([Equipment.B64]=""; ""; [Equipment.B64]); "") ->  | H109: of:=IF([Equipment.B64]=""; FALSE(); TRUE()) -> false | I109: of:=IF([.H109]; [.A109]; "") -> 
A110: of:=IF([.H110]; IF([Equipment.B65]=""; ""; [Equipment.B65]); "") ->  | H110: of:=IF([Equipment.B65]=""; FALSE(); TRUE()) -> false | I110: of:=IF([.H110]; [.A110]; "") -> 
A111: of:=IF([.H111]; IF([Equipment.B66]=""; ""; [Equipment.B66]); "") ->  | H111: of:=IF([Equipment.B66]=""; FALSE(); TRUE()) -> false | I111: of:=IF([.H111]; [.A111]; "") -> 
A112: of:=IF([.H112]; IF([Equipment.B67]=""; ""; [Equipment.B67]); "") ->  | H112: of:=IF([Equipment.B67]=""; FALSE(); TRUE()) -> false | I112: of:=IF([.H112]; [.A112]; "") -> 
A113: of:=IF([.H113]; IF([Equipment.B68]=""; ""; [Equipment.B68]); "") ->  | H113: of:=IF([Equipment.B68]=""; FALSE(); TRUE()) -> false | I113: of:=IF([.H113]; [.A113]; "") -> 
A114: of:=IF([.H114]; IF([Equipment.B69]=""; ""; [Equipment.B69]); "") ->  | H114: of:=IF([Equipment.B69]=""; FALSE(); TRUE()) -> false | I114: of:=IF([.H114]; [.A114]; "") -> 
A115: of:=IF([.H115]; IF([Equipment.B70]=""; ""; [Equipment.B70]); "") ->  | H115: of:=IF([Equipment.B70]=""; FALSE(); TRUE()) -> false | I115: of:=IF([.H115]; [.A115]; "") -> 
A116: of:=IF([.H116]; IF([Equipment.B71]=""; ""; [Equipment.B71]); "") ->  | H116: of:=IF([Equipment.B71]=""; FALSE(); TRUE()) -> false | I116: of:=IF([.H116]; [.A116]; "") -> 
H117: of:=IF(OR([.H107:.H116]); TRUE(); FALSE()) -> false | I117: of:=IF([.H117]; COM.MICROSOFT.TEXTJOIN(CHAR(13)&CHAR(10); TRUE(); [.I107:.I116]); "") -> 
H118: of:=IF(OR([.H45]; [.H57]; [.H62]; [.H74]; [.H82]; [.H89]; [.H96]; [.H103]; [.H117])) -> true | I118: of:=IF([.H118]; COM.MICROSOFT.TEXTJOIN(CHAR(13)&CHAR(10); TRUE(); [.I58]; [.I75]; [.I82]; [.I89]; [.I96]; [.I103]; [.I117]); "") -> Bulletproof Vest (Level 2, 5 DR) 
Colt 1911 (Level 3, 1d6+3 Damage, Short range)
Colt 1911 (Level 3, 1d6+3 Damage, Short range)
Lockpicks (Level 2)
A120: of:=HYPERLINK("#A1"; "Top 🡅") -> Top 🡅
A121: Gifts
A122: of:=HYPERLINK("#GIFT_CALC"; "GIFT_CALC") -> GIFT_CALC
A123: Display | B123: Has Gift | C123: Count | D123: Cost | E123: Reference Sheet
A124: of:=IF([.B124];[Gifts.C5]; "") -> Team Player | B124: of:=NOT([Gifts.C5]="") -> true | C124: of:=IF([.B124]; 1+N([.C123]); N([.C123])) -> 1 | D124: of:=IF([.B124]; 1; 0) -> 1 | E124: of:=IF([.B124]; [.A124]&CHAR(13)&CHAR(10)&VLOOKUP([Gifts.C5];GIFT_CHART;3;FALSE())&CHAR(13)&CHAR(10)&CHAR(13)&CHAR(10); "") -> Team Player
Once per scene, the character can grant a skill bonus (+3 AV, +3 DV) to all of their allies


A125: of:=IF([.B125];[Gifts.C6]; "") -> Unsettling | B125: of:=NOT([Gifts.C6]="") -> true | C125: of:=IF([.B125]; 1+N([.C124]); N([.C124])) -> 2 | D125: of:=IF([.B125]; 1; 0) -> 1 | E125: of:=IF([.B125]; [.A125]&CHAR(13)&CHAR(10)&VLOOKUP([Gifts.C6];GIFT_CHART;3;FALSE())&CHAR(13)&CHAR(10)&CHAR(13)&CHAR(10); "") -> Unsettling
The character can gain a skill bonus (+3 AV, +3 DV) on Manipulation skill rolls pertaining to intimidation and interrogation


A126: of:=IF([.B126];[Gifts.C7]; "") -> Vehicles | B126: of:=NOT([Gifts.C7]="") -> true | C126: of:=IF([.B126]; 1+N([.C125]); N([.C125])) -> 3 | D126: of:=IF([.B126]; 1; 0) -> 1 | E126: of:=IF([.B126]; [.A126]&CHAR(13)&CHAR(10)&VLOOKUP([Gifts.C7];GIFT_CHART;3;FALSE())&CHAR(13)&CHAR(10)&CHAR(13)&CHAR(10); "") -> Vehicles
The character has an assortment of vehicles at their disposal


A127: of:=IF([.B127];[Gifts.C8]; "") -> Wealthy | B127: of:=NOT([Gifts.C8]="") -> true | C127: of:=IF([.B127]; 1+N([.C126]); N([.C126])) -> 4 | D127: of:=IF([.B127]; 1; 0) -> 1 | E127: of:=IF([.B127]; [.A127]&CHAR(13)&CHAR(10)&VLOOKUP([Gifts.C8];GIFT_CHART;3;FALSE())&CHAR(13)&CHAR(10)&CHAR(13)&CHAR(10); "") -> Wealthy
The character can solve problems by throwing money at them


A128: of:=IF([.B128];[Gifts.C9]; "") -> Weightless Combat | B128: of:=NOT([Gifts.C9]="") -> true | C128: of:=IF([.B128]; 1+N([.C127]); N([.C127])) -> 5 | D128: of:=IF([.B128]; 1; 0) -> 1 | E128: of:=IF([.B128]; [.A128]&CHAR(13)&CHAR(10)&VLOOKUP([Gifts.C9];GIFT_CHART;3;FALSE())&CHAR(13)&CHAR(10)&CHAR(13)&CHAR(10); "") -> Weightless Combat
The character can fight or perform tasks while weightless without the associated penalties


A129: of:=IF([.B129];[Gifts.C10]; "") -> Disarming Expert | B129: of:=NOT([Gifts.C10]="") -> true | C129: of:=IF([.B129]; 1+N([.C128]); N([.C128])) -> 6 | D129: of:=IF([.B129]; 1; 0) -> 1 | E129: of:=IF([.B129]; [.A129]&CHAR(13)&CHAR(10)&VLOOKUP([Gifts.C10];GIFT_CHART;3;FALSE())&CHAR(13)&CHAR(10)&CHAR(13)&CHAR(10); "") -> Disarming Expert
The character can make disarming attacks without the associated penalty


A130: of:=IF([.B130];[Gifts.C11]; "") -> Escape Artist | B130: of:=NOT([Gifts.C11]="") -> true | C130: of:=IF([.B130]; 1+N([.C129]); N([.C129])) -> 7 | D130: of:=IF([.B130]; 1; 0) -> 1 | E130: of:=IF([.B130]; [.A130]&CHAR(13)&CHAR(10)&VLOOKUP([Gifts.C11];GIFT_CHART;3;FALSE())&CHAR(13)&CHAR(10)&CHAR(13)&CHAR(10); "") -> Escape Artist
The character receives a skill bonus (+6 AV, +6 DV) when attempting to break out of a grapple or the Hold power


A131: of:=IF([.B131];[Gifts.C12]; "") -> Expert Reputation | B131: of:=NOT([Gifts.C12]="") -> true | C131: of:=IF([.B131]; 1+N([.C130]); N([.C130])) -> 8 | D131: of:=IF([.B131]; 1; 0) -> 1 | E131: of:=IF([.B131]; [.A131]&CHAR(13)&CHAR(10)&VLOOKUP([Gifts.C12];GIFT_CHART;3;FALSE())&CHAR(13)&CHAR(10)&CHAR(13)&CHAR(10); "") -> Expert Reputation
The character can sometimes gain favors from strangers who are familiar with their work


A132: of:=IF([.B132];[Gifts.C13]; "") -> Famous | B132: of:=NOT([Gifts.C13]="") -> true | C132: of:=IF([.B132]; 1+N([.C131]); N([.C131])) -> 9 | D132: of:=IF([.B132]; 1; 0) -> 1 | E132: of:=IF([.B132]; [.A132]&CHAR(13)&CHAR(10)&VLOOKUP([Gifts.C13];GIFT_CHART;3;FALSE())&CHAR(13)&CHAR(10)&CHAR(13)&CHAR(10); "") -> Famous
The character can sometimes gain favors from strangers who recognize them


A133: of:=IF([.B133];[Gifts.C14]; "") -> Fascinating | B133: of:=NOT([Gifts.C14]="") -> true | C133: of:=IF([.B133]; 1+N([.C132]); N([.C132])) -> 10 | D133: of:=IF([.B133]; 1; 0) -> 1 | E133: of:=IF([.B133]; [.A133]&CHAR(13)&CHAR(10)&VLOOKUP([Gifts.C14];GIFT_CHART;3;FALSE())&CHAR(13)&CHAR(10)&CHAR(13)&CHAR(10); "") -> Fascinating
The character can sometimes gain favors from admirers


A134: of:=IF([.B134];[Gifts.C15]; "") -> Headquarters | B134: of:=NOT([Gifts.C15]="") -> true | C134: of:=IF([.B134]; 1+N([.C133]); N([.C133])) -> 11 | D134: of:=IF([.B134]; 1; 0) -> 1 | E134: of:=IF([.B134]; [.A134]&CHAR(13)&CHAR(10)&VLOOKUP([Gifts.C15];GIFT_CHART;3;FALSE())&CHAR(13)&CHAR(10)&CHAR(13)&CHAR(10); "") -> Headquarters
The character has one or more bases of operation, equipped with supplies and workshops reasonable for the character's background and skills


A135: of:=IF([.B135];[Gifts.C16]; "") -> Iron Fists | B135: of:=NOT([Gifts.C16]="") -> true | C135: of:=IF([.B135]; 1+N([.C134]); N([.C134])) -> 12 | D135: of:=IF([.B135]; 1; 0) -> 1 | E135: of:=IF([.B135]; [.A135]&CHAR(13)&CHAR(10)&VLOOKUP([Gifts.C16];GIFT_CHART;3;FALSE())&CHAR(13)&CHAR(10)&CHAR(13)&CHAR(10); "") -> Iron Fists
The character's unarmed hand-to-hand normal attacks deal points of Health damage equal to the character's Athletics


A136: of:=IF([.B136];[Gifts.C17]; "") -> Linguist | B136: of:=NOT([Gifts.C17]="") -> true | C136: of:=IF([.B136]; 1+N([.C135]); N([.C135])) -> 13 | D136: of:=IF([.B136]; 1; 0) -> 1 | E136: of:=IF([.B136]; [.A136]&CHAR(13)&CHAR(10)&VLOOKUP([Gifts.C17];GIFT_CHART;3;FALSE())&CHAR(13)&CHAR(10)&CHAR(13)&CHAR(10); "") -> Linguist
The character is fluent in dozens of languages, and they are capable of quickly deciphering new languages when they encounter them


A137: of:=IF([.B137];[Gifts.C18]; "") -> Mental Calculator | B137: of:=NOT([Gifts.C18]="") -> true | C137: of:=IF([.B137]; 1+N([.C136]); N([.C136])) -> 14 | D137: of:=IF([.B137]; 1; 0) -> 1 | E137: of:=IF([.B137]; [.A137]&CHAR(13)&CHAR(10)&VLOOKUP([Gifts.C18];GIFT_CHART;3;FALSE())&CHAR(13)&CHAR(10)&CHAR(13)&CHAR(10); "") -> Mental Calculator
The character can solve complex mathematical equations by thinking about them briefly


A138: of:=IF([.B138];[Gifts.C19]; "") -> Minions | B138: of:=NOT([Gifts.C19]="") -> true | C138: of:=IF([.B138]; 1+N([.C137]); N([.C137])) -> 15 | D138: of:=IF([.B138]; 1; 0) -> 1 | E138: of:=IF([.B138]; [.A138]&CHAR(13)&CHAR(10)&VLOOKUP([Gifts.C19];GIFT_CHART;3;FALSE())&CHAR(13)&CHAR(10)&CHAR(13)&CHAR(10); "") -> Minions
The character has an assortment of minor, mostly nameless lackeys of marginal usefulness


A139: of:=IF([.B139];[Gifts.C20]; "") -> Perfect Recall | B139: of:=NOT([Gifts.C20]="") -> true | C139: of:=IF([.B139]; 1+N([.C138]); N([.C138])) -> 16 | D139: of:=IF([.B139]; 1; 0) -> 1 | E139: of:=IF([.B139]; [.A139]&CHAR(13)&CHAR(10)&VLOOKUP([Gifts.C20];GIFT_CHART;3;FALSE())&CHAR(13)&CHAR(10)&CHAR(13)&CHAR(10); "") -> Perfect Recall
The character can perfectly remember any event, document, or recording which the character has clearly seen or heard


A140: of:=IF([.B140];[Gifts.C21]; "") -> Quick Change | B140: of:=NOT([Gifts.C21]="") -> true | C140: of:=IF([.B140]; 1+N([.C139]); N([.C139])) -> 17 | D140: of:=IF([.B140]; 1; 0) -> 1 | E140: of:=IF([.B140]; [.A140]&CHAR(13)&CHAR(10)&VLOOKUP([Gifts.C21];GIFT_CHART;3;FALSE())&CHAR(13)&CHAR(10)&CHAR(13)&CHAR(10); "") -> Quick Change
The character can change their entire outfit with a quick action


A141: of:=IF([.B141];[Gifts.C22]; "") -> Ranged Disarm | B141: of:=NOT([Gifts.C22]="") -> true | C141: of:=IF([.B141]; 1+N([.C140]); N([.C140])) -> 18 | D141: of:=IF([.B141]; 1; 0) -> 1 | E141: of:=IF([.B141]; [.A141]&CHAR(13)&CHAR(10)&VLOOKUP([Gifts.C22];GIFT_CHART;3;FALSE())&CHAR(13)&CHAR(10)&CHAR(13)&CHAR(10); "") -> Ranged Disarm
The character can make a disarming attack with a ranged weapon, with the usual associated penalties


A142: of:=IF([.B142];[Gifts.C23]; "") -> Scrounger | B142: of:=NOT([Gifts.C23]="") -> true | C142: of:=IF([.B142]; 1+N([.C141]); N([.C141])) -> 19 | D142: of:=IF([.B142]; 1; 0) -> 1 | E142: of:=IF([.B142]; [.A142]&CHAR(13)&CHAR(10)&VLOOKUP([Gifts.C23];GIFT_CHART;3;FALSE())&CHAR(13)&CHAR(10)&CHAR(13)&CHAR(10); "") -> Scrounger
The character can find shelter, food, and personal essentials enough to provide for themselves and a small number of friends


A143: of:=IF([.B143];[Gifts.C24]; "") -> Second Identity | B143: of:=NOT([Gifts.C24]="") -> true | C143: of:=IF([.B143]; 1+N([.C142]); N([.C142])) -> 20 | D143: of:=IF([.B143]; 1; 0) -> 1 | E143: of:=IF([.B143]; [.A143]&CHAR(13)&CHAR(10)&VLOOKUP([Gifts.C24];GIFT_CHART;3;FALSE())&CHAR(13)&CHAR(10)&CHAR(13)&CHAR(10); "") -> Second Identity
The character has a second, completely legitimate identity which will withstand even the most focused scrutiny


A144: of:=IF([.B144];[Gifts.C25]; "") -> Sense Auras | B144: of:=NOT([Gifts.C25]="") -> true | C144: of:=IF([.B144]; 1+N([.C143]); N([.C143])) -> 21 | D144: of:=IF([.B144]; 1; 0) -> 1 | E144: of:=IF([.B144]; [.A144]&CHAR(13)&CHAR(10)&VLOOKUP([Gifts.C25];GIFT_CHART;3;FALSE())&CHAR(13)&CHAR(10)&CHAR(13)&CHAR(10); "") -> Sense Auras
The character can see the invisible emanations around people


A145: of:=IF([.B145];[Gifts.C26]; "") -> Sharpshooter | B145: of:=NOT([Gifts.C26]="") -> true | C145: of:=IF([.B145]; 1+N([.C144]); N([.C144])) -> 22 | D145: of:=IF([.B145]; 1; 0) -> 1 | E145: of:=IF([.B145]; [.A145]&CHAR(13)&CHAR(10)&VLOOKUP([Gifts.C26];GIFT_CHART;3;FALSE())&CHAR(13)&CHAR(10)&CHAR(13)&CHAR(10); "") -> Sharpshooter
The character may ignore cover in ranged combat, as long as they can see part of the target


A146: of:=COM.MICROSOFT.TEXTJOIN(CHAR(13)&CHAR(10); TRUE(); [.A124:.A145]) -> Team Player
Unsettling
Vehicles
Wealthy
Weightless Combat
Disarming Expert
Escape Artist
Expert Reputation
Famous
Fascinating
Headquarters
Iron Fists
Linguist
Mental Calculator
Minions
Perfect Recall
Quick Change
Ranged Disarm
Scrounger
Second Identity
Sense Auras
Sharpshooter | C146: of:=[.C145] -> 22 | D146: of:=ROUNDUP(SUM([.D124:.D145])) -> 22 | E146: of:=COM.MICROSOFT.CONCAT([.E124:.E134]) -> Team Player
Once per scene, the character can grant a skill bonus (+3 AV, +3 DV) to all of their allies

Unsettling
The character can gain a skill bonus (+3 AV, +3 DV) on Manipulation skill rolls pertaining to intimidation and interrogation

Vehicles
The character has an assortment of vehicles at their disposal

Wealthy
The character can solve problems by throwing money at them

Weightless Combat
The character can fight or perform tasks while weightless without the associated penalties

Disarming Expert
The character can make disarming attacks without the associated penalty

Escape Artist
The character receives a skill bonus (+6 AV, +6 DV) when attempting to break out of a grapple or the Hold power

Expert Reputation
The character can sometimes gain favors from strangers who are familiar with their work

Famous
The character can sometimes gain favors from strangers who recognize them

Fascinating
The character can sometimes gain favors from admirers

Headquarters
The character has one or more bases of operation, equipped with supplies and workshops reasonable for the character's background and skills


E147: of:=COM.MICROSOFT.CONCAT([.E135:.E145]) -> Iron Fists
The character's unarmed hand-to-hand normal attacks deal points of Health damage equal to the character's Athletics

Linguist
The character is fluent in dozens of languages, and they are capable of quickly deciphering new languages when they encounter them

Mental Calculator
The character can solve complex mathematical equations by thinking about them briefly

Minions
The character has an assortment of minor, mostly nameless lackeys of marginal usefulness

Perfect Recall
The character can perfectly remember any event, document, or recording which the character has clearly seen or heard

Quick Change
The character can change their entire outfit with a quick action

Ranged Disarm
The character can make a disarming attack with a ranged weapon, with the usual associated penalties

Scrounger
The character can find shelter, food, and personal essentials enough to provide for themselves and a small number of friends

Second Identity
The character has a second, completely legitimate identity which will withstand even the most focused scrutiny

Sense Auras
The character can see the invisible emanations around people

Sharpshooter
The character may ignore cover in ranged combat, as long as they can see part of the target


E148: of:=COM.MICROSOFT.CONCAT([.E146:.E147]) -> Team Player
Once per scene, the character can grant a skill bonus (+3 AV, +3 DV) to all of their allies

Unsettling
The character can gain a skill bonus (+3 AV, +3 DV) on Manipulation skill rolls pertaining to intimidation and interrogation

Vehicles
The character has an assortment of vehicles at their disposal

Wealthy
The character can solve problems by throwing money at them

Weightless Combat
The character can fight or perform tasks while weightless without the associated penalties

Disarming Expert
The character can make disarming attacks without the associated penalty

Escape Artist
The character receives a skill bonus (+6 AV, +6 DV) when attempting to break out of a grapple or the Hold power

Expert Reputation
The character can sometimes gain favors from strangers who are familiar with their work

Famous
The character can sometimes gain favors from strangers who recognize them

Fascinating
The character can sometimes gain favors from admirers

Headquarters
The character has one or more bases of operation, equipped with supplies and workshops reasonable for the character's background and skills

Iron Fists
The character's unarmed hand-to-hand normal attacks deal points of Health damage equal to the character's Athletics

Linguist
The character is fluent in dozens of languages, and they are capable of quickly deciphering new languages when they encounter them

Mental Calculator
The character can solve complex mathematical equations by thinking about them briefly

Minions
The character has an assortment of minor, mostly nameless lackeys of marginal usefulness

Perfect Recall
The character can perfectly remember any event, document, or recording which the character has clearly seen or heard

Quick Change
The character can change their entire outfit with a quick action

Ranged Disarm
The character can make a disarming attack with a ranged weapon, with the usual associated penalties

Scrounger
The character can find shelter, food, and personal essentials enough to provide for themselves and a small number of friends

Second Identity
The character has a second, completely legitimate identity which will withstand even the most focused scrutiny

Sense Auras
The character can see the invisible emanations around people

Sharpshooter
The character may ignore cover in ranged combat, as long as they can see part of the target


A150: of:=HYPERLINK("#A1"; "Top 🡅") -> Top 🡅
A151: Movement | B151: XXX
A152: of:=HYPERLINK("#MOVEMENT_CALC"; "MOVEMENT_CALC") -> MOVEMENT_CALC
B153: Athletics | C153: Base | D153: Sprint (m) | E153: Sprint Text | F153: Sprint (km/h) | G153: Sprint (km/h) Text | H153: Combined Text | I153: Reference Sheet | J153: Concat
A154: Run | B154: of:=ATHLETICS+IF(HAS_SUPER_RUNNING; POWER_LEVEL; 0) -> 11 | C154: of:=INDEX(STRENGTH_CHART; [.B154]; 8) -> 100 m | D154: of:=INDEX(STRENGTH_CHART; [.B154]; 7)*6 -> 600 | E154: of:=IF([.D154]>9999;TEXT([.D154]/1000;"#,##0")&" km";TEXT([.D154];"#,##0")&" m") -> 600 m | F154: of:=INDEX(STRENGTH_CHART; [.B154]; 9) ->  | G154: of:=TEXT([.F154];"#,##0")&" km/h" ->  | H154: of:=[.E154]&" ("&[.G154]&")" ->  | I154: of:=[.A154]&": "&[.C154]&" (Max "&[.E154]&" / "&[.G154]&")" ->  | J154: of:=IF(RUNNING_TEXT=""; ""; RUNNING_TEXT&CHAR(13)&CHAR(10))&IF(SWIMMING_TEXT=""; ""; SWIMMING_TEXT&CHAR(13)&CHAR(10))&IF(jump_text=""; ""; jump_text&CHAR(13)&CHAR(10))&IF(FLIGHT_TEXT=""; ""; FLIGHT_TEXT&CHAR(13)&CHAR(10))&IF(TELEPORTATION_TEXT=""; ""; TELEPORTATION_TEXT&CHAR(13)&CHAR(10))&TUNNELING_TEXT -> 
A155: Swim | B155: of:=ATHLETICS+IF(HAS_SUPER_SWIMMING; POWER_LEVEL; 0) -> 11 | C155: of:=INDEX(STRENGTH_CHART; [.B155]; 12) ->  | D155: of:=INDEX(STRENGTH_CHART; [.B155]; 11)*6 ->  | E155: of:=IF([.D155]>9999;TEXT([.D155]/1000;"#,##0")&" km";TEXT([.D155];"#,##0")&" m") ->  | F155: of:=INDEX(STRENGTH_CHART; [.B155]; 13) ->  | G155: of:=TEXT([.F155];"#,##0")&" km/h" ->  | H155: of:=[.E155]&" ("&[.G155]&")" ->  | I155: of:=[.A155]&": "&[.C155]&" (Max "&[.E155]&" / "&[.G155]&")" -> 
A156: Fly | B156: of:=IF(HAS_FLIGHT; ATHLETICS+POWER_LEVEL; 0) -> 0 | C156: of:=IF(HAS_FLIGHT; INDEX(STRENGTH_CHART; [.B156]; 8); "") ->  | D156: of:=IF(HAS_FLIGHT; INDEX(STRENGTH_CHART; [.B156]; 7)*6; "") ->  | E156: of:=IF(HAS_FLIGHT; IF([.D156]>9999;TEXT([.D156]/1000;"#,##0")&" km";TEXT([.D156];"#,##0")&" m"); "") ->  | F156: of:=IF(HAS_FLIGHT; INDEX(STRENGTH_CHART; [.B156]; 9); "") ->  | G156: of:=IF(HAS_FLIGHT; TEXT([.F156];"#,##0")&" km/h"; "") ->  | H156: of:=IF(HAS_FLIGHT; [.E156]&" ("&[.G156]&")"; "") ->  | I156: of:=IF(HAS_FLIGHT; [.A156]&": "&[.C156]&" (Max "&[.E156]&" / "&[.G156]&")"; "") -> 
A157: Teleport | B157: of:=IF(HAS_TELEPORTATION; ATHLETICS+POWER_LEVEL; 0) -> 0 | C157: of:=IF(HAS_TELEPORTATION; INDEX(STRENGTH_CHART; [.B157]; 8); "") ->  | D157: of:=IF(HAS_TELEPORTATION; INDEX(STRENGTH_CHART; [.B157]; 7)*6; "") ->  | E157: of:=IF(HAS_TELEPORTATION; IF([.D157]>9999;TEXT([.D157]/1000;"#,##0")&" km";TEXT([.D157];"#,##0")&" m"); "") ->  | F157: of:=IF(HAS_TELEPORTATION; INDEX(STRENGTH_CHART; [.B157]; 9); "") ->  | G157: of:=IF(HAS_TELEPORTATION; TEXT([.F157];"#,##0")&" km/h"; "") ->  | H157: of:=IF(HAS_TELEPORTATION; [.E157]&" ("&[.G157]&")"; "") ->  | I157: of:=IF(HAS_TELEPORTATION; [.A157]&": "&[.C157]&" (Max "&[.E157]&")"; "") -> 
A158: Tunnel | B158: of:=IF(HAS_TUNNELING; ATHLETICS+POWER_LEVEL; 0) -> 0 | C158: of:=IF(HAS_TUNNELING; INDEX(STRENGTH_CHART; [.B158]; 12); "") ->  | D158: of:=IF(HAS_TUNNELING; INDEX(STRENGTH_CHART; [.B158]; 11)*6; "") ->  | E158: of:=IF(HAS_TUNNELING; IF([.D158]>9999;TEXT([.D158]/1000;"#,##0")&" km";TEXT([.D158];"#,##0")&" m"); "") ->  | F158: of:=IF(HAS_TUNNELING; INDEX(STRENGTH_CHART; [.B158]; 13); "") ->  | G158: of:=IF(HAS_TUNNELING; TEXT([.F158];"#,##0")&" km/h"; "") ->  | H158: of:=IF(HAS_TUNNELING; [.E158]&" ("&[.G158]&")"; "") ->  | I158: of:=IF(HAS_TUNNELING; [.A158]&": "&[.C158]&" (Max "&[.E158]&" / "&[.G158]&")"; "") -> 
A160: of:=HYPERLINK("#A1"; "Top 🡅") -> Top 🡅
A161: Powers
A162: of:=HYPERLINK("#POWER_CALC"; "POWER_CALC") -> POWER_CALC | C162: of:=HYPERLINK("#POWER_CALC_SELECTED_INDEXES"; "POWER_CALC_SELECTED_INDEXES") -> POWER_CALC_SELECTED_INDEXES | G162: XXX | R162: XXX | U162: of:=HYPERLINK("#POWER_CALC_HAS_INDEXES"; "POWER_CALC_HAS_INDEXES") -> POWER_CALC_HAS_INDEXES | BB162: XXX
A163: Selected | B163: Is Ultra-power | C163: Selected Power Index | D163: Selected Power Count | E163: Ultra-power Prereq Met | F163: Has Ultra Power | G163: Prerequisite 1 | H163: Prereq 1 Index | I163: Prereq 1 Met | J163: Prerequisite 2 | K163: Prereq 2 Index | L163: Prereq 2 Met | M163: Prerequisite 3 | N163: Prereq 3 Index | O163: Prereq 3 Met | P163: Prereq 1, 2, 3 Met | Q163: Prereq 1, 2, 3 Warning | R163: Has Non-Ultra Power | T163: Has Power | U163: Has Power Index | V163: Has Power Count | W163: Custom Name | X163: Ultra-power Name | Y163: Display Name | Z163: Note | AA163: Action | AB163: Attack | AC163: Type | AD163: Ranged Is Selected | AE163: Ranged Is Default | AF163: Is Ranged | AG163: xRanged Selected | AH163: Short Range Text | AI163: Default Long Range (m) | AJ163: Long Range (m) | AK163: Long Range Text | AL163: Range Text | AM163: Seeking Is Selected | AN163: Is Seeking | AO163: Seeking Text | AP163: Area Is Selected | AQ163: Area Is Default | AR163: Is Area | AS163: xArea Selected | AT163: Default Max Area (m) | AU163: Max Area (m) | AV163: Max Area Text | AW163: Area Text | AX163: Selective Is Selected | AY163: Is Selective | AZ163: Selective Text | BA163: Is Movement | BB163: xSprint Selected | BC163: Is Super Running | BD163: Base Running Text | BE163: Default Running Sprint (m) | BF163: Running Sprint (m) | BG163: Running Sprint Text | BH163: Running Text | BI163: Is Super Swimming | BJ163: Base Swimming Text | BK163: Default Swimming Sprint (m) | BL163: Swimming Sprint (m) | BM163: Swimming Sprint Text | BN163: Swimming Text | BO163: Is Flight | BP163: Base Flight Text | BQ163: Default Flight Sprint (m) | BR163: Flight Sprint (m) | BS163: Flight Sprint Text | BT163: Flight Text | BU163: Is Teleportation | BV163: Base Teleportation Text | BW163: Default Teleportation Sprint (m) | BX163: Teleportation Sprint (m) | BY163: Teleportation Sprint Text | BZ163: Teleportation Text | CA163: Is Tunneling | CB163: Base Tunneling Text | CC163: Default Tunneling Sprint (m) | CD163: Tunneling Sprint (m) | CE163: Tunneling Sprint Text | CF163: Tunneling Text | CG163: Is Super Endurance | CH163: Is Super Health | CI163: Is Super Reflection | CJ163: Is Super Strength | CK163: Is Alteration Resistance | CL163: Alteration Resistance Text | CM163: Is Damage Resistance | CN163: Damage Resistance Text | CO163: Is Mental Resistance | CP163: Mental Resistance Text | CQ163: Is Bulletproof | CR163: Bulletproof Text | CS163: Is Density Control | CT163: Density Control Text | CU163: Is Duplication | CV163: Duplication Text | CW163: Is Growth | CX163: Growth Text | CY163: Is Extra Actions | CZ163: Extra Actions Text | DA163: Is Haste | DB163: Haste Text | DC163: Is Shrinking | DD163: Shrinking Text | DE163: Is Stretching | DF163: Stretching Text | DG163: Text Concat | DH163: Is [Element] | DI163: Is [Subject] | DJ163: Is [Transformation] | DM163: Ultra-power Ranged Is Selected | DN163: Ultra-power xRanged Selected | DO163: Ultra-power Seeking | DP163: Ultra-power Area | DQ163: Ultra-power xArea Selected | DR163: Ultra-power Selective | DS163: Ultra-power xSprint Selected | DT163: Details | DU163: Note + Text | DV163: Base Power Cost | DW163: Range Cost | DX163: Seeking Cost | DY163: Area Cost | DZ163: Selective Cost | EA163: Sprint Cost | EB163: Power Total Cost | EC163: Reference Sheet
A164: of:=IF([Powers.C5]=""; ""; [Powers.C5]) -> Stretching | B164: of:=IF(ISNUMBER(FIND("Ultra-power"; [.A164])); TRUE(); FALSE()) -> false | C164: of:=IF(TRIM([.A164])=""; 0; INDEX(POWER_CHART_INDEXES; MATCH([.A164]; POWER_CHART_NAMES; 0))) -> 65 | D164: of:=IF([.C164]; 1; 0) + N([.D163]) -> 1 | E164: of:=IF(AND([.B164]; SELECTED_POWER_COUNT<4); FALSE(); TRUE()) -> true | F164: of:=IF(AND([.B164]; [.E164]); TRUE(); FALSE()) -> false | G164: of:=IF(N([.C164]); IFERROR(T(INDEX(POWER_CHART_PREREQ_1; MATCH([.C164]; POWER_CHART_INDEXES; 0))); ""); "") ->  | H164: of:=IF(OR([.B164]; [.G164]=""); 0; INDEX(POWER_CHART_INDEXES; MATCH([.G164]; POWER_CHART_NAMES; 0))) -> 0 | I164: of:=IF([.H164]=0; TRUE(); COUNTIF(POWER_CALC_SELECTED_INDEXES; [.H164])) -> true | J164: of:=IF(N([.C164]); IFERROR(T(INDEX(POWER_CHART_PREREQ_2; MATCH([.C164]; POWER_CHART_INDEXES; 0))); ""); "") ->  | K164: of:=IF(OR([.B164]; [.J164]=""); 0; INDEX(POWER_CHART_INDEXES; MATCH([.J164]; POWER_CHART_NAMES; 0))) -> 0 | L164: of:=IF([.K164]=0; TRUE(); COUNTIF(POWER_CALC_SELECTED_INDEXES; [.K164])) -> true | M164: of:=IF(N([.C164]); IFERROR(T(INDEX(POWER_CHART_PREREQ_3; MATCH([.C164]; POWER_CHART_INDEXES; 0))); ""); "") ->  | N164: of:=IF(OR([.B164]; [.M164]=""); 0; INDEX(POWER_CHART_INDEXES; MATCH([.M164]; POWER_CHART_NAMES; 0))) -> 0 | O164: of:=IF([.N164]=0; TRUE(); COUNTIF(POWER_CALC_SELECTED_INDEXES; [.N164])) -> true | P164: of:=IF(AND([.I164]; [.L164]; [.O164]); TRUE(); FALSE()) -> true | Q164: of:=IF(NOT([.P164]); "Purchase a prerequisite for "&[.A164]&" ("&COM.MICROSOFT.TEXTJOIN(" or "; 1; [.G164]; [.J164]; [.M164])&")."&CHAR(13)&CHAR(10); "") ->  | R164: of:=IF([.A164]=""; FALSE(); IF([.P164]; TRUE(); FALSE())) -> true | T164: of:=IF([.A164]=""; FALSE(); IF([.P164]; TRUE(); FALSE())) -> true | U164: of:=IF([.T164]; [.C164]; 0) -> 65 | V164: of:=[.T164] + N([.V163]) -> 1 | W164: of:=IF(AND([.T164]; NOT([Powers.E5]="")); [Powers.E5]; "") ->  | X164: of:=IF([.B164]; IF([Powers.E5]=""; ""; IF([Powers.E5]="Ultra-power"; ""; [Powers.E5])); [.X163]) -> Ultra-power Name | Y164: of:=IF(AND([.T164]; OR([.W164]=""; [.B164])); [.A164]; [.W164]) -> Stretching | Z164: of:=IF(AND([.T164]; NOT([Powers.F5]="")); [Powers.F5]; "") -> Oriental mysticism | AA164: of:=IF([.T164]; IFERROR(T(INDEX(POWER_CHART_ACTIONS; MATCH([.C164]; POWER_CHART_INDEXES; 0))); ""); "") -> Quick action | AB164: of:=IF([.T164]; INDEX(POWER_CHART_ATTACKS; MATCH([.C164]; POWER_CHART_INDEXES; 0)); FALSE()) -> false | AC164: of:=IF([.T164]; INDEX(POWER_CHART_TYPES; MATCH([.C164]; POWER_CHART_INDEXES; 0))&" "&IF([.AB164]; "attack"; "power"); "") -> Personal power | AD164: of:=IF(AND([.T164]; [Powers.H5]="Y"); TRUE(); FALSE()) -> true | AE164: of:=IF([.T164]; IF(INDEX(POWER_CHART_RANGES;MATCH([.C164];POWER_CHART_INDEXES;0))="Ranged";TRUE();FALSE())) -> false | AF164: of:=OR([.AD164];[.AE164]) -> true | AG164: of:=IF([.T164]; RIGHT([Powers.P5]; LEN([Powers.P5])-1)*1; 1) -> 100 | AH164: of:=IF([.AF164]; INDEX(POWER_LEVEL_CHART_RANGES_TEXT; MATCH(POWER_LEVEL-1; POWER_LEVEL_CHART_INDEXES;0)); "") -> 600 m | AI164: of:=IF([.AF164]; INDEX(POWER_LEVEL_CHART_RANGES; MATCH(POWER_LEVEL; POWER_LEVEL_CHART_INDEXES;0)); "") -> 1000 | AJ164: of:=IF([.AF164]; [.AI164]*[.AG164]; "") -> 100000 | AK164: of:=IF([.AF164]; IF(([.AJ164])>9999; TEXT(([.AJ164])/1000; "#,##0")&" km"; TEXT([.AJ164];"#,##0")&" m"); "") -> 100 km | AL164: of:=IF([.AF164]; "Ranged ("&[.AH164]&"/"&[.AK164]&")"; "") -> Ranged (600 m/100 km) | AM164: of:=IF(AND([.T164]; [Powers.L5]="Y"); TRUE(); FALSE()) -> false | AN164: of:=IF(AND([.AM164]; OR(ISNUMBER(FIND("attack"; [.AC164])); ISNUMBER(FIND("Ultra-power"; [.A164])))); TRUE(); FALSE()) -> false | AO164: of:=IF([.AN164];", Seeking";"") ->  | AP164: of:=IF(AND([.T164]; [Powers.J5]="Y"); TRUE(); FALSE()) -> true | AQ164: of:=IF([.T164]; IF(INDEX(POWER_CHART_AREAS; MATCH([.C164]; POWER_CHART_INDEXES; 0))="Area"; TRUE(); FALSE())) -> false | AR164: of:=OR([.AP164];[.AQ164]) -> true | AS164: of:=IF([.T164]; RIGHT([Powers.R5]; LEN([Powers.R5])-1)*1; 1) -> 1 | AT164: of:=IF([.AR164]; INDEX(POWER_LEVEL_CHART_AREAS; MATCH(POWER_LEVEL; POWER_LEVEL_CHART_INDEXES;0)); "") -> 10 | AU164: of:=IF([.AR164]; [.AS164]*[.AT164]; "") -> 10 | AV164: of:=IF([.AR164]; IF(([.AU164])>9999; TEXT(([.AU164])/1000; "#,##0")&" km radius"; TEXT([.AU164];"#,##0")&" m radius"); "") -> 10 m radius | AW164: of:=IF([.AR164]; "Area ("&[.AV164]&")"; "") -> Area (10 m radius) | AX164: of:=IF(AND([.T164]; [Powers.N5]="Y"); TRUE(); FALSE()) -> false | AY164: of:=IF([.AX164]) -> false | AZ164: of:=IF([.AY164];", Selective";"") ->  | BA164: of:=ISNUMBER(FIND("Movement"; [.AC164])) -> false | BB164: of:=IF(OR([.BA164]; [.B164]); RIGHT([Powers.T5]; LEN([Powers.T5])-1)*1; 1) -> 1 | BC164: of:=ISNUMBER(FIND("Super Running"; [.A164])) -> false | BD164: of:=IF([.BC164]; INDEX(MOVEMENT_CHART_BASES_TEXT; MATCH(ATHLETICS+POWER_LEVEL; MOVEMENT_CHART_INDEXES;0)); "") ->  | BE164: of:=IF([.BC164]; INDEX(MOVEMENT_CHART_SPRINTS; MATCH(ATHLETICS+POWER_LEVEL; MOVEMENT_CHART_INDEXES;0)); "") ->  | BF164: of:=IF([.BC164]; [.BE164]*[.BB164]; "") ->  | BG164: of:=IF([.BC164]; IF(([.BF164])>9999; TEXT(([.BF164])/1000; "#,##0")&" km"; TEXT([.BF164];"#,##0")&" m"); "") ->  | BH164: of:=IF([.BC164]; "("&[.BD164]&"/"&[.BG164]&")"; "") ->  | BI164: of:=AND(ISNUMBER(FIND("Super Swimming"; [.A164]))) -> false | BJ164: of:=IF([.BI164]; INDEX(MOVEMENT_CHART_BASES_TEXT; MATCH(ATHLETICS+POWER_LEVEL; MOVEMENT_CHART_INDEXES;0)); "") ->  | BK164: of:=IF([.BI164]; INDEX(MOVEMENT_CHART_SPRINTS; MATCH(ATHLETICS+POWER_LEVEL; MOVEMENT_CHART_INDEXES;0)); "") ->  | BL164: of:=IF([.BI164]; [.BK164]*[.BB164]; "") ->  | BM164: of:=IF([.BI164]; IF(([.BL164])>9999; TEXT(([.BL164])/1000; "#,##0")&" km"; TEXT([.BL164];"#,##0")&" m"); "") ->  | BN164: of:=IF([.BI164]; "("&[.BJ164]&"/"&[.BM164]&")"; "") ->  | BO164: of:=ISNUMBER(FIND("Flight"; [.A164])) -> false | BP164: of:=IF([.BO164]; INDEX(MOVEMENT_CHART_BASES_TEXT; MATCH(ATHLETICS+POWER_LEVEL; MOVEMENT_CHART_INDEXES;0)); "") ->  | BQ164: of:=IF([.BO164]; INDEX(MOVEMENT_CHART_SPRINTS; MATCH(ATHLETICS+POWER_LEVEL; MOVEMENT_CHART_INDEXES;0)); "") ->  | BR164: of:=IF([.BO164]; [.BQ164]*[.BB164]; "") ->  | BS164: of:=IF([.BO164]; IF(([.BR164])>9999; TEXT(([.BR164])/1000; "#,##0")&" km"; TEXT([.BR164];"#,##0")&" m"); "") ->  | BT164: of:=IF([.BO164]; "("&[.BP164]&"/"&[.BS164]&")"; "") ->  | BU164: of:=ISNUMBER(FIND("Teleportation"; [.A164])) -> false | BV164: of:=IF([.BU164]; INDEX(TELEPORTATION_CHART_BASES_TEXT; MATCH(POWER_LEVEL; TELEPORTATION_CHART_INDEXES; 0)); "") ->  | BW164: of:=IF([.BU164]; INDEX(TELEPORTATION_CHART_SPRINTS; MATCH(POWER_LEVEL; TELEPORTATION_CHART_INDEXES; 0)); "") ->  | BX164: of:=IF([.BU164]; [.BW164]*[.BB164]; "") ->  | BY164: of:=IF([.BU164]; IF(([.BX164])>9999; TEXT(([.BX164])/1000; "#,##0")&" km"; TEXT([.BX164];"#,##0")&" m"); "") ->  | BZ164: of:=IF([.BU164]; "("&[.BV164]&"/"&[.BY164]&")"; "") ->  | CA164: of:=ISNUMBER(FIND("Tunneling"; [.A164])) -> false | CB164: of:=IF([.CA164]; INDEX(MOVEMENT_CHART_BASES_TEXT; MATCH(ATHLETICS+POWER_LEVEL; MOVEMENT_CHART_INDEXES;0)); "") ->  | CC164: of:=IF([.CA164]; INDEX(MOVEMENT_CHART_SPRINTS; MATCH(ATHLETICS+POWER_LEVEL; MOVEMENT_CHART_INDEXES;0)); "") ->  | CD164: of:=IF([.CA164]; [.CC164]*[.BB164]; "") ->  | CE164: of:=IF([.CA164]; IF(([.CD164])>9999; TEXT(([.CD164])/1000; "#,##0")&" km"; TEXT([.CD164];"#,##0")&" m"); "") ->  | CF164: of:=IF([.CA164]; "("&[.CB164]&"/"&[.CE164]&")"; "") ->  | CG164: of:=AND(ISNUMBER(FIND("Super Endurance"; [.A164]))) -> false | CH164: of:=AND(ISNUMBER(FIND("Super Health"; [.A164]))) -> false | CI164: of:=AND(ISNUMBER(FIND("Super Reflection"; [.A164]))) -> false | CJ164: of:=AND(ISNUMBER(FIND("Super Strength"; [.A164]))) -> false | CK164: of:=ISNUMBER(FIND("Alteration Resistance"; [.A164])) -> false | CL164: of:=IF([.CK164]; ALTERATION_RESISTANCE_TEXT; "") ->  | CM164: of:=ISNUMBER(FIND("Damage Resistance"; [.A164])) -> false | CN164: of:=IF([.CM164]; DAMAGE_RESISTANCE_TEXT; "") ->  | CO164: of:=ISNUMBER(FIND("Mental Resistance"; [.A164])) -> false | CP164: of:=IF([.CO164]; MENTAL_RESISTANCE_TEXT; "") ->  | CQ164: of:=ISNUMBER(FIND("Bulletproof"; [.A164])) -> false | CR164: of:=IF([.CQ164]; "Unaffected by ordinary weapons Equipment Level "&POWER_LEVEL&" and lower"; "") ->  | CS164: of:=ISNUMBER(FIND("Density Control"; [.A164])) -> false | CT164: of:=IF([.CS164]; INDEX(DENSITY_CONTROL_CHART; POWER_LEVEL; 4); "") ->  | CU164: of:=ISNUMBER(FIND("Duplication"; [.A164])) -> false | CV164: of:=IF([.CU164]; INDEX(DUPLICATION_CHART; POWER_LEVEL; 3); "") ->  | CW164: of:=ISNUMBER(FIND("Growth"; [.A164])) -> false | CX164: of:=IF([.CW164]; INDEX(GROWTH_CHART; POWER_LEVEL; 6); "") ->  | CY164: of:=ISNUMBER(FIND("Extra Actions"; [.A164])) -> false | CZ164: of:=IF([.CY164]; POWER_LEVEL&" extra actions per scene"; "") ->  | DA164: of:=ISNUMBER(FIND("Haste"; [.A164])) -> false | DB164: of:=IF([.DA164]; INDEX(HASTE_CHART; POWER_LEVEL; 3); "") ->  | DC164: of:=ISNUMBER(FIND("Shrinking"; [.A164])) -> false | DD164: of:=IF([.DC164]; INDEX(SHRINKING_CHART; POWER_LEVEL; 4); "") ->  | DE164: of:=ISNUMBER(FIND("Stretching"; [.A164])) -> true | DF164: of:=IF([.DE164]; INDEX(STRETCHING_CHART; POWER_LEVEL; 2)&" reach"; "") -> 20 m reach | DG164: of:=[.CL164]&[.CN164]&[.CP164]&[.CR164]&[.CT164]&[.CV164]&[.CX164]&[.CZ164]&[.DB164]&[.DD164]&[.DF164] -> 20 m reach | DH164: of:=ISNUMBER(FIND("[Element]"; [.A164])) -> false | DI164: of:=ISNUMBER(FIND("[Subject]"; [.A164])) -> false | DJ164: of:=ISNUMBER(FIND("[Transformation]"; [.A164])) -> false | DM164: of:=IF([.B164]; [.AD164]; FALSE()) -> false | DN164: of:=IF(AND([.B164]; [.AG164]>[.DN163]); [.AG164]; N([.DN163])) -> 0 | DO164: of:=IF([.B164]; [.AN164]; FALSE()) -> false | DP164: of:=IF([.B164]; [.AR164]; FALSE()) -> false | DQ164: of:=IF(AND([.B164]; [.AS164]>[.DQ163]); [.AS164]; N([.DQ163])) -> 0 | DR164: of:=IF([.B164]; [.AX164]; FALSE()) -> false | DS164: of:=IF(AND([.B164]; [.BB164]>[.DS163]); [.BB164]; N([.DS163])) -> 0 | DT164: of:=IF([.T164]; COM.MICROSOFT.TEXTJOIN(", "; 1; [.AA164]; [.AL164]; [.AL164]; [.AZ164]; [.AZ164]; [.AC164]); "") -> Quick action, Ranged (600 m/100 km), Ranged (600 m/100 km), Personal power | DU164: of:=COM.MICROSOFT.TEXTJOIN("; "; TRUE(); [.Z164]; [.DG164]) -> Oriental mysticism; 20 m reach | DV164: of:=IF([.T164]; [.V164]; 0) -> 1 | DW164: of:=IF(AND([.AD164]; NOT([.AE164])); 1; 0) + INDEX(MULTIPLIER_CHART_INDEXES; MATCH([.AG164]; MULTIPLIER_CHART_MULTIPLIERS;0)) -> 3 | DX164: of:=IF([.AN164]; 1; 0) -> 0 | DY164: of:=IF(AND(NOT([.AQ164]); [.AR164]); 1; 0) + INDEX(MULTIPLIER_CHART_INDEXES; MATCH([.AS164]; MULTIPLIER_CHART_MULTIPLIERS;0)) -> 1 | DZ164: of:=IF([.AY164]; 1; 0) -> 0 | EA164: of:=INDEX(MULTIPLIER_CHART_INDEXES; MATCH([.BB164]; MULTIPLIER_CHART_MULTIPLIERS;0)) -> 0 | EB164: of:=SUM([.DV164:.EA164]) -> 5 | EC164: of:=IF([.T164]; [.Y164]&CHAR(13)&CHAR(10)&[.DT164]&CHAR(13)&CHAR(10)&[.DU164]&CHAR(13)&CHAR(10)&VLOOKUP( [.A164]; POWER_CHART; 11; FALSE())&CHAR(13)&CHAR(10)&CHAR(13)&CHAR(10); "") -> Stretching
Quick action, Ranged (600 m/100 km), Ranged (600 m/100 km), Personal power
Oriental mysticism; 20 m reach
65


A165: of:=IF([Powers.C6]=""; ""; [Powers.C6]) -> Density Control | B165: of:=IF(ISNUMBER(FIND("Ultra-power"; [.A165])); TRUE(); FALSE()) -> false | C165: of:=IF(TRIM([.A165])=""; 0; INDEX(POWER_CHART_INDEXES; MATCH([.A165]; POWER_CHART_NAMES; 0))) -> 18 | D165: of:=IF([.C165]; 1; 0) + N([.D164]) -> 2 | E165: of:=IF(AND([.B165]; SELECTED_POWER_COUNT<4); FALSE(); TRUE()) -> true | F165: of:=IF(AND([.B165]; [.E165]); TRUE(); FALSE()) -> false | G165: of:=IF(N([.C165]); IFERROR(T(INDEX(POWER_CHART_PREREQ_1; MATCH([.C165]; POWER_CHART_INDEXES; 0))); ""); "") ->  | H165: of:=IF(OR([.B165]; [.G165]=""); 0; INDEX(POWER_CHART_INDEXES; MATCH([.G165]; POWER_CHART_NAMES; 0))) -> 0 | I165: of:=IF([.H165]=0; TRUE(); COUNTIF(POWER_CALC_SELECTED_INDEXES; [.H165])) -> true | J165: of:=IF(N([.C165]); IFERROR(T(INDEX(POWER_CHART_PREREQ_2; MATCH([.C165]; POWER_CHART_INDEXES; 0))); ""); "") ->  | K165: of:=IF(OR([.B165]; [.J165]=""); 0; INDEX(POWER_CHART_INDEXES; MATCH([.J165]; POWER_CHART_NAMES; 0))) -> 0 | L165: of:=IF([.K165]=0; TRUE(); COUNTIF(POWER_CALC_SELECTED_INDEXES; [.K165])) -> true | M165: of:=IF(N([.C165]); IFERROR(T(INDEX(POWER_CHART_PREREQ_3; MATCH([.C165]; POWER_CHART_INDEXES; 0))); ""); "") ->  | N165: of:=IF(OR([.B165]; [.M165]=""); 0; INDEX(POWER_CHART_INDEXES; MATCH([.M165]; POWER_CHART_NAMES; 0))) -> 0 | O165: of:=IF([.N165]=0; TRUE(); COUNTIF(POWER_CALC_SELECTED_INDEXES; [.N165])) -> true | P165: of:=IF(AND([.I165]; [.L165]; [.O165]); TRUE(); FALSE()) -> true | Q165: of:=IF(NOT([.P165]); "Purchase a prerequisite for "&[.A165]&" ("&COM.MICROSOFT.TEXTJOIN(" or "; 1; [.G165]; [.J165]; [.M165])&")."&CHAR(13)&CHAR(10); "") ->  | R165: of:=IF([.A165]=""; FALSE(); IF([.P165]; TRUE(); FALSE())) -> true | T165: of:=IF([.A165]=""; FALSE(); IF([.P165]; TRUE(); FALSE())) -> true | U165: of:=IF([.T165]; [.C165]; 0) -> 18 | V165: of:=[.T165] + N([.V164]) -> 2 | W165: of:=IF(AND([.T165]; NOT([Powers.E6]="")); [Powers.E6]; "") ->  | X165: of:=IF([.B165]; IF([Powers.E6]=""; ""; IF([Powers.E6]="Ultra-power"; ""; [Powers.E6])); [.X164]) -> Ultra-power Name | Y165: of:=IF(AND([.T165]; OR([.W165]=""; [.B165])); [.A165]; [.W165]) -> Density Control | Z165: of:=IF(AND([.T165]; NOT([Powers.F6]="")); [Powers.F6]; "") -> Oriental mysticism | AA165: of:=IF([.T165]; IFERROR(T(INDEX(POWER_CHART_ACTIONS; MATCH([.C165]; POWER_CHART_INDEXES; 0))); ""); "") -> Quick action | AB165: of:=IF([.T165]; INDEX(POWER_CHART_ATTACKS; MATCH([.C165]; POWER_CHART_INDEXES; 0)); FALSE()) -> false | AC165: of:=IF([.T165]; INDEX(POWER_CHART_TYPES; MATCH([.C165]; POWER_CHART_INDEXES; 0))&" "&IF([.AB165]; "attack"; "power"); "") -> Personal power | AD165: of:=IF(AND([.T165]; [Powers.H6]="Y"); TRUE(); FALSE()) -> false | AE165: of:=IF([.T165]; IF(INDEX(POWER_CHART_RANGES;MATCH([.C165];POWER_CHART_INDEXES;0))="Ranged";TRUE();FALSE())) -> false | AF165: of:=OR([.AD165];[.AE165]) -> false | AG165: of:=IF([.T165]; RIGHT([Powers.P6]; LEN([Powers.P6])-1)*1; 1) -> 1 | AH165: of:=IF([.AF165]; INDEX(POWER_LEVEL_CHART_RANGES_TEXT; MATCH(POWER_LEVEL-1; POWER_LEVEL_CHART_INDEXES;0)); "") ->  | AI165: of:=IF([.AF165]; INDEX(POWER_LEVEL_CHART_RANGES; MATCH(POWER_LEVEL; POWER_LEVEL_CHART_INDEXES;0)); "") ->  | AJ165: of:=IF([.AF165]; [.AI165]*[.AG165]; "") ->  | AK165: of:=IF([.AF165]; IF(([.AJ165])>9999; TEXT(([.AJ165])/1000; "#,##0")&" km"; TEXT([.AJ165];"#,##0")&" m"); "") ->  | AL165: of:=IF([.AF165]; "Ranged ("&[.AH165]&"/"&[.AK165]&")"; "") ->  | AM165: of:=IF(AND([.T165]; [Powers.L6]="Y"); TRUE(); FALSE()) -> false | AN165: of:=IF(AND([.AM165]; OR(ISNUMBER(FIND("attack"; [.AC165])); ISNUMBER(FIND("Ultra-power"; [.A165])))); TRUE(); FALSE()) -> false | AO165: of:=IF([.AN165];", Seeking";"") ->  | AP165: of:=IF(AND([.T165]; [Powers.J6]="Y"); TRUE(); FALSE()) -> false | AQ165: of:=IF([.T165]; IF(INDEX(POWER_CHART_AREAS; MATCH([.C165]; POWER_CHART_INDEXES; 0))="Area"; TRUE(); FALSE())) -> false | AR165: of:=OR([.AP165];[.AQ165]) -> false | AS165: of:=IF([.T165]; RIGHT([Powers.R6]; LEN([Powers.R6])-1)*1; 1) -> 1 | AT165: of:=IF([.AR165]; INDEX(POWER_LEVEL_CHART_AREAS; MATCH(POWER_LEVEL; POWER_LEVEL_CHART_INDEXES;0)); "") ->  | AU165: of:=IF([.AR165]; [.AS165]*[.AT165]; "") ->  | AV165: of:=IF([.AR165]; IF(([.AU165])>9999; TEXT(([.AU165])/1000; "#,##0")&" km radius"; TEXT([.AU165];"#,##0")&" m radius"); "") ->  | AW165: of:=IF([.AR165]; "Area ("&[.AV165]&")"; "") ->  | AX165: of:=IF(AND([.T165]; [Powers.N6]="Y"); TRUE(); FALSE()) -> false | AY165: of:=IF([.AX165]) -> false | AZ165: of:=IF([.AY165];", Selective";"") ->  | BA165: of:=ISNUMBER(FIND("Movement"; [.AC165])) -> false | BB165: of:=IF(OR([.BA165]; [.B165]); RIGHT([Powers.T6]; LEN([Powers.T6])-1)*1; 1) -> 1 | BC165: of:=ISNUMBER(FIND("Super Running"; [.A165])) -> false | BD165: of:=IF([.BC165]; INDEX(MOVEMENT_CHART_BASES_TEXT; MATCH(ATHLETICS+POWER_LEVEL; MOVEMENT_CHART_INDEXES;0)); "") ->  | BE165: of:=IF([.BC165]; INDEX(MOVEMENT_CHART_SPRINTS; MATCH(ATHLETICS+POWER_LEVEL; MOVEMENT_CHART_INDEXES;0)); "") ->  | BF165: of:=IF([.BC165]; [.BE165]*[.BB165]; "") ->  | BG165: of:=IF([.BC165]; IF(([.BF165])>9999; TEXT(([.BF165])/1000; "#,##0")&" km"; TEXT([.BF165];"#,##0")&" m"); "") ->  | BH165: of:=IF([.BC165]; "("&[.BD165]&"/"&[.BG165]&")"; "") ->  | BI165: of:=AND(ISNUMBER(FIND("Super Swimming"; [.A165]))) -> false | BJ165: of:=IF([.BI165]; INDEX(MOVEMENT_CHART_BASES_TEXT; MATCH(ATHLETICS+POWER_LEVEL; MOVEMENT_CHART_INDEXES;0)); "") ->  | BK165: of:=IF([.BI165]; INDEX(MOVEMENT_CHART_SPRINTS; MATCH(ATHLETICS+POWER_LEVEL; MOVEMENT_CHART_INDEXES;0)); "") ->  | BL165: of:=IF([.BI165]; [.BK165]*[.BB165]; "") ->  | BM165: of:=IF([.BI165]; IF(([.BL165])>9999; TEXT(([.BL165])/1000; "#,##0")&" km"; TEXT([.BL165];"#,##0")&" m"); "") ->  | BN165: of:=IF([.BI165]; "("&[.BJ165]&"/"&[.BM165]&")"; "") ->  | BO165: of:=ISNUMBER(FIND("Flight"; [.A165])) -> false | BP165: of:=IF([.BO165]; INDEX(MOVEMENT_CHART_BASES_TEXT; MATCH(ATHLETICS+POWER_LEVEL; MOVEMENT_CHART_INDEXES;0)); "") ->  | BQ165: of:=IF([.BO165]; INDEX(MOVEMENT_CHART_SPRINTS; MATCH(ATHLETICS+POWER_LEVEL; MOVEMENT_CHART_INDEXES;0)); "") ->  | BR165: of:=IF([.BO165]; [.BQ165]*[.BB165]; "") ->  | BS165: of:=IF([.BO165]; IF(([.BR165])>9999; TEXT(([.BR165])/1000; "#,##0")&" km"; TEXT([.BR165];"#,##0")&" m"); "") ->  | BT165: of:=IF([.BO165]; "("&[.BP165]&"/"&[.BS165]&")"; "") ->  | BU165: of:=ISNUMBER(FIND("Teleportation"; [.A165])) -> false | BV165: of:=IF([.BU165]; INDEX(TELEPORTATION_CHART_BASES_TEXT; MATCH(POWER_LEVEL; TELEPORTATION_CHART_INDEXES; 0)); "") ->  | BW165: of:=IF([.BU165]; INDEX(TELEPORTATION_CHART_SPRINTS; MATCH(POWER_LEVEL; TELEPORTATION_CHART_INDEXES; 0)); "") ->  | BX165: of:=IF([.BU165]; [.BW165]*[.BB165]; "") ->  | BY165: of:=IF([.BU165]; IF(([.BX165])>9999; TEXT(([.BX165])/1000; "#,##0")&" km"; TEXT([.BX165];"#,##0")&" m"); "") ->  | BZ165: of:=IF([.BU165]; "("&[.BV165]&"/"&[.BY165]&")"; "") ->  | CA165: of:=ISNUMBER(FIND("Tunneling"; [.A165])) -> false | CB165: of:=IF([.CA165]; INDEX(MOVEMENT_CHART_BASES_TEXT; MATCH(ATHLETICS+POWER_LEVEL; MOVEMENT_CHART_INDEXES;0)); "") ->  | CC165: of:=IF([.CA165]; INDEX(MOVEMENT_CHART_SPRINTS; MATCH(ATHLETICS+POWER_LEVEL; MOVEMENT_CHART_INDEXES;0)); "") ->  | CD165: of:=IF([.CA165]; [.CC165]*[.BB165]; "") ->  | CE165: of:=IF([.CA165]; IF(([.CD165])>9999; TEXT(([.CD165])/1000; "#,##0")&" km"; TEXT([.CD165];"#,##0")&" m"); "") ->  | CF165: of:=IF([.CA165]; "("&[.CB165]&"/"&[.CE165]&")"; "") ->  | CG165: of:=AND(ISNUMBER(FIND("Super Endurance"; [.A165]))) -> false | CH165: of:=AND(ISNUMBER(FIND("Super Health"; [.A165]))) -> false | CI165: of:=AND(ISNUMBER(FIND("Super Reflection"; [.A165]))) -> false | CJ165: of:=AND(ISNUMBER(FIND("Super Strength"; [.A165]))) -> false | CK165: of:=ISNUMBER(FIND("Alteration Resistance"; [.A165])) -> false | CL165: of:=IF([.CK165]; ALTERATION_RESISTANCE_TEXT; "") ->  | CM165: of:=ISNUMBER(FIND("Damage Resistance"; [.A165])) -> false | CN165: of:=IF([.CM165]; DAMAGE_RESISTANCE_TEXT; "") ->  | CO165: of:=ISNUMBER(FIND("Mental Resistance"; [.A165])) -> false | CP165: of:=IF([.CO165]; MENTAL_RESISTANCE_TEXT; "") ->  | CQ165: of:=ISNUMBER(FIND("Bulletproof"; [.A165])) -> false | CR165: of:=IF([.CQ165]; "Unaffected by ordinary weapons Equipment Level "&POWER_LEVEL&" and lower"; "") ->  | CS165: of:=ISNUMBER(FIND("Density Control"; [.A165])) -> true | CT165: of:=IF([.CS165]; INDEX(DENSITY_CONTROL_CHART; POWER_LEVEL; 4); "") -> Mass 5,000 kg, Athletics +3 | CU165: of:=ISNUMBER(FIND("Duplication"; [.A165])) -> false | CV165: of:=IF([.CU165]; INDEX(DUPLICATION_CHART; POWER_LEVEL; 3); "") ->  | CW165: of:=ISNUMBER(FIND("Growth"; [.A165])) -> false | CX165: of:=IF([.CW165]; INDEX(GROWTH_CHART; POWER_LEVEL; 6); "") ->  | CY165: of:=ISNUMBER(FIND("Extra Actions"; [.A165])) -> false | CZ165: of:=IF([.CY165]; POWER_LEVEL&" extra actions per scene"; "") ->  | DA165: of:=ISNUMBER(FIND("Haste"; [.A165])) -> false | DB165: of:=IF([.DA165]; INDEX(HASTE_CHART; POWER_LEVEL; 3); "") ->  | DC165: of:=ISNUMBER(FIND("Shrinking"; [.A165])) -> false | DD165: of:=IF([.DC165]; INDEX(SHRINKING_CHART; POWER_LEVEL; 4); "") ->  | DE165: of:=ISNUMBER(FIND("Stretching"; [.A165])) -> false | DF165: of:=IF([.DE165]; INDEX(STRETCHING_CHART; POWER_LEVEL; 2)&" reach"; "") ->  | DG165: of:=[.CL165]&[.CN165]&[.CP165]&[.CR165]&[.CT165]&[.CV165]&[.CX165]&[.CZ165]&[.DB165]&[.DD165]&[.DF165] -> Mass 5,000 kg, Athletics +3 | DH165: of:=ISNUMBER(FIND("[Element]"; [.A165])) -> false | DI165: of:=ISNUMBER(FIND("[Subject]"; [.A165])) -> false | DJ165: of:=ISNUMBER(FIND("[Transformation]"; [.A165])) -> false | DM165: of:=IF([.B165]; [.AD165]; FALSE()) -> false | DN165: of:=IF(AND([.B165]; [.AG165]>[.DN164]); [.AG165]; N([.DN164])) -> 0 | DO165: of:=IF([.B165]; [.AN165]; FALSE()) -> false | DP165: of:=IF([.B165]; [.AR165]; FALSE()) -> false | DQ165: of:=IF(AND([.B165]; [.AS165]>[.DQ164]); [.AS165]; N([.DQ164])) -> 0 | DR165: of:=IF([.B165]; [.AX165]; FALSE()) -> false | DS165: of:=IF(AND([.B165]; [.BB165]>[.DS164]); [.BB165]; N([.DS164])) -> 0 | DT165: of:=IF([.T165]; COM.MICROSOFT.TEXTJOIN(", "; 1; [.AA165]; [.AL165]; [.AL165]; [.AZ165]; [.AZ165]; [.AC165]); "") -> Quick action, Personal power | DU165: of:=COM.MICROSOFT.TEXTJOIN("; "; TRUE(); [.Z165]; [.DG165]) -> Oriental mysticism; Mass 5,000 kg, Athletics +3 | DV165: of:=IF([.T165]; [.V165]; 0) -> 2 | DW165: of:=IF(AND([.AD165]; NOT([.AE165])); 1; 0) + INDEX(MULTIPLIER_CHART_INDEXES; MATCH([.AG165]; MULTIPLIER_CHART_MULTIPLIERS;0)) -> 0 | DX165: of:=IF([.AN165]; 1; 0) -> 0 | DY165: of:=IF(AND(NOT([.AQ165]); [.AR165]); 1; 0) + INDEX(MULTIPLIER_CHART_INDEXES; MATCH([.AS165]; MULTIPLIER_CHART_MULTIPLIERS;0)) -> 0 | DZ165: of:=IF([.AY165]; 1; 0) -> 0 | EA165: of:=INDEX(MULTIPLIER_CHART_INDEXES; MATCH([.BB165]; MULTIPLIER_CHART_MULTIPLIERS;0)) -> 0 | EB165: of:=SUM([.DV165:.EA165]) -> 2 | EC165: of:=IF([.T165]; [.Y165]&CHAR(13)&CHAR(10)&[.DT165]&CHAR(13)&CHAR(10)&[.DU165]&CHAR(13)&CHAR(10)&VLOOKUP( [.A165]; POWER_CHART; 11; FALSE())&CHAR(13)&CHAR(10)&CHAR(13)&CHAR(10); "") -> Density Control
Quick action, Personal power
Oriental mysticism; Mass 5,000 kg, Athletics +3
18


A166: of:=IF([Powers.C7]=""; ""; [Powers.C7]) -> Duplication | B166: of:=IF(ISNUMBER(FIND("Ultra-power"; [.A166])); TRUE(); FALSE()) -> false | C166: of:=IF(TRIM([.A166])=""; 0; INDEX(POWER_CHART_INDEXES; MATCH([.A166]; POWER_CHART_NAMES; 0))) -> 20 | D166: of:=IF([.C166]; 1; 0) + N([.D165]) -> 3 | E166: of:=IF(AND([.B166]; SELECTED_POWER_COUNT<4); FALSE(); TRUE()) -> true | F166: of:=IF(AND([.B166]; [.E166]); TRUE(); FALSE()) -> false | G166: of:=IF(N([.C166]); IFERROR(T(INDEX(POWER_CHART_PREREQ_1; MATCH([.C166]; POWER_CHART_INDEXES; 0))); ""); "") ->  | H166: of:=IF(OR([.B166]; [.G166]=""); 0; INDEX(POWER_CHART_INDEXES; MATCH([.G166]; POWER_CHART_NAMES; 0))) -> 0 | I166: of:=IF([.H166]=0; TRUE(); COUNTIF(POWER_CALC_SELECTED_INDEXES; [.H166])) -> true | J166: of:=IF(N([.C166]); IFERROR(T(INDEX(POWER_CHART_PREREQ_2; MATCH([.C166]; POWER_CHART_INDEXES; 0))); ""); "") ->  | K166: of:=IF(OR([.B166]; [.J166]=""); 0; INDEX(POWER_CHART_INDEXES; MATCH([.J166]; POWER_CHART_NAMES; 0))) -> 0 | L166: of:=IF([.K166]=0; TRUE(); COUNTIF(POWER_CALC_SELECTED_INDEXES; [.K166])) -> true | M166: of:=IF(N([.C166]); IFERROR(T(INDEX(POWER_CHART_PREREQ_3; MATCH([.C166]; POWER_CHART_INDEXES; 0))); ""); "") ->  | N166: of:=IF(OR([.B166]; [.M166]=""); 0; INDEX(POWER_CHART_INDEXES; MATCH([.M166]; POWER_CHART_NAMES; 0))) -> 0 | O166: of:=IF([.N166]=0; TRUE(); COUNTIF(POWER_CALC_SELECTED_INDEXES; [.N166])) -> true | P166: of:=IF(AND([.I166]; [.L166]; [.O166]); TRUE(); FALSE()) -> true | Q166: of:=IF(NOT([.P166]); "Purchase a prerequisite for "&[.A166]&" ("&COM.MICROSOFT.TEXTJOIN(" or "; 1; [.G166]; [.J166]; [.M166])&")."&CHAR(13)&CHAR(10); "") ->  | R166: of:=IF([.A166]=""; FALSE(); IF([.P166]; TRUE(); FALSE())) -> true | T166: of:=IF([.A166]=""; FALSE(); IF([.P166]; TRUE(); FALSE())) -> true | U166: of:=IF([.T166]; [.C166]; 0) -> 20 | V166: of:=[.T166] + N([.V165]) -> 3 | W166: of:=IF(AND([.T166]; NOT([Powers.E7]="")); [Powers.E7]; "") -> Psychic Invisibility | X166: of:=IF([.B166]; IF([Powers.E7]=""; ""; IF([Powers.E7]="Ultra-power"; ""; [Powers.E7])); [.X165]) -> Ultra-power Name | Y166: of:=IF(AND([.T166]; OR([.W166]=""; [.B166])); [.A166]; [.W166]) -> Psychic Invisibility | Z166: of:=IF(AND([.T166]; NOT([Powers.F7]="")); [Powers.F7]; "") -> Oriental mysticism | AA166: of:=IF([.T166]; IFERROR(T(INDEX(POWER_CHART_ACTIONS; MATCH([.C166]; POWER_CHART_INDEXES; 0))); ""); "") -> Quick action | AB166: of:=IF([.T166]; INDEX(POWER_CHART_ATTACKS; MATCH([.C166]; POWER_CHART_INDEXES; 0)); FALSE()) -> false | AC166: of:=IF([.T166]; INDEX(POWER_CHART_TYPES; MATCH([.C166]; POWER_CHART_INDEXES; 0))&" "&IF([.AB166]; "attack"; "power"); "") -> Personal power | AD166: of:=IF(AND([.T166]; [Powers.H7]="Y"); TRUE(); FALSE()) -> false | AE166: of:=IF([.T166]; IF(INDEX(POWER_CHART_RANGES;MATCH([.C166];POWER_CHART_INDEXES;0))="Ranged";TRUE();FALSE())) -> false | AF166: of:=OR([.AD166];[.AE166]) -> false | AG166: of:=IF([.T166]; RIGHT([Powers.P7]; LEN([Powers.P7])-1)*1; 1) -> 1 | AH166: of:=IF([.AF166]; INDEX(POWER_LEVEL_CHART_RANGES_TEXT; MATCH(POWER_LEVEL-1; POWER_LEVEL_CHART_INDEXES;0)); "") ->  | AI166: of:=IF([.AF166]; INDEX(POWER_LEVEL_CHART_RANGES; MATCH(POWER_LEVEL; POWER_LEVEL_CHART_INDEXES;0)); "") ->  | AJ166: of:=IF([.AF166]; [.AI166]*[.AG166]; "") ->  | AK166: of:=IF([.AF166]; IF(([.AJ166])>9999; TEXT(([.AJ166])/1000; "#,##0")&" km"; TEXT([.AJ166];"#,##0")&" m"); "") ->  | AL166: of:=IF([.AF166]; "Ranged ("&[.AH166]&"/"&[.AK166]&")"; "") ->  | AM166: of:=IF(AND([.T166]; [Powers.L7]="Y"); TRUE(); FALSE()) -> true | AN166: of:=IF(AND([.AM166]; OR(ISNUMBER(FIND("attack"; [.AC166])); ISNUMBER(FIND("Ultra-power"; [.A166])))); TRUE(); FALSE()) -> false | AO166: of:=IF([.AN166];", Seeking";"") ->  | AP166: of:=IF(AND([.T166]; [Powers.J7]="Y"); TRUE(); FALSE()) -> true | AQ166: of:=IF([.T166]; IF(INDEX(POWER_CHART_AREAS; MATCH([.C166]; POWER_CHART_INDEXES; 0))="Area"; TRUE(); FALSE())) -> false | AR166: of:=OR([.AP166];[.AQ166]) -> true | AS166: of:=IF([.T166]; RIGHT([Powers.R7]; LEN([Powers.R7])-1)*1; 1) -> 1 | AT166: of:=IF([.AR166]; INDEX(POWER_LEVEL_CHART_AREAS; MATCH(POWER_LEVEL; POWER_LEVEL_CHART_INDEXES;0)); "") -> 10 | AU166: of:=IF([.AR166]; [.AS166]*[.AT166]; "") -> 10 | AV166: of:=IF([.AR166]; IF(([.AU166])>9999; TEXT(([.AU166])/1000; "#,##0")&" km radius"; TEXT([.AU166];"#,##0")&" m radius"); "") -> 10 m radius | AW166: of:=IF([.AR166]; "Area ("&[.AV166]&")"; "") -> Area (10 m radius) | AX166: of:=IF(AND([.T166]; [Powers.N7]="Y"); TRUE(); FALSE()) -> false | AY166: of:=IF([.AX166]) -> false | AZ166: of:=IF([.AY166];", Selective";"") ->  | BA166: of:=ISNUMBER(FIND("Movement"; [.AC166])) -> false | BB166: of:=IF(OR([.BA166]; [.B166]); RIGHT([Powers.T7]; LEN([Powers.T7])-1)*1; 1) -> 1 | BC166: of:=ISNUMBER(FIND("Super Running"; [.A166])) -> false | BD166: of:=IF([.BC166]; INDEX(MOVEMENT_CHART_BASES_TEXT; MATCH(ATHLETICS+POWER_LEVEL; MOVEMENT_CHART_INDEXES;0)); "") ->  | BE166: of:=IF([.BC166]; INDEX(MOVEMENT_CHART_SPRINTS; MATCH(ATHLETICS+POWER_LEVEL; MOVEMENT_CHART_INDEXES;0)); "") ->  | BF166: of:=IF([.BC166]; [.BE166]*[.BB166]; "") ->  | BG166: of:=IF([.BC166]; IF(([.BF166])>9999; TEXT(([.BF166])/1000; "#,##0")&" km"; TEXT([.BF166];"#,##0")&" m"); "") ->  | BH166: of:=IF([.BC166]; "("&[.BD166]&"/"&[.BG166]&")"; "") ->  | BI166: of:=AND(ISNUMBER(FIND("Super Swimming"; [.A166]))) -> false | BJ166: of:=IF([.BI166]; INDEX(MOVEMENT_CHART_BASES_TEXT; MATCH(ATHLETICS+POWER_LEVEL; MOVEMENT_CHART_INDEXES;0)); "") ->  | BK166: of:=IF([.BI166]; INDEX(MOVEMENT_CHART_SPRINTS; MATCH(ATHLETICS+POWER_LEVEL; MOVEMENT_CHART_INDEXES;0)); "") ->  | BL166: of:=IF([.BI166]; [.BK166]*[.BB166]; "") ->  | BM166: of:=IF([.BI166]; IF(([.BL166])>9999; TEXT(([.BL166])/1000; "#,##0")&" km"; TEXT([.BL166];"#,##0")&" m"); "") ->  | BN166: of:=IF([.BI166]; "("&[.BJ166]&"/"&[.BM166]&")"; "") ->  | BO166: of:=ISNUMBER(FIND("Flight"; [.A166])) -> false | BP166: of:=IF([.BO166]; INDEX(MOVEMENT_CHART_BASES_TEXT; MATCH(ATHLETICS+POWER_LEVEL; MOVEMENT_CHART_INDEXES;0)); "") ->  | BQ166: of:=IF([.BO166]; INDEX(MOVEMENT_CHART_SPRINTS; MATCH(ATHLETICS+POWER_LEVEL; MOVEMENT_CHART_INDEXES;0)); "") ->  | BR166: of:=IF([.BO166]; [.BQ166]*[.BB166]; "") ->  | BS166: of:=IF([.BO166]; IF(([.BR166])>9999; TEXT(([.BR166])/1000; "#,##0")&" km"; TEXT([.BR166];"#,##0")&" m"); "") ->  | BT166: of:=IF([.BO166]; "("&[.BP166]&"/"&[.BS166]&")"; "") ->  | BU166: of:=ISNUMBER(FIND("Teleportation"; [.A166])) -> false | BV166: of:=IF([.BU166]; INDEX(TELEPORTATION_CHART_BASES_TEXT; MATCH(POWER_LEVEL; TELEPORTATION_CHART_INDEXES; 0)); "") ->  | BW166: of:=IF([.BU166]; INDEX(TELEPORTATION_CHART_SPRINTS; MATCH(POWER_LEVEL; TELEPORTATION_CHART_INDEXES; 0)); "") ->  | BX166: of:=IF([.BU166]; [.BW166]*[.BB166]; "") ->  | BY166: of:=IF([.BU166]; IF(([.BX166])>9999; TEXT(([.BX166])/1000; "#,##0")&" km"; TEXT([.BX166];"#,##0")&" m"); "") ->  | BZ166: of:=IF([.BU166]; "("&[.BV166]&"/"&[.BY166]&")"; "") ->  | CA166: of:=ISNUMBER(FIND("Tunneling"; [.A166])) -> false | CB166: of:=IF([.CA166]; INDEX(MOVEMENT_CHART_BASES_TEXT; MATCH(ATHLETICS+POWER_LEVEL; MOVEMENT_CHART_INDEXES;0)); "") ->  | CC166: of:=IF([.CA166]; INDEX(MOVEMENT_CHART_SPRINTS; MATCH(ATHLETICS+POWER_LEVEL; MOVEMENT_CHART_INDEXES;0)); "") ->  | CD166: of:=IF([.CA166]; [.CC166]*[.BB166]; "") ->  | CE166: of:=IF([.CA166]; IF(([.CD166])>9999; TEXT(([.CD166])/1000; "#,##0")&" km"; TEXT([.CD166];"#,##0")&" m"); "") ->  | CF166: of:=IF([.CA166]; "("&[.CB166]&"/"&[.CE166]&")"; "") ->  | CG166: of:=AND(ISNUMBER(FIND("Super Endurance"; [.A166]))) -> false | CH166: of:=AND(ISNUMBER(FIND("Super Health"; [.A166]))) -> false | CI166: of:=AND(ISNUMBER(FIND("Super Reflection"; [.A166]))) -> false | CJ166: of:=AND(ISNUMBER(FIND("Super Strength"; [.A166]))) -> false | CK166: of:=ISNUMBER(FIND("Alteration Resistance"; [.A166])) -> false | CL166: of:=IF([.CK166]; ALTERATION_RESISTANCE_TEXT; "") ->  | CM166: of:=ISNUMBER(FIND("Damage Resistance"; [.A166])) -> false | CN166: of:=IF([.CM166]; DAMAGE_RESISTANCE_TEXT; "") ->  | CO166: of:=ISNUMBER(FIND("Mental Resistance"; [.A166])) -> false | CP166: of:=IF([.CO166]; MENTAL_RESISTANCE_TEXT; "") ->  | CQ166: of:=ISNUMBER(FIND("Bulletproof"; [.A166])) -> false | CR166: of:=IF([.CQ166]; "Unaffected by ordinary weapons Equipment Level "&POWER_LEVEL&" and lower"; "") ->  | CS166: of:=ISNUMBER(FIND("Density Control"; [.A166])) -> false | CT166: of:=IF([.CS166]; INDEX(DENSITY_CONTROL_CHART; POWER_LEVEL; 4); "") ->  | CU166: of:=ISNUMBER(FIND("Duplication"; [.A166])) -> true | CV166: of:=IF([.CU166]; INDEX(DUPLICATION_CHART; POWER_LEVEL; 3); "") -> 20 duplicates | CW166: of:=ISNUMBER(FIND("Growth"; [.A166])) -> false | CX166: of:=IF([.CW166]; INDEX(GROWTH_CHART; POWER_LEVEL; 6); "") ->  | CY166: of:=ISNUMBER(FIND("Extra Actions"; [.A166])) -> false | CZ166: of:=IF([.CY166]; POWER_LEVEL&" extra actions per scene"; "") ->  | DA166: of:=ISNUMBER(FIND("Haste"; [.A166])) -> false | DB166: of:=IF([.DA166]; INDEX(HASTE_CHART; POWER_LEVEL; 3); "") ->  | DC166: of:=ISNUMBER(FIND("Shrinking"; [.A166])) -> false | DD166: of:=IF([.DC166]; INDEX(SHRINKING_CHART; POWER_LEVEL; 4); "") ->  | DE166: of:=ISNUMBER(FIND("Stretching"; [.A166])) -> false | DF166: of:=IF([.DE166]; INDEX(STRETCHING_CHART; POWER_LEVEL; 2)&" reach"; "") ->  | DG166: of:=[.CL166]&[.CN166]&[.CP166]&[.CR166]&[.CT166]&[.CV166]&[.CX166]&[.CZ166]&[.DB166]&[.DD166]&[.DF166] -> 20 duplicates | DH166: of:=ISNUMBER(FIND("[Element]"; [.A166])) -> false | DI166: of:=ISNUMBER(FIND("[Subject]"; [.A166])) -> false | DJ166: of:=ISNUMBER(FIND("[Transformation]"; [.A166])) -> false | DM166: of:=IF([.B166]; [.AD166]; FALSE()) -> false | DN166: of:=IF(AND([.B166]; [.AG166]>[.DN165]); [.AG166]; N([.DN165])) -> 0 | DO166: of:=IF([.B166]; [.AN166]; FALSE()) -> false | DP166: of:=IF([.B166]; [.AR166]; FALSE()) -> false | DQ166: of:=IF(AND([.B166]; [.AS166]>[.DQ165]); [.AS166]; N([.DQ165])) -> 0 | DR166: of:=IF([.B166]; [.AX166]; FALSE()) -> false | DS166: of:=IF(AND([.B166]; [.BB166]>[.DS165]); [.BB166]; N([.DS165])) -> 0 | DT166: of:=IF([.T166]; COM.MICROSOFT.TEXTJOIN(", "; 1; [.AA166]; [.AL166]; [.AL166]; [.AZ166]; [.AZ166]; [.AC166]); "") -> Quick action, Personal power | DU166: of:=COM.MICROSOFT.TEXTJOIN("; "; TRUE(); [.Z166]; [.DG166]) -> Oriental mysticism; 20 duplicates | DV166: of:=IF([.T166]; [.V166]; 0) -> 3 | DW166: of:=IF(AND([.AD166]; NOT([.AE166])); 1; 0) + INDEX(MULTIPLIER_CHART_INDEXES; MATCH([.AG166]; MULTIPLIER_CHART_MULTIPLIERS;0)) -> 0 | DX166: of:=IF([.AN166]; 1; 0) -> 0 | DY166: of:=IF(AND(NOT([.AQ166]); [.AR166]); 1; 0) + INDEX(MULTIPLIER_CHART_INDEXES; MATCH([.AS166]; MULTIPLIER_CHART_MULTIPLIERS;0)) -> 1 | DZ166: of:=IF([.AY166]; 1; 0) -> 0 | EA166: of:=INDEX(MULTIPLIER_CHART_INDEXES; MATCH([.BB166]; MULTIPLIER_CHART_MULTIPLIERS;0)) -> 0 | EB166: of:=SUM([.DV166:.EA166]) -> 4 | EC166: of:=IF([.T166]; [.Y166]&CHAR(13)&CHAR(10)&[.DT166]&CHAR(13)&CHAR(10)&[.DU166]&CHAR(13)&CHAR(10)&VLOOKUP( [.A166]; POWER_CHART; 11; FALSE())&CHAR(13)&CHAR(10)&CHAR(13)&CHAR(10); "") -> Psychic Invisibility
Quick action, Personal power
Oriental mysticism; 20 duplicates
20


A167: of:=IF([Powers.C8]=""; ""; [Powers.C8]) -> Super Reflection | B167: of:=IF(ISNUMBER(FIND("Ultra-power"; [.A167])); TRUE(); FALSE()) -> false | C167: of:=IF(TRIM([.A167])=""; 0; INDEX(POWER_CHART_INDEXES; MATCH([.A167]; POWER_CHART_NAMES; 0))) -> 69 | D167: of:=IF([.C167]; 1; 0) + N([.D166]) -> 4 | E167: of:=IF(AND([.B167]; SELECTED_POWER_COUNT<4); FALSE(); TRUE()) -> true | F167: of:=IF(AND([.B167]; [.E167]); TRUE(); FALSE()) -> false | G167: of:=IF(N([.C167]); IFERROR(T(INDEX(POWER_CHART_PREREQ_1; MATCH([.C167]; POWER_CHART_INDEXES; 0))); ""); "") -> Reflection | H167: of:=IF(OR([.B167]; [.G167]=""); 0; INDEX(POWER_CHART_INDEXES; MATCH([.G167]; POWER_CHART_NAMES; 0))) -> 54 | I167: of:=IF([.H167]=0; TRUE(); COUNTIF(POWER_CALC_SELECTED_INDEXES; [.H167])) -> false | J167: of:=IF(N([.C167]); IFERROR(T(INDEX(POWER_CHART_PREREQ_2; MATCH([.C167]; POWER_CHART_INDEXES; 0))); ""); "") ->  | K167: of:=IF(OR([.B167]; [.J167]=""); 0; INDEX(POWER_CHART_INDEXES; MATCH([.J167]; POWER_CHART_NAMES; 0))) -> 0 | L167: of:=IF([.K167]=0; TRUE(); COUNTIF(POWER_CALC_SELECTED_INDEXES; [.K167])) -> true | M167: of:=IF(N([.C167]); IFERROR(T(INDEX(POWER_CHART_PREREQ_3; MATCH([.C167]; POWER_CHART_INDEXES; 0))); ""); "") ->  | N167: of:=IF(OR([.B167]; [.M167]=""); 0; INDEX(POWER_CHART_INDEXES; MATCH([.M167]; POWER_CHART_NAMES; 0))) -> 0 | O167: of:=IF([.N167]=0; TRUE(); COUNTIF(POWER_CALC_SELECTED_INDEXES; [.N167])) -> true | P167: of:=IF(AND([.I167]; [.L167]; [.O167]); TRUE(); FALSE()) -> false | Q167: of:=IF(NOT([.P167]); "Purchase a prerequisite for "&[.A167]&" ("&COM.MICROSOFT.TEXTJOIN(" or "; 1; [.G167]; [.J167]; [.M167])&")."&CHAR(13)&CHAR(10); "") -> Purchase a prerequisite for Super Reflection (Reflection).
 | R167: of:=IF([.A167]=""; FALSE(); IF([.P167]; TRUE(); FALSE())) -> false | T167: of:=IF([.A167]=""; FALSE(); IF([.P167]; TRUE(); FALSE())) -> false | U167: of:=IF([.T167]; [.C167]; 0) -> 0 | V167: of:=[.T167] + N([.V166]) -> 3 | W167: of:=IF(AND([.T167]; NOT([Powers.E8]="")); [Powers.E8]; "") ->  | X167: of:=IF([.B167]; IF([Powers.E8]=""; ""; IF([Powers.E8]="Ultra-power"; ""; [Powers.E8])); [.X166]) -> Ultra-power Name | Y167: of:=IF(AND([.T167]; OR([.W167]=""; [.B167])); [.A167]; [.W167]) ->  | Z167: of:=IF(AND([.T167]; NOT([Powers.F8]="")); [Powers.F8]; "") ->  | AA167: of:=IF([.T167]; IFERROR(T(INDEX(POWER_CHART_ACTIONS; MATCH([.C167]; POWER_CHART_INDEXES; 0))); ""); "") ->  | AB167: of:=IF([.T167]; INDEX(POWER_CHART_ATTACKS; MATCH([.C167]; POWER_CHART_INDEXES; 0)); FALSE()) -> false | AC167: of:=IF([.T167]; INDEX(POWER_CHART_TYPES; MATCH([.C167]; POWER_CHART_INDEXES; 0))&" "&IF([.AB167]; "attack"; "power"); "") ->  | AD167: of:=IF(AND([.T167]; [Powers.H8]="Y"); TRUE(); FALSE()) -> false | AE167: of:=IF([.T167]; IF(INDEX(POWER_CHART_RANGES;MATCH([.C167];POWER_CHART_INDEXES;0))="Ranged";TRUE();FALSE())) -> false | AF167: of:=OR([.AD167];[.AE167]) -> false | AG167: of:=IF([.T167]; RIGHT([Powers.P8]; LEN([Powers.P8])-1)*1; 1) -> 1 | AH167: of:=IF([.AF167]; INDEX(POWER_LEVEL_CHART_RANGES_TEXT; MATCH(POWER_LEVEL-1; POWER_LEVEL_CHART_INDEXES;0)); "") ->  | AI167: of:=IF([.AF167]; INDEX(POWER_LEVEL_CHART_RANGES; MATCH(POWER_LEVEL; POWER_LEVEL_CHART_INDEXES;0)); "") ->  | AJ167: of:=IF([.AF167]; [.AI167]*[.AG167]; "") ->  | AK167: of:=IF([.AF167]; IF(([.AJ167])>9999; TEXT(([.AJ167])/1000; "#,##0")&" km"; TEXT([.AJ167];"#,##0")&" m"); "") ->  | AL167: of:=IF([.AF167]; "Ranged ("&[.AH167]&"/"&[.AK167]&")"; "") ->  | AM167: of:=IF(AND([.T167]; [Powers.L8]="Y"); TRUE(); FALSE()) -> false | AN167: of:=IF(AND([.AM167]; OR(ISNUMBER(FIND("attack"; [.AC167])); ISNUMBER(FIND("Ultra-power"; [.A167])))); TRUE(); FALSE()) -> false | AO167: of:=IF([.AN167];", Seeking";"") ->  | AP167: of:=IF(AND([.T167]; [Powers.J8]="Y"); TRUE(); FALSE()) -> false | AQ167: of:=IF([.T167]; IF(INDEX(POWER_CHART_AREAS; MATCH([.C167]; POWER_CHART_INDEXES; 0))="Area"; TRUE(); FALSE())) -> false | AR167: of:=OR([.AP167];[.AQ167]) -> false | AS167: of:=IF([.T167]; RIGHT([Powers.R8]; LEN([Powers.R8])-1)*1; 1) -> 1 | AT167: of:=IF([.AR167]; INDEX(POWER_LEVEL_CHART_AREAS; MATCH(POWER_LEVEL; POWER_LEVEL_CHART_INDEXES;0)); "") ->  | AU167: of:=IF([.AR167]; [.AS167]*[.AT167]; "") ->  | AV167: of:=IF([.AR167]; IF(([.AU167])>9999; TEXT(([.AU167])/1000; "#,##0")&" km radius"; TEXT([.AU167];"#,##0")&" m radius"); "") ->  | AW167: of:=IF([.AR167]; "Area ("&[.AV167]&")"; "") ->  | AX167: of:=IF(AND([.T167]; [Powers.N8]="Y"); TRUE(); FALSE()) -> false | AY167: of:=IF([.AX167]) -> false | AZ167: of:=IF([.AY167];", Selective";"") ->  | BA167: of:=ISNUMBER(FIND("Movement"; [.AC167])) -> false | BB167: of:=IF(OR([.BA167]; [.B167]); RIGHT([Powers.T8]; LEN([Powers.T8])-1)*1; 1) -> 1 | BC167: of:=ISNUMBER(FIND("Super Running"; [.A167])) -> false | BD167: of:=IF([.BC167]; INDEX(MOVEMENT_CHART_BASES_TEXT; MATCH(ATHLETICS+POWER_LEVEL; MOVEMENT_CHART_INDEXES;0)); "") ->  | BE167: of:=IF([.BC167]; INDEX(MOVEMENT_CHART_SPRINTS; MATCH(ATHLETICS+POWER_LEVEL; MOVEMENT_CHART_INDEXES;0)); "") ->  | BF167: of:=IF([.BC167]; [.BE167]*[.BB167]; "") ->  | BG167: of:=IF([.BC167]; IF(([.BF167])>9999; TEXT(([.BF167])/1000; "#,##0")&" km"; TEXT([.BF167];"#,##0")&" m"); "") ->  | BH167: of:=IF([.BC167]; "("&[.BD167]&"/"&[.BG167]&")"; "") ->  | BI167: of:=AND(ISNUMBER(FIND("Super Swimming"; [.A167]))) -> false | BJ167: of:=IF([.BI167]; INDEX(MOVEMENT_CHART_BASES_TEXT; MATCH(ATHLETICS+POWER_LEVEL; MOVEMENT_CHART_INDEXES;0)); "") ->  | BK167: of:=IF([.BI167]; INDEX(MOVEMENT_CHART_SPRINTS; MATCH(ATHLETICS+POWER_LEVEL; MOVEMENT_CHART_INDEXES;0)); "") ->  | BL167: of:=IF([.BI167]; [.BK167]*[.BB167]; "") ->  | BM167: of:=IF([.BI167]; IF(([.BL167])>9999; TEXT(([.BL167])/1000; "#,##0")&" km"; TEXT([.BL167];"#,##0")&" m"); "") ->  | BN167: of:=IF([.BI167]; "("&[.BJ167]&"/"&[.BM167]&")"; "") ->  | BO167: of:=ISNUMBER(FIND("Flight"; [.A167])) -> false | BP167: of:=IF([.BO167]; INDEX(MOVEMENT_CHART_BASES_TEXT; MATCH(ATHLETICS+POWER_LEVEL; MOVEMENT_CHART_INDEXES;0)); "") ->  | BQ167: of:=IF([.BO167]; INDEX(MOVEMENT_CHART_SPRINTS; MATCH(ATHLETICS+POWER_LEVEL; MOVEMENT_CHART_INDEXES;0)); "") ->  | BR167: of:=IF([.BO167]; [.BQ167]*[.BB167]; "") ->  | BS167: of:=IF([.BO167]; IF(([.BR167])>9999; TEXT(([.BR167])/1000; "#,##0")&" km"; TEXT([.BR167];"#,##0")&" m"); "") ->  | BT167: of:=IF([.BO167]; "("&[.BP167]&"/"&[.BS167]&")"; "") ->  | BU167: of:=ISNUMBER(FIND("Teleportation"; [.A167])) -> false | BV167: of:=IF([.BU167]; INDEX(TELEPORTATION_CHART_BASES_TEXT; MATCH(POWER_LEVEL; TELEPORTATION_CHART_INDEXES; 0)); "") ->  | BW167: of:=IF([.BU167]; INDEX(TELEPORTATION_CHART_SPRINTS; MATCH(POWER_LEVEL; TELEPORTATION_CHART_INDEXES; 0)); "") ->  | BX167: of:=IF([.BU167]; [.BW167]*[.BB167]; "") ->  | BY167: of:=IF([.BU167]; IF(([.BX167])>9999; TEXT(([.BX167])/1000; "#,##0")&" km"; TEXT([.BX167];"#,##0")&" m"); "") ->  | BZ167: of:=IF([.BU167]; "("&[.BV167]&"/"&[.BY167]&")"; "") ->  | CA167: of:=ISNUMBER(FIND("Tunneling"; [.A167])) -> false | CB167: of:=IF([.CA167]; INDEX(MOVEMENT_CHART_BASES_TEXT; MATCH(ATHLETICS+POWER_LEVEL; MOVEMENT_CHART_INDEXES;0)); "") ->  | CC167: of:=IF([.CA167]; INDEX(MOVEMENT_CHART_SPRINTS; MATCH(ATHLETICS+POWER_LEVEL; MOVEMENT_CHART_INDEXES;0)); "") ->  | CD167: of:=IF([.CA167]; [.CC167]*[.BB167]; "") ->  | CE167: of:=IF([.CA167]; IF(([.CD167])>9999; TEXT(([.CD167])/1000; "#,##0")&" km"; TEXT([.CD167];"#,##0")&" m"); "") ->  | CF167: of:=IF([.CA167]; "("&[.CB167]&"/"&[.CE167]&")"; "") ->  | CG167: of:=AND(ISNUMBER(FIND("Super Endurance"; [.A167]))) -> false | CH167: of:=AND(ISNUMBER(FIND("Super Health"; [.A167]))) -> false | CI167: of:=AND(ISNUMBER(FIND("Super Reflection"; [.A167]))) -> true | CJ167: of:=AND(ISNUMBER(FIND("Super Strength"; [.A167]))) -> false | CK167: of:=ISNUMBER(FIND("Alteration Resistance"; [.A167])) -> false | CL167: of:=IF([.CK167]; ALTERATION_RESISTANCE_TEXT; "") ->  | CM167: of:=ISNUMBER(FIND("Damage Resistance"; [.A167])) -> false | CN167: of:=IF([.CM167]; DAMAGE_RESISTANCE_TEXT; "") ->  | CO167: of:=ISNUMBER(FIND("Mental Resistance"; [.A167])) -> false | CP167: of:=IF([.CO167]; MENTAL_RESISTANCE_TEXT; "") ->  | CQ167: of:=ISNUMBER(FIND("Bulletproof"; [.A167])) -> false | CR167: of:=IF([.CQ167]; "Unaffected by ordinary weapons Equipment Level "&POWER_LEVEL&" and lower"; "") ->  | CS167: of:=ISNUMBER(FIND("Density Control"; [.A167])) -> false | CT167: of:=IF([.CS167]; INDEX(DENSITY_CONTROL_CHART; POWER_LEVEL; 4); "") ->  | CU167: of:=ISNUMBER(FIND("Duplication"; [.A167])) -> false | CV167: of:=IF([.CU167]; INDEX(DUPLICATION_CHART; POWER_LEVEL; 3); "") ->  | CW167: of:=ISNUMBER(FIND("Growth"; [.A167])) -> false | CX167: of:=IF([.CW167]; INDEX(GROWTH_CHART; POWER_LEVEL; 6); "") ->  | CY167: of:=ISNUMBER(FIND("Extra Actions"; [.A167])) -> false | CZ167: of:=IF([.CY167]; POWER_LEVEL&" extra actions per scene"; "") ->  | DA167: of:=ISNUMBER(FIND("Haste"; [.A167])) -> false | DB167: of:=IF([.DA167]; INDEX(HASTE_CHART; POWER_LEVEL; 3); "") ->  | DC167: of:=ISNUMBER(FIND("Shrinking"; [.A167])) -> false | DD167: of:=IF([.DC167]; INDEX(SHRINKING_CHART; POWER_LEVEL; 4); "") ->  | DE167: of:=ISNUMBER(FIND("Stretching"; [.A167])) -> false | DF167: of:=IF([.DE167]; INDEX(STRETCHING_CHART; POWER_LEVEL; 2)&" reach"; "") ->  | DG167: of:=[.CL167]&[.CN167]&[.CP167]&[.CR167]&[.CT167]&[.CV167]&[.CX167]&[.CZ167]&[.DB167]&[.DD167]&[.DF167] ->  | DH167: of:=ISNUMBER(FIND("[Element]"; [.A167])) -> false | DI167: of:=ISNUMBER(FIND("[Subject]"; [.A167])) -> false | DJ167: of:=ISNUMBER(FIND("[Transformation]"; [.A167])) -> false | DM167: of:=IF([.B167]; [.AD167]; FALSE()) -> false | DN167: of:=IF(AND([.B167]; [.AG167]>[.DN166]); [.AG167]; N([.DN166])) -> 0 | DO167: of:=IF([.B167]; [.AN167]; FALSE()) -> false | DP167: of:=IF([.B167]; [.AR167]; FALSE()) -> false | DQ167: of:=IF(AND([.B167]; [.AS167]>[.DQ166]); [.AS167]; N([.DQ166])) -> 0 | DR167: of:=IF([.B167]; [.AX167]; FALSE()) -> false | DS167: of:=IF(AND([.B167]; [.BB167]>[.DS166]); [.BB167]; N([.DS166])) -> 0 | DT167: of:=IF([.T167]; COM.MICROSOFT.TEXTJOIN(", "; 1; [.AA167]; [.AL167]; [.AL167]; [.AZ167]; [.AZ167]; [.AC167]); "") ->  | DU167: of:=COM.MICROSOFT.TEXTJOIN("; "; TRUE(); [.Z167]; [.DG167]) ->  | DV167: of:=IF([.T167]; [.V167]; 0) -> 0 | DW167: of:=IF(AND([.AD167]; NOT([.AE167])); 1; 0) + INDEX(MULTIPLIER_CHART_INDEXES; MATCH([.AG167]; MULTIPLIER_CHART_MULTIPLIERS;0)) -> 0 | DX167: of:=IF([.AN167]; 1; 0) -> 0 | DY167: of:=IF(AND(NOT([.AQ167]); [.AR167]); 1; 0) + INDEX(MULTIPLIER_CHART_INDEXES; MATCH([.AS167]; MULTIPLIER_CHART_MULTIPLIERS;0)) -> 0 | DZ167: of:=IF([.AY167]; 1; 0) -> 0 | EA167: of:=INDEX(MULTIPLIER_CHART_INDEXES; MATCH([.BB167]; MULTIPLIER_CHART_MULTIPLIERS;0)) -> 0 | EB167: of:=SUM([.DV167:.EA167]) -> 0 | EC167: of:=IF([.T167]; [.Y167]&CHAR(13)&CHAR(10)&[.DT167]&CHAR(13)&CHAR(10)&[.DU167]&CHAR(13)&CHAR(10)&VLOOKUP( [.A167]; POWER_CHART; 11; FALSE())&CHAR(13)&CHAR(10)&CHAR(13)&CHAR(10); "") -> 
A168: of:=IF([Powers.C9]=""; ""; [Powers.C9]) ->  | B168: of:=IF(ISNUMBER(FIND("Ultra-power"; [.A168])); TRUE(); FALSE()) -> false | C168: of:=IF(TRIM([.A168])=""; 0; INDEX(POWER_CHART_INDEXES; MATCH([.A168]; POWER_CHART_NAMES; 0))) -> 0 | D168: of:=IF([.C168]; 1; 0) + N([.D167]) -> 4 | E168: of:=IF(AND([.B168]; SELECTED_POWER_COUNT<4); FALSE(); TRUE()) -> true | F168: of:=IF(AND([.B168]; [.E168]); TRUE(); FALSE()) -> false | G168: of:=IF(N([.C168]); IFERROR(T(INDEX(POWER_CHART_PREREQ_1; MATCH([.C168]; POWER_CHART_INDEXES; 0))); ""); "") ->  | H168: of:=IF(OR([.B168]; [.G168]=""); 0; INDEX(POWER_CHART_INDEXES; MATCH([.G168]; POWER_CHART_NAMES; 0))) -> 0 | I168: of:=IF([.H168]=0; TRUE(); COUNTIF(POWER_CALC_SELECTED_INDEXES; [.H168])) -> true | J168: of:=IF(N([.C168]); IFERROR(T(INDEX(POWER_CHART_PREREQ_2; MATCH([.C168]; POWER_CHART_INDEXES; 0))); ""); "") ->  | K168: of:=IF(OR([.B168]; [.J168]=""); 0; INDEX(POWER_CHART_INDEXES; MATCH([.J168]; POWER_CHART_NAMES; 0))) -> 0 | L168: of:=IF([.K168]=0; TRUE(); COUNTIF(POWER_CALC_SELECTED_INDEXES; [.K168])) -> true | M168: of:=IF(N([.C168]); IFERROR(T(INDEX(POWER_CHART_PREREQ_3; MATCH([.C168]; POWER_CHART_INDEXES; 0))); ""); "") ->  | N168: of:=IF(OR([.B168]; [.M168]=""); 0; INDEX(POWER_CHART_INDEXES; MATCH([.M168]; POWER_CHART_NAMES; 0))) -> 0 | O168: of:=IF([.N168]=0; TRUE(); COUNTIF(POWER_CALC_SELECTED_INDEXES; [.N168])) -> true | P168: of:=IF(AND([.I168]; [.L168]; [.O168]); TRUE(); FALSE()) -> true | Q168: of:=IF(NOT([.P168]); "Purchase a prerequisite for "&[.A168]&" ("&COM.MICROSOFT.TEXTJOIN(" or "; 1; [.G168]; [.J168]; [.M168])&")."&CHAR(13)&CHAR(10); "") ->  | R168: of:=IF([.A168]=""; FALSE(); IF([.P168]; TRUE(); FALSE())) -> false | T168: of:=IF([.A168]=""; FALSE(); IF([.P168]; TRUE(); FALSE())) -> false | U168: of:=IF([.T168]; [.C168]; 0) -> 0 | V168: of:=[.T168] + N([.V167]) -> 3 | W168: of:=IF(AND([.T168]; NOT([Powers.E9]="")); [Powers.E9]; "") ->  | X168: of:=IF([.B168]; IF([Powers.E9]=""; ""; IF([Powers.E9]="Ultra-power"; ""; [Powers.E9])); [.X167]) -> Ultra-power Name | Y168: of:=IF(AND([.T168]; OR([.W168]=""; [.B168])); [.A168]; [.W168]) ->  | Z168: of:=IF(AND([.T168]; NOT([Powers.F9]="")); [Powers.F9]; "") ->  | AA168: of:=IF([.T168]; IFERROR(T(INDEX(POWER_CHART_ACTIONS; MATCH([.C168]; POWER_CHART_INDEXES; 0))); ""); "") ->  | AB168: of:=IF([.T168]; INDEX(POWER_CHART_ATTACKS; MATCH([.C168]; POWER_CHART_INDEXES; 0)); FALSE()) -> false | AC168: of:=IF([.T168]; INDEX(POWER_CHART_TYPES; MATCH([.C168]; POWER_CHART_INDEXES; 0))&" "&IF([.AB168]; "attack"; "power"); "") ->  | AD168: of:=IF(AND([.T168]; [Powers.H9]="Y"); TRUE(); FALSE()) -> false | AE168: of:=IF([.T168]; IF(INDEX(POWER_CHART_RANGES;MATCH([.C168];POWER_CHART_INDEXES;0))="Ranged";TRUE();FALSE())) -> false | AF168: of:=OR([.AD168];[.AE168]) -> false | AG168: of:=IF([.T168]; RIGHT([Powers.P9]; LEN([Powers.P9])-1)*1; 1) -> 1 | AH168: of:=IF([.AF168]; INDEX(POWER_LEVEL_CHART_RANGES_TEXT; MATCH(POWER_LEVEL-1; POWER_LEVEL_CHART_INDEXES;0)); "") ->  | AI168: of:=IF([.AF168]; INDEX(POWER_LEVEL_CHART_RANGES; MATCH(POWER_LEVEL; POWER_LEVEL_CHART_INDEXES;0)); "") ->  | AJ168: of:=IF([.AF168]; [.AI168]*[.AG168]; "") ->  | AK168: of:=IF([.AF168]; IF(([.AJ168])>9999; TEXT(([.AJ168])/1000; "#,##0")&" km"; TEXT([.AJ168];"#,##0")&" m"); "") ->  | AL168: of:=IF([.AF168]; "Ranged ("&[.AH168]&"/"&[.AK168]&")"; "") ->  | AM168: of:=IF(AND([.T168]; [Powers.L9]="Y"); TRUE(); FALSE()) -> false | AN168: of:=IF(AND([.AM168]; OR(ISNUMBER(FIND("attack"; [.AC168])); ISNUMBER(FIND("Ultra-power"; [.A168])))); TRUE(); FALSE()) -> false | AO168: of:=IF([.AN168];", Seeking";"") ->  | AP168: of:=IF(AND([.T168]; [Powers.J9]="Y"); TRUE(); FALSE()) -> false | AQ168: of:=IF([.T168]; IF(INDEX(POWER_CHART_AREAS; MATCH([.C168]; POWER_CHART_INDEXES; 0))="Area"; TRUE(); FALSE())) -> false | AR168: of:=OR([.AP168];[.AQ168]) -> false | AS168: of:=IF([.T168]; RIGHT([Powers.R9]; LEN([Powers.R9])-1)*1; 1) -> 1 | AT168: of:=IF([.AR168]; INDEX(POWER_LEVEL_CHART_AREAS; MATCH(POWER_LEVEL; POWER_LEVEL_CHART_INDEXES;0)); "") ->  | AU168: of:=IF([.AR168]; [.AS168]*[.AT168]; "") ->  | AV168: of:=IF([.AR168]; IF(([.AU168])>9999; TEXT(([.AU168])/1000; "#,##0")&" km radius"; TEXT([.AU168];"#,##0")&" m radius"); "") ->  | AW168: of:=IF([.AR168]; "Area ("&[.AV168]&")"; "") ->  | AX168: of:=IF(AND([.T168]; [Powers.N9]="Y"); TRUE(); FALSE()) -> false | AY168: of:=IF([.AX168]) -> false | AZ168: of:=IF([.AY168];", Selective";"") ->  | BA168: of:=ISNUMBER(FIND("Movement"; [.AC168])) -> false | BB168: of:=IF(OR([.BA168]; [.B168]); RIGHT([Powers.T9]; LEN([Powers.T9])-1)*1; 1) -> 1 | BC168: of:=ISNUMBER(FIND("Super Running"; [.A168])) -> false | BD168: of:=IF([.BC168]; INDEX(MOVEMENT_CHART_BASES_TEXT; MATCH(ATHLETICS+POWER_LEVEL; MOVEMENT_CHART_INDEXES;0)); "") ->  | BE168: of:=IF([.BC168]; INDEX(MOVEMENT_CHART_SPRINTS; MATCH(ATHLETICS+POWER_LEVEL; MOVEMENT_CHART_INDEXES;0)); "") ->  | BF168: of:=IF([.BC168]; [.BE168]*[.BB168]; "") ->  | BG168: of:=IF([.BC168]; IF(([.BF168])>9999; TEXT(([.BF168])/1000; "#,##0")&" km"; TEXT([.BF168];"#,##0")&" m"); "") ->  | BH168: of:=IF([.BC168]; "("&[.BD168]&"/"&[.BG168]&")"; "") ->  | BI168: of:=AND(ISNUMBER(FIND("Super Swimming"; [.A168]))) -> false | BJ168: of:=IF([.BI168]; INDEX(MOVEMENT_CHART_BASES_TEXT; MATCH(ATHLETICS+POWER_LEVEL; MOVEMENT_CHART_INDEXES;0)); "") ->  | BK168: of:=IF([.BI168]; INDEX(MOVEMENT_CHART_SPRINTS; MATCH(ATHLETICS+POWER_LEVEL; MOVEMENT_CHART_INDEXES;0)); "") ->  | BL168: of:=IF([.BI168]; [.BK168]*[.BB168]; "") ->  | BM168: of:=IF([.BI168]; IF(([.BL168])>9999; TEXT(([.BL168])/1000; "#,##0")&" km"; TEXT([.BL168];"#,##0")&" m"); "") ->  | BN168: of:=IF([.BI168]; "("&[.BJ168]&"/"&[.BM168]&")"; "") ->  | BO168: of:=ISNUMBER(FIND("Flight"; [.A168])) -> false | BP168: of:=IF([.BO168]; INDEX(MOVEMENT_CHART_BASES_TEXT; MATCH(ATHLETICS+POWER_LEVEL; MOVEMENT_CHART_INDEXES;0)); "") ->  | BQ168: of:=IF([.BO168]; INDEX(MOVEMENT_CHART_SPRINTS; MATCH(ATHLETICS+POWER_LEVEL; MOVEMENT_CHART_INDEXES;0)); "") ->  | BR168: of:=IF([.BO168]; [.BQ168]*[.BB168]; "") ->  | BS168: of:=IF([.BO168]; IF(([.BR168])>9999; TEXT(([.BR168])/1000; "#,##0")&" km"; TEXT([.BR168];"#,##0")&" m"); "") ->  | BT168: of:=IF([.BO168]; "("&[.BP168]&"/"&[.BS168]&")"; "") ->  | BU168: of:=ISNUMBER(FIND("Teleportation"; [.A168])) -> false | BV168: of:=IF([.BU168]; INDEX(TELEPORTATION_CHART_BASES_TEXT; MATCH(POWER_LEVEL; TELEPORTATION_CHART_INDEXES; 0)); "") ->  | BW168: of:=IF([.BU168]; INDEX(TELEPORTATION_CHART_SPRINTS; MATCH(POWER_LEVEL; TELEPORTATION_CHART_INDEXES; 0)); "") ->  | BX168: of:=IF([.BU168]; [.BW168]*[.BB168]; "") ->  | BY168: of:=IF([.BU168]; IF(([.BX168])>9999; TEXT(([.BX168])/1000; "#,##0")&" km"; TEXT([.BX168];"#,##0")&" m"); "") ->  | BZ168: of:=IF([.BU168]; "("&[.BV168]&"/"&[.BY168]&")"; "") ->  | CA168: of:=ISNUMBER(FIND("Tunneling"; [.A168])) -> false | CB168: of:=IF([.CA168]; INDEX(MOVEMENT_CHART_BASES_TEXT; MATCH(ATHLETICS+POWER_LEVEL; MOVEMENT_CHART_INDEXES;0)); "") ->  | CC168: of:=IF([.CA168]; INDEX(MOVEMENT_CHART_SPRINTS; MATCH(ATHLETICS+POWER_LEVEL; MOVEMENT_CHART_INDEXES;0)); "") ->  | CD168: of:=IF([.CA168]; [.CC168]*[.BB168]; "") ->  | CE168: of:=IF([.CA168]; IF(([.CD168])>9999; TEXT(([.CD168])/1000; "#,##0")&" km"; TEXT([.CD168];"#,##0")&" m"); "") ->  | CF168: of:=IF([.CA168]; "("&[.CB168]&"/"&[.CE168]&")"; "") ->  | CG168: of:=AND(ISNUMBER(FIND("Super Endurance"; [.A168]))) -> false | CH168: of:=AND(ISNUMBER(FIND("Super Health"; [.A168]))) -> false | CI168: of:=AND(ISNUMBER(FIND("Super Reflection"; [.A168]))) -> false | CJ168: of:=AND(ISNUMBER(FIND("Super Strength"; [.A168]))) -> false | CK168: of:=ISNUMBER(FIND("Alteration Resistance"; [.A168])) -> false | CL168: of:=IF([.CK168]; ALTERATION_RESISTANCE_TEXT; "") ->  | CM168: of:=ISNUMBER(FIND("Damage Resistance"; [.A168])) -> false | CN168: of:=IF([.CM168]; DAMAGE_RESISTANCE_TEXT; "") ->  | CO168: of:=ISNUMBER(FIND("Mental Resistance"; [.A168])) -> false | CP168: of:=IF([.CO168]; MENTAL_RESISTANCE_TEXT; "") ->  | CQ168: of:=ISNUMBER(FIND("Bulletproof"; [.A168])) -> false | CR168: of:=IF([.CQ168]; "Unaffected by ordinary weapons Equipment Level "&POWER_LEVEL&" and lower"; "") ->  | CS168: of:=ISNUMBER(FIND("Density Control"; [.A168])) -> false | CT168: of:=IF([.CS168]; INDEX(DENSITY_CONTROL_CHART; POWER_LEVEL; 4); "") ->  | CU168: of:=ISNUMBER(FIND("Duplication"; [.A168])) -> false | CV168: of:=IF([.CU168]; INDEX(DUPLICATION_CHART; POWER_LEVEL; 3); "") ->  | CW168: of:=ISNUMBER(FIND("Growth"; [.A168])) -> false | CX168: of:=IF([.CW168]; INDEX(GROWTH_CHART; POWER_LEVEL; 6); "") ->  | CY168: of:=ISNUMBER(FIND("Extra Actions"; [.A168])) -> false | CZ168: of:=IF([.CY168]; POWER_LEVEL&" extra actions per scene"; "") ->  | DA168: of:=ISNUMBER(FIND("Haste"; [.A168])) -> false | DB168: of:=IF([.DA168]; INDEX(HASTE_CHART; POWER_LEVEL; 3); "") ->  | DC168: of:=ISNUMBER(FIND("Shrinking"; [.A168])) -> false | DD168: of:=IF([.DC168]; INDEX(SHRINKING_CHART; POWER_LEVEL; 4); "") ->  | DE168: of:=ISNUMBER(FIND("Stretching"; [.A168])) -> false | DF168: of:=IF([.DE168]; INDEX(STRETCHING_CHART; POWER_LEVEL; 2)&" reach"; "") ->  | DG168: of:=[.CL168]&[.CN168]&[.CP168]&[.CR168]&[.CT168]&[.CV168]&[.CX168]&[.CZ168]&[.DB168]&[.DD168]&[.DF168] ->  | DH168: of:=ISNUMBER(FIND("[Element]"; [.A168])) -> false | DI168: of:=ISNUMBER(FIND("[Subject]"; [.A168])) -> false | DJ168: of:=ISNUMBER(FIND("[Transformation]"; [.A168])) -> false | DM168: of:=IF([.B168]; [.AD168]; FALSE()) -> false | DN168: of:=IF(AND([.B168]; [.AG168]>[.DN167]); [.AG168]; N([.DN167])) -> 0 | DO168: of:=IF([.B168]; [.AN168]; FALSE()) -> false | DP168: of:=IF([.B168]; [.AR168]; FALSE()) -> false | DQ168: of:=IF(AND([.B168]; [.AS168]>[.DQ167]); [.AS168]; N([.DQ167])) -> 0 | DR168: of:=IF([.B168]; [.AX168]; FALSE()) -> false | DS168: of:=IF(AND([.B168]; [.BB168]>[.DS167]); [.BB168]; N([.DS167])) -> 0 | DT168: of:=IF([.T168]; COM.MICROSOFT.TEXTJOIN(", "; 1; [.AA168]; [.AL168]; [.AL168]; [.AZ168]; [.AZ168]; [.AC168]); "") ->  | DU168: of:=COM.MICROSOFT.TEXTJOIN("; "; TRUE(); [.Z168]; [.DG168]) ->  | DV168: of:=IF([.T168]; [.V168]; 0) -> 0 | DW168: of:=IF(AND([.AD168]; NOT([.AE168])); 1; 0) + INDEX(MULTIPLIER_CHART_INDEXES; MATCH([.AG168]; MULTIPLIER_CHART_MULTIPLIERS;0)) -> 0 | DX168: of:=IF([.AN168]; 1; 0) -> 0 | DY168: of:=IF(AND(NOT([.AQ168]); [.AR168]); 1; 0) + INDEX(MULTIPLIER_CHART_INDEXES; MATCH([.AS168]; MULTIPLIER_CHART_MULTIPLIERS;0)) -> 0 | DZ168: of:=IF([.AY168]; 1; 0) -> 0 | EA168: of:=INDEX(MULTIPLIER_CHART_INDEXES; MATCH([.BB168]; MULTIPLIER_CHART_MULTIPLIERS;0)) -> 0 | EB168: of:=SUM([.DV168:.EA168]) -> 0 | EC168: of:=IF([.T168]; [.Y168]&CHAR(13)&CHAR(10)&[.DT168]&CHAR(13)&CHAR(10)&[.DU168]&CHAR(13)&CHAR(10)&VLOOKUP( [.A168]; POWER_CHART; 11; FALSE())&CHAR(13)&CHAR(10)&CHAR(13)&CHAR(10); "") -> 
A169: of:=IF([Powers.C10]=""; ""; [Powers.C10]) -> Haste | B169: of:=IF(ISNUMBER(FIND("Ultra-power"; [.A169])); TRUE(); FALSE()) -> false | C169: of:=IF(TRIM([.A169])=""; 0; INDEX(POWER_CHART_INDEXES; MATCH([.A169]; POWER_CHART_NAMES; 0))) -> 32 | D169: of:=IF([.C169]; 1; 0) + N([.D168]) -> 5 | E169: of:=IF(AND([.B169]; SELECTED_POWER_COUNT<4); FALSE(); TRUE()) -> true | F169: of:=IF(AND([.B169]; [.E169]); TRUE(); FALSE()) -> false | G169: of:=IF(N([.C169]); IFERROR(T(INDEX(POWER_CHART_PREREQ_1; MATCH([.C169]; POWER_CHART_INDEXES; 0))); ""); "") ->  | H169: of:=IF(OR([.B169]; [.G169]=""); 0; INDEX(POWER_CHART_INDEXES; MATCH([.G169]; POWER_CHART_NAMES; 0))) -> 0 | I169: of:=IF([.H169]=0; TRUE(); COUNTIF(POWER_CALC_SELECTED_INDEXES; [.H169])) -> true | J169: of:=IF(N([.C169]); IFERROR(T(INDEX(POWER_CHART_PREREQ_2; MATCH([.C169]; POWER_CHART_INDEXES; 0))); ""); "") ->  | K169: of:=IF(OR([.B169]; [.J169]=""); 0; INDEX(POWER_CHART_INDEXES; MATCH([.J169]; POWER_CHART_NAMES; 0))) -> 0 | L169: of:=IF([.K169]=0; TRUE(); COUNTIF(POWER_CALC_SELECTED_INDEXES; [.K169])) -> true | M169: of:=IF(N([.C169]); IFERROR(T(INDEX(POWER_CHART_PREREQ_3; MATCH([.C169]; POWER_CHART_INDEXES; 0))); ""); "") ->  | N169: of:=IF(OR([.B169]; [.M169]=""); 0; INDEX(POWER_CHART_INDEXES; MATCH([.M169]; POWER_CHART_NAMES; 0))) -> 0 | O169: of:=IF([.N169]=0; TRUE(); COUNTIF(POWER_CALC_SELECTED_INDEXES; [.N169])) -> true | P169: of:=IF(AND([.I169]; [.L169]; [.O169]); TRUE(); FALSE()) -> true | Q169: of:=IF(NOT([.P169]); "Purchase a prerequisite for "&[.A169]&" ("&COM.MICROSOFT.TEXTJOIN(" or "; 1; [.G169]; [.J169]; [.M169])&")."&CHAR(13)&CHAR(10); "") ->  | R169: of:=IF([.A169]=""; FALSE(); IF([.P169]; TRUE(); FALSE())) -> true | T169: of:=IF([.A169]=""; FALSE(); IF([.P169]; TRUE(); FALSE())) -> true | U169: of:=IF([.T169]; [.C169]; 0) -> 32 | V169: of:=[.T169] + N([.V168]) -> 4 | W169: of:=IF(AND([.T169]; NOT([Powers.E10]="")); [Powers.E10]; "") ->  | X169: of:=IF([.B169]; IF([Powers.E10]=""; ""; IF([Powers.E10]="Ultra-power"; ""; [Powers.E10])); [.X168]) -> Ultra-power Name | Y169: of:=IF(AND([.T169]; OR([.W169]=""; [.B169])); [.A169]; [.W169]) -> Haste | Z169: of:=IF(AND([.T169]; NOT([Powers.F10]="")); [Powers.F10]; "") ->  | AA169: of:=IF([.T169]; IFERROR(T(INDEX(POWER_CHART_ACTIONS; MATCH([.C169]; POWER_CHART_INDEXES; 0))); ""); "") -> Constant | AB169: of:=IF([.T169]; INDEX(POWER_CHART_ATTACKS; MATCH([.C169]; POWER_CHART_INDEXES; 0)); FALSE()) -> false | AC169: of:=IF([.T169]; INDEX(POWER_CHART_TYPES; MATCH([.C169]; POWER_CHART_INDEXES; 0))&" "&IF([.AB169]; "attack"; "power"); "") -> Personal power | AD169: of:=IF(AND([.T169]; [Powers.H10]="Y"); TRUE(); FALSE()) -> false | AE169: of:=IF([.T169]; IF(INDEX(POWER_CHART_RANGES;MATCH([.C169];POWER_CHART_INDEXES;0))="Ranged";TRUE();FALSE())) -> false | AF169: of:=OR([.AD169];[.AE169]) -> false | AG169: of:=IF([.T169]; RIGHT([Powers.P10]; LEN([Powers.P10])-1)*1; 1) -> 1 | AH169: of:=IF([.AF169]; INDEX(POWER_LEVEL_CHART_RANGES_TEXT; MATCH(POWER_LEVEL-1; POWER_LEVEL_CHART_INDEXES;0)); "") ->  | AI169: of:=IF([.AF169]; INDEX(POWER_LEVEL_CHART_RANGES; MATCH(POWER_LEVEL; POWER_LEVEL_CHART_INDEXES;0)); "") ->  | AJ169: of:=IF([.AF169]; [.AI169]*[.AG169]; "") ->  | AK169: of:=IF([.AF169]; IF(([.AJ169])>9999; TEXT(([.AJ169])/1000; "#,##0")&" km"; TEXT([.AJ169];"#,##0")&" m"); "") ->  | AL169: of:=IF([.AF169]; "Ranged ("&[.AH169]&"/"&[.AK169]&")"; "") ->  | AM169: of:=IF(AND([.T169]; [Powers.L10]="Y"); TRUE(); FALSE()) -> false | AN169: of:=IF(AND([.AM169]; OR(ISNUMBER(FIND("attack"; [.AC169])); ISNUMBER(FIND("Ultra-power"; [.A169])))); TRUE(); FALSE()) -> false | AO169: of:=IF([.AN169];", Seeking";"") ->  | AP169: of:=IF(AND([.T169]; [Powers.J10]="Y"); TRUE(); FALSE()) -> true | AQ169: of:=IF([.T169]; IF(INDEX(POWER_CHART_AREAS; MATCH([.C169]; POWER_CHART_INDEXES; 0))="Area"; TRUE(); FALSE())) -> false | AR169: of:=OR([.AP169];[.AQ169]) -> true | AS169: of:=IF([.T169]; RIGHT([Powers.R10]; LEN([Powers.R10])-1)*1; 1) -> 1000 | AT169: of:=IF([.AR169]; INDEX(POWER_LEVEL_CHART_AREAS; MATCH(POWER_LEVEL; POWER_LEVEL_CHART_INDEXES;0)); "") -> 10 | AU169: of:=IF([.AR169]; [.AS169]*[.AT169]; "") -> 10000 | AV169: of:=IF([.AR169]; IF(([.AU169])>9999; TEXT(([.AU169])/1000; "#,##0")&" km radius"; TEXT([.AU169];"#,##0")&" m radius"); "") -> 10 km radius | AW169: of:=IF([.AR169]; "Area ("&[.AV169]&")"; "") -> Area (10 km radius) | AX169: of:=IF(AND([.T169]; [Powers.N10]="Y"); TRUE(); FALSE()) -> false | AY169: of:=IF([.AX169]) -> false | AZ169: of:=IF([.AY169];", Selective";"") ->  | BA169: of:=ISNUMBER(FIND("Movement"; [.AC169])) -> false | BB169: of:=IF(OR([.BA169]; [.B169]); RIGHT([Powers.T10]; LEN([Powers.T10])-1)*1; 1) -> 1 | BC169: of:=ISNUMBER(FIND("Super Running"; [.A169])) -> false | BD169: of:=IF([.BC169]; INDEX(MOVEMENT_CHART_BASES_TEXT; MATCH(ATHLETICS+POWER_LEVEL; MOVEMENT_CHART_INDEXES;0)); "") ->  | BE169: of:=IF([.BC169]; INDEX(MOVEMENT_CHART_SPRINTS; MATCH(ATHLETICS+POWER_LEVEL; MOVEMENT_CHART_INDEXES;0)); "") ->  | BF169: of:=IF([.BC169]; [.BE169]*[.BB169]; "") ->  | BG169: of:=IF([.BC169]; IF(([.BF169])>9999; TEXT(([.BF169])/1000; "#,##0")&" km"; TEXT([.BF169];"#,##0")&" m"); "") ->  | BH169: of:=IF([.BC169]; "("&[.BD169]&"/"&[.BG169]&")"; "") ->  | BI169: of:=AND(ISNUMBER(FIND("Super Swimming"; [.A169]))) -> false | BJ169: of:=IF([.BI169]; INDEX(MOVEMENT_CHART_BASES_TEXT; MATCH(ATHLETICS+POWER_LEVEL; MOVEMENT_CHART_INDEXES;0)); "") ->  | BK169: of:=IF([.BI169]; INDEX(MOVEMENT_CHART_SPRINTS; MATCH(ATHLETICS+POWER_LEVEL; MOVEMENT_CHART_INDEXES;0)); "") ->  | BL169: of:=IF([.BI169]; [.BK169]*[.BB169]; "") ->  | BM169: of:=IF([.BI169]; IF(([.BL169])>9999; TEXT(([.BL169])/1000; "#,##0")&" km"; TEXT([.BL169];"#,##0")&" m"); "") ->  | BN169: of:=IF([.BI169]; "("&[.BJ169]&"/"&[.BM169]&")"; "") ->  | BO169: of:=ISNUMBER(FIND("Flight"; [.A169])) -> false | BP169: of:=IF([.BO169]; INDEX(MOVEMENT_CHART_BASES_TEXT; MATCH(ATHLETICS+POWER_LEVEL; MOVEMENT_CHART_INDEXES;0)); "") ->  | BQ169: of:=IF([.BO169]; INDEX(MOVEMENT_CHART_SPRINTS; MATCH(ATHLETICS+POWER_LEVEL; MOVEMENT_CHART_INDEXES;0)); "") ->  | BR169: of:=IF([.BO169]; [.BQ169]*[.BB169]; "") ->  | BS169: of:=IF([.BO169]; IF(([.BR169])>9999; TEXT(([.BR169])/1000; "#,##0")&" km"; TEXT([.BR169];"#,##0")&" m"); "") ->  | BT169: of:=IF([.BO169]; "("&[.BP169]&"/"&[.BS169]&")"; "") ->  | BU169: of:=ISNUMBER(FIND("Teleportation"; [.A169])) -> false | BV169: of:=IF([.BU169]; INDEX(TELEPORTATION_CHART_BASES_TEXT; MATCH(POWER_LEVEL; TELEPORTATION_CHART_INDEXES; 0)); "") ->  | BW169: of:=IF([.BU169]; INDEX(TELEPORTATION_CHART_SPRINTS; MATCH(POWER_LEVEL; TELEPORTATION_CHART_INDEXES; 0)); "") ->  | BX169: of:=IF([.BU169]; [.BW169]*[.BB169]; "") ->  | BY169: of:=IF([.BU169]; IF(([.BX169])>9999; TEXT(([.BX169])/1000; "#,##0")&" km"; TEXT([.BX169];"#,##0")&" m"); "") ->  | BZ169: of:=IF([.BU169]; "("&[.BV169]&"/"&[.BY169]&")"; "") ->  | CA169: of:=ISNUMBER(FIND("Tunneling"; [.A169])) -> false | CB169: of:=IF([.CA169]; INDEX(MOVEMENT_CHART_BASES_TEXT; MATCH(ATHLETICS+POWER_LEVEL; MOVEMENT_CHART_INDEXES;0)); "") ->  | CC169: of:=IF([.CA169]; INDEX(MOVEMENT_CHART_SPRINTS; MATCH(ATHLETICS+POWER_LEVEL; MOVEMENT_CHART_INDEXES;0)); "") ->  | CD169: of:=IF([.CA169]; [.CC169]*[.BB169]; "") ->  | CE169: of:=IF([.CA169]; IF(([.CD169])>9999; TEXT(([.CD169])/1000; "#,##0")&" km"; TEXT([.CD169];"#,##0")&" m"); "") ->  | CF169: of:=IF([.CA169]; "("&[.CB169]&"/"&[.CE169]&")"; "") ->  | CG169: of:=AND(ISNUMBER(FIND("Super Endurance"; [.A169]))) -> false | CH169: of:=AND(ISNUMBER(FIND("Super Health"; [.A169]))) -> false | CI169: of:=AND(ISNUMBER(FIND("Super Reflection"; [.A169]))) -> false | CJ169: of:=AND(ISNUMBER(FIND("Super Strength"; [.A169]))) -> false | CK169: of:=ISNUMBER(FIND("Alteration Resistance"; [.A169])) -> false | CL169: of:=IF([.CK169]; ALTERATION_RESISTANCE_TEXT; "") ->  | CM169: of:=ISNUMBER(FIND("Damage Resistance"; [.A169])) -> false | CN169: of:=IF([.CM169]; DAMAGE_RESISTANCE_TEXT; "") ->  | CO169: of:=ISNUMBER(FIND("Mental Resistance"; [.A169])) -> false | CP169: of:=IF([.CO169]; MENTAL_RESISTANCE_TEXT; "") ->  | CQ169: of:=ISNUMBER(FIND("Bulletproof"; [.A169])) -> false | CR169: of:=IF([.CQ169]; "Unaffected by ordinary weapons Equipment Level "&POWER_LEVEL&" and lower"; "") ->  | CS169: of:=ISNUMBER(FIND("Density Control"; [.A169])) -> false | CT169: of:=IF([.CS169]; INDEX(DENSITY_CONTROL_CHART; POWER_LEVEL; 4); "") ->  | CU169: of:=ISNUMBER(FIND("Duplication"; [.A169])) -> false | CV169: of:=IF([.CU169]; INDEX(DUPLICATION_CHART; POWER_LEVEL; 3); "") ->  | CW169: of:=ISNUMBER(FIND("Growth"; [.A169])) -> false | CX169: of:=IF([.CW169]; INDEX(GROWTH_CHART; POWER_LEVEL; 6); "") ->  | CY169: of:=ISNUMBER(FIND("Extra Actions"; [.A169])) -> false | CZ169: of:=IF([.CY169]; POWER_LEVEL&" extra actions per scene"; "") ->  | DA169: of:=ISNUMBER(FIND("Haste"; [.A169])) -> true | DB169: of:=IF([.DA169]; INDEX(HASTE_CHART; POWER_LEVEL; 3); "") -> x2,000 multiplier | DC169: of:=ISNUMBER(FIND("Shrinking"; [.A169])) -> false | DD169: of:=IF([.DC169]; INDEX(SHRINKING_CHART; POWER_LEVEL; 4); "") ->  | DE169: of:=ISNUMBER(FIND("Stretching"; [.A169])) -> false | DF169: of:=IF([.DE169]; INDEX(STRETCHING_CHART; POWER_LEVEL; 2)&" reach"; "") ->  | DG169: of:=[.CL169]&[.CN169]&[.CP169]&[.CR169]&[.CT169]&[.CV169]&[.CX169]&[.CZ169]&[.DB169]&[.DD169]&[.DF169] -> x2,000 multiplier | DH169: of:=ISNUMBER(FIND("[Element]"; [.A169])) -> false | DI169: of:=ISNUMBER(FIND("[Subject]"; [.A169])) -> false | DJ169: of:=ISNUMBER(FIND("[Transformation]"; [.A169])) -> false | DM169: of:=IF([.B169]; [.AD169]; FALSE()) -> false | DN169: of:=IF(AND([.B169]; [.AG169]>[.DN168]); [.AG169]; N([.DN168])) -> 0 | DO169: of:=IF([.B169]; [.AN169]; FALSE()) -> false | DP169: of:=IF([.B169]; [.AR169]; FALSE()) -> false | DQ169: of:=IF(AND([.B169]; [.AS169]>[.DQ168]); [.AS169]; N([.DQ168])) -> 0 | DR169: of:=IF([.B169]; [.AX169]; FALSE()) -> false | DS169: of:=IF(AND([.B169]; [.BB169]>[.DS168]); [.BB169]; N([.DS168])) -> 0 | DT169: of:=IF([.T169]; COM.MICROSOFT.TEXTJOIN(", "; 1; [.AA169]; [.AL169]; [.AL169]; [.AZ169]; [.AZ169]; [.AC169]); "") -> Constant, Personal power | DU169: of:=COM.MICROSOFT.TEXTJOIN("; "; TRUE(); [.Z169]; [.DG169]) -> x2,000 multiplier | DV169: of:=IF([.T169]; [.V169]; 0) -> 4 | DW169: of:=IF(AND([.AD169]; NOT([.AE169])); 1; 0) + INDEX(MULTIPLIER_CHART_INDEXES; MATCH([.AG169]; MULTIPLIER_CHART_MULTIPLIERS;0)) -> 0 | DX169: of:=IF([.AN169]; 1; 0) -> 0 | DY169: of:=IF(AND(NOT([.AQ169]); [.AR169]); 1; 0) + INDEX(MULTIPLIER_CHART_INDEXES; MATCH([.AS169]; MULTIPLIER_CHART_MULTIPLIERS;0)) -> 4 | DZ169: of:=IF([.AY169]; 1; 0) -> 0 | EA169: of:=INDEX(MULTIPLIER_CHART_INDEXES; MATCH([.BB169]; MULTIPLIER_CHART_MULTIPLIERS;0)) -> 0 | EB169: of:=SUM([.DV169:.EA169]) -> 8 | EC169: of:=IF([.T169]; [.Y169]&CHAR(13)&CHAR(10)&[.DT169]&CHAR(13)&CHAR(10)&[.DU169]&CHAR(13)&CHAR(10)&VLOOKUP( [.A169]; POWER_CHART; 11; FALSE())&CHAR(13)&CHAR(10)&CHAR(13)&CHAR(10); "") -> Haste
Constant, Personal power
x2,000 multiplier
32


A170: of:=IF([Powers.C11]=""; ""; [Powers.C11]) -> Shrinking | B170: of:=IF(ISNUMBER(FIND("Ultra-power"; [.A170])); TRUE(); FALSE()) -> false | C170: of:=IF(TRIM([.A170])=""; 0; INDEX(POWER_CHART_INDEXES; MATCH([.A170]; POWER_CHART_NAMES; 0))) -> 58 | D170: of:=IF([.C170]; 1; 0) + N([.D169]) -> 6 | E170: of:=IF(AND([.B170]; SELECTED_POWER_COUNT<4); FALSE(); TRUE()) -> true | F170: of:=IF(AND([.B170]; [.E170]); TRUE(); FALSE()) -> false | G170: of:=IF(N([.C170]); IFERROR(T(INDEX(POWER_CHART_PREREQ_1; MATCH([.C170]; POWER_CHART_INDEXES; 0))); ""); "") ->  | H170: of:=IF(OR([.B170]; [.G170]=""); 0; INDEX(POWER_CHART_INDEXES; MATCH([.G170]; POWER_CHART_NAMES; 0))) -> 0 | I170: of:=IF([.H170]=0; TRUE(); COUNTIF(POWER_CALC_SELECTED_INDEXES; [.H170])) -> true | J170: of:=IF(N([.C170]); IFERROR(T(INDEX(POWER_CHART_PREREQ_2; MATCH([.C170]; POWER_CHART_INDEXES; 0))); ""); "") ->  | K170: of:=IF(OR([.B170]; [.J170]=""); 0; INDEX(POWER_CHART_INDEXES; MATCH([.J170]; POWER_CHART_NAMES; 0))) -> 0 | L170: of:=IF([.K170]=0; TRUE(); COUNTIF(POWER_CALC_SELECTED_INDEXES; [.K170])) -> true | M170: of:=IF(N([.C170]); IFERROR(T(INDEX(POWER_CHART_PREREQ_3; MATCH([.C170]; POWER_CHART_INDEXES; 0))); ""); "") ->  | N170: of:=IF(OR([.B170]; [.M170]=""); 0; INDEX(POWER_CHART_INDEXES; MATCH([.M170]; POWER_CHART_NAMES; 0))) -> 0 | O170: of:=IF([.N170]=0; TRUE(); COUNTIF(POWER_CALC_SELECTED_INDEXES; [.N170])) -> true | P170: of:=IF(AND([.I170]; [.L170]; [.O170]); TRUE(); FALSE()) -> true | Q170: of:=IF(NOT([.P170]); "Purchase a prerequisite for "&[.A170]&" ("&COM.MICROSOFT.TEXTJOIN(" or "; 1; [.G170]; [.J170]; [.M170])&")."&CHAR(13)&CHAR(10); "") ->  | R170: of:=IF([.A170]=""; FALSE(); IF([.P170]; TRUE(); FALSE())) -> true | T170: of:=IF([.A170]=""; FALSE(); IF([.P170]; TRUE(); FALSE())) -> true | U170: of:=IF([.T170]; [.C170]; 0) -> 58 | V170: of:=[.T170] + N([.V169]) -> 5 | W170: of:=IF(AND([.T170]; NOT([Powers.E11]="")); [Powers.E11]; "") -> U-p cn | X170: of:=IF([.B170]; IF([Powers.E11]=""; ""; IF([Powers.E11]="Ultra-power"; ""; [Powers.E11])); [.X169]) -> Ultra-power Name | Y170: of:=IF(AND([.T170]; OR([.W170]=""; [.B170])); [.A170]; [.W170]) -> U-p cn | Z170: of:=IF(AND([.T170]; NOT([Powers.F11]="")); [Powers.F11]; "") -> U-p n | AA170: of:=IF([.T170]; IFERROR(T(INDEX(POWER_CHART_ACTIONS; MATCH([.C170]; POWER_CHART_INDEXES; 0))); ""); "") -> Quick action | AB170: of:=IF([.T170]; INDEX(POWER_CHART_ATTACKS; MATCH([.C170]; POWER_CHART_INDEXES; 0)); FALSE()) -> false | AC170: of:=IF([.T170]; INDEX(POWER_CHART_TYPES; MATCH([.C170]; POWER_CHART_INDEXES; 0))&" "&IF([.AB170]; "attack"; "power"); "") -> Personal power | AD170: of:=IF(AND([.T170]; [Powers.H11]="Y"); TRUE(); FALSE()) -> false | AE170: of:=IF([.T170]; IF(INDEX(POWER_CHART_RANGES;MATCH([.C170];POWER_CHART_INDEXES;0))="Ranged";TRUE();FALSE())) -> false | AF170: of:=OR([.AD170];[.AE170]) -> false | AG170: of:=IF([.T170]; RIGHT([Powers.P11]; LEN([Powers.P11])-1)*1; 1) -> 10000 | AH170: of:=IF([.AF170]; INDEX(POWER_LEVEL_CHART_RANGES_TEXT; MATCH(POWER_LEVEL-1; POWER_LEVEL_CHART_INDEXES;0)); "") ->  | AI170: of:=IF([.AF170]; INDEX(POWER_LEVEL_CHART_RANGES; MATCH(POWER_LEVEL; POWER_LEVEL_CHART_INDEXES;0)); "") ->  | AJ170: of:=IF([.AF170]; [.AI170]*[.AG170]; "") ->  | AK170: of:=IF([.AF170]; IF(([.AJ170])>9999; TEXT(([.AJ170])/1000; "#,##0")&" km"; TEXT([.AJ170];"#,##0")&" m"); "") ->  | AL170: of:=IF([.AF170]; "Ranged ("&[.AH170]&"/"&[.AK170]&")"; "") ->  | AM170: of:=IF(AND([.T170]; [Powers.L11]="Y"); TRUE(); FALSE()) -> true | AN170: of:=IF(AND([.AM170]; OR(ISNUMBER(FIND("attack"; [.AC170])); ISNUMBER(FIND("Ultra-power"; [.A170])))); TRUE(); FALSE()) -> false | AO170: of:=IF([.AN170];", Seeking";"") ->  | AP170: of:=IF(AND([.T170]; [Powers.J11]="Y"); TRUE(); FALSE()) -> false | AQ170: of:=IF([.T170]; IF(INDEX(POWER_CHART_AREAS; MATCH([.C170]; POWER_CHART_INDEXES; 0))="Area"; TRUE(); FALSE())) -> false | AR170: of:=OR([.AP170];[.AQ170]) -> false | AS170: of:=IF([.T170]; RIGHT([Powers.R11]; LEN([Powers.R11])-1)*1; 1) -> 100 | AT170: of:=IF([.AR170]; INDEX(POWER_LEVEL_CHART_AREAS; MATCH(POWER_LEVEL; POWER_LEVEL_CHART_INDEXES;0)); "") ->  | AU170: of:=IF([.AR170]; [.AS170]*[.AT170]; "") ->  | AV170: of:=IF([.AR170]; IF(([.AU170])>9999; TEXT(([.AU170])/1000; "#,##0")&" km radius"; TEXT([.AU170];"#,##0")&" m radius"); "") ->  | AW170: of:=IF([.AR170]; "Area ("&[.AV170]&")"; "") ->  | AX170: of:=IF(AND([.T170]; [Powers.N11]="Y"); TRUE(); FALSE()) -> false | AY170: of:=IF([.AX170]) -> false | AZ170: of:=IF([.AY170];", Selective";"") ->  | BA170: of:=ISNUMBER(FIND("Movement"; [.AC170])) -> false | BB170: of:=IF(OR([.BA170]; [.B170]); RIGHT([Powers.T11]; LEN([Powers.T11])-1)*1; 1) -> 1 | BC170: of:=ISNUMBER(FIND("Super Running"; [.A170])) -> false | BD170: of:=IF([.BC170]; INDEX(MOVEMENT_CHART_BASES_TEXT; MATCH(ATHLETICS+POWER_LEVEL; MOVEMENT_CHART_INDEXES;0)); "") ->  | BE170: of:=IF([.BC170]; INDEX(MOVEMENT_CHART_SPRINTS; MATCH(ATHLETICS+POWER_LEVEL; MOVEMENT_CHART_INDEXES;0)); "") ->  | BF170: of:=IF([.BC170]; [.BE170]*[.BB170]; "") ->  | BG170: of:=IF([.BC170]; IF(([.BF170])>9999; TEXT(([.BF170])/1000; "#,##0")&" km"; TEXT([.BF170];"#,##0")&" m"); "") ->  | BH170: of:=IF([.BC170]; "("&[.BD170]&"/"&[.BG170]&")"; "") ->  | BI170: of:=AND(ISNUMBER(FIND("Super Swimming"; [.A170]))) -> false | BJ170: of:=IF([.BI170]; INDEX(MOVEMENT_CHART_BASES_TEXT; MATCH(ATHLETICS+POWER_LEVEL; MOVEMENT_CHART_INDEXES;0)); "") ->  | BK170: of:=IF([.BI170]; INDEX(MOVEMENT_CHART_SPRINTS; MATCH(ATHLETICS+POWER_LEVEL; MOVEMENT_CHART_INDEXES;0)); "") ->  | BL170: of:=IF([.BI170]; [.BK170]*[.BB170]; "") ->  | BM170: of:=IF([.BI170]; IF(([.BL170])>9999; TEXT(([.BL170])/1000; "#,##0")&" km"; TEXT([.BL170];"#,##0")&" m"); "") ->  | BN170: of:=IF([.BI170]; "("&[.BJ170]&"/"&[.BM170]&")"; "") ->  | BO170: of:=ISNUMBER(FIND("Flight"; [.A170])) -> false | BP170: of:=IF([.BO170]; INDEX(MOVEMENT_CHART_BASES_TEXT; MATCH(ATHLETICS+POWER_LEVEL; MOVEMENT_CHART_INDEXES;0)); "") ->  | BQ170: of:=IF([.BO170]; INDEX(MOVEMENT_CHART_SPRINTS; MATCH(ATHLETICS+POWER_LEVEL; MOVEMENT_CHART_INDEXES;0)); "") ->  | BR170: of:=IF([.BO170]; [.BQ170]*[.BB170]; "") ->  | BS170: of:=IF([.BO170]; IF(([.BR170])>9999; TEXT(([.BR170])/1000; "#,##0")&" km"; TEXT([.BR170];"#,##0")&" m"); "") ->  | BT170: of:=IF([.BO170]; "("&[.BP170]&"/"&[.BS170]&")"; "") ->  | BU170: of:=ISNUMBER(FIND("Teleportation"; [.A170])) -> false | BV170: of:=IF([.BU170]; INDEX(TELEPORTATION_CHART_BASES_TEXT; MATCH(POWER_LEVEL; TELEPORTATION_CHART_INDEXES; 0)); "") ->  | BW170: of:=IF([.BU170]; INDEX(TELEPORTATION_CHART_SPRINTS; MATCH(POWER_LEVEL; TELEPORTATION_CHART_INDEXES; 0)); "") ->  | BX170: of:=IF([.BU170]; [.BW170]*[.BB170]; "") ->  | BY170: of:=IF([.BU170]; IF(([.BX170])>9999; TEXT(([.BX170])/1000; "#,##0")&" km"; TEXT([.BX170];"#,##0")&" m"); "") ->  | BZ170: of:=IF([.BU170]; "("&[.BV170]&"/"&[.BY170]&")"; "") ->  | CA170: of:=ISNUMBER(FIND("Tunneling"; [.A170])) -> false | CB170: of:=IF([.CA170]; INDEX(MOVEMENT_CHART_BASES_TEXT; MATCH(ATHLETICS+POWER_LEVEL; MOVEMENT_CHART_INDEXES;0)); "") ->  | CC170: of:=IF([.CA170]; INDEX(MOVEMENT_CHART_SPRINTS; MATCH(ATHLETICS+POWER_LEVEL; MOVEMENT_CHART_INDEXES;0)); "") ->  | CD170: of:=IF([.CA170]; [.CC170]*[.BB170]; "") ->  | CE170: of:=IF([.CA170]; IF(([.CD170])>9999; TEXT(([.CD170])/1000; "#,##0")&" km"; TEXT([.CD170];"#,##0")&" m"); "") ->  | CF170: of:=IF([.CA170]; "("&[.CB170]&"/"&[.CE170]&")"; "") ->  | CG170: of:=AND(ISNUMBER(FIND("Super Endurance"; [.A170]))) -> false | CH170: of:=AND(ISNUMBER(FIND("Super Health"; [.A170]))) -> false | CI170: of:=AND(ISNUMBER(FIND("Super Reflection"; [.A170]))) -> false | CJ170: of:=AND(ISNUMBER(FIND("Super Strength"; [.A170]))) -> false | CK170: of:=ISNUMBER(FIND("Alteration Resistance"; [.A170])) -> false | CL170: of:=IF([.CK170]; ALTERATION_RESISTANCE_TEXT; "") ->  | CM170: of:=ISNUMBER(FIND("Damage Resistance"; [.A170])) -> false | CN170: of:=IF([.CM170]; DAMAGE_RESISTANCE_TEXT; "") ->  | CO170: of:=ISNUMBER(FIND("Mental Resistance"; [.A170])) -> false | CP170: of:=IF([.CO170]; MENTAL_RESISTANCE_TEXT; "") ->  | CQ170: of:=ISNUMBER(FIND("Bulletproof"; [.A170])) -> false | CR170: of:=IF([.CQ170]; "Unaffected by ordinary weapons Equipment Level "&POWER_LEVEL&" and lower"; "") ->  | CS170: of:=ISNUMBER(FIND("Density Control"; [.A170])) -> false | CT170: of:=IF([.CS170]; INDEX(DENSITY_CONTROL_CHART; POWER_LEVEL; 4); "") ->  | CU170: of:=ISNUMBER(FIND("Duplication"; [.A170])) -> false | CV170: of:=IF([.CU170]; INDEX(DUPLICATION_CHART; POWER_LEVEL; 3); "") ->  | CW170: of:=ISNUMBER(FIND("Growth"; [.A170])) -> false | CX170: of:=IF([.CW170]; INDEX(GROWTH_CHART; POWER_LEVEL; 6); "") ->  | CY170: of:=ISNUMBER(FIND("Extra Actions"; [.A170])) -> false | CZ170: of:=IF([.CY170]; POWER_LEVEL&" extra actions per scene"; "") ->  | DA170: of:=ISNUMBER(FIND("Haste"; [.A170])) -> false | DB170: of:=IF([.DA170]; INDEX(HASTE_CHART; POWER_LEVEL; 3); "") ->  | DC170: of:=ISNUMBER(FIND("Shrinking"; [.A170])) -> true | DD170: of:=IF([.DC170]; INDEX(SHRINKING_CHART; POWER_LEVEL; 4); "") -> Min height 20 μm, Athletics +3 | DE170: of:=ISNUMBER(FIND("Stretching"; [.A170])) -> false | DF170: of:=IF([.DE170]; INDEX(STRETCHING_CHART; POWER_LEVEL; 2)&" reach"; "") ->  | DG170: of:=[.CL170]&[.CN170]&[.CP170]&[.CR170]&[.CT170]&[.CV170]&[.CX170]&[.CZ170]&[.DB170]&[.DD170]&[.DF170] -> Min height 20 μm, Athletics +3 | DH170: of:=ISNUMBER(FIND("[Element]"; [.A170])) -> false | DI170: of:=ISNUMBER(FIND("[Subject]"; [.A170])) -> false | DJ170: of:=ISNUMBER(FIND("[Transformation]"; [.A170])) -> false | DM170: of:=IF([.B170]; [.AD170]; FALSE()) -> false | DN170: of:=IF(AND([.B170]; [.AG170]>[.DN169]); [.AG170]; N([.DN169])) -> 0 | DO170: of:=IF([.B170]; [.AN170]; FALSE()) -> false | DP170: of:=IF([.B170]; [.AR170]; FALSE()) -> false | DQ170: of:=IF(AND([.B170]; [.AS170]>[.DQ169]); [.AS170]; N([.DQ169])) -> 0 | DR170: of:=IF([.B170]; [.AX170]; FALSE()) -> false | DS170: of:=IF(AND([.B170]; [.BB170]>[.DS169]); [.BB170]; N([.DS169])) -> 0 | DT170: of:=IF([.T170]; COM.MICROSOFT.TEXTJOIN(", "; 1; [.AA170]; [.AL170]; [.AL170]; [.AZ170]; [.AZ170]; [.AC170]); "") -> Quick action, Personal power | DU170: of:=COM.MICROSOFT.TEXTJOIN("; "; TRUE(); [.Z170]; [.DG170]) -> U-p n; Min height 20 μm, Athletics +3 | DV170: of:=IF([.T170]; [.V170]; 0) -> 5 | DW170: of:=IF(AND([.AD170]; NOT([.AE170])); 1; 0) + INDEX(MULTIPLIER_CHART_INDEXES; MATCH([.AG170]; MULTIPLIER_CHART_MULTIPLIERS;0)) -> 4 | DX170: of:=IF([.AN170]; 1; 0) -> 0 | DY170: of:=IF(AND(NOT([.AQ170]); [.AR170]); 1; 0) + INDEX(MULTIPLIER_CHART_INDEXES; MATCH([.AS170]; MULTIPLIER_CHART_MULTIPLIERS;0)) -> 2 | DZ170: of:=IF([.AY170]; 1; 0) -> 0 | EA170: of:=INDEX(MULTIPLIER_CHART_INDEXES; MATCH([.BB170]; MULTIPLIER_CHART_MULTIPLIERS;0)) -> 0 | EB170: of:=SUM([.DV170:.EA170]) -> 11 | EC170: of:=IF([.T170]; [.Y170]&CHAR(13)&CHAR(10)&[.DT170]&CHAR(13)&CHAR(10)&[.DU170]&CHAR(13)&CHAR(10)&VLOOKUP( [.A170]; POWER_CHART; 11; FALSE())&CHAR(13)&CHAR(10)&CHAR(13)&CHAR(10); "") -> U-p cn
Quick action, Personal power
U-p n; Min height 20 μm, Athletics +3
58


A171: of:=IF([Powers.C12]=""; ""; [Powers.C12]) -> Ultra-power | B171: of:=IF(ISNUMBER(FIND("Ultra-power"; [.A171])); TRUE(); FALSE()) -> true | C171: of:=IF(TRIM([.A171])=""; 0; INDEX(POWER_CHART_INDEXES; MATCH([.A171]; POWER_CHART_NAMES; 0))) -> 81 | D171: of:=IF([.C171]; 1; 0) + N([.D170]) -> 7 | E171: of:=IF(AND([.B171]; SELECTED_POWER_COUNT<4); FALSE(); TRUE()) -> true | F171: of:=IF(AND([.B171]; [.E171]); TRUE(); FALSE()) -> true | G171: of:=IF(N([.C171]); IFERROR(T(INDEX(POWER_CHART_PREREQ_1; MATCH([.C171]; POWER_CHART_INDEXES; 0))); ""); "") -> Four theme powers | H171: of:=IF(OR([.B171]; [.G171]=""); 0; INDEX(POWER_CHART_INDEXES; MATCH([.G171]; POWER_CHART_NAMES; 0))) -> 0 | I171: of:=IF([.H171]=0; TRUE(); COUNTIF(POWER_CALC_SELECTED_INDEXES; [.H171])) -> true | J171: of:=IF(N([.C171]); IFERROR(T(INDEX(POWER_CHART_PREREQ_2; MATCH([.C171]; POWER_CHART_INDEXES; 0))); ""); "") ->  | K171: of:=IF(OR([.B171]; [.J171]=""); 0; INDEX(POWER_CHART_INDEXES; MATCH([.J171]; POWER_CHART_NAMES; 0))) -> 0 | L171: of:=IF([.K171]=0; TRUE(); COUNTIF(POWER_CALC_SELECTED_INDEXES; [.K171])) -> true | M171: of:=IF(N([.C171]); IFERROR(T(INDEX(POWER_CHART_PREREQ_3; MATCH([.C171]; POWER_CHART_INDEXES; 0))); ""); "") ->  | N171: of:=IF(OR([.B171]; [.M171]=""); 0; INDEX(POWER_CHART_INDEXES; MATCH([.M171]; POWER_CHART_NAMES; 0))) -> 0 | O171: of:=IF([.N171]=0; TRUE(); COUNTIF(POWER_CALC_SELECTED_INDEXES; [.N171])) -> true | P171: of:=IF(AND([.I171]; [.L171]; [.O171]); TRUE(); FALSE()) -> true | Q171: of:=IF(NOT([.P171]); "Purchase a prerequisite for "&[.A171]&" ("&COM.MICROSOFT.TEXTJOIN(" or "; 1; [.G171]; [.J171]; [.M171])&")."&CHAR(13)&CHAR(10); "") ->  | R171: of:=IF([.A171]=""; FALSE(); IF([.P171]; TRUE(); FALSE())) -> true | T171: of:=IF([.A171]=""; FALSE(); IF([.P171]; TRUE(); FALSE())) -> true | U171: of:=IF([.T171]; [.C171]; 0) -> 81 | V171: of:=[.T171] + N([.V170]) -> 6 | W171: of:=IF(AND([.T171]; NOT([Powers.E12]="")); [Powers.E12]; "") ->  | X171: of:=IF([.B171]; IF([Powers.E12]=""; ""; IF([Powers.E12]="Ultra-power"; ""; [Powers.E12])); [.X170]) ->  | Y171: of:=IF(AND([.T171]; OR([.W171]=""; [.B171])); [.A171]; [.W171]) -> Ultra-power | Z171: of:=IF(AND([.T171]; NOT([Powers.F12]="")); [Powers.F12]; "") ->  | AA171: of:=IF([.T171]; IFERROR(T(INDEX(POWER_CHART_ACTIONS; MATCH([.C171]; POWER_CHART_INDEXES; 0))); ""); "") -> Quick action | AB171: of:=IF([.T171]; INDEX(POWER_CHART_ATTACKS; MATCH([.C171]; POWER_CHART_INDEXES; 0)); FALSE()) -> false | AC171: of:=IF([.T171]; INDEX(POWER_CHART_TYPES; MATCH([.C171]; POWER_CHART_INDEXES; 0))&" "&IF([.AB171]; "attack"; "power"); "") -> Personal power | AD171: of:=IF(AND([.T171]; [Powers.H12]="Y"); TRUE(); FALSE()) -> true | AE171: of:=IF([.T171]; IF(INDEX(POWER_CHART_RANGES;MATCH([.C171];POWER_CHART_INDEXES;0))="Ranged";TRUE();FALSE())) -> false | AF171: of:=OR([.AD171];[.AE171]) -> true | AG171: of:=IF([.T171]; RIGHT([Powers.P12]; LEN([Powers.P12])-1)*1; 1) -> 10 | AH171: of:=IF([.AF171]; INDEX(POWER_LEVEL_CHART_RANGES_TEXT; MATCH(POWER_LEVEL-1; POWER_LEVEL_CHART_INDEXES;0)); "") -> 600 m | AI171: of:=IF([.AF171]; INDEX(POWER_LEVEL_CHART_RANGES; MATCH(POWER_LEVEL; POWER_LEVEL_CHART_INDEXES;0)); "") -> 1000 | AJ171: of:=IF([.AF171]; [.AI171]*[.AG171]; "") -> 10000 | AK171: of:=IF([.AF171]; IF(([.AJ171])>9999; TEXT(([.AJ171])/1000; "#,##0")&" km"; TEXT([.AJ171];"#,##0")&" m"); "") -> 10 km | AL171: of:=IF([.AF171]; "Ranged ("&[.AH171]&"/"&[.AK171]&")"; "") -> Ranged (600 m/10 km) | AM171: of:=IF(AND([.T171]; [Powers.L12]="Y"); TRUE(); FALSE()) -> true | AN171: of:=IF(AND([.AM171]; OR(ISNUMBER(FIND("attack"; [.AC171])); ISNUMBER(FIND("Ultra-power"; [.A171])))); TRUE(); FALSE()) -> true | AO171: of:=IF([.AN171];", Seeking";"") -> , Seeking | AP171: of:=IF(AND([.T171]; [Powers.J12]="Y"); TRUE(); FALSE()) -> true | AQ171: of:=IF([.T171]; IF(INDEX(POWER_CHART_AREAS; MATCH([.C171]; POWER_CHART_INDEXES; 0))="Area"; TRUE(); FALSE())) -> false | AR171: of:=OR([.AP171];[.AQ171]) -> true | AS171: of:=IF([.T171]; RIGHT([Powers.R12]; LEN([Powers.R12])-1)*1; 1) -> 100 | AT171: of:=IF([.AR171]; INDEX(POWER_LEVEL_CHART_AREAS; MATCH(POWER_LEVEL; POWER_LEVEL_CHART_INDEXES;0)); "") -> 10 | AU171: of:=IF([.AR171]; [.AS171]*[.AT171]; "") -> 1000 | AV171: of:=IF([.AR171]; IF(([.AU171])>9999; TEXT(([.AU171])/1000; "#,##0")&" km radius"; TEXT([.AU171];"#,##0")&" m radius"); "") -> 1,000 m radius | AW171: of:=IF([.AR171]; "Area ("&[.AV171]&")"; "") -> Area (1,000 m radius) | AX171: of:=IF(AND([.T171]; [Powers.N12]="Y"); TRUE(); FALSE()) -> true | AY171: of:=IF([.AX171]) -> true | AZ171: of:=IF([.AY171];", Selective";"") -> , Selective | BA171: of:=ISNUMBER(FIND("Movement"; [.AC171])) -> false | BB171: of:=IF(OR([.BA171]; [.B171]); RIGHT([Powers.T12]; LEN([Powers.T12])-1)*1; 1) -> 10000000000 | BC171: of:=ISNUMBER(FIND("Super Running"; [.A171])) -> false | BD171: of:=IF([.BC171]; INDEX(MOVEMENT_CHART_BASES_TEXT; MATCH(ATHLETICS+POWER_LEVEL; MOVEMENT_CHART_INDEXES;0)); "") ->  | BE171: of:=IF([.BC171]; INDEX(MOVEMENT_CHART_SPRINTS; MATCH(ATHLETICS+POWER_LEVEL; MOVEMENT_CHART_INDEXES;0)); "") ->  | BF171: of:=IF([.BC171]; [.BE171]*[.BB171]; "") ->  | BG171: of:=IF([.BC171]; IF(([.BF171])>9999; TEXT(([.BF171])/1000; "#,##0")&" km"; TEXT([.BF171];"#,##0")&" m"); "") ->  | BH171: of:=IF([.BC171]; "("&[.BD171]&"/"&[.BG171]&")"; "") ->  | BI171: of:=AND(ISNUMBER(FIND("Super Swimming"; [.A171]))) -> false | BJ171: of:=IF([.BI171]; INDEX(MOVEMENT_CHART_BASES_TEXT; MATCH(ATHLETICS+POWER_LEVEL; MOVEMENT_CHART_INDEXES;0)); "") ->  | BK171: of:=IF([.BI171]; INDEX(MOVEMENT_CHART_SPRINTS; MATCH(ATHLETICS+POWER_LEVEL; MOVEMENT_CHART_INDEXES;0)); "") ->  | BL171: of:=IF([.BI171]; [.BK171]*[.BB171]; "") ->  | BM171: of:=IF([.BI171]; IF(([.BL171])>9999; TEXT(([.BL171])/1000; "#,##0")&" km"; TEXT([.BL171];"#,##0")&" m"); "") ->  | BN171: of:=IF([.BI171]; "("&[.BJ171]&"/"&[.BM171]&")"; "") ->  | BO171: of:=ISNUMBER(FIND("Flight"; [.A171])) -> false | BP171: of:=IF([.BO171]; INDEX(MOVEMENT_CHART_BASES_TEXT; MATCH(ATHLETICS+POWER_LEVEL; MOVEMENT_CHART_INDEXES;0)); "") ->  | BQ171: of:=IF([.BO171]; INDEX(MOVEMENT_CHART_SPRINTS; MATCH(ATHLETICS+POWER_LEVEL; MOVEMENT_CHART_INDEXES;0)); "") ->  | BR171: of:=IF([.BO171]; [.BQ171]*[.BB171]; "") ->  | BS171: of:=IF([.BO171]; IF(([.BR171])>9999; TEXT(([.BR171])/1000; "#,##0")&" km"; TEXT([.BR171];"#,##0")&" m"); "") ->  | BT171: of:=IF([.BO171]; "("&[.BP171]&"/"&[.BS171]&")"; "") ->  | BU171: of:=ISNUMBER(FIND("Teleportation"; [.A171])) -> false | BV171: of:=IF([.BU171]; INDEX(TELEPORTATION_CHART_BASES_TEXT; MATCH(POWER_LEVEL; TELEPORTATION_CHART_INDEXES; 0)); "") ->  | BW171: of:=IF([.BU171]; INDEX(TELEPORTATION_CHART_SPRINTS; MATCH(POWER_LEVEL; TELEPORTATION_CHART_INDEXES; 0)); "") ->  | BX171: of:=IF([.BU171]; [.BW171]*[.BB171]; "") ->  | BY171: of:=IF([.BU171]; IF(([.BX171])>9999; TEXT(([.BX171])/1000; "#,##0")&" km"; TEXT([.BX171];"#,##0")&" m"); "") ->  | BZ171: of:=IF([.BU171]; "("&[.BV171]&"/"&[.BY171]&")"; "") ->  | CA171: of:=ISNUMBER(FIND("Tunneling"; [.A171])) -> false | CB171: of:=IF([.CA171]; INDEX(MOVEMENT_CHART_BASES_TEXT; MATCH(ATHLETICS+POWER_LEVEL; MOVEMENT_CHART_INDEXES;0)); "") ->  | CC171: of:=IF([.CA171]; INDEX(MOVEMENT_CHART_SPRINTS; MATCH(ATHLETICS+POWER_LEVEL; MOVEMENT_CHART_INDEXES;0)); "") ->  | CD171: of:=IF([.CA171]; [.CC171]*[.BB171]; "") ->  | CE171: of:=IF([.CA171]; IF(([.CD171])>9999; TEXT(([.CD171])/1000; "#,##0")&" km"; TEXT([.CD171];"#,##0")&" m"); "") ->  | CF171: of:=IF([.CA171]; "("&[.CB171]&"/"&[.CE171]&")"; "") ->  | CG171: of:=AND(ISNUMBER(FIND("Super Endurance"; [.A171]))) -> false | CH171: of:=AND(ISNUMBER(FIND("Super Health"; [.A171]))) -> false | CI171: of:=AND(ISNUMBER(FIND("Super Reflection"; [.A171]))) -> false | CJ171: of:=AND(ISNUMBER(FIND("Super Strength"; [.A171]))) -> false | CK171: of:=ISNUMBER(FIND("Alteration Resistance"; [.A171])) -> false | CL171: of:=IF([.CK171]; ALTERATION_RESISTANCE_TEXT; "") ->  | CM171: of:=ISNUMBER(FIND("Damage Resistance"; [.A171])) -> false | CN171: of:=IF([.CM171]; DAMAGE_RESISTANCE_TEXT; "") ->  | CO171: of:=ISNUMBER(FIND("Mental Resistance"; [.A171])) -> false | CP171: of:=IF([.CO171]; MENTAL_RESISTANCE_TEXT; "") ->  | CQ171: of:=ISNUMBER(FIND("Bulletproof"; [.A171])) -> false | CR171: of:=IF([.CQ171]; "Unaffected by ordinary weapons Equipment Level "&POWER_LEVEL&" and lower"; "") ->  | CS171: of:=ISNUMBER(FIND("Density Control"; [.A171])) -> false | CT171: of:=IF([.CS171]; INDEX(DENSITY_CONTROL_CHART; POWER_LEVEL; 4); "") ->  | CU171: of:=ISNUMBER(FIND("Duplication"; [.A171])) -> false | CV171: of:=IF([.CU171]; INDEX(DUPLICATION_CHART; POWER_LEVEL; 3); "") ->  | CW171: of:=ISNUMBER(FIND("Growth"; [.A171])) -> false | CX171: of:=IF([.CW171]; INDEX(GROWTH_CHART; POWER_LEVEL; 6); "") ->  | CY171: of:=ISNUMBER(FIND("Extra Actions"; [.A171])) -> false | CZ171: of:=IF([.CY171]; POWER_LEVEL&" extra actions per scene"; "") ->  | DA171: of:=ISNUMBER(FIND("Haste"; [.A171])) -> false | DB171: of:=IF([.DA171]; INDEX(HASTE_CHART; POWER_LEVEL; 3); "") ->  | DC171: of:=ISNUMBER(FIND("Shrinking"; [.A171])) -> false | DD171: of:=IF([.DC171]; INDEX(SHRINKING_CHART; POWER_LEVEL; 4); "") ->  | DE171: of:=ISNUMBER(FIND("Stretching"; [.A171])) -> false | DF171: of:=IF([.DE171]; INDEX(STRETCHING_CHART; POWER_LEVEL; 2)&" reach"; "") ->  | DG171: of:=[.CL171]&[.CN171]&[.CP171]&[.CR171]&[.CT171]&[.CV171]&[.CX171]&[.CZ171]&[.DB171]&[.DD171]&[.DF171] ->  | DH171: of:=ISNUMBER(FIND("[Element]"; [.A171])) -> false | DI171: of:=ISNUMBER(FIND("[Subject]"; [.A171])) -> false | DJ171: of:=ISNUMBER(FIND("[Transformation]"; [.A171])) -> false | DM171: of:=IF([.B171]; [.AD171]; FALSE()) -> true | DN171: of:=IF(AND([.B171]; [.AG171]>[.DN170]); [.AG171]; N([.DN170])) -> 10 | DO171: of:=IF([.B171]; [.AN171]; FALSE()) -> true | DP171: of:=IF([.B171]; [.AR171]; FALSE()) -> true | DQ171: of:=IF(AND([.B171]; [.AS171]>[.DQ170]); [.AS171]; N([.DQ170])) -> 100 | DR171: of:=IF([.B171]; [.AX171]; FALSE()) -> true | DS171: of:=IF(AND([.B171]; [.BB171]>[.DS170]); [.BB171]; N([.DS170])) -> 10000000000 | DT171: of:=IF([.T171]; COM.MICROSOFT.TEXTJOIN(", "; 1; [.AA171]; [.AL171]; [.AL171]; [.AZ171]; [.AZ171]; [.AC171]); "") -> Quick action, Ranged (600 m/10 km), Ranged (600 m/10 km), , Selective, , Selective, Personal power | DU171: of:=COM.MICROSOFT.TEXTJOIN("; "; TRUE(); [.Z171]; [.DG171]) ->  | DV171: of:=IF([.T171]; [.V171]; 0) -> 6 | DW171: of:=IF(AND([.AD171]; NOT([.AE171])); 1; 0) + INDEX(MULTIPLIER_CHART_INDEXES; MATCH([.AG171]; MULTIPLIER_CHART_MULTIPLIERS;0)) -> 2 | DX171: of:=IF([.AN171]; 1; 0) -> 1 | DY171: of:=IF(AND(NOT([.AQ171]); [.AR171]); 1; 0) + INDEX(MULTIPLIER_CHART_INDEXES; MATCH([.AS171]; MULTIPLIER_CHART_MULTIPLIERS;0)) -> 3 | DZ171: of:=IF([.AY171]; 1; 0) -> 1 | EA171: of:=INDEX(MULTIPLIER_CHART_INDEXES; MATCH([.BB171]; MULTIPLIER_CHART_MULTIPLIERS;0)) -> 10 | EB171: of:=SUM([.DV171:.EA171]) -> 23 | EC171: of:=IF([.T171]; [.Y171]&CHAR(13)&CHAR(10)&[.DT171]&CHAR(13)&CHAR(10)&[.DU171]&CHAR(13)&CHAR(10)&VLOOKUP( [.A171]; POWER_CHART; 11; FALSE())&CHAR(13)&CHAR(10)&CHAR(13)&CHAR(10); "") -> Ultra-power
Quick action, Ranged (600 m/10 km), Ranged (600 m/10 km), , Selective, , Selective, Personal power

81


A172: of:=IF([Powers.C13]=""; ""; [Powers.C13]) -> Command [Subject] | B172: of:=IF(ISNUMBER(FIND("Ultra-power"; [.A172])); TRUE(); FALSE()) -> false | C172: of:=IF(TRIM([.A172])=""; 0; INDEX(POWER_CHART_INDEXES; MATCH([.A172]; POWER_CHART_NAMES; 0))) -> 12 | D172: of:=IF([.C172]; 1; 0) + N([.D171]) -> 8 | E172: of:=IF(AND([.B172]; SELECTED_POWER_COUNT<4); FALSE(); TRUE()) -> true | F172: of:=IF(AND([.B172]; [.E172]); TRUE(); FALSE()) -> false | G172: of:=IF(N([.C172]); IFERROR(T(INDEX(POWER_CHART_PREREQ_1; MATCH([.C172]; POWER_CHART_INDEXES; 0))); ""); "") ->  | H172: of:=IF(OR([.B172]; [.G172]=""); 0; INDEX(POWER_CHART_INDEXES; MATCH([.G172]; POWER_CHART_NAMES; 0))) -> 0 | I172: of:=IF([.H172]=0; TRUE(); COUNTIF(POWER_CALC_SELECTED_INDEXES; [.H172])) -> true | J172: of:=IF(N([.C172]); IFERROR(T(INDEX(POWER_CHART_PREREQ_2; MATCH([.C172]; POWER_CHART_INDEXES; 0))); ""); "") ->  | K172: of:=IF(OR([.B172]; [.J172]=""); 0; INDEX(POWER_CHART_INDEXES; MATCH([.J172]; POWER_CHART_NAMES; 0))) -> 0 | L172: of:=IF([.K172]=0; TRUE(); COUNTIF(POWER_CALC_SELECTED_INDEXES; [.K172])) -> true | M172: of:=IF(N([.C172]); IFERROR(T(INDEX(POWER_CHART_PREREQ_3; MATCH([.C172]; POWER_CHART_INDEXES; 0))); ""); "") ->  | N172: of:=IF(OR([.B172]; [.M172]=""); 0; INDEX(POWER_CHART_INDEXES; MATCH([.M172]; POWER_CHART_NAMES; 0))) -> 0 | O172: of:=IF([.N172]=0; TRUE(); COUNTIF(POWER_CALC_SELECTED_INDEXES; [.N172])) -> true | P172: of:=IF(AND([.I172]; [.L172]; [.O172]); TRUE(); FALSE()) -> true | Q172: of:=IF(NOT([.P172]); "Purchase a prerequisite for "&[.A172]&" ("&COM.MICROSOFT.TEXTJOIN(" or "; 1; [.G172]; [.J172]; [.M172])&")."&CHAR(13)&CHAR(10); "") ->  | R172: of:=IF([.A172]=""; FALSE(); IF([.P172]; TRUE(); FALSE())) -> true | T172: of:=IF([.A172]=""; FALSE(); IF([.P172]; TRUE(); FALSE())) -> true | U172: of:=IF([.T172]; [.C172]; 0) -> 12 | V172: of:=[.T172] + N([.V171]) -> 7 | W172: of:=IF(AND([.T172]; NOT([Powers.E13]="")); [Powers.E13]; "") ->  | X172: of:=IF([.B172]; IF([Powers.E13]=""; ""; IF([Powers.E13]="Ultra-power"; ""; [Powers.E13])); [.X171]) ->  | Y172: of:=IF(AND([.T172]; OR([.W172]=""; [.B172])); [.A172]; [.W172]) -> Command [Subject] | Z172: of:=IF(AND([.T172]; NOT([Powers.F13]="")); [Powers.F13]; "") ->  | AA172: of:=IF([.T172]; IFERROR(T(INDEX(POWER_CHART_ACTIONS; MATCH([.C172]; POWER_CHART_INDEXES; 0))); ""); "") -> Standard action | AB172: of:=IF([.T172]; INDEX(POWER_CHART_ATTACKS; MATCH([.C172]; POWER_CHART_INDEXES; 0)); FALSE()) -> true | AC172: of:=IF([.T172]; INDEX(POWER_CHART_TYPES; MATCH([.C172]; POWER_CHART_INDEXES; 0))&" "&IF([.AB172]; "attack"; "power"); "") -> Mental attack | AD172: of:=IF(AND([.T172]; [Powers.H13]="Y"); TRUE(); FALSE()) -> false | AE172: of:=IF([.T172]; IF(INDEX(POWER_CHART_RANGES;MATCH([.C172];POWER_CHART_INDEXES;0))="Ranged";TRUE();FALSE())) -> true | AF172: of:=OR([.AD172];[.AE172]) -> true | AG172: of:=IF([.T172]; RIGHT([Powers.P13]; LEN([Powers.P13])-1)*1; 1) -> 1 | AH172: of:=IF([.AF172]; INDEX(POWER_LEVEL_CHART_RANGES_TEXT; MATCH(POWER_LEVEL-1; POWER_LEVEL_CHART_INDEXES;0)); "") -> 600 m | AI172: of:=IF([.AF172]; INDEX(POWER_LEVEL_CHART_RANGES; MATCH(POWER_LEVEL; POWER_LEVEL_CHART_INDEXES;0)); "") -> 1000 | AJ172: of:=IF([.AF172]; [.AI172]*[.AG172]; "") -> 1000 | AK172: of:=IF([.AF172]; IF(([.AJ172])>9999; TEXT(([.AJ172])/1000; "#,##0")&" km"; TEXT([.AJ172];"#,##0")&" m"); "") -> 1,000 m | AL172: of:=IF([.AF172]; "Ranged ("&[.AH172]&"/"&[.AK172]&")"; "") -> Ranged (600 m/1,000 m) | AM172: of:=IF(AND([.T172]; [Powers.L13]="Y"); TRUE(); FALSE()) -> false | AN172: of:=IF(AND([.AM172]; OR(ISNUMBER(FIND("attack"; [.AC172])); ISNUMBER(FIND("Ultra-power"; [.A172])))); TRUE(); FALSE()) -> false | AO172: of:=IF([.AN172];", Seeking";"") ->  | AP172: of:=IF(AND([.T172]; [Powers.J13]="Y"); TRUE(); FALSE()) -> false | AQ172: of:=IF([.T172]; IF(INDEX(POWER_CHART_AREAS; MATCH([.C172]; POWER_CHART_INDEXES; 0))="Area"; TRUE(); FALSE())) -> false | AR172: of:=OR([.AP172];[.AQ172]) -> false | AS172: of:=IF([.T172]; RIGHT([Powers.R13]; LEN([Powers.R13])-1)*1; 1) -> 1 | AT172: of:=IF([.AR172]; INDEX(POWER_LEVEL_CHART_AREAS; MATCH(POWER_LEVEL; POWER_LEVEL_CHART_INDEXES;0)); "") ->  | AU172: of:=IF([.AR172]; [.AS172]*[.AT172]; "") ->  | AV172: of:=IF([.AR172]; IF(([.AU172])>9999; TEXT(([.AU172])/1000; "#,##0")&" km radius"; TEXT([.AU172];"#,##0")&" m radius"); "") ->  | AW172: of:=IF([.AR172]; "Area ("&[.AV172]&")"; "") ->  | AX172: of:=IF(AND([.T172]; [Powers.N13]="Y"); TRUE(); FALSE()) -> false | AY172: of:=IF([.AX172]) -> false | AZ172: of:=IF([.AY172];", Selective";"") ->  | BA172: of:=ISNUMBER(FIND("Movement"; [.AC172])) -> false | BB172: of:=IF(OR([.BA172]; [.B172]); RIGHT([Powers.T13]; LEN([Powers.T13])-1)*1; 1) -> 1 | BC172: of:=ISNUMBER(FIND("Super Running"; [.A172])) -> false | BD172: of:=IF([.BC172]; INDEX(MOVEMENT_CHART_BASES_TEXT; MATCH(ATHLETICS+POWER_LEVEL; MOVEMENT_CHART_INDEXES;0)); "") ->  | BE172: of:=IF([.BC172]; INDEX(MOVEMENT_CHART_SPRINTS; MATCH(ATHLETICS+POWER_LEVEL; MOVEMENT_CHART_INDEXES;0)); "") ->  | BF172: of:=IF([.BC172]; [.BE172]*[.BB172]; "") ->  | BG172: of:=IF([.BC172]; IF(([.BF172])>9999; TEXT(([.BF172])/1000; "#,##0")&" km"; TEXT([.BF172];"#,##0")&" m"); "") ->  | BH172: of:=IF([.BC172]; "("&[.BD172]&"/"&[.BG172]&")"; "") ->  | BI172: of:=AND(ISNUMBER(FIND("Super Swimming"; [.A172]))) -> false | BJ172: of:=IF([.BI172]; INDEX(MOVEMENT_CHART_BASES_TEXT; MATCH(ATHLETICS+POWER_LEVEL; MOVEMENT_CHART_INDEXES;0)); "") ->  | BK172: of:=IF([.BI172]; INDEX(MOVEMENT_CHART_SPRINTS; MATCH(ATHLETICS+POWER_LEVEL; MOVEMENT_CHART_INDEXES;0)); "") ->  | BL172: of:=IF([.BI172]; [.BK172]*[.BB172]; "") ->  | BM172: of:=IF([.BI172]; IF(([.BL172])>9999; TEXT(([.BL172])/1000; "#,##0")&" km"; TEXT([.BL172];"#,##0")&" m"); "") ->  | BN172: of:=IF([.BI172]; "("&[.BJ172]&"/"&[.BM172]&")"; "") ->  | BO172: of:=ISNUMBER(FIND("Flight"; [.A172])) -> false | BP172: of:=IF([.BO172]; INDEX(MOVEMENT_CHART_BASES_TEXT; MATCH(ATHLETICS+POWER_LEVEL; MOVEMENT_CHART_INDEXES;0)); "") ->  | BQ172: of:=IF([.BO172]; INDEX(MOVEMENT_CHART_SPRINTS; MATCH(ATHLETICS+POWER_LEVEL; MOVEMENT_CHART_INDEXES;0)); "") ->  | BR172: of:=IF([.BO172]; [.BQ172]*[.BB172]; "") ->  | BS172: of:=IF([.BO172]; IF(([.BR172])>9999; TEXT(([.BR172])/1000; "#,##0")&" km"; TEXT([.BR172];"#,##0")&" m"); "") ->  | BT172: of:=IF([.BO172]; "("&[.BP172]&"/"&[.BS172]&")"; "") ->  | BU172: of:=ISNUMBER(FIND("Teleportation"; [.A172])) -> false | BV172: of:=IF([.BU172]; INDEX(TELEPORTATION_CHART_BASES_TEXT; MATCH(POWER_LEVEL; TELEPORTATION_CHART_INDEXES; 0)); "") ->  | BW172: of:=IF([.BU172]; INDEX(TELEPORTATION_CHART_SPRINTS; MATCH(POWER_LEVEL; TELEPORTATION_CHART_INDEXES; 0)); "") ->  | BX172: of:=IF([.BU172]; [.BW172]*[.BB172]; "") ->  | BY172: of:=IF([.BU172]; IF(([.BX172])>9999; TEXT(([.BX172])/1000; "#,##0")&" km"; TEXT([.BX172];"#,##0")&" m"); "") ->  | BZ172: of:=IF([.BU172]; "("&[.BV172]&"/"&[.BY172]&")"; "") ->  | CA172: of:=ISNUMBER(FIND("Tunneling"; [.A172])) -> false | CB172: of:=IF([.CA172]; INDEX(MOVEMENT_CHART_BASES_TEXT; MATCH(ATHLETICS+POWER_LEVEL; MOVEMENT_CHART_INDEXES;0)); "") ->  | CC172: of:=IF([.CA172]; INDEX(MOVEMENT_CHART_SPRINTS; MATCH(ATHLETICS+POWER_LEVEL; MOVEMENT_CHART_INDEXES;0)); "") ->  | CD172: of:=IF([.CA172]; [.CC172]*[.BB172]; "") ->  | CE172: of:=IF([.CA172]; IF(([.CD172])>9999; TEXT(([.CD172])/1000; "#,##0")&" km"; TEXT([.CD172];"#,##0")&" m"); "") ->  | CF172: of:=IF([.CA172]; "("&[.CB172]&"/"&[.CE172]&")"; "") ->  | CG172: of:=AND(ISNUMBER(FIND("Super Endurance"; [.A172]))) -> false | CH172: of:=AND(ISNUMBER(FIND("Super Health"; [.A172]))) -> false | CI172: of:=AND(ISNUMBER(FIND("Super Reflection"; [.A172]))) -> false | CJ172: of:=AND(ISNUMBER(FIND("Super Strength"; [.A172]))) -> false | CK172: of:=ISNUMBER(FIND("Alteration Resistance"; [.A172])) -> false | CL172: of:=IF([.CK172]; ALTERATION_RESISTANCE_TEXT; "") ->  | CM172: of:=ISNUMBER(FIND("Damage Resistance"; [.A172])) -> false | CN172: of:=IF([.CM172]; DAMAGE_RESISTANCE_TEXT; "") ->  | CO172: of:=ISNUMBER(FIND("Mental Resistance"; [.A172])) -> false | CP172: of:=IF([.CO172]; MENTAL_RESISTANCE_TEXT; "") ->  | CQ172: of:=ISNUMBER(FIND("Bulletproof"; [.A172])) -> false | CR172: of:=IF([.CQ172]; "Unaffected by ordinary weapons Equipment Level "&POWER_LEVEL&" and lower"; "") ->  | CS172: of:=ISNUMBER(FIND("Density Control"; [.A172])) -> false | CT172: of:=IF([.CS172]; INDEX(DENSITY_CONTROL_CHART; POWER_LEVEL; 4); "") ->  | CU172: of:=ISNUMBER(FIND("Duplication"; [.A172])) -> false | CV172: of:=IF([.CU172]; INDEX(DUPLICATION_CHART; POWER_LEVEL; 3); "") ->  | CW172: of:=ISNUMBER(FIND("Growth"; [.A172])) -> false | CX172: of:=IF([.CW172]; INDEX(GROWTH_CHART; POWER_LEVEL; 6); "") ->  | CY172: of:=ISNUMBER(FIND("Extra Actions"; [.A172])) -> false | CZ172: of:=IF([.CY172]; POWER_LEVEL&" extra actions per scene"; "") ->  | DA172: of:=ISNUMBER(FIND("Haste"; [.A172])) -> false | DB172: of:=IF([.DA172]; INDEX(HASTE_CHART; POWER_LEVEL; 3); "") ->  | DC172: of:=ISNUMBER(FIND("Shrinking"; [.A172])) -> false | DD172: of:=IF([.DC172]; INDEX(SHRINKING_CHART; POWER_LEVEL; 4); "") ->  | DE172: of:=ISNUMBER(FIND("Stretching"; [.A172])) -> false | DF172: of:=IF([.DE172]; INDEX(STRETCHING_CHART; POWER_LEVEL; 2)&" reach"; "") ->  | DG172: of:=[.CL172]&[.CN172]&[.CP172]&[.CR172]&[.CT172]&[.CV172]&[.CX172]&[.CZ172]&[.DB172]&[.DD172]&[.DF172] ->  | DH172: of:=ISNUMBER(FIND("[Element]"; [.A172])) -> false | DI172: of:=ISNUMBER(FIND("[Subject]"; [.A172])) -> true | DJ172: of:=ISNUMBER(FIND("[Transformation]"; [.A172])) -> false | DM172: of:=IF([.B172]; [.AD172]; FALSE()) -> false | DN172: of:=IF(AND([.B172]; [.AG172]>[.DN171]); [.AG172]; N([.DN171])) -> 10 | DO172: of:=IF([.B172]; [.AN172]; FALSE()) -> false | DP172: of:=IF([.B172]; [.AR172]; FALSE()) -> false | DQ172: of:=IF(AND([.B172]; [.AS172]>[.DQ171]); [.AS172]; N([.DQ171])) -> 100 | DR172: of:=IF([.B172]; [.AX172]; FALSE()) -> false | DS172: of:=IF(AND([.B172]; [.BB172]>[.DS171]); [.BB172]; N([.DS171])) -> 10000000000 | DT172: of:=IF([.T172]; COM.MICROSOFT.TEXTJOIN(", "; 1; [.AA172]; [.AL172]; [.AL172]; [.AZ172]; [.AZ172]; [.AC172]); "") -> Standard action, Ranged (600 m/1,000 m), Ranged (600 m/1,000 m), Mental attack | DU172: of:=COM.MICROSOFT.TEXTJOIN("; "; TRUE(); [.Z172]; [.DG172]) ->  | DV172: of:=IF([.T172]; [.V172]; 0) -> 7 | DW172: of:=IF(AND([.AD172]; NOT([.AE172])); 1; 0) + INDEX(MULTIPLIER_CHART_INDEXES; MATCH([.AG172]; MULTIPLIER_CHART_MULTIPLIERS;0)) -> 0 | DX172: of:=IF([.AN172]; 1; 0) -> 0 | DY172: of:=IF(AND(NOT([.AQ172]); [.AR172]); 1; 0) + INDEX(MULTIPLIER_CHART_INDEXES; MATCH([.AS172]; MULTIPLIER_CHART_MULTIPLIERS;0)) -> 0 | DZ172: of:=IF([.AY172]; 1; 0) -> 0 | EA172: of:=INDEX(MULTIPLIER_CHART_INDEXES; MATCH([.BB172]; MULTIPLIER_CHART_MULTIPLIERS;0)) -> 0 | EB172: of:=SUM([.DV172:.EA172]) -> 7 | EC172: of:=IF([.T172]; [.Y172]&CHAR(13)&CHAR(10)&[.DT172]&CHAR(13)&CHAR(10)&[.DU172]&CHAR(13)&CHAR(10)&VLOOKUP( [.A172]; POWER_CHART; 11; FALSE())&CHAR(13)&CHAR(10)&CHAR(13)&CHAR(10); "") -> Command [Subject]
Standard action, Ranged (600 m/1,000 m), Ranged (600 m/1,000 m), Mental attack

12


A173: of:=IF([Powers.C14]=""; ""; [Powers.C14]) -> [Element] Form | B173: of:=IF(ISNUMBER(FIND("Ultra-power"; [.A173])); TRUE(); FALSE()) -> false | C173: of:=IF(TRIM([.A173])=""; 0; INDEX(POWER_CHART_INDEXES; MATCH([.A173]; POWER_CHART_NAMES; 0))) -> 21 | D173: of:=IF([.C173]; 1; 0) + N([.D172]) -> 9 | E173: of:=IF(AND([.B173]; SELECTED_POWER_COUNT<4); FALSE(); TRUE()) -> true | F173: of:=IF(AND([.B173]; [.E173]); TRUE(); FALSE()) -> false | G173: of:=IF(N([.C173]); IFERROR(T(INDEX(POWER_CHART_PREREQ_1; MATCH([.C173]; POWER_CHART_INDEXES; 0))); ""); "") ->  | H173: of:=IF(OR([.B173]; [.G173]=""); 0; INDEX(POWER_CHART_INDEXES; MATCH([.G173]; POWER_CHART_NAMES; 0))) -> 0 | I173: of:=IF([.H173]=0; TRUE(); COUNTIF(POWER_CALC_SELECTED_INDEXES; [.H173])) -> true | J173: of:=IF(N([.C173]); IFERROR(T(INDEX(POWER_CHART_PREREQ_2; MATCH([.C173]; POWER_CHART_INDEXES; 0))); ""); "") ->  | K173: of:=IF(OR([.B173]; [.J173]=""); 0; INDEX(POWER_CHART_INDEXES; MATCH([.J173]; POWER_CHART_NAMES; 0))) -> 0 | L173: of:=IF([.K173]=0; TRUE(); COUNTIF(POWER_CALC_SELECTED_INDEXES; [.K173])) -> true | M173: of:=IF(N([.C173]); IFERROR(T(INDEX(POWER_CHART_PREREQ_3; MATCH([.C173]; POWER_CHART_INDEXES; 0))); ""); "") ->  | N173: of:=IF(OR([.B173]; [.M173]=""); 0; INDEX(POWER_CHART_INDEXES; MATCH([.M173]; POWER_CHART_NAMES; 0))) -> 0 | O173: of:=IF([.N173]=0; TRUE(); COUNTIF(POWER_CALC_SELECTED_INDEXES; [.N173])) -> true | P173: of:=IF(AND([.I173]; [.L173]; [.O173]); TRUE(); FALSE()) -> true | Q173: of:=IF(NOT([.P173]); "Purchase a prerequisite for "&[.A173]&" ("&COM.MICROSOFT.TEXTJOIN(" or "; 1; [.G173]; [.J173]; [.M173])&")."&CHAR(13)&CHAR(10); "") ->  | R173: of:=IF([.A173]=""; FALSE(); IF([.P173]; TRUE(); FALSE())) -> true | T173: of:=IF([.A173]=""; FALSE(); IF([.P173]; TRUE(); FALSE())) -> true | U173: of:=IF([.T173]; [.C173]; 0) -> 21 | V173: of:=[.T173] + N([.V172]) -> 8 | W173: of:=IF(AND([.T173]; NOT([Powers.E14]="")); [Powers.E14]; "") ->  | X173: of:=IF([.B173]; IF([Powers.E14]=""; ""; IF([Powers.E14]="Ultra-power"; ""; [Powers.E14])); [.X172]) ->  | Y173: of:=IF(AND([.T173]; OR([.W173]=""; [.B173])); [.A173]; [.W173]) -> [Element] Form | Z173: of:=IF(AND([.T173]; NOT([Powers.F14]="")); [Powers.F14]; "") ->  | AA173: of:=IF([.T173]; IFERROR(T(INDEX(POWER_CHART_ACTIONS; MATCH([.C173]; POWER_CHART_INDEXES; 0))); ""); "") -> Quick action | AB173: of:=IF([.T173]; INDEX(POWER_CHART_ATTACKS; MATCH([.C173]; POWER_CHART_INDEXES; 0)); FALSE()) -> false | AC173: of:=IF([.T173]; INDEX(POWER_CHART_TYPES; MATCH([.C173]; POWER_CHART_INDEXES; 0))&" "&IF([.AB173]; "attack"; "power"); "") -> Personal power | AD173: of:=IF(AND([.T173]; [Powers.H14]="Y"); TRUE(); FALSE()) -> false | AE173: of:=IF([.T173]; IF(INDEX(POWER_CHART_RANGES;MATCH([.C173];POWER_CHART_INDEXES;0))="Ranged";TRUE();FALSE())) -> false | AF173: of:=OR([.AD173];[.AE173]) -> false | AG173: of:=IF([.T173]; RIGHT([Powers.P14]; LEN([Powers.P14])-1)*1; 1) -> 1 | AH173: of:=IF([.AF173]; INDEX(POWER_LEVEL_CHART_RANGES_TEXT; MATCH(POWER_LEVEL-1; POWER_LEVEL_CHART_INDEXES;0)); "") ->  | AI173: of:=IF([.AF173]; INDEX(POWER_LEVEL_CHART_RANGES; MATCH(POWER_LEVEL; POWER_LEVEL_CHART_INDEXES;0)); "") ->  | AJ173: of:=IF([.AF173]; [.AI173]*[.AG173]; "") ->  | AK173: of:=IF([.AF173]; IF(([.AJ173])>9999; TEXT(([.AJ173])/1000; "#,##0")&" km"; TEXT([.AJ173];"#,##0")&" m"); "") ->  | AL173: of:=IF([.AF173]; "Ranged ("&[.AH173]&"/"&[.AK173]&")"; "") ->  | AM173: of:=IF(AND([.T173]; [Powers.L14]="Y"); TRUE(); FALSE()) -> false | AN173: of:=IF(AND([.AM173]; OR(ISNUMBER(FIND("attack"; [.AC173])); ISNUMBER(FIND("Ultra-power"; [.A173])))); TRUE(); FALSE()) -> false | AO173: of:=IF([.AN173];", Seeking";"") ->  | AP173: of:=IF(AND([.T173]; [Powers.J14]="Y"); TRUE(); FALSE()) -> false | AQ173: of:=IF([.T173]; IF(INDEX(POWER_CHART_AREAS; MATCH([.C173]; POWER_CHART_INDEXES; 0))="Area"; TRUE(); FALSE())) -> false | AR173: of:=OR([.AP173];[.AQ173]) -> false | AS173: of:=IF([.T173]; RIGHT([Powers.R14]; LEN([Powers.R14])-1)*1; 1) -> 1 | AT173: of:=IF([.AR173]; INDEX(POWER_LEVEL_CHART_AREAS; MATCH(POWER_LEVEL; POWER_LEVEL_CHART_INDEXES;0)); "") ->  | AU173: of:=IF([.AR173]; [.AS173]*[.AT173]; "") ->  | AV173: of:=IF([.AR173]; IF(([.AU173])>9999; TEXT(([.AU173])/1000; "#,##0")&" km radius"; TEXT([.AU173];"#,##0")&" m radius"); "") ->  | AW173: of:=IF([.AR173]; "Area ("&[.AV173]&")"; "") ->  | AX173: of:=IF(AND([.T173]; [Powers.N14]="Y"); TRUE(); FALSE()) -> false | AY173: of:=IF([.AX173]) -> false | AZ173: of:=IF([.AY173];", Selective";"") ->  | BA173: of:=ISNUMBER(FIND("Movement"; [.AC173])) -> false | BB173: of:=IF(OR([.BA173]; [.B173]); RIGHT([Powers.T14]; LEN([Powers.T14])-1)*1; 1) -> 1 | BC173: of:=ISNUMBER(FIND("Super Running"; [.A173])) -> false | BD173: of:=IF([.BC173]; INDEX(MOVEMENT_CHART_BASES_TEXT; MATCH(ATHLETICS+POWER_LEVEL; MOVEMENT_CHART_INDEXES;0)); "") ->  | BE173: of:=IF([.BC173]; INDEX(MOVEMENT_CHART_SPRINTS; MATCH(ATHLETICS+POWER_LEVEL; MOVEMENT_CHART_INDEXES;0)); "") ->  | BF173: of:=IF([.BC173]; [.BE173]*[.BB173]; "") ->  | BG173: of:=IF([.BC173]; IF(([.BF173])>9999; TEXT(([.BF173])/1000; "#,##0")&" km"; TEXT([.BF173];"#,##0")&" m"); "") ->  | BH173: of:=IF([.BC173]; "("&[.BD173]&"/"&[.BG173]&")"; "") ->  | BI173: of:=AND(ISNUMBER(FIND("Super Swimming"; [.A173]))) -> false | BJ173: of:=IF([.BI173]; INDEX(MOVEMENT_CHART_BASES_TEXT; MATCH(ATHLETICS+POWER_LEVEL; MOVEMENT_CHART_INDEXES;0)); "") ->  | BK173: of:=IF([.BI173]; INDEX(MOVEMENT_CHART_SPRINTS; MATCH(ATHLETICS+POWER_LEVEL; MOVEMENT_CHART_INDEXES;0)); "") ->  | BL173: of:=IF([.BI173]; [.BK173]*[.BB173]; "") ->  | BM173: of:=IF([.BI173]; IF(([.BL173])>9999; TEXT(([.BL173])/1000; "#,##0")&" km"; TEXT([.BL173];"#,##0")&" m"); "") ->  | BN173: of:=IF([.BI173]; "("&[.BJ173]&"/"&[.BM173]&")"; "") ->  | BO173: of:=ISNUMBER(FIND("Flight"; [.A173])) -> false | BP173: of:=IF([.BO173]; INDEX(MOVEMENT_CHART_BASES_TEXT; MATCH(ATHLETICS+POWER_LEVEL; MOVEMENT_CHART_INDEXES;0)); "") ->  | BQ173: of:=IF([.BO173]; INDEX(MOVEMENT_CHART_SPRINTS; MATCH(ATHLETICS+POWER_LEVEL; MOVEMENT_CHART_INDEXES;0)); "") ->  | BR173: of:=IF([.BO173]; [.BQ173]*[.BB173]; "") ->  | BS173: of:=IF([.BO173]; IF(([.BR173])>9999; TEXT(([.BR173])/1000; "#,##0")&" km"; TEXT([.BR173];"#,##0")&" m"); "") ->  | BT173: of:=IF([.BO173]; "("&[.BP173]&"/"&[.BS173]&")"; "") ->  | BU173: of:=ISNUMBER(FIND("Teleportation"; [.A173])) -> false | BV173: of:=IF([.BU173]; INDEX(TELEPORTATION_CHART_BASES_TEXT; MATCH(POWER_LEVEL; TELEPORTATION_CHART_INDEXES; 0)); "") ->  | BW173: of:=IF([.BU173]; INDEX(TELEPORTATION_CHART_SPRINTS; MATCH(POWER_LEVEL; TELEPORTATION_CHART_INDEXES; 0)); "") ->  | BX173: of:=IF([.BU173]; [.BW173]*[.BB173]; "") ->  | BY173: of:=IF([.BU173]; IF(([.BX173])>9999; TEXT(([.BX173])/1000; "#,##0")&" km"; TEXT([.BX173];"#,##0")&" m"); "") ->  | BZ173: of:=IF([.BU173]; "("&[.BV173]&"/"&[.BY173]&")"; "") ->  | CA173: of:=ISNUMBER(FIND("Tunneling"; [.A173])) -> false | CB173: of:=IF([.CA173]; INDEX(MOVEMENT_CHART_BASES_TEXT; MATCH(ATHLETICS+POWER_LEVEL; MOVEMENT_CHART_INDEXES;0)); "") ->  | CC173: of:=IF([.CA173]; INDEX(MOVEMENT_CHART_SPRINTS; MATCH(ATHLETICS+POWER_LEVEL; MOVEMENT_CHART_INDEXES;0)); "") ->  | CD173: of:=IF([.CA173]; [.CC173]*[.BB173]; "") ->  | CE173: of:=IF([.CA173]; IF(([.CD173])>9999; TEXT(([.CD173])/1000; "#,##0")&" km"; TEXT([.CD173];"#,##0")&" m"); "") ->  | CF173: of:=IF([.CA173]; "("&[.CB173]&"/"&[.CE173]&")"; "") ->  | CG173: of:=AND(ISNUMBER(FIND("Super Endurance"; [.A173]))) -> false | CH173: of:=AND(ISNUMBER(FIND("Super Health"; [.A173]))) -> false | CI173: of:=AND(ISNUMBER(FIND("Super Reflection"; [.A173]))) -> false | CJ173: of:=AND(ISNUMBER(FIND("Super Strength"; [.A173]))) -> false | CK173: of:=ISNUMBER(FIND("Alteration Resistance"; [.A173])) -> false | CL173: of:=IF([.CK173]; ALTERATION_RESISTANCE_TEXT; "") ->  | CM173: of:=ISNUMBER(FIND("Damage Resistance"; [.A173])) -> false | CN173: of:=IF([.CM173]; DAMAGE_RESISTANCE_TEXT; "") ->  | CO173: of:=ISNUMBER(FIND("Mental Resistance"; [.A173])) -> false | CP173: of:=IF([.CO173]; MENTAL_RESISTANCE_TEXT; "") ->  | CQ173: of:=ISNUMBER(FIND("Bulletproof"; [.A173])) -> false | CR173: of:=IF([.CQ173]; "Unaffected by ordinary weapons Equipment Level "&POWER_LEVEL&" and lower"; "") ->  | CS173: of:=ISNUMBER(FIND("Density Control"; [.A173])) -> false | CT173: of:=IF([.CS173]; INDEX(DENSITY_CONTROL_CHART; POWER_LEVEL; 4); "") ->  | CU173: of:=ISNUMBER(FIND("Duplication"; [.A173])) -> false | CV173: of:=IF([.CU173]; INDEX(DUPLICATION_CHART; POWER_LEVEL; 3); "") ->  | CW173: of:=ISNUMBER(FIND("Growth"; [.A173])) -> false | CX173: of:=IF([.CW173]; INDEX(GROWTH_CHART; POWER_LEVEL; 6); "") ->  | CY173: of:=ISNUMBER(FIND("Extra Actions"; [.A173])) -> false | CZ173: of:=IF([.CY173]; POWER_LEVEL&" extra actions per scene"; "") ->  | DA173: of:=ISNUMBER(FIND("Haste"; [.A173])) -> false | DB173: of:=IF([.DA173]; INDEX(HASTE_CHART; POWER_LEVEL; 3); "") ->  | DC173: of:=ISNUMBER(FIND("Shrinking"; [.A173])) -> false | DD173: of:=IF([.DC173]; INDEX(SHRINKING_CHART; POWER_LEVEL; 4); "") ->  | DE173: of:=ISNUMBER(FIND("Stretching"; [.A173])) -> false | DF173: of:=IF([.DE173]; INDEX(STRETCHING_CHART; POWER_LEVEL; 2)&" reach"; "") ->  | DG173: of:=[.CL173]&[.CN173]&[.CP173]&[.CR173]&[.CT173]&[.CV173]&[.CX173]&[.CZ173]&[.DB173]&[.DD173]&[.DF173] ->  | DH173: of:=ISNUMBER(FIND("[Element]"; [.A173])) -> true | DI173: of:=ISNUMBER(FIND("[Subject]"; [.A173])) -> false | DJ173: of:=ISNUMBER(FIND("[Transformation]"; [.A173])) -> false | DM173: of:=IF([.B173]; [.AD173]; FALSE()) -> false | DN173: of:=IF(AND([.B173]; [.AG173]>[.DN172]); [.AG173]; N([.DN172])) -> 10 | DO173: of:=IF([.B173]; [.AN173]; FALSE()) -> false | DP173: of:=IF([.B173]; [.AR173]; FALSE()) -> false | DQ173: of:=IF(AND([.B173]; [.AS173]>[.DQ172]); [.AS173]; N([.DQ172])) -> 100 | DR173: of:=IF([.B173]; [.AX173]; FALSE()) -> false | DS173: of:=IF(AND([.B173]; [.BB173]>[.DS172]); [.BB173]; N([.DS172])) -> 10000000000 | DT173: of:=IF([.T173]; COM.MICROSOFT.TEXTJOIN(", "; 1; [.AA173]; [.AL173]; [.AL173]; [.AZ173]; [.AZ173]; [.AC173]); "") -> Quick action, Personal power | DU173: of:=COM.MICROSOFT.TEXTJOIN("; "; TRUE(); [.Z173]; [.DG173]) ->  | DV173: of:=IF([.T173]; [.V173]; 0) -> 8 | DW173: of:=IF(AND([.AD173]; NOT([.AE173])); 1; 0) + INDEX(MULTIPLIER_CHART_INDEXES; MATCH([.AG173]; MULTIPLIER_CHART_MULTIPLIERS;0)) -> 0 | DX173: of:=IF([.AN173]; 1; 0) -> 0 | DY173: of:=IF(AND(NOT([.AQ173]); [.AR173]); 1; 0) + INDEX(MULTIPLIER_CHART_INDEXES; MATCH([.AS173]; MULTIPLIER_CHART_MULTIPLIERS;0)) -> 0 | DZ173: of:=IF([.AY173]; 1; 0) -> 0 | EA173: of:=INDEX(MULTIPLIER_CHART_INDEXES; MATCH([.BB173]; MULTIPLIER_CHART_MULTIPLIERS;0)) -> 0 | EB173: of:=SUM([.DV173:.EA173]) -> 8 | EC173: of:=IF([.T173]; [.Y173]&CHAR(13)&CHAR(10)&[.DT173]&CHAR(13)&CHAR(10)&[.DU173]&CHAR(13)&CHAR(10)&VLOOKUP( [.A173]; POWER_CHART; 11; FALSE())&CHAR(13)&CHAR(10)&CHAR(13)&CHAR(10); "") -> [Element] Form
Quick action, Personal power

21


A174: of:=IF([Powers.C15]=""; ""; [Powers.C15]) -> [Element] Immunity | B174: of:=IF(ISNUMBER(FIND("Ultra-power"; [.A174])); TRUE(); FALSE()) -> false | C174: of:=IF(TRIM([.A174])=""; 0; INDEX(POWER_CHART_INDEXES; MATCH([.A174]; POWER_CHART_NAMES; 0))) -> 22 | D174: of:=IF([.C174]; 1; 0) + N([.D173]) -> 10 | E174: of:=IF(AND([.B174]; SELECTED_POWER_COUNT<4); FALSE(); TRUE()) -> true | F174: of:=IF(AND([.B174]; [.E174]); TRUE(); FALSE()) -> false | G174: of:=IF(N([.C174]); IFERROR(T(INDEX(POWER_CHART_PREREQ_1; MATCH([.C174]; POWER_CHART_INDEXES; 0))); ""); "") ->  | H174: of:=IF(OR([.B174]; [.G174]=""); 0; INDEX(POWER_CHART_INDEXES; MATCH([.G174]; POWER_CHART_NAMES; 0))) -> 0 | I174: of:=IF([.H174]=0; TRUE(); COUNTIF(POWER_CALC_SELECTED_INDEXES; [.H174])) -> true | J174: of:=IF(N([.C174]); IFERROR(T(INDEX(POWER_CHART_PREREQ_2; MATCH([.C174]; POWER_CHART_INDEXES; 0))); ""); "") ->  | K174: of:=IF(OR([.B174]; [.J174]=""); 0; INDEX(POWER_CHART_INDEXES; MATCH([.J174]; POWER_CHART_NAMES; 0))) -> 0 | L174: of:=IF([.K174]=0; TRUE(); COUNTIF(POWER_CALC_SELECTED_INDEXES; [.K174])) -> true | M174: of:=IF(N([.C174]); IFERROR(T(INDEX(POWER_CHART_PREREQ_3; MATCH([.C174]; POWER_CHART_INDEXES; 0))); ""); "") ->  | N174: of:=IF(OR([.B174]; [.M174]=""); 0; INDEX(POWER_CHART_INDEXES; MATCH([.M174]; POWER_CHART_NAMES; 0))) -> 0 | O174: of:=IF([.N174]=0; TRUE(); COUNTIF(POWER_CALC_SELECTED_INDEXES; [.N174])) -> true | P174: of:=IF(AND([.I174]; [.L174]; [.O174]); TRUE(); FALSE()) -> true | Q174: of:=IF(NOT([.P174]); "Purchase a prerequisite for "&[.A174]&" ("&COM.MICROSOFT.TEXTJOIN(" or "; 1; [.G174]; [.J174]; [.M174])&")."&CHAR(13)&CHAR(10); "") ->  | R174: of:=IF([.A174]=""; FALSE(); IF([.P174]; TRUE(); FALSE())) -> true | T174: of:=IF([.A174]=""; FALSE(); IF([.P174]; TRUE(); FALSE())) -> true | U174: of:=IF([.T174]; [.C174]; 0) -> 22 | V174: of:=[.T174] + N([.V173]) -> 9 | W174: of:=IF(AND([.T174]; NOT([Powers.E15]="")); [Powers.E15]; "") ->  | X174: of:=IF([.B174]; IF([Powers.E15]=""; ""; IF([Powers.E15]="Ultra-power"; ""; [Powers.E15])); [.X173]) ->  | Y174: of:=IF(AND([.T174]; OR([.W174]=""; [.B174])); [.A174]; [.W174]) -> [Element] Immunity | Z174: of:=IF(AND([.T174]; NOT([Powers.F15]="")); [Powers.F15]; "") ->  | AA174: of:=IF([.T174]; IFERROR(T(INDEX(POWER_CHART_ACTIONS; MATCH([.C174]; POWER_CHART_INDEXES; 0))); ""); "") -> Constant | AB174: of:=IF([.T174]; INDEX(POWER_CHART_ATTACKS; MATCH([.C174]; POWER_CHART_INDEXES; 0)); FALSE()) -> false | AC174: of:=IF([.T174]; INDEX(POWER_CHART_TYPES; MATCH([.C174]; POWER_CHART_INDEXES; 0))&" "&IF([.AB174]; "attack"; "power"); "") -> Personal power | AD174: of:=IF(AND([.T174]; [Powers.H15]="Y"); TRUE(); FALSE()) -> false | AE174: of:=IF([.T174]; IF(INDEX(POWER_CHART_RANGES;MATCH([.C174];POWER_CHART_INDEXES;0))="Ranged";TRUE();FALSE())) -> false | AF174: of:=OR([.AD174];[.AE174]) -> false | AG174: of:=IF([.T174]; RIGHT([Powers.P15]; LEN([Powers.P15])-1)*1; 1) -> 1 | AH174: of:=IF([.AF174]; INDEX(POWER_LEVEL_CHART_RANGES_TEXT; MATCH(POWER_LEVEL-1; POWER_LEVEL_CHART_INDEXES;0)); "") ->  | AI174: of:=IF([.AF174]; INDEX(POWER_LEVEL_CHART_RANGES; MATCH(POWER_LEVEL; POWER_LEVEL_CHART_INDEXES;0)); "") ->  | AJ174: of:=IF([.AF174]; [.AI174]*[.AG174]; "") ->  | AK174: of:=IF([.AF174]; IF(([.AJ174])>9999; TEXT(([.AJ174])/1000; "#,##0")&" km"; TEXT([.AJ174];"#,##0")&" m"); "") ->  | AL174: of:=IF([.AF174]; "Ranged ("&[.AH174]&"/"&[.AK174]&")"; "") ->  | AM174: of:=IF(AND([.T174]; [Powers.L15]="Y"); TRUE(); FALSE()) -> true | AN174: of:=IF(AND([.AM174]; OR(ISNUMBER(FIND("attack"; [.AC174])); ISNUMBER(FIND("Ultra-power"; [.A174])))); TRUE(); FALSE()) -> false | AO174: of:=IF([.AN174];", Seeking";"") ->  | AP174: of:=IF(AND([.T174]; [Powers.J15]="Y"); TRUE(); FALSE()) -> false | AQ174: of:=IF([.T174]; IF(INDEX(POWER_CHART_AREAS; MATCH([.C174]; POWER_CHART_INDEXES; 0))="Area"; TRUE(); FALSE())) -> false | AR174: of:=OR([.AP174];[.AQ174]) -> false | AS174: of:=IF([.T174]; RIGHT([Powers.R15]; LEN([Powers.R15])-1)*1; 1) -> 1 | AT174: of:=IF([.AR174]; INDEX(POWER_LEVEL_CHART_AREAS; MATCH(POWER_LEVEL; POWER_LEVEL_CHART_INDEXES;0)); "") ->  | AU174: of:=IF([.AR174]; [.AS174]*[.AT174]; "") ->  | AV174: of:=IF([.AR174]; IF(([.AU174])>9999; TEXT(([.AU174])/1000; "#,##0")&" km radius"; TEXT([.AU174];"#,##0")&" m radius"); "") ->  | AW174: of:=IF([.AR174]; "Area ("&[.AV174]&")"; "") ->  | AX174: of:=IF(AND([.T174]; [Powers.N15]="Y"); TRUE(); FALSE()) -> false | AY174: of:=IF([.AX174]) -> false | AZ174: of:=IF([.AY174];", Selective";"") ->  | BA174: of:=ISNUMBER(FIND("Movement"; [.AC174])) -> false | BB174: of:=IF(OR([.BA174]; [.B174]); RIGHT([Powers.T15]; LEN([Powers.T15])-1)*1; 1) -> 1 | BC174: of:=ISNUMBER(FIND("Super Running"; [.A174])) -> false | BD174: of:=IF([.BC174]; INDEX(MOVEMENT_CHART_BASES_TEXT; MATCH(ATHLETICS+POWER_LEVEL; MOVEMENT_CHART_INDEXES;0)); "") ->  | BE174: of:=IF([.BC174]; INDEX(MOVEMENT_CHART_SPRINTS; MATCH(ATHLETICS+POWER_LEVEL; MOVEMENT_CHART_INDEXES;0)); "") ->  | BF174: of:=IF([.BC174]; [.BE174]*[.BB174]; "") ->  | BG174: of:=IF([.BC174]; IF(([.BF174])>9999; TEXT(([.BF174])/1000; "#,##0")&" km"; TEXT([.BF174];"#,##0")&" m"); "") ->  | BH174: of:=IF([.BC174]; "("&[.BD174]&"/"&[.BG174]&")"; "") ->  | BI174: of:=AND(ISNUMBER(FIND("Super Swimming"; [.A174]))) -> false | BJ174: of:=IF([.BI174]; INDEX(MOVEMENT_CHART_BASES_TEXT; MATCH(ATHLETICS+POWER_LEVEL; MOVEMENT_CHART_INDEXES;0)); "") ->  | BK174: of:=IF([.BI174]; INDEX(MOVEMENT_CHART_SPRINTS; MATCH(ATHLETICS+POWER_LEVEL; MOVEMENT_CHART_INDEXES;0)); "") ->  | BL174: of:=IF([.BI174]; [.BK174]*[.BB174]; "") ->  | BM174: of:=IF([.BI174]; IF(([.BL174])>9999; TEXT(([.BL174])/1000; "#,##0")&" km"; TEXT([.BL174];"#,##0")&" m"); "") ->  | BN174: of:=IF([.BI174]; "("&[.BJ174]&"/"&[.BM174]&")"; "") ->  | BO174: of:=ISNUMBER(FIND("Flight"; [.A174])) -> false | BP174: of:=IF([.BO174]; INDEX(MOVEMENT_CHART_BASES_TEXT; MATCH(ATHLETICS+POWER_LEVEL; MOVEMENT_CHART_INDEXES;0)); "") ->  | BQ174: of:=IF([.BO174]; INDEX(MOVEMENT_CHART_SPRINTS; MATCH(ATHLETICS+POWER_LEVEL; MOVEMENT_CHART_INDEXES;0)); "") ->  | BR174: of:=IF([.BO174]; [.BQ174]*[.BB174]; "") ->  | BS174: of:=IF([.BO174]; IF(([.BR174])>9999; TEXT(([.BR174])/1000; "#,##0")&" km"; TEXT([.BR174];"#,##0")&" m"); "") ->  | BT174: of:=IF([.BO174]; "("&[.BP174]&"/"&[.BS174]&")"; "") ->  | BU174: of:=ISNUMBER(FIND("Teleportation"; [.A174])) -> false | BV174: of:=IF([.BU174]; INDEX(TELEPORTATION_CHART_BASES_TEXT; MATCH(POWER_LEVEL; TELEPORTATION_CHART_INDEXES; 0)); "") ->  | BW174: of:=IF([.BU174]; INDEX(TELEPORTATION_CHART_SPRINTS; MATCH(POWER_LEVEL; TELEPORTATION_CHART_INDEXES; 0)); "") ->  | BX174: of:=IF([.BU174]; [.BW174]*[.BB174]; "") ->  | BY174: of:=IF([.BU174]; IF(([.BX174])>9999; TEXT(([.BX174])/1000; "#,##0")&" km"; TEXT([.BX174];"#,##0")&" m"); "") ->  | BZ174: of:=IF([.BU174]; "("&[.BV174]&"/"&[.BY174]&")"; "") ->  | CA174: of:=ISNUMBER(FIND("Tunneling"; [.A174])) -> false | CB174: of:=IF([.CA174]; INDEX(MOVEMENT_CHART_BASES_TEXT; MATCH(ATHLETICS+POWER_LEVEL; MOVEMENT_CHART_INDEXES;0)); "") ->  | CC174: of:=IF([.CA174]; INDEX(MOVEMENT_CHART_SPRINTS; MATCH(ATHLETICS+POWER_LEVEL; MOVEMENT_CHART_INDEXES;0)); "") ->  | CD174: of:=IF([.CA174]; [.CC174]*[.BB174]; "") ->  | CE174: of:=IF([.CA174]; IF(([.CD174])>9999; TEXT(([.CD174])/1000; "#,##0")&" km"; TEXT([.CD174];"#,##0")&" m"); "") ->  | CF174: of:=IF([.CA174]; "("&[.CB174]&"/"&[.CE174]&")"; "") ->  | CG174: of:=AND(ISNUMBER(FIND("Super Endurance"; [.A174]))) -> false | CH174: of:=AND(ISNUMBER(FIND("Super Health"; [.A174]))) -> false | CI174: of:=AND(ISNUMBER(FIND("Super Reflection"; [.A174]))) -> false | CJ174: of:=AND(ISNUMBER(FIND("Super Strength"; [.A174]))) -> false | CK174: of:=ISNUMBER(FIND("Alteration Resistance"; [.A174])) -> false | CL174: of:=IF([.CK174]; ALTERATION_RESISTANCE_TEXT; "") ->  | CM174: of:=ISNUMBER(FIND("Damage Resistance"; [.A174])) -> false | CN174: of:=IF([.CM174]; DAMAGE_RESISTANCE_TEXT; "") ->  | CO174: of:=ISNUMBER(FIND("Mental Resistance"; [.A174])) -> false | CP174: of:=IF([.CO174]; MENTAL_RESISTANCE_TEXT; "") ->  | CQ174: of:=ISNUMBER(FIND("Bulletproof"; [.A174])) -> false | CR174: of:=IF([.CQ174]; "Unaffected by ordinary weapons Equipment Level "&POWER_LEVEL&" and lower"; "") ->  | CS174: of:=ISNUMBER(FIND("Density Control"; [.A174])) -> false | CT174: of:=IF([.CS174]; INDEX(DENSITY_CONTROL_CHART; POWER_LEVEL; 4); "") ->  | CU174: of:=ISNUMBER(FIND("Duplication"; [.A174])) -> false | CV174: of:=IF([.CU174]; INDEX(DUPLICATION_CHART; POWER_LEVEL; 3); "") ->  | CW174: of:=ISNUMBER(FIND("Growth"; [.A174])) -> false | CX174: of:=IF([.CW174]; INDEX(GROWTH_CHART; POWER_LEVEL; 6); "") ->  | CY174: of:=ISNUMBER(FIND("Extra Actions"; [.A174])) -> false | CZ174: of:=IF([.CY174]; POWER_LEVEL&" extra actions per scene"; "") ->  | DA174: of:=ISNUMBER(FIND("Haste"; [.A174])) -> false | DB174: of:=IF([.DA174]; INDEX(HASTE_CHART; POWER_LEVEL; 3); "") ->  | DC174: of:=ISNUMBER(FIND("Shrinking"; [.A174])) -> false | DD174: of:=IF([.DC174]; INDEX(SHRINKING_CHART; POWER_LEVEL; 4); "") ->  | DE174: of:=ISNUMBER(FIND("Stretching"; [.A174])) -> false | DF174: of:=IF([.DE174]; INDEX(STRETCHING_CHART; POWER_LEVEL; 2)&" reach"; "") ->  | DG174: of:=[.CL174]&[.CN174]&[.CP174]&[.CR174]&[.CT174]&[.CV174]&[.CX174]&[.CZ174]&[.DB174]&[.DD174]&[.DF174] ->  | DH174: of:=ISNUMBER(FIND("[Element]"; [.A174])) -> true | DI174: of:=ISNUMBER(FIND("[Subject]"; [.A174])) -> false | DJ174: of:=ISNUMBER(FIND("[Transformation]"; [.A174])) -> false | DM174: of:=IF([.B174]; [.AD174]; FALSE()) -> false | DN174: of:=IF(AND([.B174]; [.AG174]>[.DN173]); [.AG174]; N([.DN173])) -> 10 | DO174: of:=IF([.B174]; [.AN174]; FALSE()) -> false | DP174: of:=IF([.B174]; [.AR174]; FALSE()) -> false | DQ174: of:=IF(AND([.B174]; [.AS174]>[.DQ173]); [.AS174]; N([.DQ173])) -> 100 | DR174: of:=IF([.B174]; [.AX174]; FALSE()) -> false | DS174: of:=IF(AND([.B174]; [.BB174]>[.DS173]); [.BB174]; N([.DS173])) -> 10000000000 | DT174: of:=IF([.T174]; COM.MICROSOFT.TEXTJOIN(", "; 1; [.AA174]; [.AL174]; [.AL174]; [.AZ174]; [.AZ174]; [.AC174]); "") -> Constant, Personal power | DU174: of:=COM.MICROSOFT.TEXTJOIN("; "; TRUE(); [.Z174]; [.DG174]) ->  | DV174: of:=IF([.T174]; [.V174]; 0) -> 9 | DW174: of:=IF(AND([.AD174]; NOT([.AE174])); 1; 0) + INDEX(MULTIPLIER_CHART_INDEXES; MATCH([.AG174]; MULTIPLIER_CHART_MULTIPLIERS;0)) -> 0 | DX174: of:=IF([.AN174]; 1; 0) -> 0 | DY174: of:=IF(AND(NOT([.AQ174]); [.AR174]); 1; 0) + INDEX(MULTIPLIER_CHART_INDEXES; MATCH([.AS174]; MULTIPLIER_CHART_MULTIPLIERS;0)) -> 0 | DZ174: of:=IF([.AY174]; 1; 0) -> 0 | EA174: of:=INDEX(MULTIPLIER_CHART_INDEXES; MATCH([.BB174]; MULTIPLIER_CHART_MULTIPLIERS;0)) -> 0 | EB174: of:=SUM([.DV174:.EA174]) -> 9 | EC174: of:=IF([.T174]; [.Y174]&CHAR(13)&CHAR(10)&[.DT174]&CHAR(13)&CHAR(10)&[.DU174]&CHAR(13)&CHAR(10)&VLOOKUP( [.A174]; POWER_CHART; 11; FALSE())&CHAR(13)&CHAR(10)&CHAR(13)&CHAR(10); "") -> [Element] Immunity
Constant, Personal power

22


A175: of:=IF([Powers.C16]=""; ""; [Powers.C16]) -> [Element] Wall | B175: of:=IF(ISNUMBER(FIND("Ultra-power"; [.A175])); TRUE(); FALSE()) -> false | C175: of:=IF(TRIM([.A175])=""; 0; INDEX(POWER_CHART_INDEXES; MATCH([.A175]; POWER_CHART_NAMES; 0))) -> 23 | D175: of:=IF([.C175]; 1; 0) + N([.D174]) -> 11 | E175: of:=IF(AND([.B175]; SELECTED_POWER_COUNT<4); FALSE(); TRUE()) -> true | F175: of:=IF(AND([.B175]; [.E175]); TRUE(); FALSE()) -> false | G175: of:=IF(N([.C175]); IFERROR(T(INDEX(POWER_CHART_PREREQ_1; MATCH([.C175]; POWER_CHART_INDEXES; 0))); ""); "") ->  | H175: of:=IF(OR([.B175]; [.G175]=""); 0; INDEX(POWER_CHART_INDEXES; MATCH([.G175]; POWER_CHART_NAMES; 0))) -> 0 | I175: of:=IF([.H175]=0; TRUE(); COUNTIF(POWER_CALC_SELECTED_INDEXES; [.H175])) -> true | J175: of:=IF(N([.C175]); IFERROR(T(INDEX(POWER_CHART_PREREQ_2; MATCH([.C175]; POWER_CHART_INDEXES; 0))); ""); "") ->  | K175: of:=IF(OR([.B175]; [.J175]=""); 0; INDEX(POWER_CHART_INDEXES; MATCH([.J175]; POWER_CHART_NAMES; 0))) -> 0 | L175: of:=IF([.K175]=0; TRUE(); COUNTIF(POWER_CALC_SELECTED_INDEXES; [.K175])) -> true | M175: of:=IF(N([.C175]); IFERROR(T(INDEX(POWER_CHART_PREREQ_3; MATCH([.C175]; POWER_CHART_INDEXES; 0))); ""); "") ->  | N175: of:=IF(OR([.B175]; [.M175]=""); 0; INDEX(POWER_CHART_INDEXES; MATCH([.M175]; POWER_CHART_NAMES; 0))) -> 0 | O175: of:=IF([.N175]=0; TRUE(); COUNTIF(POWER_CALC_SELECTED_INDEXES; [.N175])) -> true | P175: of:=IF(AND([.I175]; [.L175]; [.O175]); TRUE(); FALSE()) -> true | Q175: of:=IF(NOT([.P175]); "Purchase a prerequisite for "&[.A175]&" ("&COM.MICROSOFT.TEXTJOIN(" or "; 1; [.G175]; [.J175]; [.M175])&")."&CHAR(13)&CHAR(10); "") ->  | R175: of:=IF([.A175]=""; FALSE(); IF([.P175]; TRUE(); FALSE())) -> true | T175: of:=IF([.A175]=""; FALSE(); IF([.P175]; TRUE(); FALSE())) -> true | U175: of:=IF([.T175]; [.C175]; 0) -> 23 | V175: of:=[.T175] + N([.V174]) -> 10 | W175: of:=IF(AND([.T175]; NOT([Powers.E16]="")); [Powers.E16]; "") ->  | X175: of:=IF([.B175]; IF([Powers.E16]=""; ""; IF([Powers.E16]="Ultra-power"; ""; [Powers.E16])); [.X174]) ->  | Y175: of:=IF(AND([.T175]; OR([.W175]=""; [.B175])); [.A175]; [.W175]) -> [Element] Wall | Z175: of:=IF(AND([.T175]; NOT([Powers.F16]="")); [Powers.F16]; "") ->  | AA175: of:=IF([.T175]; IFERROR(T(INDEX(POWER_CHART_ACTIONS; MATCH([.C175]; POWER_CHART_INDEXES; 0))); ""); "") -> Standard action | AB175: of:=IF([.T175]; INDEX(POWER_CHART_ATTACKS; MATCH([.C175]; POWER_CHART_INDEXES; 0)); FALSE()) -> false | AC175: of:=IF([.T175]; INDEX(POWER_CHART_TYPES; MATCH([.C175]; POWER_CHART_INDEXES; 0))&" "&IF([.AB175]; "attack"; "power"); "") -> Environmental power | AD175: of:=IF(AND([.T175]; [Powers.H16]="Y"); TRUE(); FALSE()) -> false | AE175: of:=IF([.T175]; IF(INDEX(POWER_CHART_RANGES;MATCH([.C175];POWER_CHART_INDEXES;0))="Ranged";TRUE();FALSE())) -> true | AF175: of:=OR([.AD175];[.AE175]) -> true | AG175: of:=IF([.T175]; RIGHT([Powers.P16]; LEN([Powers.P16])-1)*1; 1) -> 1 | AH175: of:=IF([.AF175]; INDEX(POWER_LEVEL_CHART_RANGES_TEXT; MATCH(POWER_LEVEL-1; POWER_LEVEL_CHART_INDEXES;0)); "") -> 600 m | AI175: of:=IF([.AF175]; INDEX(POWER_LEVEL_CHART_RANGES; MATCH(POWER_LEVEL; POWER_LEVEL_CHART_INDEXES;0)); "") -> 1000 | AJ175: of:=IF([.AF175]; [.AI175]*[.AG175]; "") -> 1000 | AK175: of:=IF([.AF175]; IF(([.AJ175])>9999; TEXT(([.AJ175])/1000; "#,##0")&" km"; TEXT([.AJ175];"#,##0")&" m"); "") -> 1,000 m | AL175: of:=IF([.AF175]; "Ranged ("&[.AH175]&"/"&[.AK175]&")"; "") -> Ranged (600 m/1,000 m) | AM175: of:=IF(AND([.T175]; [Powers.L16]="Y"); TRUE(); FALSE()) -> false | AN175: of:=IF(AND([.AM175]; OR(ISNUMBER(FIND("attack"; [.AC175])); ISNUMBER(FIND("Ultra-power"; [.A175])))); TRUE(); FALSE()) -> false | AO175: of:=IF([.AN175];", Seeking";"") ->  | AP175: of:=IF(AND([.T175]; [Powers.J16]="Y"); TRUE(); FALSE()) -> false | AQ175: of:=IF([.T175]; IF(INDEX(POWER_CHART_AREAS; MATCH([.C175]; POWER_CHART_INDEXES; 0))="Area"; TRUE(); FALSE())) -> true | AR175: of:=OR([.AP175];[.AQ175]) -> true | AS175: of:=IF([.T175]; RIGHT([Powers.R16]; LEN([Powers.R16])-1)*1; 1) -> 1 | AT175: of:=IF([.AR175]; INDEX(POWER_LEVEL_CHART_AREAS; MATCH(POWER_LEVEL; POWER_LEVEL_CHART_INDEXES;0)); "") -> 10 | AU175: of:=IF([.AR175]; [.AS175]*[.AT175]; "") -> 10 | AV175: of:=IF([.AR175]; IF(([.AU175])>9999; TEXT(([.AU175])/1000; "#,##0")&" km radius"; TEXT([.AU175];"#,##0")&" m radius"); "") -> 10 m radius | AW175: of:=IF([.AR175]; "Area ("&[.AV175]&")"; "") -> Area (10 m radius) | AX175: of:=IF(AND([.T175]; [Powers.N16]="Y"); TRUE(); FALSE()) -> false | AY175: of:=IF([.AX175]) -> false | AZ175: of:=IF([.AY175];", Selective";"") ->  | BA175: of:=ISNUMBER(FIND("Movement"; [.AC175])) -> false | BB175: of:=IF(OR([.BA175]; [.B175]); RIGHT([Powers.T16]; LEN([Powers.T16])-1)*1; 1) -> 1 | BC175: of:=ISNUMBER(FIND("Super Running"; [.A175])) -> false | BD175: of:=IF([.BC175]; INDEX(MOVEMENT_CHART_BASES_TEXT; MATCH(ATHLETICS+POWER_LEVEL; MOVEMENT_CHART_INDEXES;0)); "") ->  | BE175: of:=IF([.BC175]; INDEX(MOVEMENT_CHART_SPRINTS; MATCH(ATHLETICS+POWER_LEVEL; MOVEMENT_CHART_INDEXES;0)); "") ->  | BF175: of:=IF([.BC175]; [.BE175]*[.BB175]; "") ->  | BG175: of:=IF([.BC175]; IF(([.BF175])>9999; TEXT(([.BF175])/1000; "#,##0")&" km"; TEXT([.BF175];"#,##0")&" m"); "") ->  | BH175: of:=IF([.BC175]; "("&[.BD175]&"/"&[.BG175]&")"; "") ->  | BI175: of:=AND(ISNUMBER(FIND("Super Swimming"; [.A175]))) -> false | BJ175: of:=IF([.BI175]; INDEX(MOVEMENT_CHART_BASES_TEXT; MATCH(ATHLETICS+POWER_LEVEL; MOVEMENT_CHART_INDEXES;0)); "") ->  | BK175: of:=IF([.BI175]; INDEX(MOVEMENT_CHART_SPRINTS; MATCH(ATHLETICS+POWER_LEVEL; MOVEMENT_CHART_INDEXES;0)); "") ->  | BL175: of:=IF([.BI175]; [.BK175]*[.BB175]; "") ->  | BM175: of:=IF([.BI175]; IF(([.BL175])>9999; TEXT(([.BL175])/1000; "#,##0")&" km"; TEXT([.BL175];"#,##0")&" m"); "") ->  | BN175: of:=IF([.BI175]; "("&[.BJ175]&"/"&[.BM175]&")"; "") ->  | BO175: of:=ISNUMBER(FIND("Flight"; [.A175])) -> false | BP175: of:=IF([.BO175]; INDEX(MOVEMENT_CHART_BASES_TEXT; MATCH(ATHLETICS+POWER_LEVEL; MOVEMENT_CHART_INDEXES;0)); "") ->  | BQ175: of:=IF([.BO175]; INDEX(MOVEMENT_CHART_SPRINTS; MATCH(ATHLETICS+POWER_LEVEL; MOVEMENT_CHART_INDEXES;0)); "") ->  | BR175: of:=IF([.BO175]; [.BQ175]*[.BB175]; "") ->  | BS175: of:=IF([.BO175]; IF(([.BR175])>9999; TEXT(([.BR175])/1000; "#,##0")&" km"; TEXT([.BR175];"#,##0")&" m"); "") ->  | BT175: of:=IF([.BO175]; "("&[.BP175]&"/"&[.BS175]&")"; "") ->  | BU175: of:=ISNUMBER(FIND("Teleportation"; [.A175])) -> false | BV175: of:=IF([.BU175]; INDEX(TELEPORTATION_CHART_BASES_TEXT; MATCH(POWER_LEVEL; TELEPORTATION_CHART_INDEXES; 0)); "") ->  | BW175: of:=IF([.BU175]; INDEX(TELEPORTATION_CHART_SPRINTS; MATCH(POWER_LEVEL; TELEPORTATION_CHART_INDEXES; 0)); "") ->  | BX175: of:=IF([.BU175]; [.BW175]*[.BB175]; "") ->  | BY175: of:=IF([.BU175]; IF(([.BX175])>9999; TEXT(([.BX175])/1000; "#,##0")&" km"; TEXT([.BX175];"#,##0")&" m"); "") ->  | BZ175: of:=IF([.BU175]; "("&[.BV175]&"/"&[.BY175]&")"; "") ->  | CA175: of:=ISNUMBER(FIND("Tunneling"; [.A175])) -> false | CB175: of:=IF([.CA175]; INDEX(MOVEMENT_CHART_BASES_TEXT; MATCH(ATHLETICS+POWER_LEVEL; MOVEMENT_CHART_INDEXES;0)); "") ->  | CC175: of:=IF([.CA175]; INDEX(MOVEMENT_CHART_SPRINTS; MATCH(ATHLETICS+POWER_LEVEL; MOVEMENT_CHART_INDEXES;0)); "") ->  | CD175: of:=IF([.CA175]; [.CC175]*[.BB175]; "") ->  | CE175: of:=IF([.CA175]; IF(([.CD175])>9999; TEXT(([.CD175])/1000; "#,##0")&" km"; TEXT([.CD175];"#,##0")&" m"); "") ->  | CF175: of:=IF([.CA175]; "("&[.CB175]&"/"&[.CE175]&")"; "") ->  | CG175: of:=AND(ISNUMBER(FIND("Super Endurance"; [.A175]))) -> false | CH175: of:=AND(ISNUMBER(FIND("Super Health"; [.A175]))) -> false | CI175: of:=AND(ISNUMBER(FIND("Super Reflection"; [.A175]))) -> false | CJ175: of:=AND(ISNUMBER(FIND("Super Strength"; [.A175]))) -> false | CK175: of:=ISNUMBER(FIND("Alteration Resistance"; [.A175])) -> false | CL175: of:=IF([.CK175]; ALTERATION_RESISTANCE_TEXT; "") ->  | CM175: of:=ISNUMBER(FIND("Damage Resistance"; [.A175])) -> false | CN175: of:=IF([.CM175]; DAMAGE_RESISTANCE_TEXT; "") ->  | CO175: of:=ISNUMBER(FIND("Mental Resistance"; [.A175])) -> false | CP175: of:=IF([.CO175]; MENTAL_RESISTANCE_TEXT; "") ->  | CQ175: of:=ISNUMBER(FIND("Bulletproof"; [.A175])) -> false | CR175: of:=IF([.CQ175]; "Unaffected by ordinary weapons Equipment Level "&POWER_LEVEL&" and lower"; "") ->  | CS175: of:=ISNUMBER(FIND("Density Control"; [.A175])) -> false | CT175: of:=IF([.CS175]; INDEX(DENSITY_CONTROL_CHART; POWER_LEVEL; 4); "") ->  | CU175: of:=ISNUMBER(FIND("Duplication"; [.A175])) -> false | CV175: of:=IF([.CU175]; INDEX(DUPLICATION_CHART; POWER_LEVEL; 3); "") ->  | CW175: of:=ISNUMBER(FIND("Growth"; [.A175])) -> false | CX175: of:=IF([.CW175]; INDEX(GROWTH_CHART; POWER_LEVEL; 6); "") ->  | CY175: of:=ISNUMBER(FIND("Extra Actions"; [.A175])) -> false | CZ175: of:=IF([.CY175]; POWER_LEVEL&" extra actions per scene"; "") ->  | DA175: of:=ISNUMBER(FIND("Haste"; [.A175])) -> false | DB175: of:=IF([.DA175]; INDEX(HASTE_CHART; POWER_LEVEL; 3); "") ->  | DC175: of:=ISNUMBER(FIND("Shrinking"; [.A175])) -> false | DD175: of:=IF([.DC175]; INDEX(SHRINKING_CHART; POWER_LEVEL; 4); "") ->  | DE175: of:=ISNUMBER(FIND("Stretching"; [.A175])) -> false | DF175: of:=IF([.DE175]; INDEX(STRETCHING_CHART; POWER_LEVEL; 2)&" reach"; "") ->  | DG175: of:=[.CL175]&[.CN175]&[.CP175]&[.CR175]&[.CT175]&[.CV175]&[.CX175]&[.CZ175]&[.DB175]&[.DD175]&[.DF175] ->  | DH175: of:=ISNUMBER(FIND("[Element]"; [.A175])) -> true | DI175: of:=ISNUMBER(FIND("[Subject]"; [.A175])) -> false | DJ175: of:=ISNUMBER(FIND("[Transformation]"; [.A175])) -> false | DM175: of:=IF([.B175]; [.AD175]; FALSE()) -> false | DN175: of:=IF(AND([.B175]; [.AG175]>[.DN174]); [.AG175]; N([.DN174])) -> 10 | DO175: of:=IF([.B175]; [.AN175]; FALSE()) -> false | DP175: of:=IF([.B175]; [.AR175]; FALSE()) -> false | DQ175: of:=IF(AND([.B175]; [.AS175]>[.DQ174]); [.AS175]; N([.DQ174])) -> 100 | DR175: of:=IF([.B175]; [.AX175]; FALSE()) -> false | DS175: of:=IF(AND([.B175]; [.BB175]>[.DS174]); [.BB175]; N([.DS174])) -> 10000000000 | DT175: of:=IF([.T175]; COM.MICROSOFT.TEXTJOIN(", "; 1; [.AA175]; [.AL175]; [.AL175]; [.AZ175]; [.AZ175]; [.AC175]); "") -> Standard action, Ranged (600 m/1,000 m), Ranged (600 m/1,000 m), Environmental power | DU175: of:=COM.MICROSOFT.TEXTJOIN("; "; TRUE(); [.Z175]; [.DG175]) ->  | DV175: of:=IF([.T175]; [.V175]; 0) -> 10 | DW175: of:=IF(AND([.AD175]; NOT([.AE175])); 1; 0) + INDEX(MULTIPLIER_CHART_INDEXES; MATCH([.AG175]; MULTIPLIER_CHART_MULTIPLIERS;0)) -> 0 | DX175: of:=IF([.AN175]; 1; 0) -> 0 | DY175: of:=IF(AND(NOT([.AQ175]); [.AR175]); 1; 0) + INDEX(MULTIPLIER_CHART_INDEXES; MATCH([.AS175]; MULTIPLIER_CHART_MULTIPLIERS;0)) -> 0 | DZ175: of:=IF([.AY175]; 1; 0) -> 0 | EA175: of:=INDEX(MULTIPLIER_CHART_INDEXES; MATCH([.BB175]; MULTIPLIER_CHART_MULTIPLIERS;0)) -> 0 | EB175: of:=SUM([.DV175:.EA175]) -> 10 | EC175: of:=IF([.T175]; [.Y175]&CHAR(13)&CHAR(10)&[.DT175]&CHAR(13)&CHAR(10)&[.DU175]&CHAR(13)&CHAR(10)&VLOOKUP( [.A175]; POWER_CHART; 11; FALSE())&CHAR(13)&CHAR(10)&CHAR(13)&CHAR(10); "") -> [Element] Wall
Standard action, Ranged (600 m/1,000 m), Ranged (600 m/1,000 m), Environmental power

23


A176: of:=IF([Powers.C17]=""; ""; [Powers.C17]) -> Sense [Element] | B176: of:=IF(ISNUMBER(FIND("Ultra-power"; [.A176])); TRUE(); FALSE()) -> false | C176: of:=IF(TRIM([.A176])=""; 0; INDEX(POWER_CHART_INDEXES; MATCH([.A176]; POWER_CHART_NAMES; 0))) -> 56 | D176: of:=IF([.C176]; 1; 0) + N([.D175]) -> 12 | E176: of:=IF(AND([.B176]; SELECTED_POWER_COUNT<4); FALSE(); TRUE()) -> true | F176: of:=IF(AND([.B176]; [.E176]); TRUE(); FALSE()) -> false | G176: of:=IF(N([.C176]); IFERROR(T(INDEX(POWER_CHART_PREREQ_1; MATCH([.C176]; POWER_CHART_INDEXES; 0))); ""); "") ->  | H176: of:=IF(OR([.B176]; [.G176]=""); 0; INDEX(POWER_CHART_INDEXES; MATCH([.G176]; POWER_CHART_NAMES; 0))) -> 0 | I176: of:=IF([.H176]=0; TRUE(); COUNTIF(POWER_CALC_SELECTED_INDEXES; [.H176])) -> true | J176: of:=IF(N([.C176]); IFERROR(T(INDEX(POWER_CHART_PREREQ_2; MATCH([.C176]; POWER_CHART_INDEXES; 0))); ""); "") ->  | K176: of:=IF(OR([.B176]; [.J176]=""); 0; INDEX(POWER_CHART_INDEXES; MATCH([.J176]; POWER_CHART_NAMES; 0))) -> 0 | L176: of:=IF([.K176]=0; TRUE(); COUNTIF(POWER_CALC_SELECTED_INDEXES; [.K176])) -> true | M176: of:=IF(N([.C176]); IFERROR(T(INDEX(POWER_CHART_PREREQ_3; MATCH([.C176]; POWER_CHART_INDEXES; 0))); ""); "") ->  | N176: of:=IF(OR([.B176]; [.M176]=""); 0; INDEX(POWER_CHART_INDEXES; MATCH([.M176]; POWER_CHART_NAMES; 0))) -> 0 | O176: of:=IF([.N176]=0; TRUE(); COUNTIF(POWER_CALC_SELECTED_INDEXES; [.N176])) -> true | P176: of:=IF(AND([.I176]; [.L176]; [.O176]); TRUE(); FALSE()) -> true | Q176: of:=IF(NOT([.P176]); "Purchase a prerequisite for "&[.A176]&" ("&COM.MICROSOFT.TEXTJOIN(" or "; 1; [.G176]; [.J176]; [.M176])&")."&CHAR(13)&CHAR(10); "") ->  | R176: of:=IF([.A176]=""; FALSE(); IF([.P176]; TRUE(); FALSE())) -> true | T176: of:=IF([.A176]=""; FALSE(); IF([.P176]; TRUE(); FALSE())) -> true | U176: of:=IF([.T176]; [.C176]; 0) -> 56 | V176: of:=[.T176] + N([.V175]) -> 11 | W176: of:=IF(AND([.T176]; NOT([Powers.E17]="")); [Powers.E17]; "") ->  | X176: of:=IF([.B176]; IF([Powers.E17]=""; ""; IF([Powers.E17]="Ultra-power"; ""; [Powers.E17])); [.X175]) ->  | Y176: of:=IF(AND([.T176]; OR([.W176]=""; [.B176])); [.A176]; [.W176]) -> Sense [Element] | Z176: of:=IF(AND([.T176]; NOT([Powers.F17]="")); [Powers.F17]; "") ->  | AA176: of:=IF([.T176]; IFERROR(T(INDEX(POWER_CHART_ACTIONS; MATCH([.C176]; POWER_CHART_INDEXES; 0))); ""); "") -> Quick action | AB176: of:=IF([.T176]; INDEX(POWER_CHART_ATTACKS; MATCH([.C176]; POWER_CHART_INDEXES; 0)); FALSE()) -> false | AC176: of:=IF([.T176]; INDEX(POWER_CHART_TYPES; MATCH([.C176]; POWER_CHART_INDEXES; 0))&" "&IF([.AB176]; "attack"; "power"); "") -> Personal power | AD176: of:=IF(AND([.T176]; [Powers.H17]="Y"); TRUE(); FALSE()) -> false | AE176: of:=IF([.T176]; IF(INDEX(POWER_CHART_RANGES;MATCH([.C176];POWER_CHART_INDEXES;0))="Ranged";TRUE();FALSE())) -> false | AF176: of:=OR([.AD176];[.AE176]) -> false | AG176: of:=IF([.T176]; RIGHT([Powers.P17]; LEN([Powers.P17])-1)*1; 1) -> 1 | AH176: of:=IF([.AF176]; INDEX(POWER_LEVEL_CHART_RANGES_TEXT; MATCH(POWER_LEVEL-1; POWER_LEVEL_CHART_INDEXES;0)); "") ->  | AI176: of:=IF([.AF176]; INDEX(POWER_LEVEL_CHART_RANGES; MATCH(POWER_LEVEL; POWER_LEVEL_CHART_INDEXES;0)); "") ->  | AJ176: of:=IF([.AF176]; [.AI176]*[.AG176]; "") ->  | AK176: of:=IF([.AF176]; IF(([.AJ176])>9999; TEXT(([.AJ176])/1000; "#,##0")&" km"; TEXT([.AJ176];"#,##0")&" m"); "") ->  | AL176: of:=IF([.AF176]; "Ranged ("&[.AH176]&"/"&[.AK176]&")"; "") ->  | AM176: of:=IF(AND([.T176]; [Powers.L17]="Y"); TRUE(); FALSE()) -> false | AN176: of:=IF(AND([.AM176]; OR(ISNUMBER(FIND("attack"; [.AC176])); ISNUMBER(FIND("Ultra-power"; [.A176])))); TRUE(); FALSE()) -> false | AO176: of:=IF([.AN176];", Seeking";"") ->  | AP176: of:=IF(AND([.T176]; [Powers.J17]="Y"); TRUE(); FALSE()) -> false | AQ176: of:=IF([.T176]; IF(INDEX(POWER_CHART_AREAS; MATCH([.C176]; POWER_CHART_INDEXES; 0))="Area"; TRUE(); FALSE())) -> false | AR176: of:=OR([.AP176];[.AQ176]) -> false | AS176: of:=IF([.T176]; RIGHT([Powers.R17]; LEN([Powers.R17])-1)*1; 1) -> 1 | AT176: of:=IF([.AR176]; INDEX(POWER_LEVEL_CHART_AREAS; MATCH(POWER_LEVEL; POWER_LEVEL_CHART_INDEXES;0)); "") ->  | AU176: of:=IF([.AR176]; [.AS176]*[.AT176]; "") ->  | AV176: of:=IF([.AR176]; IF(([.AU176])>9999; TEXT(([.AU176])/1000; "#,##0")&" km radius"; TEXT([.AU176];"#,##0")&" m radius"); "") ->  | AW176: of:=IF([.AR176]; "Area ("&[.AV176]&")"; "") ->  | AX176: of:=IF(AND([.T176]; [Powers.N17]="Y"); TRUE(); FALSE()) -> false | AY176: of:=IF([.AX176]) -> false | AZ176: of:=IF([.AY176];", Selective";"") ->  | BA176: of:=ISNUMBER(FIND("Movement"; [.AC176])) -> false | BB176: of:=IF(OR([.BA176]; [.B176]); RIGHT([Powers.T17]; LEN([Powers.T17])-1)*1; 1) -> 1 | BC176: of:=ISNUMBER(FIND("Super Running"; [.A176])) -> false | BD176: of:=IF([.BC176]; INDEX(MOVEMENT_CHART_BASES_TEXT; MATCH(ATHLETICS+POWER_LEVEL; MOVEMENT_CHART_INDEXES;0)); "") ->  | BE176: of:=IF([.BC176]; INDEX(MOVEMENT_CHART_SPRINTS; MATCH(ATHLETICS+POWER_LEVEL; MOVEMENT_CHART_INDEXES;0)); "") ->  | BF176: of:=IF([.BC176]; [.BE176]*[.BB176]; "") ->  | BG176: of:=IF([.BC176]; IF(([.BF176])>9999; TEXT(([.BF176])/1000; "#,##0")&" km"; TEXT([.BF176];"#,##0")&" m"); "") ->  | BH176: of:=IF([.BC176]; "("&[.BD176]&"/"&[.BG176]&")"; "") ->  | BI176: of:=AND(ISNUMBER(FIND("Super Swimming"; [.A176]))) -> false | BJ176: of:=IF([.BI176]; INDEX(MOVEMENT_CHART_BASES_TEXT; MATCH(ATHLETICS+POWER_LEVEL; MOVEMENT_CHART_INDEXES;0)); "") ->  | BK176: of:=IF([.BI176]; INDEX(MOVEMENT_CHART_SPRINTS; MATCH(ATHLETICS+POWER_LEVEL; MOVEMENT_CHART_INDEXES;0)); "") ->  | BL176: of:=IF([.BI176]; [.BK176]*[.BB176]; "") ->  | BM176: of:=IF([.BI176]; IF(([.BL176])>9999; TEXT(([.BL176])/1000; "#,##0")&" km"; TEXT([.BL176];"#,##0")&" m"); "") ->  | BN176: of:=IF([.BI176]; "("&[.BJ176]&"/"&[.BM176]&")"; "") ->  | BO176: of:=ISNUMBER(FIND("Flight"; [.A176])) -> false | BP176: of:=IF([.BO176]; INDEX(MOVEMENT_CHART_BASES_TEXT; MATCH(ATHLETICS+POWER_LEVEL; MOVEMENT_CHART_INDEXES;0)); "") ->  | BQ176: of:=IF([.BO176]; INDEX(MOVEMENT_CHART_SPRINTS; MATCH(ATHLETICS+POWER_LEVEL; MOVEMENT_CHART_INDEXES;0)); "") ->  | BR176: of:=IF([.BO176]; [.BQ176]*[.BB176]; "") ->  | BS176: of:=IF([.BO176]; IF(([.BR176])>9999; TEXT(([.BR176])/1000; "#,##0")&" km"; TEXT([.BR176];"#,##0")&" m"); "") ->  | BT176: of:=IF([.BO176]; "("&[.BP176]&"/"&[.BS176]&")"; "") ->  | BU176: of:=ISNUMBER(FIND("Teleportation"; [.A176])) -> false | BV176: of:=IF([.BU176]; INDEX(TELEPORTATION_CHART_BASES_TEXT; MATCH(POWER_LEVEL; TELEPORTATION_CHART_INDEXES; 0)); "") ->  | BW176: of:=IF([.BU176]; INDEX(TELEPORTATION_CHART_SPRINTS; MATCH(POWER_LEVEL; TELEPORTATION_CHART_INDEXES; 0)); "") ->  | BX176: of:=IF([.BU176]; [.BW176]*[.BB176]; "") ->  | BY176: of:=IF([.BU176]; IF(([.BX176])>9999; TEXT(([.BX176])/1000; "#,##0")&" km"; TEXT([.BX176];"#,##0")&" m"); "") ->  | BZ176: of:=IF([.BU176]; "("&[.BV176]&"/"&[.BY176]&")"; "") ->  | CA176: of:=ISNUMBER(FIND("Tunneling"; [.A176])) -> false | CB176: of:=IF([.CA176]; INDEX(MOVEMENT_CHART_BASES_TEXT; MATCH(ATHLETICS+POWER_LEVEL; MOVEMENT_CHART_INDEXES;0)); "") ->  | CC176: of:=IF([.CA176]; INDEX(MOVEMENT_CHART_SPRINTS; MATCH(ATHLETICS+POWER_LEVEL; MOVEMENT_CHART_INDEXES;0)); "") ->  | CD176: of:=IF([.CA176]; [.CC176]*[.BB176]; "") ->  | CE176: of:=IF([.CA176]; IF(([.CD176])>9999; TEXT(([.CD176])/1000; "#,##0")&" km"; TEXT([.CD176];"#,##0")&" m"); "") ->  | CF176: of:=IF([.CA176]; "("&[.CB176]&"/"&[.CE176]&")"; "") ->  | CG176: of:=AND(ISNUMBER(FIND("Super Endurance"; [.A176]))) -> false | CH176: of:=AND(ISNUMBER(FIND("Super Health"; [.A176]))) -> false | CI176: of:=AND(ISNUMBER(FIND("Super Reflection"; [.A176]))) -> false | CJ176: of:=AND(ISNUMBER(FIND("Super Strength"; [.A176]))) -> false | CK176: of:=ISNUMBER(FIND("Alteration Resistance"; [.A176])) -> false | CL176: of:=IF([.CK176]; ALTERATION_RESISTANCE_TEXT; "") ->  | CM176: of:=ISNUMBER(FIND("Damage Resistance"; [.A176])) -> false | CN176: of:=IF([.CM176]; DAMAGE_RESISTANCE_TEXT; "") ->  | CO176: of:=ISNUMBER(FIND("Mental Resistance"; [.A176])) -> false | CP176: of:=IF([.CO176]; MENTAL_RESISTANCE_TEXT; "") ->  | CQ176: of:=ISNUMBER(FIND("Bulletproof"; [.A176])) -> false | CR176: of:=IF([.CQ176]; "Unaffected by ordinary weapons Equipment Level "&POWER_LEVEL&" and lower"; "") ->  | CS176: of:=ISNUMBER(FIND("Density Control"; [.A176])) -> false | CT176: of:=IF([.CS176]; INDEX(DENSITY_CONTROL_CHART; POWER_LEVEL; 4); "") ->  | CU176: of:=ISNUMBER(FIND("Duplication"; [.A176])) -> false | CV176: of:=IF([.CU176]; INDEX(DUPLICATION_CHART; POWER_LEVEL; 3); "") ->  | CW176: of:=ISNUMBER(FIND("Growth"; [.A176])) -> false | CX176: of:=IF([.CW176]; INDEX(GROWTH_CHART; POWER_LEVEL; 6); "") ->  | CY176: of:=ISNUMBER(FIND("Extra Actions"; [.A176])) -> false | CZ176: of:=IF([.CY176]; POWER_LEVEL&" extra actions per scene"; "") ->  | DA176: of:=ISNUMBER(FIND("Haste"; [.A176])) -> false | DB176: of:=IF([.DA176]; INDEX(HASTE_CHART; POWER_LEVEL; 3); "") ->  | DC176: of:=ISNUMBER(FIND("Shrinking"; [.A176])) -> false | DD176: of:=IF([.DC176]; INDEX(SHRINKING_CHART; POWER_LEVEL; 4); "") ->  | DE176: of:=ISNUMBER(FIND("Stretching"; [.A176])) -> false | DF176: of:=IF([.DE176]; INDEX(STRETCHING_CHART; POWER_LEVEL; 2)&" reach"; "") ->  | DG176: of:=[.CL176]&[.CN176]&[.CP176]&[.CR176]&[.CT176]&[.CV176]&[.CX176]&[.CZ176]&[.DB176]&[.DD176]&[.DF176] ->  | DH176: of:=ISNUMBER(FIND("[Element]"; [.A176])) -> true | DI176: of:=ISNUMBER(FIND("[Subject]"; [.A176])) -> false | DJ176: of:=ISNUMBER(FIND("[Transformation]"; [.A176])) -> false | DM176: of:=IF([.B176]; [.AD176]; FALSE()) -> false | DN176: of:=IF(AND([.B176]; [.AG176]>[.DN175]); [.AG176]; N([.DN175])) -> 10 | DO176: of:=IF([.B176]; [.AN176]; FALSE()) -> false | DP176: of:=IF([.B176]; [.AR176]; FALSE()) -> false | DQ176: of:=IF(AND([.B176]; [.AS176]>[.DQ175]); [.AS176]; N([.DQ175])) -> 100 | DR176: of:=IF([.B176]; [.AX176]; FALSE()) -> false | DS176: of:=IF(AND([.B176]; [.BB176]>[.DS175]); [.BB176]; N([.DS175])) -> 10000000000 | DT176: of:=IF([.T176]; COM.MICROSOFT.TEXTJOIN(", "; 1; [.AA176]; [.AL176]; [.AL176]; [.AZ176]; [.AZ176]; [.AC176]); "") -> Quick action, Personal power | DU176: of:=COM.MICROSOFT.TEXTJOIN("; "; TRUE(); [.Z176]; [.DG176]) ->  | DV176: of:=IF([.T176]; [.V176]; 0) -> 11 | DW176: of:=IF(AND([.AD176]; NOT([.AE176])); 1; 0) + INDEX(MULTIPLIER_CHART_INDEXES; MATCH([.AG176]; MULTIPLIER_CHART_MULTIPLIERS;0)) -> 0 | DX176: of:=IF([.AN176]; 1; 0) -> 0 | DY176: of:=IF(AND(NOT([.AQ176]); [.AR176]); 1; 0) + INDEX(MULTIPLIER_CHART_INDEXES; MATCH([.AS176]; MULTIPLIER_CHART_MULTIPLIERS;0)) -> 0 | DZ176: of:=IF([.AY176]; 1; 0) -> 0 | EA176: of:=INDEX(MULTIPLIER_CHART_INDEXES; MATCH([.BB176]; MULTIPLIER_CHART_MULTIPLIERS;0)) -> 0 | EB176: of:=SUM([.DV176:.EA176]) -> 11 | EC176: of:=IF([.T176]; [.Y176]&CHAR(13)&CHAR(10)&[.DT176]&CHAR(13)&CHAR(10)&[.DU176]&CHAR(13)&CHAR(10)&VLOOKUP( [.A176]; POWER_CHART; 11; FALSE())&CHAR(13)&CHAR(10)&CHAR(13)&CHAR(10); "") -> Sense [Element]
Quick action, Personal power

56


A177: of:=IF([Powers.C18]=""; ""; [Powers.C18]) -> [Transformation] Ray | B177: of:=IF(ISNUMBER(FIND("Ultra-power"; [.A177])); TRUE(); FALSE()) -> false | C177: of:=IF(TRIM([.A177])=""; 0; INDEX(POWER_CHART_INDEXES; MATCH([.A177]; POWER_CHART_NAMES; 0))) -> 78 | D177: of:=IF([.C177]; 1; 0) + N([.D176]) -> 13 | E177: of:=IF(AND([.B177]; SELECTED_POWER_COUNT<4); FALSE(); TRUE()) -> true | F177: of:=IF(AND([.B177]; [.E177]); TRUE(); FALSE()) -> false | G177: of:=IF(N([.C177]); IFERROR(T(INDEX(POWER_CHART_PREREQ_1; MATCH([.C177]; POWER_CHART_INDEXES; 0))); ""); "") ->  | H177: of:=IF(OR([.B177]; [.G177]=""); 0; INDEX(POWER_CHART_INDEXES; MATCH([.G177]; POWER_CHART_NAMES; 0))) -> 0 | I177: of:=IF([.H177]=0; TRUE(); COUNTIF(POWER_CALC_SELECTED_INDEXES; [.H177])) -> true | J177: of:=IF(N([.C177]); IFERROR(T(INDEX(POWER_CHART_PREREQ_2; MATCH([.C177]; POWER_CHART_INDEXES; 0))); ""); "") ->  | K177: of:=IF(OR([.B177]; [.J177]=""); 0; INDEX(POWER_CHART_INDEXES; MATCH([.J177]; POWER_CHART_NAMES; 0))) -> 0 | L177: of:=IF([.K177]=0; TRUE(); COUNTIF(POWER_CALC_SELECTED_INDEXES; [.K177])) -> true | M177: of:=IF(N([.C177]); IFERROR(T(INDEX(POWER_CHART_PREREQ_3; MATCH([.C177]; POWER_CHART_INDEXES; 0))); ""); "") ->  | N177: of:=IF(OR([.B177]; [.M177]=""); 0; INDEX(POWER_CHART_INDEXES; MATCH([.M177]; POWER_CHART_NAMES; 0))) -> 0 | O177: of:=IF([.N177]=0; TRUE(); COUNTIF(POWER_CALC_SELECTED_INDEXES; [.N177])) -> true | P177: of:=IF(AND([.I177]; [.L177]; [.O177]); TRUE(); FALSE()) -> true | Q177: of:=IF(NOT([.P177]); "Purchase a prerequisite for "&[.A177]&" ("&COM.MICROSOFT.TEXTJOIN(" or "; 1; [.G177]; [.J177]; [.M177])&")."&CHAR(13)&CHAR(10); "") ->  | R177: of:=IF([.A177]=""; FALSE(); IF([.P177]; TRUE(); FALSE())) -> true | T177: of:=IF([.A177]=""; FALSE(); IF([.P177]; TRUE(); FALSE())) -> true | U177: of:=IF([.T177]; [.C177]; 0) -> 78 | V177: of:=[.T177] + N([.V176]) -> 12 | W177: of:=IF(AND([.T177]; NOT([Powers.E18]="")); [Powers.E18]; "") -> sr cn | X177: of:=IF([.B177]; IF([Powers.E18]=""; ""; IF([Powers.E18]="Ultra-power"; ""; [Powers.E18])); [.X176]) ->  | Y177: of:=IF(AND([.T177]; OR([.W177]=""; [.B177])); [.A177]; [.W177]) -> sr cn | Z177: of:=IF(AND([.T177]; NOT([Powers.F18]="")); [Powers.F18]; "") -> sr n | AA177: of:=IF([.T177]; IFERROR(T(INDEX(POWER_CHART_ACTIONS; MATCH([.C177]; POWER_CHART_INDEXES; 0))); ""); "") -> Standard action | AB177: of:=IF([.T177]; INDEX(POWER_CHART_ATTACKS; MATCH([.C177]; POWER_CHART_INDEXES; 0)); FALSE()) -> true | AC177: of:=IF([.T177]; INDEX(POWER_CHART_TYPES; MATCH([.C177]; POWER_CHART_INDEXES; 0))&" "&IF([.AB177]; "attack"; "power"); "") -> Alteration attack | AD177: of:=IF(AND([.T177]; [Powers.H18]="Y"); TRUE(); FALSE()) -> true | AE177: of:=IF([.T177]; IF(INDEX(POWER_CHART_RANGES;MATCH([.C177];POWER_CHART_INDEXES;0))="Ranged";TRUE();FALSE())) -> true | AF177: of:=OR([.AD177];[.AE177]) -> true | AG177: of:=IF([.T177]; RIGHT([Powers.P18]; LEN([Powers.P18])-1)*1; 1) -> 100000 | AH177: of:=IF([.AF177]; INDEX(POWER_LEVEL_CHART_RANGES_TEXT; MATCH(POWER_LEVEL-1; POWER_LEVEL_CHART_INDEXES;0)); "") -> 600 m | AI177: of:=IF([.AF177]; INDEX(POWER_LEVEL_CHART_RANGES; MATCH(POWER_LEVEL; POWER_LEVEL_CHART_INDEXES;0)); "") -> 1000 | AJ177: of:=IF([.AF177]; [.AI177]*[.AG177]; "") -> 100000000 | AK177: of:=IF([.AF177]; IF(([.AJ177])>9999; TEXT(([.AJ177])/1000; "#,##0")&" km"; TEXT([.AJ177];"#,##0")&" m"); "") -> 100,000 km | AL177: of:=IF([.AF177]; "Ranged ("&[.AH177]&"/"&[.AK177]&")"; "") -> Ranged (600 m/100,000 km) | AM177: of:=IF(AND([.T177]; [Powers.L18]="Y"); TRUE(); FALSE()) -> true | AN177: of:=IF(AND([.AM177]; OR(ISNUMBER(FIND("attack"; [.AC177])); ISNUMBER(FIND("Ultra-power"; [.A177])))); TRUE(); FALSE()) -> true | AO177: of:=IF([.AN177];", Seeking";"") -> , Seeking | AP177: of:=IF(AND([.T177]; [Powers.J18]="Y"); TRUE(); FALSE()) -> true | AQ177: of:=IF([.T177]; IF(INDEX(POWER_CHART_AREAS; MATCH([.C177]; POWER_CHART_INDEXES; 0))="Area"; TRUE(); FALSE())) -> false | AR177: of:=OR([.AP177];[.AQ177]) -> true | AS177: of:=IF([.T177]; RIGHT([Powers.R18]; LEN([Powers.R18])-1)*1; 1) -> 10 | AT177: of:=IF([.AR177]; INDEX(POWER_LEVEL_CHART_AREAS; MATCH(POWER_LEVEL; POWER_LEVEL_CHART_INDEXES;0)); "") -> 10 | AU177: of:=IF([.AR177]; [.AS177]*[.AT177]; "") -> 100 | AV177: of:=IF([.AR177]; IF(([.AU177])>9999; TEXT(([.AU177])/1000; "#,##0")&" km radius"; TEXT([.AU177];"#,##0")&" m radius"); "") -> 100 m radius | AW177: of:=IF([.AR177]; "Area ("&[.AV177]&")"; "") -> Area (100 m radius) | AX177: of:=IF(AND([.T177]; [Powers.N18]="Y"); TRUE(); FALSE()) -> true | AY177: of:=IF([.AX177]) -> true | AZ177: of:=IF([.AY177];", Selective";"") -> , Selective | BA177: of:=ISNUMBER(FIND("Movement"; [.AC177])) -> false | BB177: of:=IF(OR([.BA177]; [.B177]); RIGHT([Powers.T18]; LEN([Powers.T18])-1)*1; 1) -> 1 | BC177: of:=ISNUMBER(FIND("Super Running"; [.A177])) -> false | BD177: of:=IF([.BC177]; INDEX(MOVEMENT_CHART_BASES_TEXT; MATCH(ATHLETICS+POWER_LEVEL; MOVEMENT_CHART_INDEXES;0)); "") ->  | BE177: of:=IF([.BC177]; INDEX(MOVEMENT_CHART_SPRINTS; MATCH(ATHLETICS+POWER_LEVEL; MOVEMENT_CHART_INDEXES;0)); "") ->  | BF177: of:=IF([.BC177]; [.BE177]*[.BB177]; "") ->  | BG177: of:=IF([.BC177]; IF(([.BF177])>9999; TEXT(([.BF177])/1000; "#,##0")&" km"; TEXT([.BF177];"#,##0")&" m"); "") ->  | BH177: of:=IF([.BC177]; "("&[.BD177]&"/"&[.BG177]&")"; "") ->  | BI177: of:=AND(ISNUMBER(FIND("Super Swimming"; [.A177]))) -> false | BJ177: of:=IF([.BI177]; INDEX(MOVEMENT_CHART_BASES_TEXT; MATCH(ATHLETICS+POWER_LEVEL; MOVEMENT_CHART_INDEXES;0)); "") ->  | BK177: of:=IF([.BI177]; INDEX(MOVEMENT_CHART_SPRINTS; MATCH(ATHLETICS+POWER_LEVEL; MOVEMENT_CHART_INDEXES;0)); "") ->  | BL177: of:=IF([.BI177]; [.BK177]*[.BB177]; "") ->  | BM177: of:=IF([.BI177]; IF(([.BL177])>9999; TEXT(([.BL177])/1000; "#,##0")&" km"; TEXT([.BL177];"#,##0")&" m"); "") ->  | BN177: of:=IF([.BI177]; "("&[.BJ177]&"/"&[.BM177]&")"; "") ->  | BO177: of:=ISNUMBER(FIND("Flight"; [.A177])) -> false | BP177: of:=IF([.BO177]; INDEX(MOVEMENT_CHART_BASES_TEXT; MATCH(ATHLETICS+POWER_LEVEL; MOVEMENT_CHART_INDEXES;0)); "") ->  | BQ177: of:=IF([.BO177]; INDEX(MOVEMENT_CHART_SPRINTS; MATCH(ATHLETICS+POWER_LEVEL; MOVEMENT_CHART_INDEXES;0)); "") ->  | BR177: of:=IF([.BO177]; [.BQ177]*[.BB177]; "") ->  | BS177: of:=IF([.BO177]; IF(([.BR177])>9999; TEXT(([.BR177])/1000; "#,##0")&" km"; TEXT([.BR177];"#,##0")&" m"); "") ->  | BT177: of:=IF([.BO177]; "("&[.BP177]&"/"&[.BS177]&")"; "") ->  | BU177: of:=ISNUMBER(FIND("Teleportation"; [.A177])) -> false | BV177: of:=IF([.BU177]; INDEX(TELEPORTATION_CHART_BASES_TEXT; MATCH(POWER_LEVEL; TELEPORTATION_CHART_INDEXES; 0)); "") ->  | BW177: of:=IF([.BU177]; INDEX(TELEPORTATION_CHART_SPRINTS; MATCH(POWER_LEVEL; TELEPORTATION_CHART_INDEXES; 0)); "") ->  | BX177: of:=IF([.BU177]; [.BW177]*[.BB177]; "") ->  | BY177: of:=IF([.BU177]; IF(([.BX177])>9999; TEXT(([.BX177])/1000; "#,##0")&" km"; TEXT([.BX177];"#,##0")&" m"); "") ->  | BZ177: of:=IF([.BU177]; "("&[.BV177]&"/"&[.BY177]&")"; "") ->  | CA177: of:=ISNUMBER(FIND("Tunneling"; [.A177])) -> false | CB177: of:=IF([.CA177]; INDEX(MOVEMENT_CHART_BASES_TEXT; MATCH(ATHLETICS+POWER_LEVEL; MOVEMENT_CHART_INDEXES;0)); "") ->  | CC177: of:=IF([.CA177]; INDEX(MOVEMENT_CHART_SPRINTS; MATCH(ATHLETICS+POWER_LEVEL; MOVEMENT_CHART_INDEXES;0)); "") ->  | CD177: of:=IF([.CA177]; [.CC177]*[.BB177]; "") ->  | CE177: of:=IF([.CA177]; IF(([.CD177])>9999; TEXT(([.CD177])/1000; "#,##0")&" km"; TEXT([.CD177];"#,##0")&" m"); "") ->  | CF177: of:=IF([.CA177]; "("&[.CB177]&"/"&[.CE177]&")"; "") ->  | CG177: of:=AND(ISNUMBER(FIND("Super Endurance"; [.A177]))) -> false | CH177: of:=AND(ISNUMBER(FIND("Super Health"; [.A177]))) -> false | CI177: of:=AND(ISNUMBER(FIND("Super Reflection"; [.A177]))) -> false | CJ177: of:=AND(ISNUMBER(FIND("Super Strength"; [.A177]))) -> false | CK177: of:=ISNUMBER(FIND("Alteration Resistance"; [.A177])) -> false | CL177: of:=IF([.CK177]; ALTERATION_RESISTANCE_TEXT; "") ->  | CM177: of:=ISNUMBER(FIND("Damage Resistance"; [.A177])) -> false | CN177: of:=IF([.CM177]; DAMAGE_RESISTANCE_TEXT; "") ->  | CO177: of:=ISNUMBER(FIND("Mental Resistance"; [.A177])) -> false | CP177: of:=IF([.CO177]; MENTAL_RESISTANCE_TEXT; "") ->  | CQ177: of:=ISNUMBER(FIND("Bulletproof"; [.A177])) -> false | CR177: of:=IF([.CQ177]; "Unaffected by ordinary weapons Equipment Level "&POWER_LEVEL&" and lower"; "") ->  | CS177: of:=ISNUMBER(FIND("Density Control"; [.A177])) -> false | CT177: of:=IF([.CS177]; INDEX(DENSITY_CONTROL_CHART; POWER_LEVEL; 4); "") ->  | CU177: of:=ISNUMBER(FIND("Duplication"; [.A177])) -> false | CV177: of:=IF([.CU177]; INDEX(DUPLICATION_CHART; POWER_LEVEL; 3); "") ->  | CW177: of:=ISNUMBER(FIND("Growth"; [.A177])) -> false | CX177: of:=IF([.CW177]; INDEX(GROWTH_CHART; POWER_LEVEL; 6); "") ->  | CY177: of:=ISNUMBER(FIND("Extra Actions"; [.A177])) -> false | CZ177: of:=IF([.CY177]; POWER_LEVEL&" extra actions per scene"; "") ->  | DA177: of:=ISNUMBER(FIND("Haste"; [.A177])) -> false | DB177: of:=IF([.DA177]; INDEX(HASTE_CHART; POWER_LEVEL; 3); "") ->  | DC177: of:=ISNUMBER(FIND("Shrinking"; [.A177])) -> false | DD177: of:=IF([.DC177]; INDEX(SHRINKING_CHART; POWER_LEVEL; 4); "") ->  | DE177: of:=ISNUMBER(FIND("Stretching"; [.A177])) -> false | DF177: of:=IF([.DE177]; INDEX(STRETCHING_CHART; POWER_LEVEL; 2)&" reach"; "") ->  | DG177: of:=[.CL177]&[.CN177]&[.CP177]&[.CR177]&[.CT177]&[.CV177]&[.CX177]&[.CZ177]&[.DB177]&[.DD177]&[.DF177] ->  | DH177: of:=ISNUMBER(FIND("[Element]"; [.A177])) -> false | DI177: of:=ISNUMBER(FIND("[Subject]"; [.A177])) -> false | DJ177: of:=ISNUMBER(FIND("[Transformation]"; [.A177])) -> true | DM177: of:=IF([.B177]; [.AD177]; FALSE()) -> false | DN177: of:=IF(AND([.B177]; [.AG177]>[.DN176]); [.AG177]; N([.DN176])) -> 10 | DO177: of:=IF([.B177]; [.AN177]; FALSE()) -> false | DP177: of:=IF([.B177]; [.AR177]; FALSE()) -> false | DQ177: of:=IF(AND([.B177]; [.AS177]>[.DQ176]); [.AS177]; N([.DQ176])) -> 100 | DR177: of:=IF([.B177]; [.AX177]; FALSE()) -> false | DS177: of:=IF(AND([.B177]; [.BB177]>[.DS176]); [.BB177]; N([.DS176])) -> 10000000000 | DT177: of:=IF([.T177]; COM.MICROSOFT.TEXTJOIN(", "; 1; [.AA177]; [.AL177]; [.AL177]; [.AZ177]; [.AZ177]; [.AC177]); "") -> Standard action, Ranged (600 m/100,000 km), Ranged (600 m/100,000 km), , Selective, , Selective, Alteration attack | DU177: of:=COM.MICROSOFT.TEXTJOIN("; "; TRUE(); [.Z177]; [.DG177]) -> sr n | DV177: of:=IF([.T177]; [.V177]; 0) -> 12 | DW177: of:=IF(AND([.AD177]; NOT([.AE177])); 1; 0) + INDEX(MULTIPLIER_CHART_INDEXES; MATCH([.AG177]; MULTIPLIER_CHART_MULTIPLIERS;0)) -> 5 | DX177: of:=IF([.AN177]; 1; 0) -> 1 | DY177: of:=IF(AND(NOT([.AQ177]); [.AR177]); 1; 0) + INDEX(MULTIPLIER_CHART_INDEXES; MATCH([.AS177]; MULTIPLIER_CHART_MULTIPLIERS;0)) -> 2 | DZ177: of:=IF([.AY177]; 1; 0) -> 1 | EA177: of:=INDEX(MULTIPLIER_CHART_INDEXES; MATCH([.BB177]; MULTIPLIER_CHART_MULTIPLIERS;0)) -> 0 | EB177: of:=SUM([.DV177:.EA177]) -> 21 | EC177: of:=IF([.T177]; [.Y177]&CHAR(13)&CHAR(10)&[.DT177]&CHAR(13)&CHAR(10)&[.DU177]&CHAR(13)&CHAR(10)&VLOOKUP( [.A177]; POWER_CHART; 11; FALSE())&CHAR(13)&CHAR(10)&CHAR(13)&CHAR(10); "") -> sr cn
Standard action, Ranged (600 m/100,000 km), Ranged (600 m/100,000 km), , Selective, , Selective, Alteration attack
sr n
78


D178: of:=[.D177] -> 13 | F178: of:=OR([.B164:.B177]) -> true | Q178: of:=COM.MICROSOFT.CONCAT([.Q164:.Q177]) -> Purchase a prerequisite for Super Reflection (Reflection).
 | V178: of:=[.V177] -> 12 | X178: of:=IF([.X177]=[.$X$163]; ""; [.X177]) ->  | BC178: of:=OR([.BC164:.BC177]) -> false | BI178: of:=OR([.BI164:.BI177]) -> false | BO178: of:=OR([.BO164:.BO177]) -> false | BU178: of:=OR([.BU164:.BU177]) -> false | CA178: of:=OR([.CA164:.CA177]) -> false | CG178: of:=OR([.CG164:.CG177]) -> false | CH178: of:=OR([.CH164:.CH177]) -> false | CI178: of:=OR([.CI164:.CI177]) -> true | CJ178: of:=OR([.CJ164:.CJ177]) -> false | CK178: of:=OR([.CK164:.CK177]) -> false | CM178: of:=OR([.CM164:.CM177]) -> false | CO178: of:=OR([.CO164:.CO177]) -> false | CQ178: of:=OR([.CQ164:.CQ177]) -> false | CS178: of:=OR([.CS164:.CS177]) -> true | CU178: of:=OR([.CU164:.CU177]) -> true | CW178: of:=OR([.CW164:.CW177]) -> false | CY178: of:=OR([.CY164:.CY177]) -> false | DA178: of:=OR([.DA164:.DA177]) -> true | DC178: of:=OR([.DC164:.DC177]) -> true | DE178: of:=OR([.DE164:.DE177]) -> true | DH178: of:=OR([.DH164:.DH177]) -> true | DI178: of:=OR([.DI164:.DI177]) -> true | DJ178: of:=OR([.DJ164:.DJ177]) -> true | DM178: of:=OR([.DM164:.DM177]) -> true | DN178: of:=IF(NOT([.DN177]); 1; [.DN177]) -> 10 | DO178: of:=OR([.DO164:.DO177]) -> true | DP178: of:=OR([.DP164:.DP177]) -> true | DQ178: of:=IF(NOT([.DQ177]); 1; [.DQ177]) -> 100 | DR178: of:=OR([.DR164:.DR177]) -> true | DS178: of:=IF(NOT([.DS177]); 1; [.DS177]) -> 10000000000 | EB178: of:=SUM([.EB164:.EB177]) -> 119 | EC178: of:=COM.MICROSOFT.CONCAT([.EC164:.EC170]) -> Stretching
Quick action, Ranged (600 m/100 km), Ranged (600 m/100 km), Personal power
Oriental mysticism; 20 m reach
65

Density Control
Quick action, Personal power
Oriental mysticism; Mass 5,000 kg, Athletics +3
18

Psychic Invisibility
Quick action, Personal power
Oriental mysticism; 20 duplicates
20

Haste
Constant, Personal power
x2,000 multiplier
32

U-p cn
Quick action, Personal power
U-p n; Min height 20 μm, Athletics +3
58


B179: of:=IF(AND(HAS_ULTRA; HAS_POWER_COUNT<5); "Ultra-power requires four theme powers."&CHAR(13)&CHAR(10); "") ->  | X179: of:=IF([.X178]=""; "Specify the kind of Ultra-power in the Custom Name. For example, Ultra-power: Star Knight."&CHAR(13)&CHAR(10); "") -> Specify the kind of Ultra-power in the Custom Name. For example, Ultra-power: Star Knight.
 | DH179: of:=IF([.DH178]; "Specify the kind of [Element] in the Custom Name."&CHAR(13)&CHAR(10); "") -> Specify the kind of [Element] in the Custom Name.
 | DI179: of:=IF([.DI178]; "Specify the kind of [Subject] in the Custom Name."&CHAR(13)&CHAR(10); "") -> Specify the kind of [Subject] in the Custom Name.
 | DJ179: of:=IF([.DJ178]; "Specify the kind of [Transformation] in the Custom Name."&CHAR(13)&CHAR(10); "") -> Specify the kind of [Transformation] in the Custom Name.
 | EC179: of:=COM.MICROSOFT.CONCAT([.EC171:.EC177]) -> Ultra-power
Quick action, Ranged (600 m/10 km), Ranged (600 m/10 km), , Selective, , Selective, Personal power

81

Command [Subject]
Standard action, Ranged (600 m/1,000 m), Ranged (600 m/1,000 m), Mental attack

12

[Element] Form
Quick action, Personal power

21

[Element] Immunity
Constant, Personal power

22

[Element] Wall
Standard action, Ranged (600 m/1,000 m), Ranged (600 m/1,000 m), Environmental power

23

Sense [Element]
Quick action, Personal power

56

sr cn
Standard action, Ranged (600 m/100,000 km), Ranged (600 m/100,000 km), , Selective, , Selective, Alteration attack
sr n
78


DJ180: of:=COM.MICROSOFT.CONCAT([.Q178];[.DK179:.DL179]) -> Purchase a prerequisite for Super Reflection (Reflection).
 | EC180: of:=COM.MICROSOFT.CONCAT([.EC178:.EC179]) -> Stretching
Quick action, Ranged (600 m/100 km), Ranged (600 m/100 km), Personal power
Oriental mysticism; 20 m reach
65

Density Control
Quick action, Personal power
Oriental mysticism; Mass 5,000 kg, Athletics +3
18

Psychic Invisibility
Quick action, Personal power
Oriental mysticism; 20 duplicates
20

Haste
Constant, Personal power
x2,000 multiplier
32

U-p cn
Quick action, Personal power
U-p n; Min height 20 μm, Athletics +3
58

Ultra-power
Quick action, Ranged (600 m/10 km), Ranged (600 m/10 km), , Selective, , Selective, Personal power

81

Command [Subject]
Standard action, Ranged (600 m/1,000 m), Ranged (600 m/1,000 m), Mental attack

12

[Element] Form
Quick action, Personal power

21

[Element] Immunity
Constant, Personal power

22

[Element] Wall
Standard action, Ranged (600 m/1,000 m), Ranged (600 m/1,000 m), Environmental power

23

Sense [Element]
Quick action, Personal power

56

sr cn
Standard action, Ranged (600 m/100,000 km), Ranged (600 m/100,000 km), , Selective, , Selective, Alteration attack
sr n
78


A182: Ultra-power | B182: of:=TRIM([.$DN$179]&[.$DO$179]&[.$DQ$179]&[.$DR$179]) ->  | DJ182: XXX
A183: Selected | B183: (Blank Column) | C183: Power Index | D183: (Blank Column) | E183: (Blank Column) | F183: Has | G183: Prerequisite 1 | H183: Prereq 1 Index | I183: Prereq 1 Met | J183: Prerequisite 2 | K183: Prereq 2 Index | L183: Prereq 2 Met | M183: Prerequisite 3 | N183: Prereq 3 Index | O183: Prereq 3 Met | P183: Prereq Met | Q183: Prereq Warning | R183: Has | T183: Has | U183: Has Power Index | V183: (Blank Column) | W183: Custom Name | X183: (Blank Column) | Y183: Display Name | Z183: Note | AA183: Action | AB183: Attack | AC183: Type | AD183: Ranged Is Selected | AE183: Ranged Is Default | AF183: Is Ranged | AG183: xRanged Selected | AH183: Short Range Text | AI183: Default Long Range (m) | AJ183: Long Range (m) | AK183: Long Range Text | AL183: Range Text | AM183: Seeking Is Selected | AN183: Is Seeking | AO183: Seeking Text | AP183: Area Is Selected | AQ183: Area Is Default | AR183: Is Area | AS183: xArea Selected | AT183: Default Max Area (m) | AU183: Max Area (m) | AV183: Max Area Text | AW183: Area Text | AX183: Selective Is Selected | AY183: Is Selective | AZ183: Selective Text | BA183: Is Movement | BB183: xSprint Selected | BC183: Is Super Running | BD183: Base Running Text | BE183: Default Running Sprint (m) | BF183: Running Sprint (m) | BG183: Running Sprint Text | BH183: Running Text | BI183: Is Super Swimming | BJ183: Base Swimming Text | BK183: Default Swimming Sprint (m) | BL183: Swimming Sprint (m) | BM183: Swimming Sprint Text | BN183: Swimming Text | BO183: Is Flight | BP183: Base Flight Text | BQ183: Default Flight Sprint (m) | BR183: Flight Sprint (m) | BS183: Flight Sprint Text | BT183: Flight Text | BU183: Is Teleportation | BV183: Base Teleportation Text | BW183: Default Teleportation Sprint (m) | BX183: Teleportation Sprint (m) | BY183: Teleportation Sprint Text | BZ183: Teleportation Text | CA183: Is Tunneling | CB183: Base Tunneling Text | CC183: Default Tunneling Sprint (m) | CD183: Tunneling Sprint (m) | CE183: Tunneling Sprint Text | CF183: Tunneling Text | CG183: Is Super Endurance | CH183: Is Super Health | CI183: Is Super Reflection | CJ183: Is Super Strength | CK183: Is Alteration Resistance | CL183: Alteration Resistance Text | CM183: Is Damage Resistance | CN183: Damage Resistance Text | CO183: Is Mental Resistance | CP183: Mental Resistance Text | CQ183: Is Bulletproof | CR183: Bulletproof Text | CS183: Is Density Control | CT183: Density Control Text | CU183: Is Duplication | CV183: Duplication Text | CW183: Is Growth | CX183: Growth Text | CY183: Is Extra Actions | CZ183: Extra Actions Text | DA183: Is Haste | DB183: Haste Text | DC183: Is Shrinking | DD183: Shrinking Text | DE183: Is Stretching | DF183: Stretching Text | DG183: Text Concat | DH183: Is [Element] | DI183: Is [Subject] | DJ183: Is [Transformation] | DM183: (Blank Column) | DN183: (Blank Column) | DO183: (Blank Column) | DP183: (Blank Column) | DQ183: (Blank Column) | DR183: (Blank Column) | DS183: (Blank Column) | DT183: Details | DU183: Note + Text | DV183: (Blank Column) | DW183: (Blank Column) | DX183: (Blank Column) | DY183: (Blank Column) | DZ183: (Blank Column) | EA183: (Blank Column) | EB183: (Blank Column) | EC183: Reference Sheet
A184: of:=IF([Powers.C25]=""; ""; [Powers.C25]) -> Speed Theft | C184: of:=IF(TRIM([.A184])=""; ""; INDEX(POWER_CHART_INDEXES; MATCH([.A184]; POWER_CHART_NAMES; 0))) -> 62 | F184: of:=IF([#REF!]=""; FALSE(); IF([.E184]; TRUE(); FALSE())) ->  | G184: of:=IF(N([.C184]); IFERROR(T(INDEX(POWER_CHART_PREREQ_1; MATCH([.C184]; POWER_CHART_INDEXES; 0))); ""); "") -> Speed Drain | H184: of:=IF(OR([.G184]=""; [.B184]); 0; INDEX(POWER_CHART_INDEXES; MATCH([.G184]; POWER_CHART_NAMES; 0))) -> 61 | I184: of:=IF([.H184]=0; TRUE(); COUNTIF(POWER_CALC_SELECTED_INDEXES; [.H184])) -> false | J184: of:=IF(N([.C184]); IFERROR(T(INDEX(POWER_CHART_PREREQ_2; MATCH([.C184]; POWER_CHART_INDEXES; 0))); ""); "") ->  | K184: of:=IF(OR([.J184]=""; [.B184]); 0; INDEX(POWER_CHART_INDEXES; MATCH([.J184]; POWER_CHART_NAMES; 0))) -> 0 | L184: of:=IF([.K184]=0; TRUE(); COUNTIF(POWER_CALC_SELECTED_INDEXES; [.K184])) -> true | M184: of:=IF(N([.C184]); IFERROR(T(INDEX(POWER_CHART_PREREQ_3; MATCH([.C184]; POWER_CHART_INDEXES; 0))); ""); "") ->  | N184: of:=IF(OR([.M184]=""; [.B184]); 0; INDEX(POWER_CHART_INDEXES; MATCH([.M184]; POWER_CHART_NAMES; 0))) -> 0 | O184: of:=IF([.N184]=0; TRUE(); COUNTIF(POWER_CALC_SELECTED_INDEXES; [.N184])) -> true | P184: of:=AND([.I184]; [.L184]; [.O184]) -> false | Q184: of:=IF(NOT([.P184]); "Purchase a prerequisite for "&[.A184]&" ("&COM.MICROSOFT.TEXTJOIN(" or "; 1; [.G184]; [.J184]; [.M184])&")."&CHAR(13)&CHAR(10); "") -> Purchase a prerequisite for Speed Theft (Speed Drain).
 | R184: of:=IF([#REF!]=""; FALSE(); IF([.O184]; TRUE(); FALSE())) ->  | T184: of:=IF([.A184]=""; FALSE(); IF([.P184]; TRUE(); FALSE())) -> false | U184: of:=IF([.T184]; [.C184]; "") ->  | W184: of:=IF(AND([.T184]; NOT([Powers.E25]="")); [Powers.E25]; "") ->  | Y184: of:=IF(AND([.T184]; OR([.W184]=""; [.B184])); [.A184]; [.W184]) ->  | Z184: of:=IF(AND([.T184]; NOT([Powers.F25]="")); [Powers.F25]; "") ->  | AA184: of:=IF([.T184]; IFERROR(T(INDEX(POWER_CHART_ACTIONS; MATCH([.C184]; POWER_CHART_INDEXES; 0))); ""); "") ->  | AB184: of:=IF([.T184]; INDEX(POWER_CHART_ATTACKS; MATCH([.C184]; POWER_CHART_INDEXES; 0)); FALSE()) -> false | AC184: of:=IF([.T184]; INDEX(POWER_CHART_TYPES; MATCH([.C184]; POWER_CHART_INDEXES; 0))&" "&IF([.AB184]; "attack"; "power"); "") ->  | AD184: of:=IF(ULTRA_RANGED; TRUE(); FALSE()) -> true | AE184: of:=IF([.T184]; IF(INDEX(POWER_CHART_RANGES;MATCH([.C184];POWER_CHART_INDEXES;0))="Ranged";TRUE();FALSE())) -> false | AF184: of:=OR([.AD184];[.AE184]) -> true | AG184: of:=IF(ULTRA_XRANGED; TRUE(); FALSE()) -> true | AH184: of:=IF([.AF184]; INDEX(POWER_LEVEL_CHART_RANGES_TEXT; MATCH(POWER_LEVEL-1; POWER_LEVEL_CHART_INDEXES;0)); "") -> 600 m | AI184: of:=IF([.AF184]; INDEX(POWER_LEVEL_CHART_RANGES; MATCH(POWER_LEVEL; POWER_LEVEL_CHART_INDEXES;0)); "") -> 1000 | AJ184: of:=IF([.AF184]; [.AI184]*[.AG184]; "") -> 1000 | AK184: of:=IF([.AF184]; IF(([.AJ184])>9999; TEXT(([.AJ184])/1000; "#,##0")&" km"; TEXT([.AJ184];"#,##0")&" m"); "") -> 1,000 m | AL184: of:=IF([.AF184]; "Ranged ("&[.AH184]&"/"&[.AK184]&")"; "") -> Ranged (600 m/1,000 m) | AM184: of:=IF(ULTRA_SEEKING; TRUE(); FALSE()) -> true | AN184: of:=IF(AND([.AM184]; OR(ISNUMBER(FIND("attack"; [.AC184])); ISNUMBER(FIND("Ultra-power"; [.A184])))); TRUE(); FALSE()) -> false | AO184: of:=IF([.AN184];", Seeking";"") ->  | AP184: of:=IF(ULTRA_AREA; TRUE(); FALSE()) -> true | AQ184: of:=IF([.T184]; IF(INDEX(POWER_CHART_AREAS; MATCH([.C184]; POWER_CHART_INDEXES; 0))="Area"; TRUE(); FALSE())) -> false | AR184: of:=OR([.AP184];[.AQ184]) -> true | AS184: of:=IF(ULTRA_XAREA; TRUE(); FALSE()) -> true | AT184: of:=IF([.AR184]; INDEX(POWER_LEVEL_CHART_AREAS; MATCH(POWER_LEVEL; POWER_LEVEL_CHART_INDEXES;0)); "") -> 10 | AU184: of:=IF([.AR184]; [.AS184]*[.AT184]; "") -> 10 | AV184: of:=IF([.AR184]; IF(([.AU184])>9999; TEXT(([.AU184])/1000; "#,##0")&" km radius"; TEXT([.AU184];"#,##0")&" m radius"); "") -> 10 m radius | AW184: of:=IF([.AR184]; "Area ("&[.AV184]&")"; "") -> Area (10 m radius) | AX184: of:=IF(ULTRA_SELECTIVE; TRUE(); FALSE()) -> true | AY184: of:=IF([.AX184]) -> true | AZ184: of:=IF([.AY184];", Selective";"") -> , Selective | BA184: of:=ISNUMBER(FIND("Movement"; [.AC184])) -> false | BB184: of:=IF(ULTRA_XSPRINT; TRUE(); FALSE()) -> true | BC184: of:=ISNUMBER(FIND("Super Running"; [.A184])) -> false | BD184: of:=IF([.BC184]; INDEX(MOVEMENT_CHART_BASES_TEXT; MATCH(ATHLETICS+POWER_LEVEL; MOVEMENT_CHART_INDEXES;0)); "") ->  | BE184: of:=IF([.BC184]; INDEX(MOVEMENT_CHART_SPRINTS; MATCH(ATHLETICS+POWER_LEVEL; MOVEMENT_CHART_INDEXES;0)); "") ->  | BF184: of:=IF([.BC184]; [.BE184]*[.BB184]; "") ->  | BG184: of:=IF([.BC184]; IF(([.BF184])>9999; TEXT(([.BF184])/1000; "#,##0")&" km"; TEXT([.BF184];"#,##0")&" m"); "") ->  | BH184: of:=IF([.BC184]; "("&[.BD184]&"/"&[.BG184]&")"; "") ->  | BI184: of:=AND(ISNUMBER(FIND("Super Swimming"; [.A184]))) -> false | BJ184: of:=IF([.BI184]; INDEX(MOVEMENT_CHART_BASES_TEXT; MATCH(ATHLETICS+POWER_LEVEL; MOVEMENT_CHART_INDEXES;0)); "") ->  | BK184: of:=IF([.BI184]; INDEX(MOVEMENT_CHART_SPRINTS; MATCH(ATHLETICS+POWER_LEVEL; MOVEMENT_CHART_INDEXES;0)); "") ->  | BL184: of:=IF([.BI184]; [.BK184]*[.BB184]; "") ->  | BM184: of:=IF([.BI184]; IF(([.BL184])>9999; TEXT(([.BL184])/1000; "#,##0")&" km"; TEXT([.BL184];"#,##0")&" m"); "") ->  | BN184: of:=IF([.BI184]; "("&[.BJ184]&"/"&[.BM184]&")"; "") ->  | BO184: of:=ISNUMBER(FIND("Flight"; [.A184])) -> false | BP184: of:=IF([.BO184]; INDEX(MOVEMENT_CHART_BASES_TEXT; MATCH(ATHLETICS+POWER_LEVEL; MOVEMENT_CHART_INDEXES;0)); "") ->  | BQ184: of:=IF([.BO184]; INDEX(MOVEMENT_CHART_SPRINTS; MATCH(ATHLETICS+POWER_LEVEL; MOVEMENT_CHART_INDEXES;0)); "") ->  | BR184: of:=IF([.BO184]; [.BQ184]*[.BB184]; "") ->  | BS184: of:=IF([.BO184]; IF(([.BR184])>9999; TEXT(([.BR184])/1000; "#,##0")&" km"; TEXT([.BR184];"#,##0")&" m"); "") ->  | BT184: of:=IF([.BO184]; "("&[.BP184]&"/"&[.BS184]&")"; "") ->  | BU184: of:=ISNUMBER(FIND("Teleportation"; [.A184])) -> false | BV184: of:=IF([.BU184]; INDEX(TELEPORTATION_CHART_BASES_TEXT; MATCH(POWER_LEVEL; TELEPORTATION_CHART_INDEXES; 0)); "") ->  | BW184: of:=IF([.BU184]; INDEX(TELEPORTATION_CHART_SPRINTS; MATCH(POWER_LEVEL; TELEPORTATION_CHART_INDEXES; 0)); "") ->  | BX184: of:=IF([.BU184]; [.BW184]*[.BB184]; "") ->  | BY184: of:=IF([.BU184]; IF(([.BX184])>9999; TEXT(([.BX184])/1000; "#,##0")&" km"; TEXT([.BX184];"#,##0")&" m"); "") ->  | BZ184: of:=IF([.BU184]; "("&[.BV184]&"/"&[.BY184]&")"; "") ->  | CA184: of:=ISNUMBER(FIND("Tunneling"; [.A184])) -> false | CB184: of:=IF([.CA184]; INDEX(MOVEMENT_CHART_BASES_TEXT; MATCH(ATHLETICS+POWER_LEVEL; MOVEMENT_CHART_INDEXES;0)); "") ->  | CC184: of:=IF([.CA184]; INDEX(MOVEMENT_CHART_SPRINTS; MATCH(ATHLETICS+POWER_LEVEL; MOVEMENT_CHART_INDEXES;0)); "") ->  | CD184: of:=IF([.CA184]; [.CC184]*[.BB184]; "") ->  | CE184: of:=IF([.CA184]; IF(([.CD184])>9999; TEXT(([.CD184])/1000; "#,##0")&" km"; TEXT([.CD184];"#,##0")&" m"); "") ->  | CF184: of:=IF([.CA184]; "("&[.CB184]&"/"&[.CE184]&")"; "") ->  | CG184: of:=AND(ISNUMBER(FIND("Super Endurance"; [.A184]))) -> false | CH184: of:=AND(ISNUMBER(FIND("Super Health"; [.A184]))) -> false | CI184: of:=AND(ISNUMBER(FIND("Super Reflection"; [.A184]))) -> false | CJ184: of:=AND(ISNUMBER(FIND("Super Strength"; [.A184]))) -> false | CK184: of:=ISNUMBER(FIND("Alteration Resistance"; [.A184])) -> false | CL184: of:=IF([.CK184]; ALTERATION_RESISTANCE_TEXT; "") ->  | CM184: of:=ISNUMBER(FIND("Damage Resistance"; [.A184])) -> false | CN184: of:=IF([.CM184]; DAMAGE_RESISTANCE_TEXT; "") ->  | CO184: of:=ISNUMBER(FIND("Mental Resistance"; [.A184])) -> false | CP184: of:=IF([.CO184]; MENTAL_RESISTANCE_TEXT; "") ->  | CQ184: of:=ISNUMBER(FIND("Bulletproof"; [.A184])) -> false | CR184: of:=IF([.CQ184]; "Unaffected by ordinary weapons Equipment Level "&POWER_LEVEL&" and lower"; "") ->  | CS184: of:=ISNUMBER(FIND("Density Control"; [.A184])) -> false | CT184: of:=IF([.CS184]; INDEX(DENSITY_CONTROL_CHART; POWER_LEVEL; 4); "") ->  | CU184: of:=ISNUMBER(FIND("Duplication"; [.A184])) -> false | CV184: of:=IF([.CU184]; INDEX(DUPLICATION_CHART; POWER_LEVEL; 3); "") ->  | CW184: of:=ISNUMBER(FIND("Growth"; [.A184])) -> false | CX184: of:=IF([.CW184]; INDEX(GROWTH_CHART; POWER_LEVEL; 6); "") ->  | CY184: of:=ISNUMBER(FIND("Extra Actions"; [.A184])) -> false | CZ184: of:=IF([.CY184]; POWER_LEVEL&" extra actions per scene"; "") ->  | DA184: of:=ISNUMBER(FIND("Haste"; [.A184])) -> false | DB184: of:=IF([.DA184]; INDEX(HASTE_CHART; POWER_LEVEL; 3); "") ->  | DC184: of:=ISNUMBER(FIND("Shrinking"; [.A184])) -> false | DD184: of:=IF([.DC184]; INDEX(SHRINKING_CHART; POWER_LEVEL; 4); "") ->  | DE184: of:=ISNUMBER(FIND("Stretching"; [.A184])) -> false | DF184: of:=IF([.DE184]; INDEX(STRETCHING_CHART; POWER_LEVEL; 2)&" reach"; "") ->  | DG184: of:=[.CL184]&[.CN184]&[.CP184]&[.CR184]&[.CT184]&[.CV184]&[.CX184]&[.CZ184]&[.DB184]&[.DD184]&[.DF184] ->  | DH184: of:=ISNUMBER(FIND("[Element]"; [.A184])) -> false | DI184: of:=ISNUMBER(FIND("[Subject]"; [.A184])) -> false | DJ184: of:=ISNUMBER(FIND("[Transformation]"; [.A184])) -> false | DT184: of:=IF([.T184]; COM.MICROSOFT.TEXTJOIN(", "; 1; [.AA184]; [.AL184]; [.AL184]; [.AZ184]; [.AZ184]; [.AC184]); "") ->  | DU184: of:=COM.MICROSOFT.TEXTJOIN("; "; TRUE(); [.Z184]; [.DG184]) ->  | EC184: of:=IF([.T184]; [.Y184]&CHAR(13)&CHAR(10)&[.DT184]&CHAR(13)&CHAR(10)&[.DU184]&CHAR(13)&CHAR(10)&VLOOKUP( [.A184]; POWER_CHART; 11; FALSE())&CHAR(13)&CHAR(10)&CHAR(13)&CHAR(10); "") -> 
A185: of:=IF([Powers.C26]=""; ""; [Powers.C26]) -> Power Theft | C185: of:=IF(TRIM([.A185])=""; ""; INDEX(POWER_CHART_INDEXES; MATCH([.A185]; POWER_CHART_NAMES; 0))) -> 51 | F185: of:=IF([#REF!]=""; FALSE(); IF([.E185]; TRUE(); FALSE())) ->  | G185: of:=IF(N([.C185]); IFERROR(T(INDEX(POWER_CHART_PREREQ_1; MATCH([.C185]; POWER_CHART_INDEXES; 0))); ""); "") -> Power Drain | H185: of:=IF(OR([.G185]=""; [.B185]); 0; INDEX(POWER_CHART_INDEXES; MATCH([.G185]; POWER_CHART_NAMES; 0))) -> 49 | I185: of:=IF([.H185]=0; TRUE(); COUNTIF(POWER_CALC_SELECTED_INDEXES; [.H185])) -> false | J185: of:=IF(N([.C185]); IFERROR(T(INDEX(POWER_CHART_PREREQ_2; MATCH([.C185]; POWER_CHART_INDEXES; 0))); ""); "") -> Power Mimicry | K185: of:=IF(OR([.J185]=""; [.B185]); 0; INDEX(POWER_CHART_INDEXES; MATCH([.J185]; POWER_CHART_NAMES; 0))) -> 50 | L185: of:=IF([.K185]=0; TRUE(); COUNTIF(POWER_CALC_SELECTED_INDEXES; [.K185])) -> false | M185: of:=IF(N([.C185]); IFERROR(T(INDEX(POWER_CHART_PREREQ_3; MATCH([.C185]; POWER_CHART_INDEXES; 0))); ""); "") ->  | N185: of:=IF(OR([.M185]=""; [.B185]); 0; INDEX(POWER_CHART_INDEXES; MATCH([.M185]; POWER_CHART_NAMES; 0))) -> 0 | O185: of:=IF([.N185]=0; TRUE(); COUNTIF(POWER_CALC_SELECTED_INDEXES; [.N185])) -> true | P185: of:=AND([.I185]; [.L185]; [.O185]) -> false | Q185: of:=IF(NOT([.P185]); "Purchase a prerequisite for "&[.A185]&" ("&COM.MICROSOFT.TEXTJOIN(" or "; 1; [.G185]; [.J185]; [.M185])&")."&CHAR(13)&CHAR(10); "") -> Purchase a prerequisite for Power Theft (Power Drain or Power Mimicry).
 | R185: of:=IF([#REF!]=""; FALSE(); IF([.O185]; TRUE(); FALSE())) ->  | T185: of:=IF([.A185]=""; FALSE(); IF([.P185]; TRUE(); FALSE())) -> false | U185: of:=IF([.T185]; [.C185]; "") ->  | W185: of:=IF(AND([.T185]; NOT([Powers.E26]="")); [Powers.E26]; "") ->  | Y185: of:=IF(AND([.T185]; OR([.W185]=""; [.B185])); [.A185]; [.W185]) ->  | Z185: of:=IF(AND([.T185]; NOT([Powers.F26]="")); [Powers.F26]; "") ->  | AA185: of:=IF([.T185]; IFERROR(T(INDEX(POWER_CHART_ACTIONS; MATCH([.C185]; POWER_CHART_INDEXES; 0))); ""); "") ->  | AB185: of:=IF([.T185]; INDEX(POWER_CHART_ATTACKS; MATCH([.C185]; POWER_CHART_INDEXES; 0)); FALSE()) -> false | AC185: of:=IF([.T185]; INDEX(POWER_CHART_TYPES; MATCH([.C185]; POWER_CHART_INDEXES; 0))&" "&IF([.AB185]; "attack"; "power"); "") ->  | AD185: of:=[.AD184] -> true | AE185: of:=IF([.T185]; IF(VLOOKUP([.A185]; POWER_CHART; 4; FALSE())="Ranged"; TRUE(); FALSE()); FALSE()) -> false | AF185: of:=IF(AND(OR([.AE185];[.AD185]); OR(ISNUMBER(FIND("attack"; [.AC185])); ISNUMBER(FIND("Environmental"; [.AC185])); ISNUMBER(FIND("Ultra-power"; [.A185]))); NOT(ISNUMBER(FIND("Strike";[.A185])))); TRUE(); FALSE()) -> false | AG185: of:=[.AG184] -> true | AH185: of:=IF([.AF185]; INDEX(POWER_LEVEL_CHART_RANGES_TEXT; MATCH(POWER_LEVEL-1; POWER_LEVEL_CHART_INDEXES;0)); "") ->  | AI185: of:=IF([.AF185]; INDEX(POWER_LEVEL_CHART_RANGES; MATCH(POWER_LEVEL; POWER_LEVEL_CHART_INDEXES;0)); "") ->  | AJ185: of:=IF([.AF185]; [.AI185]*[.AG185]; "") ->  | AK185: of:=IF([.AF185]; IF(([.AJ185])>9999; TEXT(([.AJ185])/1000; "#,##0")&" km"; TEXT([.AJ185];"#,##0")&" m"); "") ->  | AL185: of:=IF([.AF185]; "Ranged ("&[.AH185]&"/"&[.AK185]&")"; "") ->  | AM185: of:=[.AM184] -> true | AN185: of:=IF(AND([.AM185]; OR(ISNUMBER(FIND("attack"; [.AC185])); ISNUMBER(FIND("Ultra-power"; [.A185])))); TRUE(); FALSE()) -> false | AO185: of:=IF([.AN185];", Seeking";"") ->  | AP185: of:=[.AP184] -> true | AQ185: of:=IF([.T185]; IF(INDEX(POWER_CHART_AREAS; MATCH([.C185]; POWER_CHART_INDEXES; 0))="Area"; TRUE(); FALSE())) -> false | AR185: of:=OR([.AP185];[.AQ185]) -> true | AS185: of:=[.AS184] -> true | AT185: of:=IF([.AR185]; INDEX(POWER_LEVEL_CHART_AREAS; MATCH(POWER_LEVEL; POWER_LEVEL_CHART_INDEXES;0)); "") -> 10 | AU185: of:=IF([.AR185]; [.AS185]*[.AT185]; "") -> 10 | AV185: of:=IF([.AR185]; IF(([.AU185])>9999; TEXT(([.AU185])/1000; "#,##0")&" km radius"; TEXT([.AU185];"#,##0")&" m radius"); "") -> 10 m radius | AW185: of:=IF([.AR185]; "Area ("&[.AV185]&")"; "") -> Area (10 m radius) | AX185: of:=[.AX184] -> true | AY185: of:=IF([.AX185]) -> true | AZ185: of:=IF([.AY185];", Selective";"") -> , Selective | BA185: of:=ISNUMBER(FIND("Movement"; [.AC185])) -> false | BB185: of:=[.BB184] -> true | BC185: of:=ISNUMBER(FIND("Super Running"; [.A185])) -> false | BD185: of:=IF([.BC185]; INDEX(MOVEMENT_CHART_BASES_TEXT; MATCH(ATHLETICS+POWER_LEVEL; MOVEMENT_CHART_INDEXES;0)); "") ->  | BE185: of:=IF([.BC185]; INDEX(MOVEMENT_CHART_SPRINTS; MATCH(ATHLETICS+POWER_LEVEL; MOVEMENT_CHART_INDEXES;0)); "") ->  | BF185: of:=IF([.BC185]; [.BE185]*[.BB185]; "") ->  | BG185: of:=IF([.BC185]; IF(([.BF185])>9999; TEXT(([.BF185])/1000; "#,##0")&" km"; TEXT([.BF185];"#,##0")&" m"); "") ->  | BH185: of:=IF([.BC185]; "("&[.BD185]&"/"&[.BG185]&")"; "") ->  | BI185: of:=AND(ISNUMBER(FIND("Super Swimming"; [.A185]))) -> false | BJ185: of:=IF([.BI185]; INDEX(MOVEMENT_CHART_BASES_TEXT; MATCH(ATHLETICS+POWER_LEVEL; MOVEMENT_CHART_INDEXES;0)); "") ->  | BK185: of:=IF([.BI185]; INDEX(MOVEMENT_CHART_SPRINTS; MATCH(ATHLETICS+POWER_LEVEL; MOVEMENT_CHART_INDEXES;0)); "") ->  | BL185: of:=IF([.BI185]; [.BK185]*[.BB185]; "") ->  | BM185: of:=IF([.BI185]; IF(([.BL185])>9999; TEXT(([.BL185])/1000; "#,##0")&" km"; TEXT([.BL185];"#,##0")&" m"); "") ->  | BN185: of:=IF([.BI185]; "("&[.BJ185]&"/"&[.BM185]&")"; "") ->  | BO185: of:=ISNUMBER(FIND("Flight"; [.A185])) -> false | BP185: of:=IF([.BO185]; INDEX(MOVEMENT_CHART_BASES_TEXT; MATCH(ATHLETICS+POWER_LEVEL; MOVEMENT_CHART_INDEXES;0)); "") ->  | BQ185: of:=IF([.BO185]; INDEX(MOVEMENT_CHART_SPRINTS; MATCH(ATHLETICS+POWER_LEVEL; MOVEMENT_CHART_INDEXES;0)); "") ->  | BR185: of:=IF([.BO185]; [.BQ185]*[.BB185]; "") ->  | BS185: of:=IF([.BO185]; IF(([.BR185])>9999; TEXT(([.BR185])/1000; "#,##0")&" km"; TEXT([.BR185];"#,##0")&" m"); "") ->  | BT185: of:=IF([.BO185]; "("&[.BP185]&"/"&[.BS185]&")"; "") ->  | BU185: of:=ISNUMBER(FIND("Teleportation"; [.A185])) -> false | BV185: of:=IF([.BU185]; INDEX(TELEPORTATION_CHART_BASES_TEXT; MATCH(POWER_LEVEL; TELEPORTATION_CHART_INDEXES; 0)); "") ->  | BW185: of:=IF([.BU185]; INDEX(TELEPORTATION_CHART_SPRINTS; MATCH(POWER_LEVEL; TELEPORTATION_CHART_INDEXES; 0)); "") ->  | BX185: of:=IF([.BU185]; [.BW185]*[.BB185]; "") ->  | BY185: of:=IF([.BU185]; IF(([.BX185])>9999; TEXT(([.BX185])/1000; "#,##0")&" km"; TEXT([.BX185];"#,##0")&" m"); "") ->  | BZ185: of:=IF([.BU185]; "("&[.BV185]&"/"&[.BY185]&")"; "") ->  | CA185: of:=ISNUMBER(FIND("Tunneling"; [.A185])) -> false | CB185: of:=IF([.CA185]; INDEX(MOVEMENT_CHART_BASES_TEXT; MATCH(ATHLETICS+POWER_LEVEL; MOVEMENT_CHART_INDEXES;0)); "") ->  | CC185: of:=IF([.CA185]; INDEX(MOVEMENT_CHART_SPRINTS; MATCH(ATHLETICS+POWER_LEVEL; MOVEMENT_CHART_INDEXES;0)); "") ->  | CD185: of:=IF([.CA185]; [.CC185]*[.BB185]; "") ->  | CE185: of:=IF([.CA185]; IF(([.CD185])>9999; TEXT(([.CD185])/1000; "#,##0")&" km"; TEXT([.CD185];"#,##0")&" m"); "") ->  | CF185: of:=IF([.CA185]; "("&[.CB185]&"/"&[.CE185]&")"; "") ->  | CG185: of:=AND(ISNUMBER(FIND("Super Endurance"; [.A185]))) -> false | CH185: of:=AND(ISNUMBER(FIND("Super Health"; [.A185]))) -> false | CI185: of:=AND(ISNUMBER(FIND("Super Reflection"; [.A185]))) -> false | CJ185: of:=AND(ISNUMBER(FIND("Super Strength"; [.A185]))) -> false | CK185: of:=ISNUMBER(FIND("Alteration Resistance"; [.A185])) -> false | CL185: of:=IF([.CK185]; ALTERATION_RESISTANCE_TEXT; "") ->  | CM185: of:=ISNUMBER(FIND("Damage Resistance"; [.A185])) -> false | CN185: of:=IF([.CM185]; DAMAGE_RESISTANCE_TEXT; "") ->  | CO185: of:=ISNUMBER(FIND("Mental Resistance"; [.A185])) -> false | CP185: of:=IF([.CO185]; MENTAL_RESISTANCE_TEXT; "") ->  | CQ185: of:=ISNUMBER(FIND("Bulletproof"; [.A185])) -> false | CR185: of:=IF([.CQ185]; "Unaffected by ordinary weapons Equipment Level "&POWER_LEVEL&" and lower"; "") ->  | CS185: of:=ISNUMBER(FIND("Density Control"; [.A185])) -> false | CT185: of:=IF([.CS185]; INDEX(DENSITY_CONTROL_CHART; POWER_LEVEL; 4); "") ->  | CU185: of:=ISNUMBER(FIND("Duplication"; [.A185])) -> false | CV185: of:=IF([.CU185]; INDEX(DUPLICATION_CHART; POWER_LEVEL; 3); "") ->  | CW185: of:=ISNUMBER(FIND("Growth"; [.A185])) -> false | CX185: of:=IF([.CW185]; INDEX(GROWTH_CHART; POWER_LEVEL; 6); "") ->  | CY185: of:=ISNUMBER(FIND("Extra Actions"; [.A185])) -> false | CZ185: of:=IF([.CY185]; POWER_LEVEL&" extra actions per scene"; "") ->  | DA185: of:=ISNUMBER(FIND("Haste"; [.A185])) -> false | DB185: of:=IF([.DA185]; INDEX(HASTE_CHART; POWER_LEVEL; 3); "") ->  | DC185: of:=ISNUMBER(FIND("Shrinking"; [.A185])) -> false | DD185: of:=IF([.DC185]; INDEX(SHRINKING_CHART; POWER_LEVEL; 4); "") ->  | DE185: of:=ISNUMBER(FIND("Stretching"; [.A185])) -> false | DF185: of:=IF([.DE185]; INDEX(STRETCHING_CHART; POWER_LEVEL; 2)&" reach"; "") ->  | DG185: of:=[.CL185]&[.CN185]&[.CP185]&[.CR185]&[.CT185]&[.CV185]&[.CX185]&[.CZ185]&[.DB185]&[.DD185]&[.DF185] ->  | DH185: of:=ISNUMBER(FIND("[Element]"; [.A185])) -> false | DI185: of:=ISNUMBER(FIND("[Subject]"; [.A185])) -> false | DJ185: of:=ISNUMBER(FIND("[Transformation]"; [.A185])) -> false | DT185: of:=IF([.T185]; COM.MICROSOFT.TEXTJOIN(", "; 1; [.AA185];[.AL185];[.AL185];[.AZ185];[.AZ185];[.AC185]); "") ->  | DU185: of:=IF([Powers.F26]=""; ""; [Powers.F26])&IF(OR([Powers.F26]=""; [.DG185]=""); ""; "; ")&IF([.DG185]=""; ""; [.DG185]) ->  | EC185: of:=IF([.T185]; [.Y185]&CHAR(13)&CHAR(10)&[.DT185]&CHAR(13)&CHAR(10)&[.DU185]&CHAR(13)&CHAR(10)&VLOOKUP( [.A185]; POWER_CHART; 11; FALSE())&CHAR(13)&CHAR(10)&CHAR(13)&CHAR(10); "") -> 
A186: of:=IF([Powers.C27]=""; ""; [Powers.C27]) -> Teleportation Attack | C186: of:=IF(TRIM([.A186])=""; ""; INDEX(POWER_CHART_INDEXES; MATCH([.A186]; POWER_CHART_NAMES; 0))) -> 76 | F186: of:=IF([#REF!]=""; FALSE(); IF([.E186]; TRUE(); FALSE())) ->  | G186: of:=IF(N([.C186]); IFERROR(T(INDEX(POWER_CHART_PREREQ_1; MATCH([.C186]; POWER_CHART_INDEXES; 0))); ""); "") -> Teleportation | H186: of:=IF(OR([.G186]=""; [.B186]); 0; INDEX(POWER_CHART_INDEXES; MATCH([.G186]; POWER_CHART_NAMES; 0))) -> 75 | I186: of:=IF([.H186]=0; TRUE(); COUNTIF(POWER_CALC_SELECTED_INDEXES; [.H186])) -> false | J186: of:=IF(N([.C186]); IFERROR(T(INDEX(POWER_CHART_PREREQ_2; MATCH([.C186]; POWER_CHART_INDEXES; 0))); ""); "") ->  | K186: of:=IF(OR([.J186]=""; [.B186]); 0; INDEX(POWER_CHART_INDEXES; MATCH([.J186]; POWER_CHART_NAMES; 0))) -> 0 | L186: of:=IF([.K186]=0; TRUE(); COUNTIF(POWER_CALC_SELECTED_INDEXES; [.K186])) -> true | M186: of:=IF(N([.C186]); IFERROR(T(INDEX(POWER_CHART_PREREQ_3; MATCH([.C186]; POWER_CHART_INDEXES; 0))); ""); "") ->  | N186: of:=IF(OR([.M186]=""; [.B186]); 0; INDEX(POWER_CHART_INDEXES; MATCH([.M186]; POWER_CHART_NAMES; 0))) -> 0 | O186: of:=IF([.N186]=0; TRUE(); COUNTIF(POWER_CALC_SELECTED_INDEXES; [.N186])) -> true | P186: of:=AND([.I186]; [.L186]; [.O186]) -> false | Q186: of:=IF(NOT([.P186]); "Purchase a prerequisite for "&[.A186]&" ("&COM.MICROSOFT.TEXTJOIN(" or "; 1; [.G186]; [.J186]; [.M186])&")."&CHAR(13)&CHAR(10); "") -> Purchase a prerequisite for Teleportation Attack (Teleportation).
 | R186: of:=IF([#REF!]=""; FALSE(); IF([.O186]; TRUE(); FALSE())) ->  | T186: of:=IF([.A186]=""; FALSE(); IF([.P186]; TRUE(); FALSE())) -> false | U186: of:=IF([.T186]; [.C186]; "") ->  | W186: of:=IF(AND([.T186]; NOT([Powers.E27]="")); [Powers.E27]; "") ->  | Y186: of:=IF(AND([.T186]; OR([.W186]=""; [.B186])); [.A186]; [.W186]) ->  | Z186: of:=IF(AND([.T186]; NOT([Powers.F27]="")); [Powers.F27]; "") ->  | AA186: of:=IF([.T186]; IFERROR(T(INDEX(POWER_CHART_ACTIONS; MATCH([.C186]; POWER_CHART_INDEXES; 0))); ""); "") ->  | AB186: of:=IF([.T186]; INDEX(POWER_CHART_ATTACKS; MATCH([.C186]; POWER_CHART_INDEXES; 0)); FALSE()) -> false | AC186: of:=IF([.T186]; INDEX(POWER_CHART_TYPES; MATCH([.C186]; POWER_CHART_INDEXES; 0))&" "&IF([.AB186]; "attack"; "power"); "") ->  | AD186: of:=[.AD185] -> true | AE186: of:=IF([.T186]; IF(VLOOKUP([.A186]; POWER_CHART; 4; FALSE())="Ranged"; TRUE(); FALSE()); FALSE()) -> false | AF186: of:=IF(AND(OR([.AE186];[.AD186]); OR(ISNUMBER(FIND("attack"; [.AC186])); ISNUMBER(FIND("Environmental"; [.AC186])); ISNUMBER(FIND("Ultra-power"; [.A186]))); NOT(ISNUMBER(FIND("Strike";[.A186])))); TRUE(); FALSE()) -> false | AG186: of:=[.AG185] -> true | AH186: of:=IF([.AF186]; INDEX(POWER_LEVEL_CHART_RANGES_TEXT; MATCH(POWER_LEVEL-1; POWER_LEVEL_CHART_INDEXES;0)); "") ->  | AI186: of:=IF([.AF186]; INDEX(POWER_LEVEL_CHART_RANGES; MATCH(POWER_LEVEL; POWER_LEVEL_CHART_INDEXES;0)); "") ->  | AJ186: of:=IF([.AF186]; [.AI186]*[.AG186]; "") ->  | AK186: of:=IF([.AF186]; IF(([.AJ186])>9999; TEXT(([.AJ186])/1000; "#,##0")&" km"; TEXT([.AJ186];"#,##0")&" m"); "") ->  | AL186: of:=IF([.AF186]; "Ranged ("&[.AH186]&"/"&[.AK186]&")"; "") ->  | AM186: of:=[.AM185] -> true | AN186: of:=IF(AND([.AM186]; OR(ISNUMBER(FIND("attack"; [.AC186])); ISNUMBER(FIND("Ultra-power"; [.A186])))); TRUE(); FALSE()) -> false | AO186: of:=IF([.AN186];", Seeking";"") ->  | AP186: of:=[.AP185] -> true | AQ186: of:=IF([.T186]; IF(INDEX(POWER_CHART_AREAS; MATCH([.C186]; POWER_CHART_INDEXES; 0))="Area"; TRUE(); FALSE())) -> false | AR186: of:=OR([.AP186];[.AQ186]) -> true | AS186: of:=[.AS185] -> true | AT186: of:=IF([.AR186]; INDEX(POWER_LEVEL_CHART_AREAS; MATCH(POWER_LEVEL; POWER_LEVEL_CHART_INDEXES;0)); "") -> 10 | AU186: of:=IF([.AR186]; [.AS186]*[.AT186]; "") -> 10 | AV186: of:=IF([.AR186]; IF(([.AU186])>9999; TEXT(([.AU186])/1000; "#,##0")&" km radius"; TEXT([.AU186];"#,##0")&" m radius"); "") -> 10 m radius | AW186: of:=IF([.AR186]; "Area ("&[.AV186]&")"; "") -> Area (10 m radius) | AX186: of:=[.AX185] -> true | AY186: of:=IF([.AX186]) -> true | AZ186: of:=IF([.AY186];", Selective";"") -> , Selective | BA186: of:=ISNUMBER(FIND("Movement"; [.AC186])) -> false | BB186: of:=[.BB185] -> true | BC186: of:=ISNUMBER(FIND("Super Running"; [.A186])) -> false | BD186: of:=IF([.BC186]; INDEX(MOVEMENT_CHART_BASES_TEXT; MATCH(ATHLETICS+POWER_LEVEL; MOVEMENT_CHART_INDEXES;0)); "") ->  | BE186: of:=IF([.BC186]; INDEX(MOVEMENT_CHART_SPRINTS; MATCH(ATHLETICS+POWER_LEVEL; MOVEMENT_CHART_INDEXES;0)); "") ->  | BF186: of:=IF([.BC186]; [.BE186]*[.BB186]; "") ->  | BG186: of:=IF([.BC186]; IF(([.BF186])>9999; TEXT(([.BF186])/1000; "#,##0")&" km"; TEXT([.BF186];"#,##0")&" m"); "") ->  | BH186: of:=IF([.BC186]; "("&[.BD186]&"/"&[.BG186]&")"; "") ->  | BI186: of:=AND(ISNUMBER(FIND("Super Swimming"; [.A186]))) -> false | BJ186: of:=IF([.BI186]; INDEX(MOVEMENT_CHART_BASES_TEXT; MATCH(ATHLETICS+POWER_LEVEL; MOVEMENT_CHART_INDEXES;0)); "") ->  | BK186: of:=IF([.BI186]; INDEX(MOVEMENT_CHART_SPRINTS; MATCH(ATHLETICS+POWER_LEVEL; MOVEMENT_CHART_INDEXES;0)); "") ->  | BL186: of:=IF([.BI186]; [.BK186]*[.BB186]; "") ->  | BM186: of:=IF([.BI186]; IF(([.BL186])>9999; TEXT(([.BL186])/1000; "#,##0")&" km"; TEXT([.BL186];"#,##0")&" m"); "") ->  | BN186: of:=IF([.BI186]; "("&[.BJ186]&"/"&[.BM186]&")"; "") ->  | BO186: of:=ISNUMBER(FIND("Flight"; [.A186])) -> false | BP186: of:=IF([.BO186]; INDEX(MOVEMENT_CHART_BASES_TEXT; MATCH(ATHLETICS+POWER_LEVEL; MOVEMENT_CHART_INDEXES;0)); "") ->  | BQ186: of:=IF([.BO186]; INDEX(MOVEMENT_CHART_SPRINTS; MATCH(ATHLETICS+POWER_LEVEL; MOVEMENT_CHART_INDEXES;0)); "") ->  | BR186: of:=IF([.BO186]; [.BQ186]*[.BB186]; "") ->  | BS186: of:=IF([.BO186]; IF(([.BR186])>9999; TEXT(([.BR186])/1000; "#,##0")&" km"; TEXT([.BR186];"#,##0")&" m"); "") ->  | BT186: of:=IF([.BO186]; "("&[.BP186]&"/"&[.BS186]&")"; "") ->  | BU186: of:=ISNUMBER(FIND("Teleportation"; [.A186])) -> true | BV186: of:=IF([.BU186]; INDEX(TELEPORTATION_CHART_BASES_TEXT; MATCH(POWER_LEVEL; TELEPORTATION_CHART_INDEXES; 0)); "") -> 1,500 m | BW186: of:=IF([.BU186]; INDEX(TELEPORTATION_CHART_SPRINTS; MATCH(POWER_LEVEL; TELEPORTATION_CHART_INDEXES; 0)); "") -> 9000 | BX186: of:=IF([.BU186]; [.BW186]*[.BB186]; "") -> 9000 | BY186: of:=IF([.BU186]; IF(([.BX186])>9999; TEXT(([.BX186])/1000; "#,##0")&" km"; TEXT([.BX186];"#,##0")&" m"); "") -> 9,000 m | BZ186: of:=IF([.BU186]; "("&[.BV186]&"/"&[.BY186]&")"; "") -> (1,500 m/9,000 m) | CA186: of:=ISNUMBER(FIND("Tunneling"; [.A186])) -> false | CB186: of:=IF([.CA186]; INDEX(MOVEMENT_CHART_BASES_TEXT; MATCH(ATHLETICS+POWER_LEVEL; MOVEMENT_CHART_INDEXES;0)); "") ->  | CC186: of:=IF([.CA186]; INDEX(MOVEMENT_CHART_SPRINTS; MATCH(ATHLETICS+POWER_LEVEL; MOVEMENT_CHART_INDEXES;0)); "") ->  | CD186: of:=IF([.CA186]; [.CC186]*[.BB186]; "") ->  | CE186: of:=IF([.CA186]; IF(([.CD186])>9999; TEXT(([.CD186])/1000; "#,##0")&" km"; TEXT([.CD186];"#,##0")&" m"); "") ->  | CF186: of:=IF([.CA186]; "("&[.CB186]&"/"&[.CE186]&")"; "") ->  | CG186: of:=AND(ISNUMBER(FIND("Super Endurance"; [.A186]))) -> false | CH186: of:=AND(ISNUMBER(FIND("Super Health"; [.A186]))) -> false | CI186: of:=AND(ISNUMBER(FIND("Super Reflection"; [.A186]))) -> false | CJ186: of:=AND(ISNUMBER(FIND("Super Strength"; [.A186]))) -> false | CK186: of:=ISNUMBER(FIND("Alteration Resistance"; [.A186])) -> false | CL186: of:=IF([.CK186]; ALTERATION_RESISTANCE_TEXT; "") ->  | CM186: of:=ISNUMBER(FIND("Damage Resistance"; [.A186])) -> false | CN186: of:=IF([.CM186]; DAMAGE_RESISTANCE_TEXT; "") ->  | CO186: of:=ISNUMBER(FIND("Mental Resistance"; [.A186])) -> false | CP186: of:=IF([.CO186]; MENTAL_RESISTANCE_TEXT; "") ->  | CQ186: of:=ISNUMBER(FIND("Bulletproof"; [.A186])) -> false | CR186: of:=IF([.CQ186]; "Unaffected by ordinary weapons Equipment Level "&POWER_LEVEL&" and lower"; "") ->  | CS186: of:=ISNUMBER(FIND("Density Control"; [.A186])) -> false | CT186: of:=IF([.CS186]; INDEX(DENSITY_CONTROL_CHART; POWER_LEVEL; 4); "") ->  | CU186: of:=ISNUMBER(FIND("Duplication"; [.A186])) -> false | CV186: of:=IF([.CU186]; INDEX(DUPLICATION_CHART; POWER_LEVEL; 3); "") ->  | CW186: of:=ISNUMBER(FIND("Growth"; [.A186])) -> false | CX186: of:=IF([.CW186]; INDEX(GROWTH_CHART; POWER_LEVEL; 6); "") ->  | CY186: of:=ISNUMBER(FIND("Extra Actions"; [.A186])) -> false | CZ186: of:=IF([.CY186]; POWER_LEVEL&" extra actions per scene"; "") ->  | DA186: of:=ISNUMBER(FIND("Haste"; [.A186])) -> false | DB186: of:=IF([.DA186]; INDEX(HASTE_CHART; POWER_LEVEL; 3); "") ->  | DC186: of:=ISNUMBER(FIND("Shrinking"; [.A186])) -> false | DD186: of:=IF([.DC186]; INDEX(SHRINKING_CHART; POWER_LEVEL; 4); "") ->  | DE186: of:=ISNUMBER(FIND("Stretching"; [.A186])) -> false | DF186: of:=IF([.DE186]; INDEX(STRETCHING_CHART; POWER_LEVEL; 2)&" reach"; "") ->  | DG186: of:=[.CL186]&[.CN186]&[.CP186]&[.CR186]&[.CT186]&[.CV186]&[.CX186]&[.CZ186]&[.DB186]&[.DD186]&[.DF186] ->  | DH186: of:=ISNUMBER(FIND("[Element]"; [.A186])) -> false | DI186: of:=ISNUMBER(FIND("[Subject]"; [.A186])) -> false | DJ186: of:=ISNUMBER(FIND("[Transformation]"; [.A186])) -> false | DT186: of:=IF([.T186]; COM.MICROSOFT.TEXTJOIN(", "; 1; [.AA186];[.AL186];[.AL186];[.AZ186];[.AZ186];[.AC186]); "") ->  | DU186: of:=IF([Powers.F27]=""; ""; [Powers.F27])&IF(OR([Powers.F27]=""; [.DG186]=""); ""; "; ")&IF([.DG186]=""; ""; [.DG186]) ->  | EC186: of:=IF([.T186]; [.Y186]&CHAR(13)&CHAR(10)&[.DT186]&CHAR(13)&CHAR(10)&[.DU186]&CHAR(13)&CHAR(10)&VLOOKUP( [.A186]; POWER_CHART; 11; FALSE())&CHAR(13)&CHAR(10)&CHAR(13)&CHAR(10); "") -> 
A187: of:=IF([Powers.C28]=""; ""; [Powers.C28]) -> [Element] Form | C187: of:=IF(TRIM([.A187])=""; ""; INDEX(POWER_CHART_INDEXES; MATCH([.A187]; POWER_CHART_NAMES; 0))) -> 21 | F187: of:=IF([#REF!]=""; FALSE(); IF([.E187]; TRUE(); FALSE())) ->  | G187: of:=IF(N([.C187]); IFERROR(T(INDEX(POWER_CHART_PREREQ_1; MATCH([.C187]; POWER_CHART_INDEXES; 0))); ""); "") ->  | H187: of:=IF(OR([.G187]=""; [.B187]); 0; INDEX(POWER_CHART_INDEXES; MATCH([.G187]; POWER_CHART_NAMES; 0))) -> 0 | I187: of:=IF([.H187]=0; TRUE(); COUNTIF(POWER_CALC_SELECTED_INDEXES; [.H187])) -> true | J187: of:=IF(N([.C187]); IFERROR(T(INDEX(POWER_CHART_PREREQ_2; MATCH([.C187]; POWER_CHART_INDEXES; 0))); ""); "") ->  | K187: of:=IF(OR([.J187]=""; [.B187]); 0; INDEX(POWER_CHART_INDEXES; MATCH([.J187]; POWER_CHART_NAMES; 0))) -> 0 | L187: of:=IF([.K187]=0; TRUE(); COUNTIF(POWER_CALC_SELECTED_INDEXES; [.K187])) -> true | M187: of:=IF(N([.C187]); IFERROR(T(INDEX(POWER_CHART_PREREQ_3; MATCH([.C187]; POWER_CHART_INDEXES; 0))); ""); "") ->  | N187: of:=IF(OR([.M187]=""; [.B187]); 0; INDEX(POWER_CHART_INDEXES; MATCH([.M187]; POWER_CHART_NAMES; 0))) -> 0 | O187: of:=IF([.N187]=0; TRUE(); COUNTIF(POWER_CALC_SELECTED_INDEXES; [.N187])) -> true | P187: of:=AND([.I187]; [.L187]; [.O187]) -> true | Q187: of:=IF(NOT([.P187]); "Purchase a prerequisite for "&[.A187]&" ("&COM.MICROSOFT.TEXTJOIN(" or "; 1; [.G187]; [.J187]; [.M187])&")."&CHAR(13)&CHAR(10); "") ->  | R187: of:=IF([#REF!]=""; FALSE(); IF([.O187]; TRUE(); FALSE())) ->  | T187: of:=IF([.A187]=""; FALSE(); IF([.P187]; TRUE(); FALSE())) -> true | U187: of:=IF([.T187]; [.C187]; "") -> 21 | W187: of:=IF(AND([.T187]; NOT([Powers.E28]="")); [Powers.E28]; "") ->  | Y187: of:=IF(AND([.T187]; OR([.W187]=""; [.B187])); [.A187]; [.W187]) -> [Element] Form | Z187: of:=IF(AND([.T187]; NOT([Powers.F28]="")); [Powers.F28]; "") ->  | AA187: of:=IF([.T187]; IFERROR(T(INDEX(POWER_CHART_ACTIONS; MATCH([.C187]; POWER_CHART_INDEXES; 0))); ""); "") -> Quick action | AB187: of:=IF([.T187]; INDEX(POWER_CHART_ATTACKS; MATCH([.C187]; POWER_CHART_INDEXES; 0)); FALSE()) -> false | AC187: of:=IF([.T187]; INDEX(POWER_CHART_TYPES; MATCH([.C187]; POWER_CHART_INDEXES; 0))&" "&IF([.AB187]; "attack"; "power"); "") -> Personal power | AD187: of:=[.AD186] -> true | AE187: of:=IF([.T187]; IF(VLOOKUP([.A187]; POWER_CHART; 4; FALSE())="Ranged"; TRUE(); FALSE()); FALSE()) -> false | AF187: of:=IF(AND(OR([.AE187];[.AD187]); OR(ISNUMBER(FIND("attack"; [.AC187])); ISNUMBER(FIND("Environmental"; [.AC187])); ISNUMBER(FIND("Ultra-power"; [.A187]))); NOT(ISNUMBER(FIND("Strike";[.A187])))); TRUE(); FALSE()) -> false | AG187: of:=[.AG186] -> true | AH187: of:=IF([.AF187]; INDEX(POWER_LEVEL_CHART_RANGES_TEXT; MATCH(POWER_LEVEL-1; POWER_LEVEL_CHART_INDEXES;0)); "") ->  | AI187: of:=IF([.AF187]; INDEX(POWER_LEVEL_CHART_RANGES; MATCH(POWER_LEVEL; POWER_LEVEL_CHART_INDEXES;0)); "") ->  | AJ187: of:=IF([.AF187]; [.AI187]*[.AG187]; "") ->  | AK187: of:=IF([.AF187]; IF(([.AJ187])>9999; TEXT(([.AJ187])/1000; "#,##0")&" km"; TEXT([.AJ187];"#,##0")&" m"); "") ->  | AL187: of:=IF([.AF187]; "Ranged ("&[.AH187]&"/"&[.AK187]&")"; "") ->  | AM187: of:=[.AM186] -> true | AN187: of:=IF(AND([.AM187]; OR(ISNUMBER(FIND("attack"; [.AC187])); ISNUMBER(FIND("Ultra-power"; [.A187])))); TRUE(); FALSE()) -> false | AO187: of:=IF([.AN187];", Seeking";"") ->  | AP187: of:=[.AP186] -> true | AQ187: of:=IF([.T187]; IF(INDEX(POWER_CHART_AREAS; MATCH([.C187]; POWER_CHART_INDEXES; 0))="Area"; TRUE(); FALSE())) -> false | AR187: of:=OR([.AP187];[.AQ187]) -> true | AS187: of:=[.AS186] -> true | AT187: of:=IF([.AR187]; INDEX(POWER_LEVEL_CHART_AREAS; MATCH(POWER_LEVEL; POWER_LEVEL_CHART_INDEXES;0)); "") -> 10 | AU187: of:=IF([.AR187]; [.AS187]*[.AT187]; "") -> 10 | AV187: of:=IF([.AR187]; IF(([.AU187])>9999; TEXT(([.AU187])/1000; "#,##0")&" km radius"; TEXT([.AU187];"#,##0")&" m radius"); "") -> 10 m radius | AW187: of:=IF([.AR187]; "Area ("&[.AV187]&")"; "") -> Area (10 m radius) | AX187: of:=[.AX186] -> true | AY187: of:=IF([.AX187]) -> true | AZ187: of:=IF([.AY187];", Selective";"") -> , Selective | BA187: of:=ISNUMBER(FIND("Movement"; [.AC187])) -> false | BB187: of:=[.BB186] -> true | BC187: of:=ISNUMBER(FIND("Super Running"; [.A187])) -> false | BD187: of:=IF([.BC187]; INDEX(MOVEMENT_CHART_BASES_TEXT; MATCH(ATHLETICS+POWER_LEVEL; MOVEMENT_CHART_INDEXES;0)); "") ->  | BE187: of:=IF([.BC187]; INDEX(MOVEMENT_CHART_SPRINTS; MATCH(ATHLETICS+POWER_LEVEL; MOVEMENT_CHART_INDEXES;0)); "") ->  | BF187: of:=IF([.BC187]; [.BE187]*[.BB187]; "") ->  | BG187: of:=IF([.BC187]; IF(([.BF187])>9999; TEXT(([.BF187])/1000; "#,##0")&" km"; TEXT([.BF187];"#,##0")&" m"); "") ->  | BH187: of:=IF([.BC187]; "("&[.BD187]&"/"&[.BG187]&")"; "") ->  | BI187: of:=AND(ISNUMBER(FIND("Super Swimming"; [.A187]))) -> false | BJ187: of:=IF([.BI187]; INDEX(MOVEMENT_CHART_BASES_TEXT; MATCH(ATHLETICS+POWER_LEVEL; MOVEMENT_CHART_INDEXES;0)); "") ->  | BK187: of:=IF([.BI187]; INDEX(MOVEMENT_CHART_SPRINTS; MATCH(ATHLETICS+POWER_LEVEL; MOVEMENT_CHART_INDEXES;0)); "") ->  | BL187: of:=IF([.BI187]; [.BK187]*[.BB187]; "") ->  | BM187: of:=IF([.BI187]; IF(([.BL187])>9999; TEXT(([.BL187])/1000; "#,##0")&" km"; TEXT([.BL187];"#,##0")&" m"); "") ->  | BN187: of:=IF([.BI187]; "("&[.BJ187]&"/"&[.BM187]&")"; "") ->  | BO187: of:=ISNUMBER(FIND("Flight"; [.A187])) -> false | BP187: of:=IF([.BO187]; INDEX(MOVEMENT_CHART_BASES_TEXT; MATCH(ATHLETICS+POWER_LEVEL; MOVEMENT_CHART_INDEXES;0)); "") ->  | BQ187: of:=IF([.BO187]; INDEX(MOVEMENT_CHART_SPRINTS; MATCH(ATHLETICS+POWER_LEVEL; MOVEMENT_CHART_INDEXES;0)); "") ->  | BR187: of:=IF([.BO187]; [.BQ187]*[.BB187]; "") ->  | BS187: of:=IF([.BO187]; IF(([.BR187])>9999; TEXT(([.BR187])/1000; "#,##0")&" km"; TEXT([.BR187];"#,##0")&" m"); "") ->  | BT187: of:=IF([.BO187]; "("&[.BP187]&"/"&[.BS187]&")"; "") ->  | BU187: of:=ISNUMBER(FIND("Teleportation"; [.A187])) -> false | BV187: of:=IF([.BU187]; INDEX(TELEPORTATION_CHART_BASES_TEXT; MATCH(POWER_LEVEL; TELEPORTATION_CHART_INDEXES; 0)); "") ->  | BW187: of:=IF([.BU187]; INDEX(TELEPORTATION_CHART_SPRINTS; MATCH(POWER_LEVEL; TELEPORTATION_CHART_INDEXES; 0)); "") ->  | BX187: of:=IF([.BU187]; [.BW187]*[.BB187]; "") ->  | BY187: of:=IF([.BU187]; IF(([.BX187])>9999; TEXT(([.BX187])/1000; "#,##0")&" km"; TEXT([.BX187];"#,##0")&" m"); "") ->  | BZ187: of:=IF([.BU187]; "("&[.BV187]&"/"&[.BY187]&")"; "") ->  | CA187: of:=ISNUMBER(FIND("Tunneling"; [.A187])) -> false | CB187: of:=IF([.CA187]; INDEX(MOVEMENT_CHART_BASES_TEXT; MATCH(ATHLETICS+POWER_LEVEL; MOVEMENT_CHART_INDEXES;0)); "") ->  | CC187: of:=IF([.CA187]; INDEX(MOVEMENT_CHART_SPRINTS; MATCH(ATHLETICS+POWER_LEVEL; MOVEMENT_CHART_INDEXES;0)); "") ->  | CD187: of:=IF([.CA187]; [.CC187]*[.BB187]; "") ->  | CE187: of:=IF([.CA187]; IF(([.CD187])>9999; TEXT(([.CD187])/1000; "#,##0")&" km"; TEXT([.CD187];"#,##0")&" m"); "") ->  | CF187: of:=IF([.CA187]; "("&[.CB187]&"/"&[.CE187]&")"; "") ->  | CG187: of:=AND(ISNUMBER(FIND("Super Endurance"; [.A187]))) -> false | CH187: of:=AND(ISNUMBER(FIND("Super Health"; [.A187]))) -> false | CI187: of:=AND(ISNUMBER(FIND("Super Reflection"; [.A187]))) -> false | CJ187: of:=AND(ISNUMBER(FIND("Super Strength"; [.A187]))) -> false | CK187: of:=ISNUMBER(FIND("Alteration Resistance"; [.A187])) -> false | CL187: of:=IF([.CK187]; ALTERATION_RESISTANCE_TEXT; "") ->  | CM187: of:=ISNUMBER(FIND("Damage Resistance"; [.A187])) -> false | CN187: of:=IF([.CM187]; DAMAGE_RESISTANCE_TEXT; "") ->  | CO187: of:=ISNUMBER(FIND("Mental Resistance"; [.A187])) -> false | CP187: of:=IF([.CO187]; MENTAL_RESISTANCE_TEXT; "") ->  | CQ187: of:=ISNUMBER(FIND("Bulletproof"; [.A187])) -> false | CR187: of:=IF([.CQ187]; "Unaffected by ordinary weapons Equipment Level "&POWER_LEVEL&" and lower"; "") ->  | CS187: of:=ISNUMBER(FIND("Density Control"; [.A187])) -> false | CT187: of:=IF([.CS187]; INDEX(DENSITY_CONTROL_CHART; POWER_LEVEL; 4); "") ->  | CU187: of:=ISNUMBER(FIND("Duplication"; [.A187])) -> false | CV187: of:=IF([.CU187]; INDEX(DUPLICATION_CHART; POWER_LEVEL; 3); "") ->  | CW187: of:=ISNUMBER(FIND("Growth"; [.A187])) -> false | CX187: of:=IF([.CW187]; INDEX(GROWTH_CHART; POWER_LEVEL; 6); "") ->  | CY187: of:=ISNUMBER(FIND("Extra Actions"; [.A187])) -> false | CZ187: of:=IF([.CY187]; POWER_LEVEL&" extra actions per scene"; "") ->  | DA187: of:=ISNUMBER(FIND("Haste"; [.A187])) -> false | DB187: of:=IF([.DA187]; INDEX(HASTE_CHART; POWER_LEVEL; 3); "") ->  | DC187: of:=ISNUMBER(FIND("Shrinking"; [.A187])) -> false | DD187: of:=IF([.DC187]; INDEX(SHRINKING_CHART; POWER_LEVEL; 4); "") ->  | DE187: of:=ISNUMBER(FIND("Stretching"; [.A187])) -> false | DF187: of:=IF([.DE187]; INDEX(STRETCHING_CHART; POWER_LEVEL; 2)&" reach"; "") ->  | DG187: of:=[.CL187]&[.CN187]&[.CP187]&[.CR187]&[.CT187]&[.CV187]&[.CX187]&[.CZ187]&[.DB187]&[.DD187]&[.DF187] ->  | DH187: of:=ISNUMBER(FIND("[Element]"; [.A187])) -> true | DI187: of:=ISNUMBER(FIND("[Subject]"; [.A187])) -> false | DJ187: of:=ISNUMBER(FIND("[Transformation]"; [.A187])) -> false | DT187: of:=IF([.T187]; COM.MICROSOFT.TEXTJOIN(", "; 1; [.AA187];[.AL187];[.AL187];[.AZ187];[.AZ187];[.AC187]); "") -> Quick action, , Selective, , Selective, Personal power | DU187: of:=IF([Powers.F28]=""; ""; [Powers.F28])&IF(OR([Powers.F28]=""; [.DG187]=""); ""; "; ")&IF([.DG187]=""; ""; [.DG187]) ->  | EC187: of:=IF([.T187]; [.Y187]&CHAR(13)&CHAR(10)&[.DT187]&CHAR(13)&CHAR(10)&[.DU187]&CHAR(13)&CHAR(10)&VLOOKUP( [.A187]; POWER_CHART; 11; FALSE())&CHAR(13)&CHAR(10)&CHAR(13)&CHAR(10); "") -> [Element] Form
Quick action, , Selective, , Selective, Personal power

21


A188: of:=IF([Powers.C29]=""; ""; [Powers.C29]) -> Flight | C188: of:=IF(TRIM([.A188])=""; ""; INDEX(POWER_CHART_INDEXES; MATCH([.A188]; POWER_CHART_NAMES; 0))) -> 30 | F188: of:=IF([#REF!]=""; FALSE(); IF([.E188]; TRUE(); FALSE())) ->  | G188: of:=IF(N([.C188]); IFERROR(T(INDEX(POWER_CHART_PREREQ_1; MATCH([.C188]; POWER_CHART_INDEXES; 0))); ""); "") ->  | H188: of:=IF(OR([.G188]=""; [.B188]); 0; INDEX(POWER_CHART_INDEXES; MATCH([.G188]; POWER_CHART_NAMES; 0))) -> 0 | I188: of:=IF([.H188]=0; TRUE(); COUNTIF(POWER_CALC_SELECTED_INDEXES; [.H188])) -> true | J188: of:=IF(N([.C188]); IFERROR(T(INDEX(POWER_CHART_PREREQ_2; MATCH([.C188]; POWER_CHART_INDEXES; 0))); ""); "") ->  | K188: of:=IF(OR([.J188]=""; [.B188]); 0; INDEX(POWER_CHART_INDEXES; MATCH([.J188]; POWER_CHART_NAMES; 0))) -> 0 | L188: of:=IF([.K188]=0; TRUE(); COUNTIF(POWER_CALC_SELECTED_INDEXES; [.K188])) -> true | M188: of:=IF(N([.C188]); IFERROR(T(INDEX(POWER_CHART_PREREQ_3; MATCH([.C188]; POWER_CHART_INDEXES; 0))); ""); "") ->  | N188: of:=IF(OR([.M188]=""; [.B188]); 0; INDEX(POWER_CHART_INDEXES; MATCH([.M188]; POWER_CHART_NAMES; 0))) -> 0 | O188: of:=IF([.N188]=0; TRUE(); COUNTIF(POWER_CALC_SELECTED_INDEXES; [.N188])) -> true | P188: of:=AND([.I188]; [.L188]; [.O188]) -> true | Q188: of:=IF(NOT([.P188]); "Purchase a prerequisite for "&[.A188]&" ("&COM.MICROSOFT.TEXTJOIN(" or "; 1; [.G188]; [.J188]; [.M188])&")."&CHAR(13)&CHAR(10); "") ->  | R188: of:=IF([#REF!]=""; FALSE(); IF([.O188]; TRUE(); FALSE())) ->  | T188: of:=IF([.A188]=""; FALSE(); IF([.P188]; TRUE(); FALSE())) -> true | U188: of:=IF([.T188]; [.C188]; "") -> 30 | W188: of:=IF(AND([.T188]; NOT([Powers.E29]="")); [Powers.E29]; "") -> UP CN 5 | Y188: of:=IF(AND([.T188]; OR([.W188]=""; [.B188])); [.A188]; [.W188]) -> UP CN 5 | Z188: of:=IF(AND([.T188]; NOT([Powers.F29]="")); [Powers.F29]; "") -> UP N 5 | AA188: of:=IF([.T188]; IFERROR(T(INDEX(POWER_CHART_ACTIONS; MATCH([.C188]; POWER_CHART_INDEXES; 0))); ""); "") ->  | AB188: of:=IF([.T188]; INDEX(POWER_CHART_ATTACKS; MATCH([.C188]; POWER_CHART_INDEXES; 0)); FALSE()) -> false | AC188: of:=IF([.T188]; INDEX(POWER_CHART_TYPES; MATCH([.C188]; POWER_CHART_INDEXES; 0))&" "&IF([.AB188]; "attack"; "power"); "") -> Movement power | AD188: of:=[.AD187] -> true | AE188: of:=IF([.T188]; IF(VLOOKUP([.A188]; POWER_CHART; 4; FALSE())="Ranged"; TRUE(); FALSE()); FALSE()) -> false | AF188: of:=IF(AND(OR([.AE188];[.AD188]); OR(ISNUMBER(FIND("attack"; [.AC188])); ISNUMBER(FIND("Environmental"; [.AC188])); ISNUMBER(FIND("Ultra-power"; [.A188]))); NOT(ISNUMBER(FIND("Strike";[.A188])))); TRUE(); FALSE()) -> false | AG188: of:=[.AG187] -> true | AH188: of:=IF([.AF188]; INDEX(POWER_LEVEL_CHART_RANGES_TEXT; MATCH(POWER_LEVEL-1; POWER_LEVEL_CHART_INDEXES;0)); "") ->  | AI188: of:=IF([.AF188]; INDEX(POWER_LEVEL_CHART_RANGES; MATCH(POWER_LEVEL; POWER_LEVEL_CHART_INDEXES;0)); "") ->  | AJ188: of:=IF([.AF188]; [.AI188]*[.AG188]; "") ->  | AK188: of:=IF([.AF188]; IF(([.AJ188])>9999; TEXT(([.AJ188])/1000; "#,##0")&" km"; TEXT([.AJ188];"#,##0")&" m"); "") ->  | AL188: of:=IF([.AF188]; "Ranged ("&[.AH188]&"/"&[.AK188]&")"; "") ->  | AM188: of:=[.AM187] -> true | AN188: of:=IF(AND([.AM188]; OR(ISNUMBER(FIND("attack"; [.AC188])); ISNUMBER(FIND("Ultra-power"; [.A188])))); TRUE(); FALSE()) -> false | AO188: of:=IF([.AN188];", Seeking";"") ->  | AP188: of:=[.AP187] -> true | AQ188: of:=IF([.T188]; IF(INDEX(POWER_CHART_AREAS; MATCH([.C188]; POWER_CHART_INDEXES; 0))="Area"; TRUE(); FALSE())) -> false | AR188: of:=OR([.AP188];[.AQ188]) -> true | AS188: of:=[.AS187] -> true | AT188: of:=IF([.AR188]; INDEX(POWER_LEVEL_CHART_AREAS; MATCH(POWER_LEVEL; POWER_LEVEL_CHART_INDEXES;0)); "") -> 10 | AU188: of:=IF([.AR188]; [.AS188]*[.AT188]; "") -> 10 | AV188: of:=IF([.AR188]; IF(([.AU188])>9999; TEXT(([.AU188])/1000; "#,##0")&" km radius"; TEXT([.AU188];"#,##0")&" m radius"); "") -> 10 m radius | AW188: of:=IF([.AR188]; "Area ("&[.AV188]&")"; "") -> Area (10 m radius) | AX188: of:=[.AX187] -> true | AY188: of:=IF([.AX188]) -> true | AZ188: of:=IF([.AY188];", Selective";"") -> , Selective | BA188: of:=ISNUMBER(FIND("Movement"; [.AC188])) -> true | BB188: of:=[.BB187] -> true | BC188: of:=ISNUMBER(FIND("Super Running"; [.A188])) -> false | BD188: of:=IF([.BC188]; INDEX(MOVEMENT_CHART_BASES_TEXT; MATCH(ATHLETICS+POWER_LEVEL; MOVEMENT_CHART_INDEXES;0)); "") ->  | BE188: of:=IF([.BC188]; INDEX(MOVEMENT_CHART_SPRINTS; MATCH(ATHLETICS+POWER_LEVEL; MOVEMENT_CHART_INDEXES;0)); "") ->  | BF188: of:=IF([.BC188]; [.BE188]*[.BB188]; "") ->  | BG188: of:=IF([.BC188]; IF(([.BF188])>9999; TEXT(([.BF188])/1000; "#,##0")&" km"; TEXT([.BF188];"#,##0")&" m"); "") ->  | BH188: of:=IF([.BC188]; "("&[.BD188]&"/"&[.BG188]&")"; "") ->  | BI188: of:=AND(ISNUMBER(FIND("Super Swimming"; [.A188]))) -> false | BJ188: of:=IF([.BI188]; INDEX(MOVEMENT_CHART_BASES_TEXT; MATCH(ATHLETICS+POWER_LEVEL; MOVEMENT_CHART_INDEXES;0)); "") ->  | BK188: of:=IF([.BI188]; INDEX(MOVEMENT_CHART_SPRINTS; MATCH(ATHLETICS+POWER_LEVEL; MOVEMENT_CHART_INDEXES;0)); "") ->  | BL188: of:=IF([.BI188]; [.BK188]*[.BB188]; "") ->  | BM188: of:=IF([.BI188]; IF(([.BL188])>9999; TEXT(([.BL188])/1000; "#,##0")&" km"; TEXT([.BL188];"#,##0")&" m"); "") ->  | BN188: of:=IF([.BI188]; "("&[.BJ188]&"/"&[.BM188]&")"; "") ->  | BO188: of:=ISNUMBER(FIND("Flight"; [.A188])) -> true | BP188: of:=IF([.BO188]; INDEX(MOVEMENT_CHART_BASES_TEXT; MATCH(ATHLETICS+POWER_LEVEL; MOVEMENT_CHART_INDEXES;0)); "") -> 3,000 m | BQ188: of:=IF([.BO188]; INDEX(MOVEMENT_CHART_SPRINTS; MATCH(ATHLETICS+POWER_LEVEL; MOVEMENT_CHART_INDEXES;0)); "") -> 18000 | BR188: of:=IF([.BO188]; [.BQ188]*[.BB188]; "") -> 18000 | BS188: of:=IF([.BO188]; IF(([.BR188])>9999; TEXT(([.BR188])/1000; "#,##0")&" km"; TEXT([.BR188];"#,##0")&" m"); "") -> 18 km | BT188: of:=IF([.BO188]; "("&[.BP188]&"/"&[.BS188]&")"; "") -> (3,000 m/18 km) | BU188: of:=ISNUMBER(FIND("Teleportation"; [.A188])) -> false | BV188: of:=IF([.BU188]; INDEX(TELEPORTATION_CHART_BASES_TEXT; MATCH(POWER_LEVEL; TELEPORTATION_CHART_INDEXES; 0)); "") ->  | BW188: of:=IF([.BU188]; INDEX(TELEPORTATION_CHART_SPRINTS; MATCH(POWER_LEVEL; TELEPORTATION_CHART_INDEXES; 0)); "") ->  | BX188: of:=IF([.BU188]; [.BW188]*[.BB188]; "") ->  | BY188: of:=IF([.BU188]; IF(([.BX188])>9999; TEXT(([.BX188])/1000; "#,##0")&" km"; TEXT([.BX188];"#,##0")&" m"); "") ->  | BZ188: of:=IF([.BU188]; "("&[.BV188]&"/"&[.BY188]&")"; "") ->  | CA188: of:=ISNUMBER(FIND("Tunneling"; [.A188])) -> false | CB188: of:=IF([.CA188]; INDEX(MOVEMENT_CHART_BASES_TEXT; MATCH(ATHLETICS+POWER_LEVEL; MOVEMENT_CHART_INDEXES;0)); "") ->  | CC188: of:=IF([.CA188]; INDEX(MOVEMENT_CHART_SPRINTS; MATCH(ATHLETICS+POWER_LEVEL; MOVEMENT_CHART_INDEXES;0)); "") ->  | CD188: of:=IF([.CA188]; [.CC188]*[.BB188]; "") ->  | CE188: of:=IF([.CA188]; IF(([.CD188])>9999; TEXT(([.CD188])/1000; "#,##0")&" km"; TEXT([.CD188];"#,##0")&" m"); "") ->  | CF188: of:=IF([.CA188]; "("&[.CB188]&"/"&[.CE188]&")"; "") ->  | CG188: of:=AND(ISNUMBER(FIND("Super Endurance"; [.A188]))) -> false | CH188: of:=AND(ISNUMBER(FIND("Super Health"; [.A188]))) -> false | CI188: of:=AND(ISNUMBER(FIND("Super Reflection"; [.A188]))) -> false | CJ188: of:=AND(ISNUMBER(FIND("Super Strength"; [.A188]))) -> false | CK188: of:=ISNUMBER(FIND("Alteration Resistance"; [.A188])) -> false | CL188: of:=IF([.CK188]; ALTERATION_RESISTANCE_TEXT; "") ->  | CM188: of:=ISNUMBER(FIND("Damage Resistance"; [.A188])) -> false | CN188: of:=IF([.CM188]; DAMAGE_RESISTANCE_TEXT; "") ->  | CO188: of:=ISNUMBER(FIND("Mental Resistance"; [.A188])) -> false | CP188: of:=IF([.CO188]; MENTAL_RESISTANCE_TEXT; "") ->  | CQ188: of:=ISNUMBER(FIND("Bulletproof"; [.A188])) -> false | CR188: of:=IF([.CQ188]; "Unaffected by ordinary weapons Equipment Level "&POWER_LEVEL&" and lower"; "") ->  | CS188: of:=ISNUMBER(FIND("Density Control"; [.A188])) -> false | CT188: of:=IF([.CS188]; INDEX(DENSITY_CONTROL_CHART; POWER_LEVEL; 4); "") ->  | CU188: of:=ISNUMBER(FIND("Duplication"; [.A188])) -> false | CV188: of:=IF([.CU188]; INDEX(DUPLICATION_CHART; POWER_LEVEL; 3); "") ->  | CW188: of:=ISNUMBER(FIND("Growth"; [.A188])) -> false | CX188: of:=IF([.CW188]; INDEX(GROWTH_CHART; POWER_LEVEL; 6); "") ->  | CY188: of:=ISNUMBER(FIND("Extra Actions"; [.A188])) -> false | CZ188: of:=IF([.CY188]; POWER_LEVEL&" extra actions per scene"; "") ->  | DA188: of:=ISNUMBER(FIND("Haste"; [.A188])) -> false | DB188: of:=IF([.DA188]; INDEX(HASTE_CHART; POWER_LEVEL; 3); "") ->  | DC188: of:=ISNUMBER(FIND("Shrinking"; [.A188])) -> false | DD188: of:=IF([.DC188]; INDEX(SHRINKING_CHART; POWER_LEVEL; 4); "") ->  | DE188: of:=ISNUMBER(FIND("Stretching"; [.A188])) -> false | DF188: of:=IF([.DE188]; INDEX(STRETCHING_CHART; POWER_LEVEL; 2)&" reach"; "") ->  | DG188: of:=[.CL188]&[.CN188]&[.CP188]&[.CR188]&[.CT188]&[.CV188]&[.CX188]&[.CZ188]&[.DB188]&[.DD188]&[.DF188] ->  | DH188: of:=ISNUMBER(FIND("[Element]"; [.A188])) -> false | DI188: of:=ISNUMBER(FIND("[Subject]"; [.A188])) -> false | DJ188: of:=ISNUMBER(FIND("[Transformation]"; [.A188])) -> false | DT188: of:=IF([.T188]; COM.MICROSOFT.TEXTJOIN(", "; 1; [.AA188];[.AL188];[.AL188];[.AZ188];[.AZ188];[.AC188]); "") -> , Selective, , Selective, Movement power | DU188: of:=IF([Powers.F29]=""; ""; [Powers.F29])&IF(OR([Powers.F29]=""; [.DG188]=""); ""; "; ")&IF([.DG188]=""; ""; [.DG188]) -> UP N 5 | EC188: of:=IF([.T188]; [.Y188]&CHAR(13)&CHAR(10)&[.DT188]&CHAR(13)&CHAR(10)&[.DU188]&CHAR(13)&CHAR(10)&VLOOKUP( [.A188]; POWER_CHART; 11; FALSE())&CHAR(13)&CHAR(10)&CHAR(13)&CHAR(10); "") -> UP CN 5
, Selective, , Selective, Movement power
UP N 5
30


A189: of:=IF([Powers.C30]=""; ""; [Powers.C30]) -> Teleportation | C189: of:=IF(TRIM([.A189])=""; ""; INDEX(POWER_CHART_INDEXES; MATCH([.A189]; POWER_CHART_NAMES; 0))) -> 75 | F189: of:=IF([#REF!]=""; FALSE(); IF([.E189]; TRUE(); FALSE())) ->  | G189: of:=IF(N([.C189]); IFERROR(T(INDEX(POWER_CHART_PREREQ_1; MATCH([.C189]; POWER_CHART_INDEXES; 0))); ""); "") ->  | H189: of:=IF(OR([.G189]=""; [.B189]); 0; INDEX(POWER_CHART_INDEXES; MATCH([.G189]; POWER_CHART_NAMES; 0))) -> 0 | I189: of:=IF([.H189]=0; TRUE(); COUNTIF(POWER_CALC_SELECTED_INDEXES; [.H189])) -> true | J189: of:=IF(N([.C189]); IFERROR(T(INDEX(POWER_CHART_PREREQ_2; MATCH([.C189]; POWER_CHART_INDEXES; 0))); ""); "") ->  | K189: of:=IF(OR([.J189]=""; [.B189]); 0; INDEX(POWER_CHART_INDEXES; MATCH([.J189]; POWER_CHART_NAMES; 0))) -> 0 | L189: of:=IF([.K189]=0; TRUE(); COUNTIF(POWER_CALC_SELECTED_INDEXES; [.K189])) -> true | M189: of:=IF(N([.C189]); IFERROR(T(INDEX(POWER_CHART_PREREQ_3; MATCH([.C189]; POWER_CHART_INDEXES; 0))); ""); "") ->  | N189: of:=IF(OR([.M189]=""; [.B189]); 0; INDEX(POWER_CHART_INDEXES; MATCH([.M189]; POWER_CHART_NAMES; 0))) -> 0 | O189: of:=IF([.N189]=0; TRUE(); COUNTIF(POWER_CALC_SELECTED_INDEXES; [.N189])) -> true | P189: of:=AND([.I189]; [.L189]; [.O189]) -> true | Q189: of:=IF(NOT([.P189]); "Purchase a prerequisite for "&[.A189]&" ("&COM.MICROSOFT.TEXTJOIN(" or "; 1; [.G189]; [.J189]; [.M189])&")."&CHAR(13)&CHAR(10); "") ->  | R189: of:=IF([#REF!]=""; FALSE(); IF([.O189]; TRUE(); FALSE())) ->  | T189: of:=IF([.A189]=""; FALSE(); IF([.P189]; TRUE(); FALSE())) -> true | U189: of:=IF([.T189]; [.C189]; "") -> 75 | W189: of:=IF(AND([.T189]; NOT([Powers.E30]="")); [Powers.E30]; "") ->  | Y189: of:=IF(AND([.T189]; OR([.W189]=""; [.B189])); [.A189]; [.W189]) -> Teleportation | Z189: of:=IF(AND([.T189]; NOT([Powers.F30]="")); [Powers.F30]; "") ->  | AA189: of:=IF([.T189]; IFERROR(T(INDEX(POWER_CHART_ACTIONS; MATCH([.C189]; POWER_CHART_INDEXES; 0))); ""); "") ->  | AB189: of:=IF([.T189]; INDEX(POWER_CHART_ATTACKS; MATCH([.C189]; POWER_CHART_INDEXES; 0)); FALSE()) -> false | AC189: of:=IF([.T189]; INDEX(POWER_CHART_TYPES; MATCH([.C189]; POWER_CHART_INDEXES; 0))&" "&IF([.AB189]; "attack"; "power"); "") -> Movement power | AD189: of:=[.AD188] -> true | AE189: of:=IF([.T189]; IF(VLOOKUP([.A189]; POWER_CHART; 4; FALSE())="Ranged"; TRUE(); FALSE()); FALSE()) -> false | AF189: of:=IF(AND(OR([.AE189];[.AD189]); OR(ISNUMBER(FIND("attack"; [.AC189])); ISNUMBER(FIND("Environmental"; [.AC189])); ISNUMBER(FIND("Ultra-power"; [.A189]))); NOT(ISNUMBER(FIND("Strike";[.A189])))); TRUE(); FALSE()) -> false | AG189: of:=[.AG188] -> true | AH189: of:=IF([.AF189]; INDEX(POWER_LEVEL_CHART_RANGES_TEXT; MATCH(POWER_LEVEL-1; POWER_LEVEL_CHART_INDEXES;0)); "") ->  | AI189: of:=IF([.AF189]; INDEX(POWER_LEVEL_CHART_RANGES; MATCH(POWER_LEVEL; POWER_LEVEL_CHART_INDEXES;0)); "") ->  | AJ189: of:=IF([.AF189]; [.AI189]*[.AG189]; "") ->  | AK189: of:=IF([.AF189]; IF(([.AJ189])>9999; TEXT(([.AJ189])/1000; "#,##0")&" km"; TEXT([.AJ189];"#,##0")&" m"); "") ->  | AL189: of:=IF([.AF189]; "Ranged ("&[.AH189]&"/"&[.AK189]&")"; "") ->  | AM189: of:=[.AM188] -> true | AN189: of:=IF(AND([.AM189]; OR(ISNUMBER(FIND("attack"; [.AC189])); ISNUMBER(FIND("Ultra-power"; [.A189])))); TRUE(); FALSE()) -> false | AO189: of:=IF([.AN189];", Seeking";"") ->  | AP189: of:=[.AP188] -> true | AQ189: of:=IF([.T189]; IF(INDEX(POWER_CHART_AREAS; MATCH([.C189]; POWER_CHART_INDEXES; 0))="Area"; TRUE(); FALSE())) -> false | AR189: of:=OR([.AP189];[.AQ189]) -> true | AS189: of:=[.AS188] -> true | AT189: of:=IF([.AR189]; INDEX(POWER_LEVEL_CHART_AREAS; MATCH(POWER_LEVEL; POWER_LEVEL_CHART_INDEXES;0)); "") -> 10 | AU189: of:=IF([.AR189]; [.AS189]*[.AT189]; "") -> 10 | AV189: of:=IF([.AR189]; IF(([.AU189])>9999; TEXT(([.AU189])/1000; "#,##0")&" km radius"; TEXT([.AU189];"#,##0")&" m radius"); "") -> 10 m radius | AW189: of:=IF([.AR189]; "Area ("&[.AV189]&")"; "") -> Area (10 m radius) | AX189: of:=[.AX188] -> true | AY189: of:=IF([.AX189]) -> true | AZ189: of:=IF([.AY189];", Selective";"") -> , Selective | BA189: of:=ISNUMBER(FIND("Movement"; [.AC189])) -> true | BB189: of:=[.BB188] -> true | BC189: of:=ISNUMBER(FIND("Super Running"; [.A189])) -> false | BD189: of:=IF([.BC189]; INDEX(MOVEMENT_CHART_BASES_TEXT; MATCH(ATHLETICS+POWER_LEVEL; MOVEMENT_CHART_INDEXES;0)); "") ->  | BE189: of:=IF([.BC189]; INDEX(MOVEMENT_CHART_SPRINTS; MATCH(ATHLETICS+POWER_LEVEL; MOVEMENT_CHART_INDEXES;0)); "") ->  | BF189: of:=IF([.BC189]; [.BE189]*[.BB189]; "") ->  | BG189: of:=IF([.BC189]; IF(([.BF189])>9999; TEXT(([.BF189])/1000; "#,##0")&" km"; TEXT([.BF189];"#,##0")&" m"); "") ->  | BH189: of:=IF([.BC189]; "("&[.BD189]&"/"&[.BG189]&")"; "") ->  | BI189: of:=AND(ISNUMBER(FIND("Super Swimming"; [.A189]))) -> false | BJ189: of:=IF([.BI189]; INDEX(MOVEMENT_CHART_BASES_TEXT; MATCH(ATHLETICS+POWER_LEVEL; MOVEMENT_CHART_INDEXES;0)); "") ->  | BK189: of:=IF([.BI189]; INDEX(MOVEMENT_CHART_SPRINTS; MATCH(ATHLETICS+POWER_LEVEL; MOVEMENT_CHART_INDEXES;0)); "") ->  | BL189: of:=IF([.BI189]; [.BK189]*[.BB189]; "") ->  | BM189: of:=IF([.BI189]; IF(([.BL189])>9999; TEXT(([.BL189])/1000; "#,##0")&" km"; TEXT([.BL189];"#,##0")&" m"); "") ->  | BN189: of:=IF([.BI189]; "("&[.BJ189]&"/"&[.BM189]&")"; "") ->  | BO189: of:=ISNUMBER(FIND("Flight"; [.A189])) -> false | BP189: of:=IF([.BO189]; INDEX(MOVEMENT_CHART_BASES_TEXT; MATCH(ATHLETICS+POWER_LEVEL; MOVEMENT_CHART_INDEXES;0)); "") ->  | BQ189: of:=IF([.BO189]; INDEX(MOVEMENT_CHART_SPRINTS; MATCH(ATHLETICS+POWER_LEVEL; MOVEMENT_CHART_INDEXES;0)); "") ->  | BR189: of:=IF([.BO189]; [.BQ189]*[.BB189]; "") ->  | BS189: of:=IF([.BO189]; IF(([.BR189])>9999; TEXT(([.BR189])/1000; "#,##0")&" km"; TEXT([.BR189];"#,##0")&" m"); "") ->  | BT189: of:=IF([.BO189]; "("&[.BP189]&"/"&[.BS189]&")"; "") ->  | BU189: of:=ISNUMBER(FIND("Teleportation"; [.A189])) -> true | BV189: of:=IF([.BU189]; INDEX(TELEPORTATION_CHART_BASES_TEXT; MATCH(POWER_LEVEL; TELEPORTATION_CHART_INDEXES; 0)); "") -> 1,500 m | BW189: of:=IF([.BU189]; INDEX(TELEPORTATION_CHART_SPRINTS; MATCH(POWER_LEVEL; TELEPORTATION_CHART_INDEXES; 0)); "") -> 9000 | BX189: of:=IF([.BU189]; [.BW189]*[.BB189]; "") -> 9000 | BY189: of:=IF([.BU189]; IF(([.BX189])>9999; TEXT(([.BX189])/1000; "#,##0")&" km"; TEXT([.BX189];"#,##0")&" m"); "") -> 9,000 m | BZ189: of:=IF([.BU189]; "("&[.BV189]&"/"&[.BY189]&")"; "") -> (1,500 m/9,000 m) | CA189: of:=ISNUMBER(FIND("Tunneling"; [.A189])) -> false | CB189: of:=IF([.CA189]; INDEX(MOVEMENT_CHART_BASES_TEXT; MATCH(ATHLETICS+POWER_LEVEL; MOVEMENT_CHART_INDEXES;0)); "") ->  | CC189: of:=IF([.CA189]; INDEX(MOVEMENT_CHART_SPRINTS; MATCH(ATHLETICS+POWER_LEVEL; MOVEMENT_CHART_INDEXES;0)); "") ->  | CD189: of:=IF([.CA189]; [.CC189]*[.BB189]; "") ->  | CE189: of:=IF([.CA189]; IF(([.CD189])>9999; TEXT(([.CD189])/1000; "#,##0")&" km"; TEXT([.CD189];"#,##0")&" m"); "") ->  | CF189: of:=IF([.CA189]; "("&[.CB189]&"/"&[.CE189]&")"; "") ->  | CG189: of:=AND(ISNUMBER(FIND("Super Endurance"; [.A189]))) -> false | CH189: of:=AND(ISNUMBER(FIND("Super Health"; [.A189]))) -> false | CI189: of:=AND(ISNUMBER(FIND("Super Reflection"; [.A189]))) -> false | CJ189: of:=AND(ISNUMBER(FIND("Super Strength"; [.A189]))) -> false | CK189: of:=ISNUMBER(FIND("Alteration Resistance"; [.A189])) -> false | CL189: of:=IF([.CK189]; ALTERATION_RESISTANCE_TEXT; "") ->  | CM189: of:=ISNUMBER(FIND("Damage Resistance"; [.A189])) -> false | CN189: of:=IF([.CM189]; DAMAGE_RESISTANCE_TEXT; "") ->  | CO189: of:=ISNUMBER(FIND("Mental Resistance"; [.A189])) -> false | CP189: of:=IF([.CO189]; MENTAL_RESISTANCE_TEXT; "") ->  | CQ189: of:=ISNUMBER(FIND("Bulletproof"; [.A189])) -> false | CR189: of:=IF([.CQ189]; "Unaffected by ordinary weapons Equipment Level "&POWER_LEVEL&" and lower"; "") ->  | CS189: of:=ISNUMBER(FIND("Density Control"; [.A189])) -> false | CT189: of:=IF([.CS189]; INDEX(DENSITY_CONTROL_CHART; POWER_LEVEL; 4); "") ->  | CU189: of:=ISNUMBER(FIND("Duplication"; [.A189])) -> false | CV189: of:=IF([.CU189]; INDEX(DUPLICATION_CHART; POWER_LEVEL; 3); "") ->  | CW189: of:=ISNUMBER(FIND("Growth"; [.A189])) -> false | CX189: of:=IF([.CW189]; INDEX(GROWTH_CHART; POWER_LEVEL; 6); "") ->  | CY189: of:=ISNUMBER(FIND("Extra Actions"; [.A189])) -> false | CZ189: of:=IF([.CY189]; POWER_LEVEL&" extra actions per scene"; "") ->  | DA189: of:=ISNUMBER(FIND("Haste"; [.A189])) -> false | DB189: of:=IF([.DA189]; INDEX(HASTE_CHART; POWER_LEVEL; 3); "") ->  | DC189: of:=ISNUMBER(FIND("Shrinking"; [.A189])) -> false | DD189: of:=IF([.DC189]; INDEX(SHRINKING_CHART; POWER_LEVEL; 4); "") ->  | DE189: of:=ISNUMBER(FIND("Stretching"; [.A189])) -> false | DF189: of:=IF([.DE189]; INDEX(STRETCHING_CHART; POWER_LEVEL; 2)&" reach"; "") ->  | DG189: of:=[.CL189]&[.CN189]&[.CP189]&[.CR189]&[.CT189]&[.CV189]&[.CX189]&[.CZ189]&[.DB189]&[.DD189]&[.DF189] ->  | DH189: of:=ISNUMBER(FIND("[Element]"; [.A189])) -> false | DI189: of:=ISNUMBER(FIND("[Subject]"; [.A189])) -> false | DJ189: of:=ISNUMBER(FIND("[Transformation]"; [.A189])) -> false | DT189: of:=IF([.T189]; COM.MICROSOFT.TEXTJOIN(", "; 1; [.AA189];[.AL189];[.AL189];[.AZ189];[.AZ189];[.AC189]); "") -> , Selective, , Selective, Movement power | DU189: of:=IF([Powers.F30]=""; ""; [Powers.F30])&IF(OR([Powers.F30]=""; [.DG189]=""); ""; "; ")&IF([.DG189]=""; ""; [.DG189]) ->  | EC189: of:=IF([.T189]; [.Y189]&CHAR(13)&CHAR(10)&[.DT189]&CHAR(13)&CHAR(10)&[.DU189]&CHAR(13)&CHAR(10)&VLOOKUP( [.A189]; POWER_CHART; 11; FALSE())&CHAR(13)&CHAR(10)&CHAR(13)&CHAR(10); "") -> Teleportation
, Selective, , Selective, Movement power

75


A190: of:=IF([Powers.C31]=""; ""; [Powers.C31]) -> [Transformation] Ray | C190: of:=IF(TRIM([.A190])=""; ""; INDEX(POWER_CHART_INDEXES; MATCH([.A190]; POWER_CHART_NAMES; 0))) -> 78 | F190: of:=IF([#REF!]=""; FALSE(); IF([.E190]; TRUE(); FALSE())) ->  | G190: of:=IF(N([.C190]); IFERROR(T(INDEX(POWER_CHART_PREREQ_1; MATCH([.C190]; POWER_CHART_INDEXES; 0))); ""); "") ->  | H190: of:=IF(OR([.G190]=""; [.B190]); 0; INDEX(POWER_CHART_INDEXES; MATCH([.G190]; POWER_CHART_NAMES; 0))) -> 0 | I190: of:=IF([.H190]=0; TRUE(); COUNTIF(POWER_CALC_SELECTED_INDEXES; [.H190])) -> true | J190: of:=IF(N([.C190]); IFERROR(T(INDEX(POWER_CHART_PREREQ_2; MATCH([.C190]; POWER_CHART_INDEXES; 0))); ""); "") ->  | K190: of:=IF(OR([.J190]=""; [.B190]); 0; INDEX(POWER_CHART_INDEXES; MATCH([.J190]; POWER_CHART_NAMES; 0))) -> 0 | L190: of:=IF([.K190]=0; TRUE(); COUNTIF(POWER_CALC_SELECTED_INDEXES; [.K190])) -> true | M190: of:=IF(N([.C190]); IFERROR(T(INDEX(POWER_CHART_PREREQ_3; MATCH([.C190]; POWER_CHART_INDEXES; 0))); ""); "") ->  | N190: of:=IF(OR([.M190]=""; [.B190]); 0; INDEX(POWER_CHART_INDEXES; MATCH([.M190]; POWER_CHART_NAMES; 0))) -> 0 | O190: of:=IF([.N190]=0; TRUE(); COUNTIF(POWER_CALC_SELECTED_INDEXES; [.N190])) -> true | P190: of:=AND([.I190]; [.L190]; [.O190]) -> true | Q190: of:=IF(NOT([.P190]); "Purchase a prerequisite for "&[.A190]&" ("&COM.MICROSOFT.TEXTJOIN(" or "; 1; [.G190]; [.J190]; [.M190])&")."&CHAR(13)&CHAR(10); "") ->  | R190: of:=IF([#REF!]=""; FALSE(); IF([.O190]; TRUE(); FALSE())) ->  | T190: of:=IF([.A190]=""; FALSE(); IF([.P190]; TRUE(); FALSE())) -> true | U190: of:=IF([.T190]; [.C190]; "") -> 78 | W190: of:=IF(AND([.T190]; NOT([Powers.E31]="")); [Powers.E31]; "") ->  | Y190: of:=IF(AND([.T190]; OR([.W190]=""; [.B190])); [.A190]; [.W190]) -> [Transformation] Ray | Z190: of:=IF(AND([.T190]; NOT([Powers.F31]="")); [Powers.F31]; "") ->  | AA190: of:=IF([.T190]; IFERROR(T(INDEX(POWER_CHART_ACTIONS; MATCH([.C190]; POWER_CHART_INDEXES; 0))); ""); "") -> Standard action | AB190: of:=IF([.T190]; INDEX(POWER_CHART_ATTACKS; MATCH([.C190]; POWER_CHART_INDEXES; 0)); FALSE()) -> true | AC190: of:=IF([.T190]; INDEX(POWER_CHART_TYPES; MATCH([.C190]; POWER_CHART_INDEXES; 0))&" "&IF([.AB190]; "attack"; "power"); "") -> Alteration attack | AD190: of:=[.AD189] -> true | AE190: of:=IF([.T190]; IF(VLOOKUP([.A190]; POWER_CHART; 4; FALSE())="Ranged"; TRUE(); FALSE()); FALSE()) -> false | AF190: of:=IF(AND(OR([.AE190];[.AD190]); OR(ISNUMBER(FIND("attack"; [.AC190])); ISNUMBER(FIND("Environmental"; [.AC190])); ISNUMBER(FIND("Ultra-power"; [.A190]))); NOT(ISNUMBER(FIND("Strike";[.A190])))); TRUE(); FALSE()) -> true | AG190: of:=[.AG189] -> true | AH190: of:=IF([.AF190]; INDEX(POWER_LEVEL_CHART_RANGES_TEXT; MATCH(POWER_LEVEL-1; POWER_LEVEL_CHART_INDEXES;0)); "") -> 600 m | AI190: of:=IF([.AF190]; INDEX(POWER_LEVEL_CHART_RANGES; MATCH(POWER_LEVEL; POWER_LEVEL_CHART_INDEXES;0)); "") -> 1000 | AJ190: of:=IF([.AF190]; [.AI190]*[.AG190]; "") -> 1000 | AK190: of:=IF([.AF190]; IF(([.AJ190])>9999; TEXT(([.AJ190])/1000; "#,##0")&" km"; TEXT([.AJ190];"#,##0")&" m"); "") -> 1,000 m | AL190: of:=IF([.AF190]; "Ranged ("&[.AH190]&"/"&[.AK190]&")"; "") -> Ranged (600 m/1,000 m) | AM190: of:=[.AM189] -> true | AN190: of:=IF(AND([.AM190]; OR(ISNUMBER(FIND("attack"; [.AC190])); ISNUMBER(FIND("Ultra-power"; [.A190])))); TRUE(); FALSE()) -> true | AO190: of:=IF([.AN190];", Seeking";"") -> , Seeking | AP190: of:=[.AP189] -> true | AQ190: of:=IF([.T190]; IF(INDEX(POWER_CHART_AREAS; MATCH([.C190]; POWER_CHART_INDEXES; 0))="Area"; TRUE(); FALSE())) -> false | AR190: of:=OR([.AP190];[.AQ190]) -> true | AS190: of:=[.AS189] -> true | AT190: of:=IF([.AR190]; INDEX(POWER_LEVEL_CHART_AREAS; MATCH(POWER_LEVEL; POWER_LEVEL_CHART_INDEXES;0)); "") -> 10 | AU190: of:=IF([.AR190]; [.AS190]*[.AT190]; "") -> 10 | AV190: of:=IF([.AR190]; IF(([.AU190])>9999; TEXT(([.AU190])/1000; "#,##0")&" km radius"; TEXT([.AU190];"#,##0")&" m radius"); "") -> 10 m radius | AW190: of:=IF([.AR190]; "Area ("&[.AV190]&")"; "") -> Area (10 m radius) | AX190: of:=[.AX189] -> true | AY190: of:=IF([.AX190]) -> true | AZ190: of:=IF([.AY190];", Selective";"") -> , Selective | BA190: of:=ISNUMBER(FIND("Movement"; [.AC190])) -> false | BB190: of:=[.BB189] -> true | BC190: of:=ISNUMBER(FIND("Super Running"; [.A190])) -> false | BD190: of:=IF([.BC190]; INDEX(MOVEMENT_CHART_BASES_TEXT; MATCH(ATHLETICS+POWER_LEVEL; MOVEMENT_CHART_INDEXES;0)); "") ->  | BE190: of:=IF([.BC190]; INDEX(MOVEMENT_CHART_SPRINTS; MATCH(ATHLETICS+POWER_LEVEL; MOVEMENT_CHART_INDEXES;0)); "") ->  | BF190: of:=IF([.BC190]; [.BE190]*[.BB190]; "") ->  | BG190: of:=IF([.BC190]; IF(([.BF190])>9999; TEXT(([.BF190])/1000; "#,##0")&" km"; TEXT([.BF190];"#,##0")&" m"); "") ->  | BH190: of:=IF([.BC190]; "("&[.BD190]&"/"&[.BG190]&")"; "") ->  | BI190: of:=AND(ISNUMBER(FIND("Super Swimming"; [.A190]))) -> false | BJ190: of:=IF([.BI190]; INDEX(MOVEMENT_CHART_BASES_TEXT; MATCH(ATHLETICS+POWER_LEVEL; MOVEMENT_CHART_INDEXES;0)); "") ->  | BK190: of:=IF([.BI190]; INDEX(MOVEMENT_CHART_SPRINTS; MATCH(ATHLETICS+POWER_LEVEL; MOVEMENT_CHART_INDEXES;0)); "") ->  | BL190: of:=IF([.BI190]; [.BK190]*[.BB190]; "") ->  | BM190: of:=IF([.BI190]; IF(([.BL190])>9999; TEXT(([.BL190])/1000; "#,##0")&" km"; TEXT([.BL190];"#,##0")&" m"); "") ->  | BN190: of:=IF([.BI190]; "("&[.BJ190]&"/"&[.BM190]&")"; "") ->  | BO190: of:=ISNUMBER(FIND("Flight"; [.A190])) -> false | BP190: of:=IF([.BO190]; INDEX(MOVEMENT_CHART_BASES_TEXT; MATCH(ATHLETICS+POWER_LEVEL; MOVEMENT_CHART_INDEXES;0)); "") ->  | BQ190: of:=IF([.BO190]; INDEX(MOVEMENT_CHART_SPRINTS; MATCH(ATHLETICS+POWER_LEVEL; MOVEMENT_CHART_INDEXES;0)); "") ->  | BR190: of:=IF([.BO190]; [.BQ190]*[.BB190]; "") ->  | BS190: of:=IF([.BO190]; IF(([.BR190])>9999; TEXT(([.BR190])/1000; "#,##0")&" km"; TEXT([.BR190];"#,##0")&" m"); "") ->  | BT190: of:=IF([.BO190]; "("&[.BP190]&"/"&[.BS190]&")"; "") ->  | BU190: of:=ISNUMBER(FIND("Teleportation"; [.A190])) -> false | BV190: of:=IF([.BU190]; INDEX(TELEPORTATION_CHART_BASES_TEXT; MATCH(POWER_LEVEL; TELEPORTATION_CHART_INDEXES; 0)); "") ->  | BW190: of:=IF([.BU190]; INDEX(TELEPORTATION_CHART_SPRINTS; MATCH(POWER_LEVEL; TELEPORTATION_CHART_INDEXES; 0)); "") ->  | BX190: of:=IF([.BU190]; [.BW190]*[.BB190]; "") ->  | BY190: of:=IF([.BU190]; IF(([.BX190])>9999; TEXT(([.BX190])/1000; "#,##0")&" km"; TEXT([.BX190];"#,##0")&" m"); "") ->  | BZ190: of:=IF([.BU190]; "("&[.BV190]&"/"&[.BY190]&")"; "") ->  | CA190: of:=ISNUMBER(FIND("Tunneling"; [.A190])) -> false | CB190: of:=IF([.CA190]; INDEX(MOVEMENT_CHART_BASES_TEXT; MATCH(ATHLETICS+POWER_LEVEL; MOVEMENT_CHART_INDEXES;0)); "") ->  | CC190: of:=IF([.CA190]; INDEX(MOVEMENT_CHART_SPRINTS; MATCH(ATHLETICS+POWER_LEVEL; MOVEMENT_CHART_INDEXES;0)); "") ->  | CD190: of:=IF([.CA190]; [.CC190]*[.BB190]; "") ->  | CE190: of:=IF([.CA190]; IF(([.CD190])>9999; TEXT(([.CD190])/1000; "#,##0")&" km"; TEXT([.CD190];"#,##0")&" m"); "") ->  | CF190: of:=IF([.CA190]; "("&[.CB190]&"/"&[.CE190]&")"; "") ->  | CG190: of:=AND(ISNUMBER(FIND("Super Endurance"; [.A190]))) -> false | CH190: of:=AND(ISNUMBER(FIND("Super Health"; [.A190]))) -> false | CI190: of:=AND(ISNUMBER(FIND("Super Reflection"; [.A190]))) -> false | CJ190: of:=AND(ISNUMBER(FIND("Super Strength"; [.A190]))) -> false | CK190: of:=ISNUMBER(FIND("Alteration Resistance"; [.A190])) -> false | CL190: of:=IF([.CK190]; ALTERATION_RESISTANCE_TEXT; "") ->  | CM190: of:=ISNUMBER(FIND("Damage Resistance"; [.A190])) -> false | CN190: of:=IF([.CM190]; DAMAGE_RESISTANCE_TEXT; "") ->  | CO190: of:=ISNUMBER(FIND("Mental Resistance"; [.A190])) -> false | CP190: of:=IF([.CO190]; MENTAL_RESISTANCE_TEXT; "") ->  | CQ190: of:=ISNUMBER(FIND("Bulletproof"; [.A190])) -> false | CR190: of:=IF([.CQ190]; "Unaffected by ordinary weapons Equipment Level "&POWER_LEVEL&" and lower"; "") ->  | CS190: of:=ISNUMBER(FIND("Density Control"; [.A190])) -> false | CT190: of:=IF([.CS190]; INDEX(DENSITY_CONTROL_CHART; POWER_LEVEL; 4); "") ->  | CU190: of:=ISNUMBER(FIND("Duplication"; [.A190])) -> false | CV190: of:=IF([.CU190]; INDEX(DUPLICATION_CHART; POWER_LEVEL; 3); "") ->  | CW190: of:=ISNUMBER(FIND("Growth"; [.A190])) -> false | CX190: of:=IF([.CW190]; INDEX(GROWTH_CHART; POWER_LEVEL; 6); "") ->  | CY190: of:=ISNUMBER(FIND("Extra Actions"; [.A190])) -> false | CZ190: of:=IF([.CY190]; POWER_LEVEL&" extra actions per scene"; "") ->  | DA190: of:=ISNUMBER(FIND("Haste"; [.A190])) -> false | DB190: of:=IF([.DA190]; INDEX(HASTE_CHART; POWER_LEVEL; 3); "") ->  | DC190: of:=ISNUMBER(FIND("Shrinking"; [.A190])) -> false | DD190: of:=IF([.DC190]; INDEX(SHRINKING_CHART; POWER_LEVEL; 4); "") ->  | DE190: of:=ISNUMBER(FIND("Stretching"; [.A190])) -> false | DF190: of:=IF([.DE190]; INDEX(STRETCHING_CHART; POWER_LEVEL; 2)&" reach"; "") ->  | DG190: of:=[.CL190]&[.CN190]&[.CP190]&[.CR190]&[.CT190]&[.CV190]&[.CX190]&[.CZ190]&[.DB190]&[.DD190]&[.DF190] ->  | DH190: of:=ISNUMBER(FIND("[Element]"; [.A190])) -> false | DI190: of:=ISNUMBER(FIND("[Subject]"; [.A190])) -> false | DJ190: of:=ISNUMBER(FIND("[Transformation]"; [.A190])) -> true | DT190: of:=IF([.T190]; COM.MICROSOFT.TEXTJOIN(", "; 1; [.AA190];[.AL190];[.AL190];[.AZ190];[.AZ190];[.AC190]); "") -> Standard action, Ranged (600 m/1,000 m), Ranged (600 m/1,000 m), , Selective, , Selective, Alteration attack | DU190: of:=IF([Powers.F31]=""; ""; [Powers.F31])&IF(OR([Powers.F31]=""; [.DG190]=""); ""; "; ")&IF([.DG190]=""; ""; [.DG190]) ->  | EC190: of:=IF([.T190]; [.Y190]&CHAR(13)&CHAR(10)&[.DT190]&CHAR(13)&CHAR(10)&[.DU190]&CHAR(13)&CHAR(10)&VLOOKUP( [.A190]; POWER_CHART; 11; FALSE())&CHAR(13)&CHAR(10)&CHAR(13)&CHAR(10); "") -> [Transformation] Ray
Standard action, Ranged (600 m/1,000 m), Ranged (600 m/1,000 m), , Selective, , Selective, Alteration attack

78


A191: of:=IF([Powers.C32]=""; ""; [Powers.C32]) -> Reflection | C191: of:=IF(TRIM([.A191])=""; ""; INDEX(POWER_CHART_INDEXES; MATCH([.A191]; POWER_CHART_NAMES; 0))) -> 54 | F191: of:=IF([#REF!]=""; FALSE(); IF([.E191]; TRUE(); FALSE())) ->  | G191: of:=IF(N([.C191]); IFERROR(T(INDEX(POWER_CHART_PREREQ_1; MATCH([.C191]; POWER_CHART_INDEXES; 0))); ""); "") ->  | H191: of:=IF(OR([.G191]=""; [.B191]); 0; INDEX(POWER_CHART_INDEXES; MATCH([.G191]; POWER_CHART_NAMES; 0))) -> 0 | I191: of:=IF([.H191]=0; TRUE(); COUNTIF(POWER_CALC_SELECTED_INDEXES; [.H191])) -> true | J191: of:=IF(N([.C191]); IFERROR(T(INDEX(POWER_CHART_PREREQ_2; MATCH([.C191]; POWER_CHART_INDEXES; 0))); ""); "") ->  | K191: of:=IF(OR([.J191]=""; [.B191]); 0; INDEX(POWER_CHART_INDEXES; MATCH([.J191]; POWER_CHART_NAMES; 0))) -> 0 | L191: of:=IF([.K191]=0; TRUE(); COUNTIF(POWER_CALC_SELECTED_INDEXES; [.K191])) -> true | M191: of:=IF(N([.C191]); IFERROR(T(INDEX(POWER_CHART_PREREQ_3; MATCH([.C191]; POWER_CHART_INDEXES; 0))); ""); "") ->  | N191: of:=IF(OR([.M191]=""; [.B191]); 0; INDEX(POWER_CHART_INDEXES; MATCH([.M191]; POWER_CHART_NAMES; 0))) -> 0 | O191: of:=IF([.N191]=0; TRUE(); COUNTIF(POWER_CALC_SELECTED_INDEXES; [.N191])) -> true | P191: of:=AND([.I191]; [.L191]; [.O191]) -> true | Q191: of:=IF(NOT([.P191]); "Purchase a prerequisite for "&[.A191]&" ("&COM.MICROSOFT.TEXTJOIN(" or "; 1; [.G191]; [.J191]; [.M191])&")."&CHAR(13)&CHAR(10); "") ->  | R191: of:=IF([#REF!]=""; FALSE(); IF([.O191]; TRUE(); FALSE())) ->  | T191: of:=IF([.A191]=""; FALSE(); IF([.P191]; TRUE(); FALSE())) -> true | U191: of:=IF([.T191]; [.C191]; "") -> 54 | W191: of:=IF(AND([.T191]; NOT([Powers.E32]="")); [Powers.E32]; "") ->  | Y191: of:=IF(AND([.T191]; OR([.W191]=""; [.B191])); [.A191]; [.W191]) -> Reflection | Z191: of:=IF(AND([.T191]; NOT([Powers.F32]="")); [Powers.F32]; "") ->  | AA191: of:=IF([.T191]; IFERROR(T(INDEX(POWER_CHART_ACTIONS; MATCH([.C191]; POWER_CHART_INDEXES; 0))); ""); "") -> Anytime action | AB191: of:=IF([.T191]; INDEX(POWER_CHART_ATTACKS; MATCH([.C191]; POWER_CHART_INDEXES; 0)); FALSE()) -> true | AC191: of:=IF([.T191]; INDEX(POWER_CHART_TYPES; MATCH([.C191]; POWER_CHART_INDEXES; 0))&" "&IF([.AB191]; "attack"; "power"); "") -> Normal attack | AD191: of:=[.AD190] -> true | AE191: of:=IF([.T191]; IF(VLOOKUP([.A191]; POWER_CHART; 4; FALSE())="Ranged"; TRUE(); FALSE()); FALSE()) -> false | AF191: of:=IF(AND(OR([.AE191];[.AD191]); OR(ISNUMBER(FIND("attack"; [.AC191])); ISNUMBER(FIND("Environmental"; [.AC191])); ISNUMBER(FIND("Ultra-power"; [.A191]))); NOT(ISNUMBER(FIND("Strike";[.A191])))); TRUE(); FALSE()) -> true | AG191: of:=[.AG190] -> true | AH191: of:=IF([.AF191]; INDEX(POWER_LEVEL_CHART_RANGES_TEXT; MATCH(POWER_LEVEL-1; POWER_LEVEL_CHART_INDEXES;0)); "") -> 600 m | AI191: of:=IF([.AF191]; INDEX(POWER_LEVEL_CHART_RANGES; MATCH(POWER_LEVEL; POWER_LEVEL_CHART_INDEXES;0)); "") -> 1000 | AJ191: of:=IF([.AF191]; [.AI191]*[.AG191]; "") -> 1000 | AK191: of:=IF([.AF191]; IF(([.AJ191])>9999; TEXT(([.AJ191])/1000; "#,##0")&" km"; TEXT([.AJ191];"#,##0")&" m"); "") -> 1,000 m | AL191: of:=IF([.AF191]; "Ranged ("&[.AH191]&"/"&[.AK191]&")"; "") -> Ranged (600 m/1,000 m) | AM191: of:=[.AM190] -> true | AN191: of:=IF(AND([.AM191]; OR(ISNUMBER(FIND("attack"; [.AC191])); ISNUMBER(FIND("Ultra-power"; [.A191])))); TRUE(); FALSE()) -> true | AO191: of:=IF([.AN191];", Seeking";"") -> , Seeking | AP191: of:=[.AP190] -> true | AQ191: of:=IF([.T191]; IF(INDEX(POWER_CHART_AREAS; MATCH([.C191]; POWER_CHART_INDEXES; 0))="Area"; TRUE(); FALSE())) -> false | AR191: of:=OR([.AP191];[.AQ191]) -> true | AS191: of:=[.AS190] -> true | AT191: of:=IF([.AR191]; INDEX(POWER_LEVEL_CHART_AREAS; MATCH(POWER_LEVEL; POWER_LEVEL_CHART_INDEXES;0)); "") -> 10 | AU191: of:=IF([.AR191]; [.AS191]*[.AT191]; "") -> 10 | AV191: of:=IF([.AR191]; IF(([.AU191])>9999; TEXT(([.AU191])/1000; "#,##0")&" km radius"; TEXT([.AU191];"#,##0")&" m radius"); "") -> 10 m radius | AW191: of:=IF([.AR191]; "Area ("&[.AV191]&")"; "") -> Area (10 m radius) | AX191: of:=[.AX190] -> true | AY191: of:=IF([.AX191]) -> true | AZ191: of:=IF([.AY191];", Selective";"") -> , Selective | BA191: of:=ISNUMBER(FIND("Movement"; [.AC191])) -> false | BB191: of:=[.BB190] -> true | BC191: of:=ISNUMBER(FIND("Super Running"; [.A191])) -> false | BD191: of:=IF([.BC191]; INDEX(MOVEMENT_CHART_BASES_TEXT; MATCH(ATHLETICS+POWER_LEVEL; MOVEMENT_CHART_INDEXES;0)); "") ->  | BE191: of:=IF([.BC191]; INDEX(MOVEMENT_CHART_SPRINTS; MATCH(ATHLETICS+POWER_LEVEL; MOVEMENT_CHART_INDEXES;0)); "") ->  | BF191: of:=IF([.BC191]; [.BE191]*[.BB191]; "") ->  | BG191: of:=IF([.BC191]; IF(([.BF191])>9999; TEXT(([.BF191])/1000; "#,##0")&" km"; TEXT([.BF191];"#,##0")&" m"); "") ->  | BH191: of:=IF([.BC191]; "("&[.BD191]&"/"&[.BG191]&")"; "") ->  | BI191: of:=AND(ISNUMBER(FIND("Super Swimming"; [.A191]))) -> false | BJ191: of:=IF([.BI191]; INDEX(MOVEMENT_CHART_BASES_TEXT; MATCH(ATHLETICS+POWER_LEVEL; MOVEMENT_CHART_INDEXES;0)); "") ->  | BK191: of:=IF([.BI191]; INDEX(MOVEMENT_CHART_SPRINTS; MATCH(ATHLETICS+POWER_LEVEL; MOVEMENT_CHART_INDEXES;0)); "") ->  | BL191: of:=IF([.BI191]; [.BK191]*[.BB191]; "") ->  | BM191: of:=IF([.BI191]; IF(([.BL191])>9999; TEXT(([.BL191])/1000; "#,##0")&" km"; TEXT([.BL191];"#,##0")&" m"); "") ->  | BN191: of:=IF([.BI191]; "("&[.BJ191]&"/"&[.BM191]&")"; "") ->  | BO191: of:=ISNUMBER(FIND("Flight"; [.A191])) -> false | BP191: of:=IF([.BO191]; INDEX(MOVEMENT_CHART_BASES_TEXT; MATCH(ATHLETICS+POWER_LEVEL; MOVEMENT_CHART_INDEXES;0)); "") ->  | BQ191: of:=IF([.BO191]; INDEX(MOVEMENT_CHART_SPRINTS; MATCH(ATHLETICS+POWER_LEVEL; MOVEMENT_CHART_INDEXES;0)); "") ->  | BR191: of:=IF([.BO191]; [.BQ191]*[.BB191]; "") ->  | BS191: of:=IF([.BO191]; IF(([.BR191])>9999; TEXT(([.BR191])/1000; "#,##0")&" km"; TEXT([.BR191];"#,##0")&" m"); "") ->  | BT191: of:=IF([.BO191]; "("&[.BP191]&"/"&[.BS191]&")"; "") ->  | BU191: of:=ISNUMBER(FIND("Teleportation"; [.A191])) -> false | BV191: of:=IF([.BU191]; INDEX(TELEPORTATION_CHART_BASES_TEXT; MATCH(POWER_LEVEL; TELEPORTATION_CHART_INDEXES; 0)); "") ->  | BW191: of:=IF([.BU191]; INDEX(TELEPORTATION_CHART_SPRINTS; MATCH(POWER_LEVEL; TELEPORTATION_CHART_INDEXES; 0)); "") ->  | BX191: of:=IF([.BU191]; [.BW191]*[.BB191]; "") ->  | BY191: of:=IF([.BU191]; IF(([.BX191])>9999; TEXT(([.BX191])/1000; "#,##0")&" km"; TEXT([.BX191];"#,##0")&" m"); "") ->  | BZ191: of:=IF([.BU191]; "("&[.BV191]&"/"&[.BY191]&")"; "") ->  | CA191: of:=ISNUMBER(FIND("Tunneling"; [.A191])) -> false | CB191: of:=IF([.CA191]; INDEX(MOVEMENT_CHART_BASES_TEXT; MATCH(ATHLETICS+POWER_LEVEL; MOVEMENT_CHART_INDEXES;0)); "") ->  | CC191: of:=IF([.CA191]; INDEX(MOVEMENT_CHART_SPRINTS; MATCH(ATHLETICS+POWER_LEVEL; MOVEMENT_CHART_INDEXES;0)); "") ->  | CD191: of:=IF([.CA191]; [.CC191]*[.BB191]; "") ->  | CE191: of:=IF([.CA191]; IF(([.CD191])>9999; TEXT(([.CD191])/1000; "#,##0")&" km"; TEXT([.CD191];"#,##0")&" m"); "") ->  | CF191: of:=IF([.CA191]; "("&[.CB191]&"/"&[.CE191]&")"; "") ->  | CG191: of:=AND(ISNUMBER(FIND("Super Endurance"; [.A191]))) -> false | CH191: of:=AND(ISNUMBER(FIND("Super Health"; [.A191]))) -> false | CI191: of:=AND(ISNUMBER(FIND("Super Reflection"; [.A191]))) -> false | CJ191: of:=AND(ISNUMBER(FIND("Super Strength"; [.A191]))) -> false | CK191: of:=ISNUMBER(FIND("Alteration Resistance"; [.A191])) -> false | CL191: of:=IF([.CK191]; ALTERATION_RESISTANCE_TEXT; "") ->  | CM191: of:=ISNUMBER(FIND("Damage Resistance"; [.A191])) -> false | CN191: of:=IF([.CM191]; DAMAGE_RESISTANCE_TEXT; "") ->  | CO191: of:=ISNUMBER(FIND("Mental Resistance"; [.A191])) -> false | CP191: of:=IF([.CO191]; MENTAL_RESISTANCE_TEXT; "") ->  | CQ191: of:=ISNUMBER(FIND("Bulletproof"; [.A191])) -> false | CR191: of:=IF([.CQ191]; "Unaffected by ordinary weapons Equipment Level "&POWER_LEVEL&" and lower"; "") ->  | CS191: of:=ISNUMBER(FIND("Density Control"; [.A191])) -> false | CT191: of:=IF([.CS191]; INDEX(DENSITY_CONTROL_CHART; POWER_LEVEL; 4); "") ->  | CU191: of:=ISNUMBER(FIND("Duplication"; [.A191])) -> false | CV191: of:=IF([.CU191]; INDEX(DUPLICATION_CHART; POWER_LEVEL; 3); "") ->  | CW191: of:=ISNUMBER(FIND("Growth"; [.A191])) -> false | CX191: of:=IF([.CW191]; INDEX(GROWTH_CHART; POWER_LEVEL; 6); "") ->  | CY191: of:=ISNUMBER(FIND("Extra Actions"; [.A191])) -> false | CZ191: of:=IF([.CY191]; POWER_LEVEL&" extra actions per scene"; "") ->  | DA191: of:=ISNUMBER(FIND("Haste"; [.A191])) -> false | DB191: of:=IF([.DA191]; INDEX(HASTE_CHART; POWER_LEVEL; 3); "") ->  | DC191: of:=ISNUMBER(FIND("Shrinking"; [.A191])) -> false | DD191: of:=IF([.DC191]; INDEX(SHRINKING_CHART; POWER_LEVEL; 4); "") ->  | DE191: of:=ISNUMBER(FIND("Stretching"; [.A191])) -> false | DF191: of:=IF([.DE191]; INDEX(STRETCHING_CHART; POWER_LEVEL; 2)&" reach"; "") ->  | DG191: of:=[.CL191]&[.CN191]&[.CP191]&[.CR191]&[.CT191]&[.CV191]&[.CX191]&[.CZ191]&[.DB191]&[.DD191]&[.DF191] ->  | DH191: of:=ISNUMBER(FIND("[Element]"; [.A191])) -> false | DI191: of:=ISNUMBER(FIND("[Subject]"; [.A191])) -> false | DJ191: of:=ISNUMBER(FIND("[Transformation]"; [.A191])) -> false | DT191: of:=IF([.T191]; COM.MICROSOFT.TEXTJOIN(", "; 1; [.AA191];[.AL191];[.AL191];[.AZ191];[.AZ191];[.AC191]); "") -> Anytime action, Ranged (600 m/1,000 m), Ranged (600 m/1,000 m), , Selective, , Selective, Normal attack | DU191: of:=IF([Powers.F32]=""; ""; [Powers.F32])&IF(OR([Powers.F32]=""; [.DG191]=""); ""; "; ")&IF([.DG191]=""; ""; [.DG191]) ->  | EC191: of:=IF([.T191]; [.Y191]&CHAR(13)&CHAR(10)&[.DT191]&CHAR(13)&CHAR(10)&[.DU191]&CHAR(13)&CHAR(10)&VLOOKUP( [.A191]; POWER_CHART; 11; FALSE())&CHAR(13)&CHAR(10)&CHAR(13)&CHAR(10); "") -> Reflection
Anytime action, Ranged (600 m/1,000 m), Ranged (600 m/1,000 m), , Selective, , Selective, Normal attack

54


A192: of:=IF([Powers.C33]=""; ""; [Powers.C33]) -> Power Drain | C192: of:=IF(TRIM([.A192])=""; ""; INDEX(POWER_CHART_INDEXES; MATCH([.A192]; POWER_CHART_NAMES; 0))) -> 49 | F192: of:=IF([#REF!]=""; FALSE(); IF([.E192]; TRUE(); FALSE())) ->  | G192: of:=IF(N([.C192]); IFERROR(T(INDEX(POWER_CHART_PREREQ_1; MATCH([.C192]; POWER_CHART_INDEXES; 0))); ""); "") ->  | H192: of:=IF(OR([.G192]=""; [.B192]); 0; INDEX(POWER_CHART_INDEXES; MATCH([.G192]; POWER_CHART_NAMES; 0))) -> 0 | I192: of:=IF([.H192]=0; TRUE(); COUNTIF(POWER_CALC_SELECTED_INDEXES; [.H192])) -> true | J192: of:=IF(N([.C192]); IFERROR(T(INDEX(POWER_CHART_PREREQ_2; MATCH([.C192]; POWER_CHART_INDEXES; 0))); ""); "") ->  | K192: of:=IF(OR([.J192]=""; [.B192]); 0; INDEX(POWER_CHART_INDEXES; MATCH([.J192]; POWER_CHART_NAMES; 0))) -> 0 | L192: of:=IF([.K192]=0; TRUE(); COUNTIF(POWER_CALC_SELECTED_INDEXES; [.K192])) -> true | M192: of:=IF(N([.C192]); IFERROR(T(INDEX(POWER_CHART_PREREQ_3; MATCH([.C192]; POWER_CHART_INDEXES; 0))); ""); "") ->  | N192: of:=IF(OR([.M192]=""; [.B192]); 0; INDEX(POWER_CHART_INDEXES; MATCH([.M192]; POWER_CHART_NAMES; 0))) -> 0 | O192: of:=IF([.N192]=0; TRUE(); COUNTIF(POWER_CALC_SELECTED_INDEXES; [.N192])) -> true | P192: of:=AND([.I192]; [.L192]; [.O192]) -> true | Q192: of:=IF(NOT([.P192]); "Purchase a prerequisite for "&[.A192]&" ("&COM.MICROSOFT.TEXTJOIN(" or "; 1; [.G192]; [.J192]; [.M192])&")."&CHAR(13)&CHAR(10); "") ->  | R192: of:=IF([#REF!]=""; FALSE(); IF([.O192]; TRUE(); FALSE())) ->  | T192: of:=IF([.A192]=""; FALSE(); IF([.P192]; TRUE(); FALSE())) -> true | U192: of:=IF([.T192]; [.C192]; "") -> 49 | W192: of:=IF(AND([.T192]; NOT([Powers.E33]="")); [Powers.E33]; "") ->  | Y192: of:=IF(AND([.T192]; OR([.W192]=""; [.B192])); [.A192]; [.W192]) -> Power Drain | Z192: of:=IF(AND([.T192]; NOT([Powers.F33]="")); [Powers.F33]; "") ->  | AA192: of:=IF([.T192]; IFERROR(T(INDEX(POWER_CHART_ACTIONS; MATCH([.C192]; POWER_CHART_INDEXES; 0))); ""); "") -> Standard action | AB192: of:=IF([.T192]; INDEX(POWER_CHART_ATTACKS; MATCH([.C192]; POWER_CHART_INDEXES; 0)); FALSE()) -> true | AC192: of:=IF([.T192]; INDEX(POWER_CHART_TYPES; MATCH([.C192]; POWER_CHART_INDEXES; 0))&" "&IF([.AB192]; "attack"; "power"); "") -> Alteration attack | AD192: of:=[.AD191] -> true | AE192: of:=IF([.T192]; IF(VLOOKUP([.A192]; POWER_CHART; 4; FALSE())="Ranged"; TRUE(); FALSE()); FALSE()) -> false | AF192: of:=IF(AND(OR([.AE192];[.AD192]); OR(ISNUMBER(FIND("attack"; [.AC192])); ISNUMBER(FIND("Environmental"; [.AC192])); ISNUMBER(FIND("Ultra-power"; [.A192]))); NOT(ISNUMBER(FIND("Strike";[.A192])))); TRUE(); FALSE()) -> true | AG192: of:=[.AG191] -> true | AH192: of:=IF([.AF192]; INDEX(POWER_LEVEL_CHART_RANGES_TEXT; MATCH(POWER_LEVEL-1; POWER_LEVEL_CHART_INDEXES;0)); "") -> 600 m | AI192: of:=IF([.AF192]; INDEX(POWER_LEVEL_CHART_RANGES; MATCH(POWER_LEVEL; POWER_LEVEL_CHART_INDEXES;0)); "") -> 1000 | AJ192: of:=IF([.AF192]; [.AI192]*[.AG192]; "") -> 1000 | AK192: of:=IF([.AF192]; IF(([.AJ192])>9999; TEXT(([.AJ192])/1000; "#,##0")&" km"; TEXT([.AJ192];"#,##0")&" m"); "") -> 1,000 m | AL192: of:=IF([.AF192]; "Ranged ("&[.AH192]&"/"&[.AK192]&")"; "") -> Ranged (600 m/1,000 m) | AM192: of:=[.AM191] -> true | AN192: of:=IF(AND([.AM192]; OR(ISNUMBER(FIND("attack"; [.AC192])); ISNUMBER(FIND("Ultra-power"; [.A192])))); TRUE(); FALSE()) -> true | AO192: of:=IF([.AN192];", Seeking";"") -> , Seeking | AP192: of:=[.AP191] -> true | AQ192: of:=IF([.T192]; IF(INDEX(POWER_CHART_AREAS; MATCH([.C192]; POWER_CHART_INDEXES; 0))="Area"; TRUE(); FALSE())) -> false | AR192: of:=OR([.AP192];[.AQ192]) -> true | AS192: of:=[.AS191] -> true | AT192: of:=IF([.AR192]; INDEX(POWER_LEVEL_CHART_AREAS; MATCH(POWER_LEVEL; POWER_LEVEL_CHART_INDEXES;0)); "") -> 10 | AU192: of:=IF([.AR192]; [.AS192]*[.AT192]; "") -> 10 | AV192: of:=IF([.AR192]; IF(([.AU192])>9999; TEXT(([.AU192])/1000; "#,##0")&" km radius"; TEXT([.AU192];"#,##0")&" m radius"); "") -> 10 m radius | AW192: of:=IF([.AR192]; "Area ("&[.AV192]&")"; "") -> Area (10 m radius) | AX192: of:=[.AX191] -> true | AY192: of:=IF([.AX192]) -> true | AZ192: of:=IF([.AY192];", Selective";"") -> , Selective | BA192: of:=ISNUMBER(FIND("Movement"; [.AC192])) -> false | BB192: of:=[.BB191] -> true | BC192: of:=ISNUMBER(FIND("Super Running"; [.A192])) -> false | BD192: of:=IF([.BC192]; INDEX(MOVEMENT_CHART_BASES_TEXT; MATCH(ATHLETICS+POWER_LEVEL; MOVEMENT_CHART_INDEXES;0)); "") ->  | BE192: of:=IF([.BC192]; INDEX(MOVEMENT_CHART_SPRINTS; MATCH(ATHLETICS+POWER_LEVEL; MOVEMENT_CHART_INDEXES;0)); "") ->  | BF192: of:=IF([.BC192]; [.BE192]*[.BB192]; "") ->  | BG192: of:=IF([.BC192]; IF(([.BF192])>9999; TEXT(([.BF192])/1000; "#,##0")&" km"; TEXT([.BF192];"#,##0")&" m"); "") ->  | BH192: of:=IF([.BC192]; "("&[.BD192]&"/"&[.BG192]&")"; "") ->  | BI192: of:=AND(ISNUMBER(FIND("Super Swimming"; [.A192]))) -> false | BJ192: of:=IF([.BI192]; INDEX(MOVEMENT_CHART_BASES_TEXT; MATCH(ATHLETICS+POWER_LEVEL; MOVEMENT_CHART_INDEXES;0)); "") ->  | BK192: of:=IF([.BI192]; INDEX(MOVEMENT_CHART_SPRINTS; MATCH(ATHLETICS+POWER_LEVEL; MOVEMENT_CHART_INDEXES;0)); "") ->  | BL192: of:=IF([.BI192]; [.BK192]*[.BB192]; "") ->  | BM192: of:=IF([.BI192]; IF(([.BL192])>9999; TEXT(([.BL192])/1000; "#,##0")&" km"; TEXT([.BL192];"#,##0")&" m"); "") ->  | BN192: of:=IF([.BI192]; "("&[.BJ192]&"/"&[.BM192]&")"; "") ->  | BO192: of:=ISNUMBER(FIND("Flight"; [.A192])) -> false | BP192: of:=IF([.BO192]; INDEX(MOVEMENT_CHART_BASES_TEXT; MATCH(ATHLETICS+POWER_LEVEL; MOVEMENT_CHART_INDEXES;0)); "") ->  | BQ192: of:=IF([.BO192]; INDEX(MOVEMENT_CHART_SPRINTS; MATCH(ATHLETICS+POWER_LEVEL; MOVEMENT_CHART_INDEXES;0)); "") ->  | BR192: of:=IF([.BO192]; [.BQ192]*[.BB192]; "") ->  | BS192: of:=IF([.BO192]; IF(([.BR192])>9999; TEXT(([.BR192])/1000; "#,##0")&" km"; TEXT([.BR192];"#,##0")&" m"); "") ->  | BT192: of:=IF([.BO192]; "("&[.BP192]&"/"&[.BS192]&")"; "") ->  | BU192: of:=ISNUMBER(FIND("Teleportation"; [.A192])) -> false | BV192: of:=IF([.BU192]; INDEX(TELEPORTATION_CHART_BASES_TEXT; MATCH(POWER_LEVEL; TELEPORTATION_CHART_INDEXES; 0)); "") ->  | BW192: of:=IF([.BU192]; INDEX(TELEPORTATION_CHART_SPRINTS; MATCH(POWER_LEVEL; TELEPORTATION_CHART_INDEXES; 0)); "") ->  | BX192: of:=IF([.BU192]; [.BW192]*[.BB192]; "") ->  | BY192: of:=IF([.BU192]; IF(([.BX192])>9999; TEXT(([.BX192])/1000; "#,##0")&" km"; TEXT([.BX192];"#,##0")&" m"); "") ->  | BZ192: of:=IF([.BU192]; "("&[.BV192]&"/"&[.BY192]&")"; "") ->  | CA192: of:=ISNUMBER(FIND("Tunneling"; [.A192])) -> false | CB192: of:=IF([.CA192]; INDEX(MOVEMENT_CHART_BASES_TEXT; MATCH(ATHLETICS+POWER_LEVEL; MOVEMENT_CHART_INDEXES;0)); "") ->  | CC192: of:=IF([.CA192]; INDEX(MOVEMENT_CHART_SPRINTS; MATCH(ATHLETICS+POWER_LEVEL; MOVEMENT_CHART_INDEXES;0)); "") ->  | CD192: of:=IF([.CA192]; [.CC192]*[.BB192]; "") ->  | CE192: of:=IF([.CA192]; IF(([.CD192])>9999; TEXT(([.CD192])/1000; "#,##0")&" km"; TEXT([.CD192];"#,##0")&" m"); "") ->  | CF192: of:=IF([.CA192]; "("&[.CB192]&"/"&[.CE192]&")"; "") ->  | CG192: of:=AND(ISNUMBER(FIND("Super Endurance"; [.A192]))) -> false | CH192: of:=AND(ISNUMBER(FIND("Super Health"; [.A192]))) -> false | CI192: of:=AND(ISNUMBER(FIND("Super Reflection"; [.A192]))) -> false | CJ192: of:=AND(ISNUMBER(FIND("Super Strength"; [.A192]))) -> false | CK192: of:=ISNUMBER(FIND("Alteration Resistance"; [.A192])) -> false | CL192: of:=IF([.CK192]; ALTERATION_RESISTANCE_TEXT; "") ->  | CM192: of:=ISNUMBER(FIND("Damage Resistance"; [.A192])) -> false | CN192: of:=IF([.CM192]; DAMAGE_RESISTANCE_TEXT; "") ->  | CO192: of:=ISNUMBER(FIND("Mental Resistance"; [.A192])) -> false | CP192: of:=IF([.CO192]; MENTAL_RESISTANCE_TEXT; "") ->  | CQ192: of:=ISNUMBER(FIND("Bulletproof"; [.A192])) -> false | CR192: of:=IF([.CQ192]; "Unaffected by ordinary weapons Equipment Level "&POWER_LEVEL&" and lower"; "") ->  | CS192: of:=ISNUMBER(FIND("Density Control"; [.A192])) -> false | CT192: of:=IF([.CS192]; INDEX(DENSITY_CONTROL_CHART; POWER_LEVEL; 4); "") ->  | CU192: of:=ISNUMBER(FIND("Duplication"; [.A192])) -> false | CV192: of:=IF([.CU192]; INDEX(DUPLICATION_CHART; POWER_LEVEL; 3); "") ->  | CW192: of:=ISNUMBER(FIND("Growth"; [.A192])) -> false | CX192: of:=IF([.CW192]; INDEX(GROWTH_CHART; POWER_LEVEL; 6); "") ->  | CY192: of:=ISNUMBER(FIND("Extra Actions"; [.A192])) -> false | CZ192: of:=IF([.CY192]; POWER_LEVEL&" extra actions per scene"; "") ->  | DA192: of:=ISNUMBER(FIND("Haste"; [.A192])) -> false | DB192: of:=IF([.DA192]; INDEX(HASTE_CHART; POWER_LEVEL; 3); "") ->  | DC192: of:=ISNUMBER(FIND("Shrinking"; [.A192])) -> false | DD192: of:=IF([.DC192]; INDEX(SHRINKING_CHART; POWER_LEVEL; 4); "") ->  | DE192: of:=ISNUMBER(FIND("Stretching"; [.A192])) -> false | DF192: of:=IF([.DE192]; INDEX(STRETCHING_CHART; POWER_LEVEL; 2)&" reach"; "") ->  | DG192: of:=[.CL192]&[.CN192]&[.CP192]&[.CR192]&[.CT192]&[.CV192]&[.CX192]&[.CZ192]&[.DB192]&[.DD192]&[.DF192] ->  | DH192: of:=ISNUMBER(FIND("[Element]"; [.A192])) -> false | DI192: of:=ISNUMBER(FIND("[Subject]"; [.A192])) -> false | DJ192: of:=ISNUMBER(FIND("[Transformation]"; [.A192])) -> false | DT192: of:=IF([.T192]; COM.MICROSOFT.TEXTJOIN(", "; 1; [.AA192];[.AL192];[.AL192];[.AZ192];[.AZ192];[.AC192]); "") -> Standard action, Ranged (600 m/1,000 m), Ranged (600 m/1,000 m), , Selective, , Selective, Alteration attack | DU192: of:=IF([Powers.F33]=""; ""; [Powers.F33])&IF(OR([Powers.F33]=""; [.DG192]=""); ""; "; ")&IF([.DG192]=""; ""; [.DG192]) ->  | EC192: of:=IF([.T192]; [.Y192]&CHAR(13)&CHAR(10)&[.DT192]&CHAR(13)&CHAR(10)&[.DU192]&CHAR(13)&CHAR(10)&VLOOKUP( [.A192]; POWER_CHART; 11; FALSE())&CHAR(13)&CHAR(10)&CHAR(13)&CHAR(10); "") -> Power Drain
Standard action, Ranged (600 m/1,000 m), Ranged (600 m/1,000 m), , Selective, , Selective, Alteration attack

49


A193: of:=IF([Powers.C34]=""; ""; [Powers.C34]) -> Teleportation | C193: of:=IF(TRIM([.A193])=""; ""; INDEX(POWER_CHART_INDEXES; MATCH([.A193]; POWER_CHART_NAMES; 0))) -> 75 | F193: of:=IF([#REF!]=""; FALSE(); IF([.E193]; TRUE(); FALSE())) ->  | G193: of:=IF(N([.C193]); IFERROR(T(INDEX(POWER_CHART_PREREQ_1; MATCH([.C193]; POWER_CHART_INDEXES; 0))); ""); "") ->  | H193: of:=IF(OR([.G193]=""; [.B193]); 0; INDEX(POWER_CHART_INDEXES; MATCH([.G193]; POWER_CHART_NAMES; 0))) -> 0 | I193: of:=IF([.H193]=0; TRUE(); COUNTIF(POWER_CALC_SELECTED_INDEXES; [.H193])) -> true | J193: of:=IF(N([.C193]); IFERROR(T(INDEX(POWER_CHART_PREREQ_2; MATCH([.C193]; POWER_CHART_INDEXES; 0))); ""); "") ->  | K193: of:=IF(OR([.J193]=""; [.B193]); 0; INDEX(POWER_CHART_INDEXES; MATCH([.J193]; POWER_CHART_NAMES; 0))) -> 0 | L193: of:=IF([.K193]=0; TRUE(); COUNTIF(POWER_CALC_SELECTED_INDEXES; [.K193])) -> true | M193: of:=IF(N([.C193]); IFERROR(T(INDEX(POWER_CHART_PREREQ_3; MATCH([.C193]; POWER_CHART_INDEXES; 0))); ""); "") ->  | N193: of:=IF(OR([.M193]=""; [.B193]); 0; INDEX(POWER_CHART_INDEXES; MATCH([.M193]; POWER_CHART_NAMES; 0))) -> 0 | O193: of:=IF([.N193]=0; TRUE(); COUNTIF(POWER_CALC_SELECTED_INDEXES; [.N193])) -> true | P193: of:=AND([.I193]; [.L193]; [.O193]) -> true | Q193: of:=IF(NOT([.P193]); "Purchase a prerequisite for "&[.A193]&" ("&COM.MICROSOFT.TEXTJOIN(" or "; 1; [.G193]; [.J193]; [.M193])&")."&CHAR(13)&CHAR(10); "") ->  | R193: of:=IF([#REF!]=""; FALSE(); IF([.O193]; TRUE(); FALSE())) ->  | T193: of:=IF([.A193]=""; FALSE(); IF([.P193]; TRUE(); FALSE())) -> true | U193: of:=IF([.T193]; [.C193]; "") -> 75 | W193: of:=IF(AND([.T193]; NOT([Powers.E34]="")); [Powers.E34]; "") -> UP CN 10 | Y193: of:=IF(AND([.T193]; OR([.W193]=""; [.B193])); [.A193]; [.W193]) -> UP CN 10 | Z193: of:=IF(AND([.T193]; NOT([Powers.F34]="")); [Powers.F34]; "") -> UP N 10 | AA193: of:=IF([.T193]; IFERROR(T(INDEX(POWER_CHART_ACTIONS; MATCH([.C193]; POWER_CHART_INDEXES; 0))); ""); "") ->  | AB193: of:=IF([.T193]; INDEX(POWER_CHART_ATTACKS; MATCH([.C193]; POWER_CHART_INDEXES; 0)); FALSE()) -> false | AC193: of:=IF([.T193]; INDEX(POWER_CHART_TYPES; MATCH([.C193]; POWER_CHART_INDEXES; 0))&" "&IF([.AB193]; "attack"; "power"); "") -> Movement power | AD193: of:=[.AD192] -> true | AE193: of:=IF([.T193]; IF(VLOOKUP([.A193]; POWER_CHART; 4; FALSE())="Ranged"; TRUE(); FALSE()); FALSE()) -> false | AF193: of:=IF(AND(OR([.AE193];[.AD193]); OR(ISNUMBER(FIND("attack"; [.AC193])); ISNUMBER(FIND("Environmental"; [.AC193])); ISNUMBER(FIND("Ultra-power"; [.A193]))); NOT(ISNUMBER(FIND("Strike";[.A193])))); TRUE(); FALSE()) -> false | AG193: of:=[.AG192] -> true | AH193: of:=IF([.AF193]; INDEX(POWER_LEVEL_CHART_RANGES_TEXT; MATCH(POWER_LEVEL-1; POWER_LEVEL_CHART_INDEXES;0)); "") ->  | AI193: of:=IF([.AF193]; INDEX(POWER_LEVEL_CHART_RANGES; MATCH(POWER_LEVEL; POWER_LEVEL_CHART_INDEXES;0)); "") ->  | AJ193: of:=IF([.AF193]; [.AI193]*[.AG193]; "") ->  | AK193: of:=IF([.AF193]; IF(([.AJ193])>9999; TEXT(([.AJ193])/1000; "#,##0")&" km"; TEXT([.AJ193];"#,##0")&" m"); "") ->  | AL193: of:=IF([.AF193]; "Ranged ("&[.AH193]&"/"&[.AK193]&")"; "") ->  | AM193: of:=[.AM192] -> true | AN193: of:=IF(AND([.AM193]; OR(ISNUMBER(FIND("attack"; [.AC193])); ISNUMBER(FIND("Ultra-power"; [.A193])))); TRUE(); FALSE()) -> false | AO193: of:=IF([.AN193];", Seeking";"") ->  | AP193: of:=[.AP192] -> true | AQ193: of:=IF([.T193]; IF(INDEX(POWER_CHART_AREAS; MATCH([.C193]; POWER_CHART_INDEXES; 0))="Area"; TRUE(); FALSE())) -> false | AR193: of:=OR([.AP193];[.AQ193]) -> true | AS193: of:=[.AS192] -> true | AT193: of:=IF([.AR193]; INDEX(POWER_LEVEL_CHART_AREAS; MATCH(POWER_LEVEL; POWER_LEVEL_CHART_INDEXES;0)); "") -> 10 | AU193: of:=IF([.AR193]; [.AS193]*[.AT193]; "") -> 10 | AV193: of:=IF([.AR193]; IF(([.AU193])>9999; TEXT(([.AU193])/1000; "#,##0")&" km radius"; TEXT([.AU193];"#,##0")&" m radius"); "") -> 10 m radius | AW193: of:=IF([.AR193]; "Area ("&[.AV193]&")"; "") -> Area (10 m radius) | AX193: of:=[.AX192] -> true | AY193: of:=IF([.AX193]) -> true | AZ193: of:=IF([.AY193];", Selective";"") -> , Selective | BA193: of:=ISNUMBER(FIND("Movement"; [.AC193])) -> true | BB193: of:=[.BB192] -> true | BC193: of:=ISNUMBER(FIND("Super Running"; [.A193])) -> false | BD193: of:=IF([.BC193]; INDEX(MOVEMENT_CHART_BASES_TEXT; MATCH(ATHLETICS+POWER_LEVEL; MOVEMENT_CHART_INDEXES;0)); "") ->  | BE193: of:=IF([.BC193]; INDEX(MOVEMENT_CHART_SPRINTS; MATCH(ATHLETICS+POWER_LEVEL; MOVEMENT_CHART_INDEXES;0)); "") ->  | BF193: of:=IF([.BC193]; [.BE193]*[.BB193]; "") ->  | BG193: of:=IF([.BC193]; IF(([.BF193])>9999; TEXT(([.BF193])/1000; "#,##0")&" km"; TEXT([.BF193];"#,##0")&" m"); "") ->  | BH193: of:=IF([.BC193]; "("&[.BD193]&"/"&[.BG193]&")"; "") ->  | BI193: of:=AND(ISNUMBER(FIND("Super Swimming"; [.A193]))) -> false | BJ193: of:=IF([.BI193]; INDEX(MOVEMENT_CHART_BASES_TEXT; MATCH(ATHLETICS+POWER_LEVEL; MOVEMENT_CHART_INDEXES;0)); "") ->  | BK193: of:=IF([.BI193]; INDEX(MOVEMENT_CHART_SPRINTS; MATCH(ATHLETICS+POWER_LEVEL; MOVEMENT_CHART_INDEXES;0)); "") ->  | BL193: of:=IF([.BI193]; [.BK193]*[.BB193]; "") ->  | BM193: of:=IF([.BI193]; IF(([.BL193])>9999; TEXT(([.BL193])/1000; "#,##0")&" km"; TEXT([.BL193];"#,##0")&" m"); "") ->  | BN193: of:=IF([.BI193]; "("&[.BJ193]&"/"&[.BM193]&")"; "") ->  | BO193: of:=ISNUMBER(FIND("Flight"; [.A193])) -> false | BP193: of:=IF([.BO193]; INDEX(MOVEMENT_CHART_BASES_TEXT; MATCH(ATHLETICS+POWER_LEVEL; MOVEMENT_CHART_INDEXES;0)); "") ->  | BQ193: of:=IF([.BO193]; INDEX(MOVEMENT_CHART_SPRINTS; MATCH(ATHLETICS+POWER_LEVEL; MOVEMENT_CHART_INDEXES;0)); "") ->  | BR193: of:=IF([.BO193]; [.BQ193]*[.BB193]; "") ->  | BS193: of:=IF([.BO193]; IF(([.BR193])>9999; TEXT(([.BR193])/1000; "#,##0")&" km"; TEXT([.BR193];"#,##0")&" m"); "") ->  | BT193: of:=IF([.BO193]; "("&[.BP193]&"/"&[.BS193]&")"; "") ->  | BU193: of:=ISNUMBER(FIND("Teleportation"; [.A193])) -> true | BV193: of:=IF([.BU193]; INDEX(TELEPORTATION_CHART_BASES_TEXT; MATCH(POWER_LEVEL; TELEPORTATION_CHART_INDEXES; 0)); "") -> 1,500 m | BW193: of:=IF([.BU193]; INDEX(TELEPORTATION_CHART_SPRINTS; MATCH(POWER_LEVEL; TELEPORTATION_CHART_INDEXES; 0)); "") -> 9000 | BX193: of:=IF([.BU193]; [.BW193]*[.BB193]; "") -> 9000 | BY193: of:=IF([.BU193]; IF(([.BX193])>9999; TEXT(([.BX193])/1000; "#,##0")&" km"; TEXT([.BX193];"#,##0")&" m"); "") -> 9,000 m | BZ193: of:=IF([.BU193]; "("&[.BV193]&"/"&[.BY193]&")"; "") -> (1,500 m/9,000 m) | CA193: of:=ISNUMBER(FIND("Tunneling"; [.A193])) -> false | CB193: of:=IF([.CA193]; INDEX(MOVEMENT_CHART_BASES_TEXT; MATCH(ATHLETICS+POWER_LEVEL; MOVEMENT_CHART_INDEXES;0)); "") ->  | CC193: of:=IF([.CA193]; INDEX(MOVEMENT_CHART_SPRINTS; MATCH(ATHLETICS+POWER_LEVEL; MOVEMENT_CHART_INDEXES;0)); "") ->  | CD193: of:=IF([.CA193]; [.CC193]*[.BB193]; "") ->  | CE193: of:=IF([.CA193]; IF(([.CD193])>9999; TEXT(([.CD193])/1000; "#,##0")&" km"; TEXT([.CD193];"#,##0")&" m"); "") ->  | CF193: of:=IF([.CA193]; "("&[.CB193]&"/"&[.CE193]&")"; "") ->  | CG193: of:=AND(ISNUMBER(FIND("Super Endurance"; [.A193]))) -> false | CH193: of:=AND(ISNUMBER(FIND("Super Health"; [.A193]))) -> false | CI193: of:=AND(ISNUMBER(FIND("Super Reflection"; [.A193]))) -> false | CJ193: of:=AND(ISNUMBER(FIND("Super Strength"; [.A193]))) -> false | CK193: of:=ISNUMBER(FIND("Alteration Resistance"; [.A193])) -> false | CL193: of:=IF([.CK193]; ALTERATION_RESISTANCE_TEXT; "") ->  | CM193: of:=ISNUMBER(FIND("Damage Resistance"; [.A193])) -> false | CN193: of:=IF([.CM193]; DAMAGE_RESISTANCE_TEXT; "") ->  | CO193: of:=ISNUMBER(FIND("Mental Resistance"; [.A193])) -> false | CP193: of:=IF([.CO193]; MENTAL_RESISTANCE_TEXT; "") ->  | CQ193: of:=ISNUMBER(FIND("Bulletproof"; [.A193])) -> false | CR193: of:=IF([.CQ193]; "Unaffected by ordinary weapons Equipment Level "&POWER_LEVEL&" and lower"; "") ->  | CS193: of:=ISNUMBER(FIND("Density Control"; [.A193])) -> false | CT193: of:=IF([.CS193]; INDEX(DENSITY_CONTROL_CHART; POWER_LEVEL; 4); "") ->  | CU193: of:=ISNUMBER(FIND("Duplication"; [.A193])) -> false | CV193: of:=IF([.CU193]; INDEX(DUPLICATION_CHART; POWER_LEVEL; 3); "") ->  | CW193: of:=ISNUMBER(FIND("Growth"; [.A193])) -> false | CX193: of:=IF([.CW193]; INDEX(GROWTH_CHART; POWER_LEVEL; 6); "") ->  | CY193: of:=ISNUMBER(FIND("Extra Actions"; [.A193])) -> false | CZ193: of:=IF([.CY193]; POWER_LEVEL&" extra actions per scene"; "") ->  | DA193: of:=ISNUMBER(FIND("Haste"; [.A193])) -> false | DB193: of:=IF([.DA193]; INDEX(HASTE_CHART; POWER_LEVEL; 3); "") ->  | DC193: of:=ISNUMBER(FIND("Shrinking"; [.A193])) -> false | DD193: of:=IF([.DC193]; INDEX(SHRINKING_CHART; POWER_LEVEL; 4); "") ->  | DE193: of:=ISNUMBER(FIND("Stretching"; [.A193])) -> false | DF193: of:=IF([.DE193]; INDEX(STRETCHING_CHART; POWER_LEVEL; 2)&" reach"; "") ->  | DG193: of:=[.CL193]&[.CN193]&[.CP193]&[.CR193]&[.CT193]&[.CV193]&[.CX193]&[.CZ193]&[.DB193]&[.DD193]&[.DF193] ->  | DH193: of:=ISNUMBER(FIND("[Element]"; [.A193])) -> false | DI193: of:=ISNUMBER(FIND("[Subject]"; [.A193])) -> false | DJ193: of:=ISNUMBER(FIND("[Transformation]"; [.A193])) -> false | DT193: of:=IF([.T193]; COM.MICROSOFT.TEXTJOIN(", "; 1; [.AA193];[.AL193];[.AL193];[.AZ193];[.AZ193];[.AC193]); "") -> , Selective, , Selective, Movement power | DU193: of:=IF([Powers.F34]=""; ""; [Powers.F34])&IF(OR([Powers.F34]=""; [.DG193]=""); ""; "; ")&IF([.DG193]=""; ""; [.DG193]) -> UP N 10 | EC193: of:=IF([.T193]; [.Y193]&CHAR(13)&CHAR(10)&[.DT193]&CHAR(13)&CHAR(10)&[.DU193]&CHAR(13)&CHAR(10)&VLOOKUP( [.A193]; POWER_CHART; 11; FALSE())&CHAR(13)&CHAR(10)&CHAR(13)&CHAR(10); "") -> UP CN 10
, Selective, , Selective, Movement power
UP N 10
75


Q194: of:=COM.MICROSOFT.CONCAT([.Q178]; [.Q184:.Q193]) -> Purchase a prerequisite for Super Reflection (Reflection).
Purchase a prerequisite for Speed Theft (Speed Drain).
Purchase a prerequisite for Power Theft (Power Drain or Power Mimicry).
Purchase a prerequisite for Teleportation Attack (Teleportation).
 | BC194: of:=OR([.BC178]; [.C184:.C193]) -> true | BI194: of:=OR([.BI178]; [.L184:.L193]) -> true | BO194: of:=OR([.BO178]; [.DT184:.DT193]) -> false | BU194: of:=OR([.BU178]; [.DY184:.DY193]) -> false | CA194: of:=OR([.CA178]; [.EB184:.EB193]) -> false | CG194: of:=OR([.CG178]; [.K184:.K193]) -> true | CH194: of:=OR([.CH178]; [.N184:.N193]) -> false | CJ194: of:=OR([.CJ178]; [.DU184:.DU193]) -> false | CK194: of:=OR([.CK178]; [.CH184:.CH193]) -> false | CM194: of:=OR([.CM178]; [.BC184:.BC193]) -> false | CO194: of:=OR([.CO178]; [.CJ184:.CJ193]) -> false | EC194: of:=COM.MICROSOFT.CONCAT([.DJ184:.DJ188]) -> 00000
EC195: of:=COM.MICROSOFT.CONCAT([.DJ189:.DJ193]) -> 01000
EC196: of:=COM.MICROSOFT.CONCAT([.EC194:.EC195]) -> 0000001000
A198: Power Reference
A199: Display Name | C199: Has | F199: Action | G199: Is Ranged | H199: Range Text | I199: Is Area | J199: Area Text | K199: Type | L199: Prerequisite 1 | M199: Prerequisite 2 | N199: Or Prerequisite 2 | O199: Prerequisite 3 | P199: Or Prerequisite 3 | Q199: Note | R199: Details | S199: Description
A200: of:=IF([.B200]=""; ""; [.B200]) ->  | C200: of:=IF([.B200]=""; FALSE(); TRUE()) -> false | F200: of:=IF([.C200]; IF(VLOOKUP( [.B200]; POWER_CHART; 2; FALSE())=""; ""; VLOOKUP( [.B200]; POWER_CHART; 2; FALSE())); "") ->  | G200: of:=IF([.C200]; IF(VLOOKUP([.B200]; POWER_CHART; 3; FALSE())="Ranged"); FALSE()) -> false | H200: of:=IF([.G200]; ", "&"Ranged"; "") ->  | I200: of:=IF([.C200]; IF(VLOOKUP([.B200]; POWER_CHART; 4; FALSE())="Area"); FALSE()) -> false | J200: of:=IF([.I200]; ", "&"Area"; "") ->  | K200: of:=IF([.C200]; IF(VLOOKUP([.B200];POWER_CHART;5;FALSE())=""; ""; ", "&VLOOKUP([.B200];POWER_CHART;5;FALSE())&" "&IF(VLOOKUP([.B200];POWER_CHART;6;FALSE());"attack"; "power")); "") ->  | L200: of:=IF([.C200]; VLOOKUP([.B200]; POWER_CHART; 7; FALSE()); "") ->  | M200: of:=IF([.C200]; VLOOKUP([.B200]; POWER_CHART; 8; FALSE()); "") ->  | N200: of:=IF([.M200]="";"";" or "&[.M200]) ->  | O200: of:=IF([.C200]; VLOOKUP([.B200]; POWER_CHART; 9; FALSE()); "") ->  | P200: of:=IF([.O200]="";"";" or "&[.O200]) ->  | Q200: of:=IF([Powers.F42]=""; ""; [Powers.F42])&IF(OR([Powers.F42]=""; [.BF200]=""); ""; "; ")&IF([.BF200]=""; ""; [.BF200]) ->  | R200: of:=IF([.C200]; [.F200]&[.H200]&[.J200]&[.K200]; "") ->  | S200: of:=IF([.C200]; VLOOKUP([.B200]; POWER_CHART; 10; FALSE()); "") -> 
A202: of:=HYPERLINK("#A1"; "Top 🡅") -> Top 🡅
A203: Power Level
A204: of:=HYPERLINK("#POWER_LEVEL_CALC"; "POWER_LEVEL_CALC") -> POWER_LEVEL_CALC
B205: Text | C205: Raw | D205: Concat
A206: Damage | B206: of:=IF(POWER_LEVEL>0; "Damage: "&[.C206]; "") -> Damage: 1d6+5 | C206: of:=IF(POWER_LEVEL>0; VLOOKUP(POWER_LEVEL;POWER_LEVEL_CHART; 2); "") -> 1d6+5 | D206: of:=IF(PL_DAMAGE_TEXT=""; ""; PL_DAMAGE_TEXT&CHAR(13)&CHAR(10))&IF(PL_RANGE_TEXT=""; ""; PL_RANGE_TEXT&CHAR(13)&CHAR(10))&IF(PL_AREA_TEXT=""; ""; PL_AREA_TEXT&CHAR(13)&CHAR(10))&IF(PL_TRANSFORM_TEXT=""; ""; PL_TRANSFORM_TEXT) -> Damage: 1d6+5
Range: 600 m/1 km
Max Area: 10 m radius
Transformation Limits: min height 20 μm; max height 20 m, mass 100 t; max bonus +3
A207: R''3 | B207: of:=IF(POWER_LEVEL>0; "R''3: "&[.C207]; "") -> R''3: 20 | C207: of:=IF(POWER_LEVEL>0; VLOOKUP(POWER_LEVEL;POWER_LEVEL_CHART; 3); "") -> 20
A208: R''4 | B208: of:=IF(POWER_LEVEL>0; "R''4: "&[.C208]; "") -> R''4: 10 | C208: of:=IF(POWER_LEVEL>0; VLOOKUP(POWER_LEVEL;POWER_LEVEL_CHART; 4); "") -> 10
A209: Range | B209: of:=IF(POWER_LEVEL>0; "Range: "&[.C209]; "") -> Range: 600 m/1 km | C209: of:=IF(POWER_LEVEL>0; VLOOKUP(POWER_LEVEL-1;POWER_LEVEL_CHART; 6); "")&"/"&IF(POWER_LEVEL>0; VLOOKUP(POWER_LEVEL;POWER_LEVEL_CHART; 6); "") -> 600 m/1 km
A210: Area | B210: of:=IF(POWER_LEVEL>0; "Max Area: "&[.C210]; "") -> Max Area: 10 m radius | C210: of:=IF(POWER_LEVEL>0; VLOOKUP(POWER_LEVEL;POWER_LEVEL_CHART; 8); "") -> 10 m radius
A211: Max Bonus | B211: of:=IF(POWER_LEVEL>0; "Max Bonus: +"&[.C211]; "") -> Max Bonus: +3 | C211: of:=IF(POWER_LEVEL>0; VLOOKUP(POWER_LEVEL;POWER_LEVEL_CHART; 9); "") -> 3
A212: Transformation | B212: of:=IF(POWER_LEVEL>0; "Transformation Limits: "&[.C212]; "") -> Transformation Limits: min height 20 μm; max height 20 m, mass 100 t; max bonus +3 | C212: of:=IF(POWER_LEVEL>0; VLOOKUP(POWER_LEVEL;POWER_LEVEL_CHART; 13); "") -> min height 20 μm; max height 20 m, mass 100 t; max bonus +3
A213: Min Height | B213: of:=IF(POWER_LEVEL>0; "Min Height: "&[.C213]; "") -> Min Height: 20 μm | C213: of:=IF(POWER_LEVEL>0; VLOOKUP(POWER_LEVEL;POWER_LEVEL_CHART; 10); "") -> 20 μm
A214: Max Height | B214: of:=IF(POWER_LEVEL>0; "Max Height: "&[.C214]; "") -> Max Height: 20 m | C214: of:=IF(POWER_LEVEL>0; VLOOKUP(POWER_LEVEL;POWER_LEVEL_CHART; 11); "") -> 20 m
A215: Max Mass | B215: of:=IF(POWER_LEVEL>0; "Max Mass: "&[.C215]; "") -> Max Mass: 100 t | C215: of:=IF(POWER_LEVEL>0; VLOOKUP(POWER_LEVEL;POWER_LEVEL_CHART; 12); "") -> 100 t
A217: of:=HYPERLINK("#A1"; "Top 🡅") -> Top 🡅
A218: Resistances
A219: of:=HYPERLINK("#RESISTANCE_CALC"; "RESISTANCE_CALC") -> RESISTANCE_CALC
B220: Resistance | C220: Has Resistance | D220: Text
A221: Damage Resistance | B221: of:=IF([.C221]; RESISTANCE_BASE+POWER_LEVEL; 0) -> 0 | C221: of:=HAS_DAMAGE_RESISTANCE -> false | D221: of:=IF([.C221]; [.A221]&": "&[.B221]; "") -> 
A222: Alteration Resistance | B222: of:=IF([.C222]; RESISTANCE_BASE+POWER_LEVEL; 0) -> 0 | C222: of:=HAS_ALTERATION_RESISTANCE -> false | D222: of:=IF([.C222]; [.A222]&": "&[.B222]; "") -> 
A223: Mental Resistance | B223: of:=IF([.C223]; RESISTANCE_BASE+POWER_LEVEL; 0) -> 0 | C223: of:=HAS_MENTAL_RESISTANCE -> false | D223: of:=IF([.C223]; [.A223]&": "&[.B223]; "") -> 
A225: of:=HYPERLINK("#A1"; "Top 🡅") -> Top 🡅
A226: Skills
A227: of:=HYPERLINK("#SKILL_CALC"; "SKILL_CALC") -> SKILL_CALC | E227: XXX
A228: Display | B228: Has Skill | C228: Level | D228: Cost | E228: Min Cost
A229: of:=IF([.B229]; [Skills.C5]&" ("&[Skills.D5]&")"; [Skills.C5]&" (0)") -> Athletics (6) | B229: of:=AND([Skills.D5]>0; [Skills.D5]<=10; NOT([Skills.C5]="")) -> true | C229: of:=IF([.B229]; [Skills.D5]; "") -> 6 | D229: of:=IF([.B229]; [.C229]; 0) -> 6 | E229: of:=IF([.C229]; [.D229]; 0) -> 6
A230: of:=IF([.B230]; [Skills.C6]&" ("&[Skills.D6]&")"; [Skills.C6]&" (0)") -> Computing (7) | B230: of:=AND([Skills.D6]>0; [Skills.D6]<=10; NOT([Skills.C6]="")) -> true | C230: of:=IF([.B230]; [Skills.D6]; "") -> 7 | D230: of:=IF([.B230]; [.C230]; 0) -> 7 | E230: of:=IF([.C230]; [.D230]; 0) -> 7
A231: of:=IF([.B231]; [Skills.C7]&" ("&[Skills.D7]&")"; [Skills.C7]&" (0)") -> Culture (8) | B231: of:=AND([Skills.D7]>0; [Skills.D7]<=10; NOT([Skills.C7]="")) -> true | C231: of:=IF([.B231]; [Skills.D7]; "") -> 8 | D231: of:=IF([.B231]; [.C231]; 0) -> 8 | E231: of:=IF([.C231]; [.D231]; 0) -> 8
A232: of:=IF([.B232]; [Skills.C8]&" ("&[Skills.D8]&")"; [Skills.C8]&" (0)") -> Deception (9) | B232: of:=AND([Skills.D8]>0; [Skills.D8]<=10; NOT([Skills.C8]="")) -> true | C232: of:=IF([.B232]; [Skills.D8]; "") -> 9 | D232: of:=IF([.B232]; [.C232]; 0) -> 9 | E232: of:=IF([.C232]; [.D232]; 0) -> 9
A233: of:=IF([.B233]; [Skills.C9]&" ("&[Skills.D9]&")"; [Skills.C9]&" (0)") -> Diplomacy (10) | B233: of:=AND([Skills.D9]>0; [Skills.D9]<=10; NOT([Skills.C9]="")) -> true | C233: of:=IF([.B233]; [Skills.D9]; "") -> 10 | D233: of:=IF([.B233]; [.C233]; 0) -> 10 | E233: of:=IF([.C233]; [.D233]; 0) -> 10
A234: of:=IF([.B234]; [Skills.C10]&" ("&[Skills.D10]&")"; [Skills.C10]&" (0)") -> Engineering (0) | B234: of:=AND([Skills.D10]>0; [Skills.D10]<=10; NOT([Skills.C10]="")) -> false | C234: of:=IF([.B234]; [Skills.D10]; "") ->  | D234: of:=IF([.B234]; [.C234]; 0) -> 0 | E234: of:=IF([.C234]; [.D234]; 0) -> 
A235: of:=IF([.B235]; [Skills.C11]&" ("&[Skills.D11]&")"; [Skills.C11]&" (0)") -> Finesse (0) | B235: of:=AND([Skills.D11]>0; [Skills.D11]<=10; NOT([Skills.C11]="")) -> false | C235: of:=IF([.B235]; [Skills.D11]; "") ->  | D235: of:=IF([.B235]; [.C235]; 0) -> 0 | E235: of:=IF([.C235]; [.D235]; 0) -> 
A236: of:=IF([.B236]; [Skills.C12]&" ("&[Skills.D12]&")"; [Skills.C12]&" (0)") -> Gambling (0) | B236: of:=AND([Skills.D12]>0; [Skills.D12]<=10; NOT([Skills.C12]="")) -> false | C236: of:=IF([.B236]; [Skills.D12]; "") ->  | D236: of:=IF([.B236]; [.C236]; 0) -> 0 | E236: of:=IF([.C236]; [.D236]; 0) -> 
A237: of:=IF([.B237]; [Skills.C13]&" ("&[Skills.D13]&")"; [Skills.C13]&" (0)") -> Hand-to-hand Combat (0) | B237: of:=AND([Skills.D13]>0; [Skills.D13]<=10; NOT([Skills.C13]="")) -> false | C237: of:=IF([.B237]; [Skills.D13]; "") ->  | D237: of:=IF([.B237]; [.C237]; 0) -> 0 | E237: of:=IF([.C237]; [.D237]; 0) -> 
A238: of:=IF([.B238]; [Skills.C14]&" ("&[Skills.D14]&")"; [Skills.C14]&" (0)") -> Investigation (0) | B238: of:=AND([Skills.D14]>0; [Skills.D14]<=10; NOT([Skills.C14]="")) -> false | C238: of:=IF([.B238]; [Skills.D14]; "") ->  | D238: of:=IF([.B238]; [.C238]; 0) -> 0 | E238: of:=IF([.C238]; [.D238]; 0) -> 
A239: of:=IF([.B239]; [Skills.C15]&" ("&[Skills.D15]&")"; [Skills.C15]&" (0)") -> Manipulation (0) | B239: of:=AND([Skills.D15]>0; [Skills.D15]<=10; NOT([Skills.C15]="")) -> false | C239: of:=IF([.B239]; [Skills.D15]; "") ->  | D239: of:=IF([.B239]; [.C239]; 0) -> 0 | E239: of:=IF([.C239]; [.D239]; 0) -> 
A240: of:=IF([.B240]; [Skills.C16]&" ("&[Skills.D16]&")"; [Skills.C16]&" (0)") -> Medicine (0) | B240: of:=AND([Skills.D16]>0; [Skills.D16]<=10; NOT([Skills.C16]="")) -> false | C240: of:=IF([.B240]; [Skills.D16]; "") ->  | D240: of:=IF([.B240]; [.C240]; 0) -> 0 | E240: of:=IF([.C240]; [.D240]; 0) -> 
A241: of:=IF([.B241]; [Skills.C17]&" ("&[Skills.D17]&")"; [Skills.C17]&" (0)") -> Mental Combat (0) | B241: of:=AND([Skills.D17]>0; [Skills.D17]<=10; NOT([Skills.C17]="")) -> false | C241: of:=IF([.B241]; [Skills.D17]; "") ->  | D241: of:=IF([.B241]; [.C241]; 0) -> 0 | E241: of:=IF([.C241]; [.D241]; 0) -> 
A242: of:=IF([.B242]; [Skills.C18]&" ("&[Skills.D18]&")"; [Skills.C18]&" (0)") -> Occultism (0) | B242: of:=AND([Skills.D18]>0; [Skills.D18]<=10; NOT([Skills.C18]="")) -> false | C242: of:=IF([.B242]; [Skills.D18]; "") ->  | D242: of:=IF([.B242]; [.C242]; 0) -> 0 | E242: of:=IF([.C242]; [.D242]; 0) -> 
A243: of:=IF([.B243]; [Skills.C19]&" ("&[Skills.D19]&")"; [Skills.C19]&" (0)") -> Performance (0) | B243: of:=AND([Skills.D19]>0; [Skills.D19]<=10; NOT([Skills.C19]="")) -> false | C243: of:=IF([.B243]; [Skills.D19]; "") ->  | D243: of:=IF([.B243]; [.C243]; 0) -> 0 | E243: of:=IF([.C243]; [.D243]; 0) -> 
A244: of:=IF([.B244]; [Skills.C20]&" ("&[Skills.D20]&")"; [Skills.C20]&" (0)") -> Piloting (0) | B244: of:=AND([Skills.D20]>0; [Skills.D20]<=10; NOT([Skills.C20]="")) -> false | C244: of:=IF([.B244]; [Skills.D20]; "") ->  | D244: of:=IF([.B244]; [.C244]; 0) -> 0 | E244: of:=IF([.C244]; [.D244]; 0) -> 
A245: of:=IF([.B245]; [Skills.C21]&" ("&[Skills.D21]&")"; [Skills.C21]&" (0)") -> Ranged Combat (0) | B245: of:=AND([Skills.D21]>0; [Skills.D21]<=10; NOT([Skills.C21]="")) -> false | C245: of:=IF([.B245]; [Skills.D21]; "") ->  | D245: of:=IF([.B245]; [.C245]; 0) -> 0 | E245: of:=IF([.C245]; [.D245]; 0) -> 
A246: of:=IF([.B246]; [Skills.C22]&" ("&[Skills.D22]&")"; [Skills.C22]&" (0)") -> Science (0) | B246: of:=AND([Skills.D22]>0; [Skills.D22]<=10; NOT([Skills.C22]="")) -> false | C246: of:=IF([.B246]; [Skills.D22]; "") ->  | D246: of:=IF([.B246]; [.C246]; 0) -> 0 | E246: of:=IF([.C246]; [.D246]; 0) -> 
A247: of:=IF([.B247]; [Skills.C23]&" ("&[Skills.D23]&")"; [Skills.C23]&" (0)") -> Self-control (1) | B247: of:=AND([Skills.D23]>0; [Skills.D23]<=10; NOT([Skills.C23]="")) -> true | C247: of:=IF([.B247]; [Skills.D23]; "") -> 1 | D247: of:=IF([.B247]; [.C247]; 0) -> 1 | E247: of:=IF([.C247]; [.D247]; 0) -> 1
A248: of:=IF([.B248]; [Skills.C24]&" ("&[Skills.D24]&")"; [Skills.C24]&" (0)") -> Stealth (0) | B248: of:=AND([Skills.D24]>0; [Skills.D24]<=10; NOT([Skills.C24]="")) -> false | C248: of:=IF([.B248]; [Skills.D24]; "") ->  | D248: of:=IF([.B248]; [.C248]; 0) -> 0 | E248: of:=IF([.C248]; [.D248]; 0) -> 
A249: of:=IF([.B249]; [Skills.C25]&" ("&[Skills.D25]&")"; [Skills.C25]&" (0)") -> Survival (2) | B249: of:=AND([Skills.D25]>0; [Skills.D25]<=10; NOT([Skills.C25]="")) -> true | C249: of:=IF([.B249]; [Skills.D25]; "") -> 2 | D249: of:=IF([.B249]; [.C249]; 0) -> 2 | E249: of:=IF([.C249]; [.D249]; 0) -> 2
A250: of:=IF([.B250]; [Skills.C26]&" ("&[Skills.D26]&")"; [Skills.C26]&" (0)") -> Warfare (0) | B250: of:=AND([Skills.D26]>0; [Skills.D26]<=10; NOT([Skills.C26]="")) -> false | C250: of:=IF([.B250]; [Skills.D26]; "") ->  | D250: of:=IF([.B250]; [.C250]; 0) -> 0 | E250: of:=IF([.C250]; [.D250]; 0) -> 
A251: of:=COM.MICROSOFT.TEXTJOIN(CHAR(13)&CHAR(10); TRUE(); [.A229:.A249]) -> Athletics (6)
Computing (7)
Culture (8)
Deception (9)
Diplomacy (10)
Engineering (0)
Finesse (0)
Gambling (0)
Hand-to-hand Combat (0)
Investigation (0)
Manipulation (0)
Medicine (0)
Mental Combat (0)
Occultism (0)
Performance (0)
Piloting (0)
Ranged Combat (0)
Science (0)
Self-control (1)
Stealth (0)
Survival (2) | D251: of:=ROUNDUP(SUM([.D229:.D250])) -> 43 | E251: of:=ROUNDUP(SUM([.E229:.E250])) -> 
A253: of:=HYPERLINK("#A1"; "Top 🡅") -> Top 🡅
A254: Strength
A255: of:=HYPERLINK("#STRENGTH_CALC"; "STRENGTH_CALC") -> STRENGTH_CALC
A256: Strength Level | B256: of:=IF(HAS_SUPER_STRENGTH; ATHLETICS+POWER_LEVEL; ATHLETICS) -> 6 | C256: of:=IF(HAS_SUPER_STRENGTH; "🡄 Has Super Strength"; "") ->  | E256: of:=HYPERLINK("#STRENGTH_SUMMARY"; "STRENGTH_SUMMARY") -> STRENGTH_SUMMARY
A257: Benchmarks | B257: of:=IF(STRENGTH_LEVEL>=0; [.C257]&" ("&[.D257]&")"; "") -> Normal Lift: 3,000 kg (spy satellite, passenger bus, dump truck, houseboat, private jet) | C257: of:=IF(STRENGTH_LEVEL>=0; "Normal Lift: "&VLOOKUP(STRENGTH_LEVEL-1; STRENGTH_CHART; 3); "") -> Normal Lift: 3,000 kg | D257: of:=IF(STRENGTH_LEVEL>=0; VLOOKUP(STRENGTH_LEVEL+1; STRENGTH_CHART; 4); "") -> spy satellite, passenger bus, dump truck, houseboat, private jet | E257: of:=LIFT_NORMAL&CHAR(13)&CHAR(10)&LIFT_MAX&CHAR(13)&CHAR(10)&THROW_SUMMARY&CHAR(13)&CHAR(10)&jump_text -> 
B258: of:=IF(STRENGTH_LEVEL>=0; [.C258]&" ("&[.D258]&")"; "") -> Max Lift: 10 t (monster truck, elephant, school bus, cargo helicopter, garbage truck) | C258: of:=IF(STRENGTH_LEVEL>=0; "Max Lift: "&VLOOKUP(STRENGTH_LEVEL; STRENGTH_CHART; 3); "") -> Max Lift: 10 t | D258: of:=IF(STRENGTH_LEVEL>=0; VLOOKUP(STRENGTH_LEVEL; STRENGTH_CHART; 4); "") -> monster truck, elephant, school bus, cargo helicopter, garbage truck
B259: of:=IF(STRENGTH_LEVEL>=0; "Throw 10 kg: "&VLOOKUP(STRENGTH_LEVEL; STRENGTH_CHART; 6); "") -> Throw 10 kg: 100 m
A261: Jump | B261: of:=ATHLETICS+IF(HAS_SUPER_STRENGTH; POWER_LEVEL; 0) -> 6 | C261: of:=INDEX(STRENGTH_CHART; [.B261]; 16) ->  | D261: of:=[.A261]&": "&[.C261] -> 
A263: of:=HYPERLINK("#A1"; "Top 🡅") -> Top 🡅
A264: End Of Sheet

Sheet: Data
A1: Data
A2: of:=HYPERLINK("#OPTIONS"; "OPTIONS") -> OPTIONS | B2: of:=HYPERLINK("#GENDER_LIST"; "GENDER_LIST") -> GENDER_LIST | C2: of:=HYPERLINK("#ORIGIN_CHART"; "ORIGIN_CHART") -> ORIGIN_CHART | D2: of:=HYPERLINK("#SHRINKING_CHART"; "SHRINKING_CHART") -> SHRINKING_CHART | E2: of:=HYPERLINK("#TELEPORTATION_CHART"; "TELEPORTATION_CHART") -> TELEPORTATION_CHART
A3: of:=HYPERLINK("#ACTION_TYPE_CHART"; "ACTION_TYPE_CHART") -> ACTION_TYPE_CHART | B3: of:=HYPERLINK("#GIFT_CHART"; "GIFT_CHART") -> GIFT_CHART | C3: of:=HYPERLINK("#POWER_CHART"; "POWER_CHART") -> POWER_CHART | D3: of:=HYPERLINK("#SKILL_CHART"; "SKILL_CHART") -> SKILL_CHART
A4: of:=HYPERLINK("#ARCHETYPE_CHART"; "ARCHETYPE_CHART") -> ARCHETYPE_CHART | B4: of:=HYPERLINK("#GROWTH_CHART"; "GROWTH_CHART") -> GROWTH_CHART | C4: of:=HYPERLINK("#POWER_BOOST_CHART"; "POWER_BOOST_CHART") -> POWER_BOOST_CHART | D4: of:=HYPERLINK("#SKILL_LEVEL_CHART"; "SKILL_LEVEL_CHART") -> SKILL_LEVEL_CHART
A5: of:=HYPERLINK("#COMPLICATION_LIST"; "COMPLICATION_LIST") -> COMPLICATION_LIST | B5: of:=HYPERLINK("#HASTE_CHART"; "HASTE_CHART") -> HASTE_CHART | C5: of:=HYPERLINK("#POWER_LEVEL_CHART"; "POWER_LEVEL_CHART") -> POWER_LEVEL_CHART | D5: of:=HYPERLINK("#SKILL_MIN_COST_CHART"; "SKILL_MIN_COST_CHART") -> SKILL_MIN_COST_CHART
A6: of:=HYPERLINK("#DENSITY_CONTROL_CHART"; "DENSITY_CONTROL_CHART") -> DENSITY_CONTROL_CHART | B6: of:=HYPERLINK("#MOTIVATION_CHART"; "MOTIVATION_CHART") -> MOTIVATION_CHART | C6: of:=HYPERLINK("#POWER_LEVELS_CHART"; "POWER_LEVELS_CHART") -> POWER_LEVELS_CHART | D6: of:=HYPERLINK("#STRENGTH_CHART"; "STRENGTH_CHART") -> STRENGTH_CHART
A7: of:=HYPERLINK("#DUPLICATION_CHART" ; "DUPLICATION_CHART") -> DUPLICATION_CHART | B7: of:=HYPERLINK("#MOVEMENT_CHART"; "MOVEMENT_CHART") -> MOVEMENT_CHART | C7: of:=HYPERLINK("#POWER_MIN_COST_CHART"; "POWER_MIN_COST_CHART") -> POWER_MIN_COST_CHART | D7: of:=HYPERLINK("#STRETCHING_CHART"; "STRETCHING_CHART") -> STRETCHING_CHART
A8: of:=HYPERLINK("#EQUIPMENT_CHARTS"; "EQUIPMENT_CHARTS") -> EQUIPMENT_CHARTS | B8: of:=HYPERLINK("#MULTIPLIER_CHART"; "MULTIPLIER_CHART") -> MULTIPLIER_CHART | C8: of:=HYPERLINK("#SEXUALITY_LIST"; "SEXUALITY_LIST") -> SEXUALITY_LIST | D8: of:=HYPERLINK("#TELEKINESIS_CHART"; "TELEKINESIS_CHART") -> TELEKINESIS_CHART
A10: of:=HYPERLINK("#A1"; "Top 🡅") -> Top 🡅
A11: Options
A12: of:=HYPERLINK("#OPTIONS"; "OPTIONS") -> OPTIONS
A13: of:=HYPERLINK("#DV_BASE"; "DV_BASE") -> DV_BASE | B13: 6
A14: of:=HYPERLINK("#DV_MODERATE"; "DV_MODERATE") -> DV_MODERATE | B14: 9
A15: of:=HYPERLINK("#DV_REMARKABLE"; "DV_REMARKABLE") -> DV_REMARKABLE | B15: 12
A16: of:=HYPERLINK("#DV_EXTREME"; "DV_EXTREME") -> DV_EXTREME | B16: 15
A18: of:=HYPERLINK("#ENDURANCE_PADDING"; "ENDURANCE_PADDING") -> ENDURANCE_PADDING | B18: 6
A20: of:=HYPERLINK("#EQUIPMENT_ERA"; "EQUIPMENT_ERA") -> EQUIPMENT_ERA | B20: Modern
A21: of:=HYPERLINK("#EQUIPMENT_ERA_LIST"; "EQUIPMENT_ERA_LIST") -> EQUIPMENT_ERA_LIST | B21: Fantasy
B22: Modern
B23: Science Fiction
A25: of:=HYPERLINK("#HEALTH_PADDING"; "HEALTH_PADDING") -> HEALTH_PADDING | B25: 6
A27: of:=HYPERLINK("#META_FILENAME"; "META_FILENAME") -> META_FILENAME | B27: of:=ORG.LIBREOFFICE.REGEX(CELL("filename");"[^/]+(?='#\$)") -> Kalos-Mechanism-Character-Helper.fods
A28: of:=HYPERLINK("#META_VERSION"; "META_VERSION") -> META_VERSION | B28: of:=INDEX(CHANGE_LIST; 2) -> 4.0.30.x
A30: of:=HYPERLINK("#ORIGIN_TITLE"; "ORIGIN_TITLE") -> ORIGIN_TITLE | B30: Origin
A31: of:=HYPERLINK("#ORIGIN_TITLE_LIST"; "ORIGIN_TITLE_LIST") -> ORIGIN_TITLE_LIST | B31: Folk
B32: Origin
B33: Species
A35: of:=HYPERLINK("#RESISTANCE_BASE"; "RESISTANCE_BASE") -> RESISTANCE_BASE | B35: 3
A37: of:=HYPERLINK("#SKILL_BONUS"; "SKILL_BONUS") -> SKILL_BONUS | B37: 3
A38: of:=HYPERLINK("#SKILL_MAJOR_BONUS"; "SKILL_MAJOR_BONUS") -> SKILL_MAJOR_BONUS | B38: 6
A40: of:=HYPERLINK("#YORN_LIST" ; "YORN_LIST") -> YORN_LIST | B40: -
B41: Y
B42: N
A44: of:=HYPERLINK("#A1"; "Top 🡅") -> Top 🡅
A45: Action Types
A46: of:=HYPERLINK("#ACTION_TYPE_CHART"; "ACTION_TYPE_CHART") -> ACTION_TYPE_CHART
A47: Action Type | B47: Abbreviation
A48: Constant | B48: Constant
A49: Anytime action | B49: Anytime
A50: Quick action | B50: Quick
A51: Standard action | B51: Standard
A52: Varies | B52: Varies
A54: of:=HYPERLINK("#A1"; "Top 🡅") -> Top 🡅
A55: Archetypes
A56: of:=HYPERLINK("#ARCHETYPE_CHART"; "ARCHETYPE_CHART") -> ARCHETYPE_CHART
A57: of:=HYPERLINK("#ARCHETYPE_LIST"; "ARCHETYPE_LIST") -> ARCHETYPE_LIST
A58: Name | B58: Description
A60: Beanstalk | B60: The character can dramatically change their size.
A61: Calculator | B61: The character knows the variables and takes all of them into account.
A62: Cannon | B62: The character is the proverbial big gun, capable of firing blasts of astonishing power.
A63: Clay | B63: The character can change their physical form in some way.
A64: Dolphin | B64: The character is at home in the sea.
A65: Elemental | B65: The character is the living embodiment of a force, substance, or idea.
A66: Gadget | B66: The character always seems to have a gizmo or incantation on hand.
A67: Hammer | B67: The character is the heaviest hitter in the neighborhood.
A68: Minion | B68: The character is the proverbial small fry, and of no great importance.
A69: Mirror | B69: The character wields forces beyond the material world.
A70: Rocket | B70: The character is fast -- super fast.
A71: Shadow | B71: The character can go where no one else can go.
A72: Sword | B72: The character is a fighter, through and through.
A73: Tank | B73: The character is an immovable object in a world of irresistible forces.
A75: of:=HYPERLINK("#A1"; "Top 🡅") -> Top 🡅
A76: Complications
A77: of:=HYPERLINK("#COMPLICATION_CHART"; "COMPLICATION_CHART") -> COMPLICATION_CHART
A78: of:=HYPERLINK("#COMPLICATION_LIST"; "COMPLICATION_LIST") -> COMPLICATION_LIST
A79: Name | B79: Description
A81: Compulsion | B81: of:="The character has a powerful urge to do (or not to do) something." -> The character has a powerful urge to do (or not to do) something.
A82: Obligation | B82: of:="The character must answer to someone else. The character doesn't necessarily have to obey, but disobedience will have consequences if it becomes known." -> The character must answer to someone else. The character doesn't necessarily have to obey, but disobedience will have consequences if it becomes known.
A83: Outsider | B83: of:="The character is unfamiliar with, uncomfortable with, or perhaps even incapable of navigating social norms and customs." -> The character is unfamiliar with, uncomfortable with, or perhaps even incapable of navigating social norms and customs.
A84: Repugnant | B84: of:="Whatever the reason, the character makes a terrible first impression. They may come across as distasteful in social situations, or they may be visually unpleasant." -> Whatever the reason, the character makes a terrible first impression. They may come across as distasteful in social situations, or they may be visually unpleasant.
A85: Wanted | B85: of:="The character is an outlaw, or is hated and/or hunted by a powerful enemy." -> The character is an outlaw, or is hated and/or hunted by a powerful enemy.
A86: Weakness | B86: of:="When the character is exposed to an otherwise harmless environment or substance, they incur a skill penalty (-"&SKILL_BONUS&" AV, -"&SKILL_BONUS&" DV)." -> When the character is exposed to an otherwise harmless environment or substance, they incur a skill penalty (-3 AV, -3 DV).
A88: of:=HYPERLINK("#A1"; "Top 🡅") -> Top 🡅
A89: Density Control
A90: of:=HYPERLINK("#DENSITY_CONTROL_CHART"; "DENSITY_CONTROL_CHART") -> DENSITY_CONTROL_CHART
A91: Level | B91: Mass | C91: Athletics Bonus | D91: Text
A92: 1 | B92: 200 kg | C92: 1 | D92: of:="Mass "&[.B92]&", Athletics +"&[.C92] -> Mass 200 kg, Athletics +1
A93: 2 | B93: 500 kg | C93: 1 | D93: of:="Mass "&[.B93]&", Athletics +"&[.C93] -> Mass 500 kg, Athletics +1
A94: 3 | B94: 1,000 kg | C94: 2 | D94: of:="Mass "&[.B94]&", Athletics +"&[.C94] -> Mass 1,000 kg, Athletics +2
A95: 4 | B95: 2,000 kg | C95: 2 | D95: of:="Mass "&[.B95]&", Athletics +"&[.C95] -> Mass 2,000 kg, Athletics +2
A96: 5 | B96: 5,000 kg | C96: 3 | D96: of:="Mass "&[.B96]&", Athletics +"&[.C96] -> Mass 5,000 kg, Athletics +3
A97: 6 | B97: 10 t | C97: 3 | D97: of:="Mass "&[.B97]&", Athletics +"&[.C97] -> Mass 10 t, Athletics +3
A98: 7 | B98: 20 t | C98: 4 | D98: of:="Mass "&[.B98]&", Athletics +"&[.C98] -> Mass 20 t, Athletics +4
A99: 8 | B99: 50 t | C99: 4 | D99: of:="Mass "&[.B99]&", Athletics +"&[.C99] -> Mass 50 t, Athletics +4
A100: 9 | B100: 100 t | C100: 5 | D100: of:="Mass "&[.B100]&", Athletics +"&[.C100] -> Mass 100 t, Athletics +5
A101: 10 | B101: 200 t | C101: 5 | D101: of:="Mass "&[.B101]&", Athletics +"&[.C101] -> Mass 200 t, Athletics +5
A103: of:=HYPERLINK("#A1"; "Top 🡅") -> Top 🡅
A104: Duplication
A105: of:=HYPERLINK("#DUPLICATION_CHART" ; "DUPLICATION_CHART") -> DUPLICATION_CHART
A106: Level | B106: Duplicates | C106: Text
A107: 1 | B107: 2 | C107: of:=TEXT([.B107];"#,##0")&" duplicates" -> 2 duplicates
A108: 2 | B108: 3 | C108: of:=TEXT([.B108];"#,##0")&" duplicates" -> 3 duplicates
A109: 3 | B109: 6 | C109: of:=TEXT([.B109];"#,##0")&" duplicates" -> 6 duplicates
A110: 4 | B110: 10 | C110: of:=TEXT([.B110];"#,##0")&" duplicates" -> 10 duplicates
A111: 5 | B111: 20 | C111: of:=TEXT([.B111];"#,##0")&" duplicates" -> 20 duplicates
A112: 6 | B112: 30 | C112: of:=TEXT([.B112];"#,##0")&" duplicates" -> 30 duplicates
A113: 7 | B113: 60 | C113: of:=TEXT([.B113];"#,##0")&" duplicates" -> 60 duplicates
A114: 8 | B114: 100 | C114: of:=TEXT([.B114];"#,##0")&" duplicates" -> 100 duplicates
A115: 9 | B115: 200 | C115: of:=TEXT([.B115];"#,##0")&" duplicates" -> 200 duplicates
A116: 10 | B116: 300 | C116: of:=TEXT([.B116];"#,##0")&" duplicates" -> 300 duplicates
A118: of:=HYPERLINK("#A1"; "Top 🡅") -> Top 🡅
A119: Equipment
A120: of:=HYPERLINK("#EQUIPMENT_CHARTS"; "EQUIPMENT_CHARTS") -> EQUIPMENT_CHARTS
A121: Era
A122: of:=EQUIPMENT_ERA -> Modern
A124: Armor
A125: of:=HYPERLINK("#ARMOR_CHART"; "ARMOR_CHART") -> ARMOR_CHART
A126: of:=HYPERLINK("#ARMOR_LIST"; "ARMOR_LIST") -> ARMOR_LIST
A127: Select Name | B127: Name | C127: Level | D127: DR | E127: (Blank Column) | F127: Cost | G127: Notes
A128: of:=IF([.B128]=""; ""; [.B128]&" (Level "&[.C128]&", "&[.D128]&" DR)") -> Industrial PPE (Level 1, 4 DR) | B128: of:=IF(EQUIPMENT_ERA="Fantasy"; [.B136]; IF(EQUIPMENT_ERA="Modern"; [.B144]; IF(EQUIPMENT_ERA="Science Fiction"; [.B152]; [.B144]))) -> Industrial PPE | C128: of:=IF(EQUIPMENT_ERA="Fantasy"; [.C136]; IF(EQUIPMENT_ERA="Modern"; [.C144]; IF(EQUIPMENT_ERA="Science Fiction"; [.C152]; [.C144]))) -> 1 | D128: of:=IF(EQUIPMENT_ERA="Fantasy"; [.D136]; IF(EQUIPMENT_ERA="Modern"; [.D144]; IF(EQUIPMENT_ERA="Science Fiction"; [.D152]; [.D144]))) -> 4 | E128: of:=IF(EQUIPMENT_ERA="Fantasy"; [.E136]; IF(EQUIPMENT_ERA="Modern"; [.E144]; IF(EQUIPMENT_ERA="Science Fiction"; [.E152]; [.E144]))) -> 0 | F128: of:=IF(EQUIPMENT_ERA="Fantasy"; [.F136]; IF(EQUIPMENT_ERA="Modern"; [.F144]; IF(EQUIPMENT_ERA="Science Fiction"; [.F152]; [.F144]))) -> 400 | G128: of:=IF(EQUIPMENT_ERA="Fantasy"; [.G136]; IF(EQUIPMENT_ERA="Modern"; [.G144]; IF(EQUIPMENT_ERA="Science Fiction"; [.G152]; [.G144]))) -> 0
A129: of:=IF([.B129]=""; ""; [.B129]&" (Level "&[.C129]&", "&[.D129]&" DR)") -> Light Tactical Armor (Level 1, 4 DR) | B129: of:=IF(EQUIPMENT_ERA="Fantasy"; [.B137]; IF(EQUIPMENT_ERA="Modern"; [.B145]; IF(EQUIPMENT_ERA="Science Fiction"; [.B153]; [.B145]))) -> Light Tactical Armor | C129: of:=IF(EQUIPMENT_ERA="Fantasy"; [.C137]; IF(EQUIPMENT_ERA="Modern"; [.C145]; IF(EQUIPMENT_ERA="Science Fiction"; [.C153]; [.C145]))) -> 1 | D129: of:=IF(EQUIPMENT_ERA="Fantasy"; [.D137]; IF(EQUIPMENT_ERA="Modern"; [.D145]; IF(EQUIPMENT_ERA="Science Fiction"; [.D153]; [.D145]))) -> 4 | E129: of:=IF(EQUIPMENT_ERA="Fantasy"; [.E137]; IF(EQUIPMENT_ERA="Modern"; [.E145]; IF(EQUIPMENT_ERA="Science Fiction"; [.E153]; [.E145]))) -> 0 | F129: of:=IF(EQUIPMENT_ERA="Fantasy"; [.F137]; IF(EQUIPMENT_ERA="Modern"; [.F145]; IF(EQUIPMENT_ERA="Science Fiction"; [.F153]; [.F145]))) -> 1600 | G129: of:=IF(EQUIPMENT_ERA="Fantasy"; [.G137]; IF(EQUIPMENT_ERA="Modern"; [.G145]; IF(EQUIPMENT_ERA="Science Fiction"; [.G153]; [.G145]))) -> 0
A130: of:=IF([.B130]=""; ""; [.B130]&" (Level "&[.C130]&", "&[.D130]&" DR)") -> Heavy Tactical Armor (Level 2, 5 DR) | B130: of:=IF(EQUIPMENT_ERA="Fantasy"; [.B138]; IF(EQUIPMENT_ERA="Modern"; [.B146]; IF(EQUIPMENT_ERA="Science Fiction"; [.B154]; [.B146]))) -> Heavy Tactical Armor | C130: of:=IF(EQUIPMENT_ERA="Fantasy"; [.C138]; IF(EQUIPMENT_ERA="Modern"; [.C146]; IF(EQUIPMENT_ERA="Science Fiction"; [.C154]; [.C146]))) -> 2 | D130: of:=IF(EQUIPMENT_ERA="Fantasy"; [.D138]; IF(EQUIPMENT_ERA="Modern"; [.D146]; IF(EQUIPMENT_ERA="Science Fiction"; [.D154]; [.D146]))) -> 5 | E130: of:=IF(EQUIPMENT_ERA="Fantasy"; [.E138]; IF(EQUIPMENT_ERA="Modern"; [.E146]; IF(EQUIPMENT_ERA="Science Fiction"; [.E154]; [.E146]))) -> 0 | F130: of:=IF(EQUIPMENT_ERA="Fantasy"; [.F138]; IF(EQUIPMENT_ERA="Modern"; [.F146]; IF(EQUIPMENT_ERA="Science Fiction"; [.F154]; [.F146]))) -> 2000 | G130: of:=IF(EQUIPMENT_ERA="Fantasy"; [.G138]; IF(EQUIPMENT_ERA="Modern"; [.G146]; IF(EQUIPMENT_ERA="Science Fiction"; [.G154]; [.G146]))) -> 0
A131: of:=IF([.B131]=""; ""; [.B131]&" (Level "&[.C131]&", "&[.D131]&" DR)") -> Light Assault Armor (Level 3, 6 DR) | B131: of:=IF(EQUIPMENT_ERA="Fantasy"; [.B139]; IF(EQUIPMENT_ERA="Modern"; [.B147]; IF(EQUIPMENT_ERA="Science Fiction"; [.B155]; [.B147]))) -> Light Assault Armor | C131: of:=IF(EQUIPMENT_ERA="Fantasy"; [.C139]; IF(EQUIPMENT_ERA="Modern"; [.C147]; IF(EQUIPMENT_ERA="Science Fiction"; [.C155]; [.C147]))) -> 3 | D131: of:=IF(EQUIPMENT_ERA="Fantasy"; [.D139]; IF(EQUIPMENT_ERA="Modern"; [.D147]; IF(EQUIPMENT_ERA="Science Fiction"; [.D155]; [.D147]))) -> 6 | E131: of:=IF(EQUIPMENT_ERA="Fantasy"; [.E139]; IF(EQUIPMENT_ERA="Modern"; [.E147]; IF(EQUIPMENT_ERA="Science Fiction"; [.E155]; [.E147]))) -> 0 | F131: of:=IF(EQUIPMENT_ERA="Fantasy"; [.F139]; IF(EQUIPMENT_ERA="Modern"; [.F147]; IF(EQUIPMENT_ERA="Science Fiction"; [.F155]; [.F147]))) -> 4000 | G131: of:=IF(EQUIPMENT_ERA="Fantasy"; [.G139]; IF(EQUIPMENT_ERA="Modern"; [.G147]; IF(EQUIPMENT_ERA="Science Fiction"; [.G155]; [.G147]))) -> Encrypted Radio, Night Vision
A132: of:=IF([.B132]=""; ""; [.B132]&" (Level "&[.C132]&", "&[.D132]&" DR)") -> Heavy Assault Armor (Level 4, 7 DR) | B132: of:=IF(EQUIPMENT_ERA="Fantasy"; [.B140]; IF(EQUIPMENT_ERA="Modern"; [.B148]; IF(EQUIPMENT_ERA="Science Fiction"; [.B156]; [.B148]))) -> Heavy Assault Armor | C132: of:=IF(EQUIPMENT_ERA="Fantasy"; [.C140]; IF(EQUIPMENT_ERA="Modern"; [.C148]; IF(EQUIPMENT_ERA="Science Fiction"; [.C156]; [.C148]))) -> 4 | D132: of:=IF(EQUIPMENT_ERA="Fantasy"; [.D140]; IF(EQUIPMENT_ERA="Modern"; [.D148]; IF(EQUIPMENT_ERA="Science Fiction"; [.D156]; [.D148]))) -> 7 | E132: of:=IF(EQUIPMENT_ERA="Fantasy"; [.E140]; IF(EQUIPMENT_ERA="Modern"; [.E148]; IF(EQUIPMENT_ERA="Science Fiction"; [.E156]; [.E148]))) -> 0 | F132: of:=IF(EQUIPMENT_ERA="Fantasy"; [.F140]; IF(EQUIPMENT_ERA="Modern"; [.F148]; IF(EQUIPMENT_ERA="Science Fiction"; [.F156]; [.F148]))) -> 8000 | G132: of:=IF(EQUIPMENT_ERA="Fantasy"; [.G140]; IF(EQUIPMENT_ERA="Modern"; [.G148]; IF(EQUIPMENT_ERA="Science Fiction"; [.G156]; [.G148]))) -> Encrypted Radio, Night Vision
A133: of:=IF([.B133]=""; ""; [.B133]&" (Level "&[.C133]&", "&[.D133]&" DR)") -> Blast Armor (Level 5, 8 DR) | B133: of:=IF(EQUIPMENT_ERA="Fantasy"; [.B141]; IF(EQUIPMENT_ERA="Modern"; [.B149]; IF(EQUIPMENT_ERA="Science Fiction"; [.B157]; [.B149]))) -> Blast Armor | C133: of:=IF(EQUIPMENT_ERA="Fantasy"; [.C141]; IF(EQUIPMENT_ERA="Modern"; [.C149]; IF(EQUIPMENT_ERA="Science Fiction"; [.C157]; [.C149]))) -> 5 | D133: of:=IF(EQUIPMENT_ERA="Fantasy"; [.D141]; IF(EQUIPMENT_ERA="Modern"; [.D149]; IF(EQUIPMENT_ERA="Science Fiction"; [.D157]; [.D149]))) -> 8 | E133: of:=IF(EQUIPMENT_ERA="Fantasy"; [.E141]; IF(EQUIPMENT_ERA="Modern"; [.E149]; IF(EQUIPMENT_ERA="Science Fiction"; [.E157]; [.E149]))) -> 0 | F133: of:=IF(EQUIPMENT_ERA="Fantasy"; [.F141]; IF(EQUIPMENT_ERA="Modern"; [.F149]; IF(EQUIPMENT_ERA="Science Fiction"; [.F157]; [.F149]))) -> 16000 | G133: of:=IF(EQUIPMENT_ERA="Fantasy"; [.G141]; IF(EQUIPMENT_ERA="Modern"; [.G149]; IF(EQUIPMENT_ERA="Science Fiction"; [.G157]; [.G149]))) -> Encrypted Radio, Night Vision
A135: Select Name | B135: Name | C135: Level | D135: DR | E135: (Blank Column) | F135: Cost | G135: Notes
A136: of:=IF([.B136]=""; ""; [.B136]&" (Level "&[.C136]&", "&[.D136]&" DR)") -> Industrial PPE (Level 1, 4 DR) | B136: Industrial PPE | C136: 1 | D136: 4 | F136: 400
A137: of:=IF([.B137]=""; ""; [.B137]&" (Level "&[.C137]&", "&[.D137]&" DR)") -> Light Tactical Armor (Level 1, 4 DR) | B137: Light Tactical Armor | C137: 1 | D137: 4 | F137: 1600
A138: of:=IF([.B138]=""; ""; [.B138]&" (Level "&[.C138]&", "&[.D138]&" DR)") -> Heavy Tactical Armor (Level 2, 5 DR) | B138: Heavy Tactical Armor | C138: 2 | D138: 5 | F138: 2000
A139: of:=IF([.B139]=""; ""; [.B139]&" (Level "&[.C139]&", "&[.D139]&" DR)") -> Light Assault Armor (Level 3, 6 DR) | B139: Light Assault Armor | C139: 3 | D139: 6 | F139: 4000
A140: of:=IF([.B140]=""; ""; [.B140]&" (Level "&[.C140]&", "&[.D140]&" DR)") -> Heavy Assault Armor (Level 4, 7 DR) | B140: Heavy Assault Armor | C140: 4 | D140: 7 | F140: 8000
A141: of:=IF([.B141]=""; ""; [.B141]&" (Level "&[.C141]&", "&[.D141]&" DR)") -> Blast Armor (Level 5, 8 DR) | B141: Blast Armor | C141: 5 | D141: 8 | F141: 16000
A143: Select Name | B143: Name | C143: Level | D143: DR | E143: (Blank Column) | F143: Cost | G143: Notes
A144: of:=IF([.B144]=""; ""; [.B144]&" (Level "&[.C144]&", "&[.D144]&" DR)") -> Industrial PPE (Level 1, 4 DR) | B144: Industrial PPE | C144: 1 | D144: 4 | F144: 400
A145: of:=IF([.B145]=""; ""; [.B145]&" (Level "&[.C145]&", "&[.D145]&" DR)") -> Light Tactical Armor (Level 1, 4 DR) | B145: Light Tactical Armor | C145: 1 | D145: 4 | F145: 1600
A146: of:=IF([.B146]=""; ""; [.B146]&" (Level "&[.C146]&", "&[.D146]&" DR)") -> Heavy Tactical Armor (Level 2, 5 DR) | B146: Heavy Tactical Armor | C146: 2 | D146: 5 | F146: 2000
A147: of:=IF([.B147]=""; ""; [.B147]&" (Level "&[.C147]&", "&[.D147]&" DR)") -> Light Assault Armor (Level 3, 6 DR) | B147: Light Assault Armor | C147: 3 | D147: 6 | F147: 4000 | G147: Encrypted Radio, Night Vision
A148: of:=IF([.B148]=""; ""; [.B148]&" (Level "&[.C148]&", "&[.D148]&" DR)") -> Heavy Assault Armor (Level 4, 7 DR) | B148: Heavy Assault Armor | C148: 4 | D148: 7 | F148: 8000 | G148: Encrypted Radio, Night Vision
A149: of:=IF([.B149]=""; ""; [.B149]&" (Level "&[.C149]&", "&[.D149]&" DR)") -> Blast Armor (Level 5, 8 DR) | B149: Blast Armor | C149: 5 | D149: 8 | F149: 16000 | G149: Encrypted Radio, Night Vision
A151: Select Name | B151: Name | C151: Level | D151: DR | E151: (Blank Column) | F151: Cost | G151: Notes
A152: of:=IF([.B152]=""; ""; [.B152]&" (Level "&[.C152]&", "&[.D152]&" DR)") -> Industrial PPE (Level 1, 4 DR) | B152: Industrial PPE | C152: 1 | D152: 4 | F152: 400 | G152: Encrypted Radio
A153: of:=IF([.B153]=""; ""; [.B153]&" (Level "&[.C153]&", "&[.D153]&" DR)") -> Light Tactical Armor (Level 1, 4 DR) | B153: Light Tactical Armor | C153: 1 | D153: 4 | F153: 1600 | G153: Encrypted Radio, Night Vision
A154: of:=IF([.B154]=""; ""; [.B154]&" (Level "&[.C154]&", "&[.D154]&" DR)") -> Heavy Tactical Armor (Level 2, 5 DR) | B154: Heavy Tactical Armor | C154: 2 | D154: 5 | F154: 2000 | G154: Encrypted Radio, Night Vision
A155: of:=IF([.B155]=""; ""; [.B155]&" (Level "&[.C155]&", "&[.D155]&" DR)") -> Light Assault Armor (Level 3, 6 DR) | B155: Light Assault Armor | C155: 3 | D155: 6 | F155: 4000 | G155: Encrypted Radio, Night Vision
A156: of:=IF([.B156]=""; ""; [.B156]&" (Level "&[.C156]&", "&[.D156]&" DR)") -> Heavy Assault Armor (Level 4, 7 DR) | B156: Heavy Assault Armor | C156: 4 | D156: 7 | F156: 8000 | G156: Encrypted Radio, Night Vision
A157: of:=IF([.B157]=""; ""; [.B157]&" (Level "&[.C157]&", "&[.D157]&" DR)") -> Blast Armor (Level 5, 8 DR) | B157: Blast Armor | C157: 5 | D157: 8 | F157: 16000 | G157: Encrypted Radio, Night Vision
A159: Armor Enhancements
A160: of:=HYPERLINK("#ARMOR_ENH_CHART"; "ARMOR_ENH_CHART") -> ARMOR_ENH_CHART
A161: of:=HYPERLINK("#ARMOR_ENH_LIST"; "ARMOR_ENH_LIST") -> ARMOR_ENH_LIST
A162: Select Name | B162: Name | C162: (Blank Column) | D162: (Blank Column) | E162: (Blank Column) | F162: Cost | G162: Notes
A163: of:=IF([.B163]=""; ""; [.B163]) -> Environmental | B163: Environmental | F163: 300 | G163: Environmental Immunity
A164: of:=IF([.B164]=""; ""; [.B164]) -> Extreme Cold Adapted | B164: Extreme Cold Adapted | F164: 600 | G164: Environmental Immunity, Cold Immunity
A165: of:=IF([.B165]=""; ""; [.B165]) -> Extreme Heat Adapted | B165: Extreme Heat Adapted | F165: 600 | G165: Environmental Immunity, Heat Immunity
A166: of:=IF([.B166]=""; ""; [.B166]) -> Field Kit | B166: Field Kit | F166: Varies | G166: see Field Kits, below
A167: of:=IF([.B167]=""; ""; [.B167]) -> Hazmat | B167: Hazmat | F167: 1500 | G167: Environmental Immunity, Alteration Resistance
A168: of:=IF([.B168]=""; ""; [.B168]) -> Magnetic Boots | B168: Magnetic Boots | F168: 300 | G168: Clinging
A169: of:=IF([.B169]=""; ""; [.B169]) -> Scout Package | B169: Scout Package | F169: 300 | G169: Ambient Awareness
A170: of:=IF([.B170]=""; ""; [.B170]) -> Strength Assist | B170: Strength Assist | F170: 1200 | G170: Strike, Super Lifting
A171: of:=IF([.B171]=""; ""; [.B171]) -> Thrusters | B171: Thrusters | F171: 600 | G171: Flight
A173: Shield
A174: of:=HYPERLINK("#SHIELD_CHART"; "SHIELD_CHART") -> SHIELD_CHART
A175: of:=HYPERLINK("#SHIELD_LIST"; "SHIELD_LIST") -> SHIELD_LIST
A176: Select Name | B176: Name | C176: Level | D176: DR Bonus | E176: (Blank Column) | F176: Cost | G176: Notes
A177: of:=IF([.B177]=""; ""; [.B177]&" (Level "&[.C177]&", +"&[.D177]&" DR Bonus)") -> Safety Shield (Level 1, +1 DR Bonus) | B177: Safety Shield | C177: 1 | D177: 1 | F177: 40
A178: of:=IF([.B178]=""; ""; [.B178]&" (Level "&[.C178]&", +"&[.D178]&" DR Bonus)") -> Light Tactical Shield (Level 1, +1 DR Bonus) | B178: Light Tactical Shield | C178: 1 | D178: 1 | F178: 80
A179: of:=IF([.B179]=""; ""; [.B179]&" (Level "&[.C179]&", +"&[.D179]&" DR Bonus)") -> Heavy Tactical Shield (Level 2, +2 DR Bonus) | B179: Heavy Tactical Shield | C179: 2 | D179: 2 | F179: 160
A180: of:=IF([.B180]=""; ""; [.B180]&" (Level "&[.C180]&", +"&[.D180]&" DR Bonus)") -> Light Assault Shield (Level 3, +3 DR Bonus) | B180: Light Assault Shield | C180: 3 | D180: 3 | F180: 200
A181: of:=IF([.B181]=""; ""; [.B181]&" (Level "&[.C181]&", +"&[.D181]&" DR Bonus)") -> Heavy Assault Shield (Level 4, +4 DR Bonus) | B181: Heavy Assault Shield | C181: 4 | D181: 4 | F181: 400
A182: of:=IF([.B182]=""; ""; [.B182]&" (Level "&[.C182]&", +"&[.D182]&" DR Bonus)") -> Blast Shield (Level 5, +5 DR Bonus) | B182: Blast Shield | C182: 5 | D182: 5 | F182: 800
A184: Shield Enhancements
A185: of:=HYPERLINK("#SHIELD_ENH_CHART"; "SHIELD_ENH_CHART") -> SHIELD_ENH_CHART
A186: of:=HYPERLINK("#SHIELD_ENH_LIST"; "SHIELD_ENH_LIST") -> SHIELD_ENH_LIST
A187: Select Name | B187: Name | C187: (Blank Column) | D187: (Blank Column) | E187: (Blank Column) | F187: Cost | G187: Notes
A188: of:=IF([.B188]=""; ""; [.B188]) -> Environmental | B188: Environmental | F188: 600 | G188: Environmental Immunity
A189: of:=IF([.B189]=""; ""; [.B189]) -> Riot Charge | B189: Riot Charge | F189: 1200 | G189: Damaging Aura
A190: of:=IF([.B190]=""; ""; [.B190]) -> Spikes | B190: Spikes | F190: 120 | G190: Damaging Aura
A192: Hand-to-hand Weapons
A193: of:=HYPERLINK("#HTH_WEAPON_CHART"; "HTH_WEAPON_CHART") -> HTH_WEAPON_CHART
A194: of:=HYPERLINK("#HTH_WEAPON_LIST"; "HTH_WEAPON_LIST") -> HTH_WEAPON_LIST
A195: Select Name | B195: Name | C195: Level | D195: Damage | E195: (Blank Column) | F195: Cost | G195: (Blank Column)
A196: of:=IF([.B196]=""; ""; [.B196]&" (Level "&[.C196]&", "&[.D196]&" Damage)") -> Simple Weapon (Level 1, 1d6+1 Damage) | B196: Simple Weapon | C196: 1 | D196: 1d6+1 | F196: --
A197: of:=IF([.B197]=""; ""; [.B197]&" (Level "&[.C197]&", "&[.D197]&" Damage)") -> Light Tactical Blade/Club (Level 2, 1d6+2 Damage) | B197: Light Tactical Blade/Club | C197: 2 | D197: 1d6+2 | F197: 40
A198: of:=IF([.B198]=""; ""; [.B198]&" (Level "&[.C198]&", "&[.D198]&" Damage)") -> Heavy Tactical Blade/Club (Level 3, 1d6+3 Damage) | B198: Heavy Tactical Blade/Club | C198: 3 | D198: 1d6+3 | F198: 120
A199: of:=IF([.B199]=""; ""; [.B199]&" (Level "&[.C199]&", "&[.D199]&" Damage)") -> Light Assault Blade/Club (Level 4, 1d6+4 Damage) | B199: Light Assault Blade/Club | C199: 4 | D199: 1d6+4 | F199: 400
A200: of:=IF([.B200]=""; ""; [.B200]&" (Level "&[.C200]&", "&[.D200]&" Damage)") -> Heavy Assault Blade/Club (Level 5, 1d6+5 Damage) | B200: Heavy Assault Blade/Club | C200: 5 | D200: 1d6+5 | F200: 1200
A202: Ranged Weapons
A203: of:=HYPERLINK("#RANGED_WEAPON_CHART"; "RANGED_WEAPON_CHART") -> RANGED_WEAPON_CHART
A204: of:=HYPERLINK("#RANGED_WEAPON_LIST"; "RANGED_WEAPON_LIST") -> RANGED_WEAPON_LIST
A205: Select Name | B205: Name | C205: Level | D205: Damage | E205: Range | F205: Cost | G205: (Blank Column)
A206: of:=IF([.B206]=""; ""; [.B206]&" (Level "&[.C206]&", "&[.D206]&" Damage, "&[.E206]&" range)") -> Utility Sidearm (Level 1, 1d6+1 Damage, Short range) | B206: Utility Sidearm | C206: 1 | D206: 1d6+1 | E206: Short | F206: 200
A207: of:=IF([.B207]=""; ""; [.B207]&" (Level "&[.C207]&", "&[.D207]&" Damage, "&[.E207]&" range)") -> Utility Carbine (Level 1, 1d6+1 Damage, Medium range) | B207: Utility Carbine | C207: 1 | D207: 1d6+1 | E207: Medium | F207: 300
A208: of:=IF([.B208]=""; ""; [.B208]&" (Level "&[.C208]&", "&[.D208]&" Damage, "&[.E208]&" range)") -> Utility Long Arm (Level 1, 1d6+1 Damage, Long range) | B208: Utility Long Arm | C208: 1 | D208: 1d6+1 | E208: Long | F208: 400
A209: of:=IF([.B209]=""; ""; [.B209]&" (Level "&[.C209]&", "&[.D209]&" Damage, "&[.E209]&" range)") -> Light Tactical Sidearm (Level 2, 1d6+2 Damage, Short range) | B209: Light Tactical Sidearm | C209: 2 | D209: 1d6+2 | E209: Short | F209: 400
A210: of:=IF([.B210]=""; ""; [.B210]&" (Level "&[.C210]&", "&[.D210]&" Damage, "&[.E210]&" range)") -> Light Tactical Carbine (Level 2, 1d6+2 Damage, Medium range) | B210: Light Tactical Carbine | C210: 2 | D210: 1d6+2 | E210: Medium | F210: 600
A211: of:=IF([.B211]=""; ""; [.B211]&" (Level "&[.C211]&", "&[.D211]&" Damage, "&[.E211]&" range)") -> Light Tactical Long Arm (Level 2, 1d6+2 Damage, Long range) | B211: Light Tactical Long Arm | C211: 2 | D211: 1d6+2 | E211: Long | F211: 800
A212: of:=IF([.B212]=""; ""; [.B212]&" (Level "&[.C212]&", "&[.D212]&" Damage, "&[.E212]&" range)") -> Heavy Tactical Sidearm (Level 3, 1d6+3 Damage, Short range) | B212: Heavy Tactical Sidearm | C212: 3 | D212: 1d6+3 | E212: Short | F212: 1200
A213: of:=IF([.B213]=""; ""; [.B213]&" (Level "&[.C213]&", "&[.D213]&" Damage, "&[.E213]&" range)") -> Heavy Tactical Carbine (Level 3, 1d6+3 Damage, Medium range) | B213: Heavy Tactical Carbine | C213: 3 | D213: 1d6+3 | E213: Medium | F213: 1600
A214: of:=IF([.B214]=""; ""; [.B214]&" (Level "&[.C214]&", "&[.D214]&" Damage, "&[.E214]&" range)") -> Heavy Tactical Long Arm (Level 3, 1d6+3 Damage, Long range) | B214: Heavy Tactical Long Arm | C214: 3 | D214: 1d6+3 | E214: Long | F214: 2000
A215: of:=IF([.B215]=""; ""; [.B215]&" (Level "&[.C215]&", "&[.D215]&" Damage, "&[.E215]&" range)") -> Light Assault Sidearm (Level 4, 1d6+4 Damage, Short range) | B215: Light Assault Sidearm | C215: 4 | D215: 1d6+4 | E215: Short | F215: 4000
A216: of:=IF([.B216]=""; ""; [.B216]&" (Level "&[.C216]&", "&[.D216]&" Damage, "&[.E216]&" range)") -> Light Assault Carbine (Level 4, 1d6+4 Damage, Medium range) | B216: Light Assault Carbine | C216: 4 | D216: 1d6+4 | E216: Medium | F216: 6000
A217: of:=IF([.B217]=""; ""; [.B217]&" (Level "&[.C217]&", "&[.D217]&" Damage, "&[.E217]&" range)") -> Light Assault Long Arm (Level 4, 1d6+4 Damage, Long range) | B217: Light Assault Long Arm | C217: 4 | D217: 1d6+4 | E217: Long | F217: 8000
A218: of:=IF([.B218]=""; ""; [.B218]&" (Level "&[.C218]&", "&[.D218]&" Damage, "&[.E218]&" range)") -> Heavy Assault Sidearm (Level 5, 1d6+5 Damage, Short range) | B218: Heavy Assault Sidearm | C218: 5 | D218: 1d6+5 | E218: Short | F218: 12000
A219: of:=IF([.B219]=""; ""; [.B219]&" (Level "&[.C219]&", "&[.D219]&" Damage, "&[.E219]&" range)") -> Heavy Assault Carbine (Level 5, 1d6+5 Damage, Medium range) | B219: Heavy Assault Carbine | C219: 5 | D219: 1d6+5 | E219: Medium | F219: 16000
A220: of:=IF([.B220]=""; ""; [.B220]&" (Level "&[.C220]&", "&[.D220]&" Damage, "&[.E220]&" range)") -> Heavy Assault Long Arm (Level 5, 1d6+5 Damage, Long range) | B220: Heavy Assault Long Arm | C220: 5 | D220: 1d6+5 | E220: Long | F220: 20000
A222: Explosives And Grenades
A223: of:=HYPERLINK("#EXPLOSIVE_WEAPON_CHART"; "EXPLOSIVE_WEAPON_CHART") -> EXPLOSIVE_WEAPON_CHART
A224: of:=HYPERLINK("#EXPLOSIVE_WEAPON_LIST"; "EXPLOSIVE_WEAPON_LIST") -> EXPLOSIVE_WEAPON_LIST
A225: Select Name | B225: Name | C225: Level | D225: Damage | E225: Range | F225: Cost | G225: Notes
A226: of:=IF([.B226]=""; ""; [.B226]&" (Level "&[.C226]&", "&[.D226]&" Damage, "&[.E226]&" range)") -> Low Yield Construction Explosive (Level 1, 1d6+1 Damage, Short range) | B226: Low Yield Construction Explosive | C226: 1 | D226: 1d6+1 | E226: Short | F226: 20 | G226: Area (10 m)
A227: of:=IF([.B227]=""; ""; [.B227]&" (Level "&[.C227]&", "&[.D227]&" Damage, "&[.E227]&" range)") -> High Yield Construction Explosive (Level 2, 1d6+2 Damage, Short range) | B227: High Yield Construction Explosive | C227: 2 | D227: 1d6+2 | E227: Short | F227: 40 | G227: Area (30 m)
A228: of:=IF([.B228]=""; ""; [.B228]&" (Level "&[.C228]&", "&[.D228]&" Damage, "&[.E228]&" range)") -> Stun Grenade (Level 3, 1d6+3 Damage, Medium range) | B228: Stun Grenade | C228: 3 | D228: 1d6+3 | E228: Medium | F228: 40 | G228: Area (5 m), Stunning
A229: of:=IF([.B229]=""; ""; [.B229]&" (Level "&[.C229]&", "&[.D229]&" Damage, "&[.E229]&" range)") -> Flashbang Grenade (Level 3, 1d6+3 Damage, Medium range) | B229: Flashbang Grenade | C229: 3 | D229: 1d6+3 | E229: Medium | F229: 60 | G229: Area (5 m), Blinding, Stunning
A230: of:=IF([.B230]=""; ""; [.B230]&" (Level "&[.C230]&", "&[.D230]&" Damage, "&[.E230]&" range)") -> Rocket Grenade (Level 3, 1d6+3 Damage, Long range) | B230: Rocket Grenade | C230: 3 | D230: 1d6+3 | E230: Long | F230: 120 | G230: Area (5 m)
A231: of:=IF([.B231]=""; ""; [.B231]&" (Level "&[.C231]&", "&[.D231]&" Damage, "&[.E231]&" range)") -> Antiarmor Rocket Grenade (Level 3, 1d6+3 Damage, Long range) | B231: Antiarmor Rocket Grenade | C231: 3 | D231: 1d6+3 | E231: Long | F231: 180 | G231: Area (5 m), Piercing
A232: of:=IF([.B232]=""; ""; [.B232]&" (Level "&[.C232]&", "&[.D232]&" Damage, "&[.E232]&" range)") -> Gas Grenade (Level 4, 1d6+4 Damage, Medium range) | B232: Gas Grenade | C232: 4 | D232: 1d6+4 | E232: Medium | F232: 60 | G232: Area (10 m), Stunning
A233: of:=IF([.B233]=""; ""; [.B233]&" (Level "&[.C233]&", "&[.D233]&" Damage, "&[.E233]&" range)") -> Entangle/Riot Grenade (Level 4, 1d6+4 Damage, Medium range) | B233: Entangle/Riot Grenade | C233: 4 | D233: 1d6+4 | E233: Medium | F233: 600 | G233: Area (10 m), Stunning, Hold
A234: of:=IF([.B234]=""; ""; [.B234]&" (Level "&[.C234]&", "&[.D234]&" Damage, "&[.E234]&" range)") -> Concussion/Frag Grenade (Level 5, 1d6+5 Damage, Medium range) | B234: Concussion/Frag Grenade | C234: 5 | D234: 1d6+5 | E234: Medium | F234: 120 | G234: Area (10 m)
A235: of:=IF([.B235]=""; ""; [.B235]&" (Level "&[.C235]&", "&[.D235]&" Damage, "&[.E235]&" range)") -> Anti-personnel Incendiary Grenade (Level 5, 1d6+5 Damage, Medium range) | B235: Anti-personnel Incendiary Grenade | C235: 5 | D235: 1d6+5 | E235: Medium | F235: 600 | G235: Area (15 m), Seeking x6, Terrifying
A236: of:=IF([.B236]=""; ""; [.B236]&" (Level "&[.C236]&", "&[.D236]&" Damage, "&[.E236]&" range)") -> Anti-materiel Incendiary Grenade (Level 5, 1d6+5 Damage, Medium range) | B236: Anti-materiel Incendiary Grenade | C236: 5 | D236: 1d6+5 | E236: Medium | F236: 600 | G236: Area (0.5 m), Piercing, Seeking x6, Terrifying
A238: Field Kits
A239: of:=HYPERLINK("#FIELD_KIT_CHART"; "FIELD_KIT_CHART") -> FIELD_KIT_CHART
A240: of:=HYPERLINK("#FIELD_KIT_LIST"; "FIELD_KIT_LIST") -> FIELD_KIT_LIST
A241: Select Name | B241: Name | C241: Level | D241: (Blank Column) | E241: (Blank Column) | F241: Cost | G241: (Blank Column)
A242: of:=IF([.B242]=""; ""; [.B242]&" (Level "&[.C242]&")") -> Field Kit (Level 1) | B242: Field Kit | C242: 1 | F242: 300
A243: of:=IF([.B243]=""; ""; [.B243]&" (Level "&[.C243]&")") -> Field Kit (Level 2) | B243: Field Kit | C243: 2 | F243: 600
A244: of:=IF([.B244]=""; ""; [.B244]&" (Level "&[.C244]&")") -> Field Kit (Level 3) | B244: Field Kit | C244: 3 | F244: 1200
A245: of:=IF([.B245]=""; ""; [.B245]&" (Level "&[.C245]&")") -> Field Kit (Level 4) | B245: Field Kit | C245: 4 | F245: 2400
A246: of:=IF([.B246]=""; ""; [.B246]&" (Level "&[.C246]&")") -> Field Kit (Level 5) | B246: Field Kit | C246: 5 | F246: 4800
A248: of:=HYPERLINK("#A1"; "Top 🡅") -> Top 🡅
A249: Gender
A250: of:=HYPERLINK("#GENDER_LIST"; "GENDER_LIST") -> GENDER_LIST
A251: Androgynous
A252: Asexual
A253: Cis Female
A254: Cis Male
A255: Gender Fluid
A256: Inorganic
A257: Neuter
A258: Nonbinary
A259: Nonhuman
A260: Trans Female
A261: Trans Male
A262: Unsure
A264: of:=HYPERLINK("#A1"; "Top 🡅") -> Top 🡅
A265: Gifts
A266: of:=HYPERLINK("#GIFT_CHART"; "GIFT_CHART") -> GIFT_CHART
A267: of:=HYPERLINK("#GIFT_LIST"; "GIFT_LIST") -> GIFT_LIST
A268: Gift | B268: Type | C268: Description
A269: Animal Empathy | B269: Noncombat | C269: The character can use Diplomacy and Manipulation skills on animals
A270: Attentive | B270: Combat | C270: The character is unaffected by attempts to distract them
A271: Bag Of Tricks | B271: Noncombat | C271: The character carries a bag, a belt, or a backpack with a number of small, ordinary items (Equipment Level 2)
A272: Blindfighting | B272: Combat | C272: The character can engage in combat while blinded without the associated penalties
A273: Connected | B273: Noncombat | C273: The character has a wide ranging network of useful friends, rivals, and former associates
A274: Disarming Expert | B274: Combat | C274: The character can make disarming attacks without the associated penalty
A275: Escape Artist | B275: Combat | C275: The character receives a skill bonus (+6 AV, +6 DV) when attempting to break out of a grapple or the Hold power
A276: Expert Reputation | B276: Noncombat | C276: The character can sometimes gain favors from strangers who are familiar with their work
A277: Famous | B277: Noncombat | C277: The character can sometimes gain favors from strangers who recognize them
A278: Fascinating | B278: Noncombat | C278: The character can sometimes gain favors from admirers
A279: Headquarters | B279: Noncombat | C279: The character has one or more bases of operation, equipped with supplies and workshops reasonable for the character's background and skills
A280: Iron Fists | B280: Combat | C280: The character's unarmed hand-to-hand normal attacks deal points of Health damage equal to the character's Athletics
A281: Linguist | B281: Noncombat | C281: The character is fluent in dozens of languages, and they are capable of quickly deciphering new languages when they encounter them
A282: Mental Calculator | B282: Noncombat | C282: The character can solve complex mathematical equations by thinking about them briefly
A283: Minions | B283: Noncombat | C283: The character has an assortment of minor, mostly nameless lackeys of marginal usefulness
A284: Perfect Recall | B284: Noncombat | C284: The character can perfectly remember any event, document, or recording which the character has clearly seen or heard
A285: Quick Change | B285: Noncombat | C285: The character can change their entire outfit with a quick action
A286: Ranged Disarm | B286: Combat | C286: The character can make a disarming attack with a ranged weapon, with the usual associated penalties
A287: Scrounger | B287: Noncombat | C287: The character can find shelter, food, and personal essentials enough to provide for themselves and a small number of friends
A288: Second Identity | B288: Noncombat | C288: The character has a second, completely legitimate identity which will withstand even the most focused scrutiny
A289: Sense Auras | B289: Noncombat | C289: The character can see the invisible emanations around people
A290: Sharpshooter | B290: Combat | C290: The character may ignore cover in ranged combat, as long as they can see part of the target
A291: Team Player | B291: Combat | C291: Once per scene, the character can grant a skill bonus (+3 AV, +3 DV) to all of their allies
A292: Unsettling | B292: Noncombat | C292: The character can gain a skill bonus (+3 AV, +3 DV) on Manipulation skill rolls pertaining to intimidation and interrogation
A293: Vehicles | B293: Noncombat | C293: The character has an assortment of vehicles at their disposal
A294: Wealthy | B294: Noncombat | C294: The character can solve problems by throwing money at them
A295: Weightless Combat | B295: Combat | C295: The character can fight or perform tasks while weightless without the associated penalties
A297: of:=HYPERLINK("#A1"; "Top 🡅") -> Top 🡅
A298: Growth
A299: of:=HYPERLINK("#GROWTH_CHART"; "GROWTH_CHART") -> GROWTH_CHART
A300: Level | B300: Height | C300: Reach | D300: Mass | E300: Athletics Bonus | F300: Text
A301: 1 | B301: 3 m | C301: 1 m | D301: 340 kg | E301: 1 | F301: of:="Max height "&[.B301]&", mass "&[.D301]&", Athletics +"&[.E301] -> Max height 3 m, mass 340 kg, Athletics +1
A302: 2 | B302: 4 m | C302: 2 m | D302: 800 kg | E302: 1 | F302: of:="Max height "&[.B302]&", mass "&[.D302]&", Athletics +"&[.E302] -> Max height 4 m, mass 800 kg, Athletics +1
A303: 3 | B303: 6 m | C303: 3 m | D303: 2,700 kg | E303: 2 | F303: of:="Max height "&[.B303]&", mass "&[.D303]&", Athletics +"&[.E303] -> Max height 6 m, mass 2,700 kg, Athletics +2
A304: 4 | B304: 10 m | C304: 5 m | D304: 12 t | E304: 2 | F304: of:="Max height "&[.B304]&", mass "&[.D304]&", Athletics +"&[.E304] -> Max height 10 m, mass 12 t, Athletics +2
A305: 5 | B305: 20 m | C305: 10 m | D305: 100 t | E305: 3 | F305: of:="Max height "&[.B305]&", mass "&[.D305]&", Athletics +"&[.E305] -> Max height 20 m, mass 100 t, Athletics +3
A306: 6 | B306: 30 m | C306: 15 m | D306: 340 t | E306: 3 | F306: of:="Max height "&[.B306]&", mass "&[.D306]&", Athletics +"&[.E306] -> Max height 30 m, mass 340 t, Athletics +3
A307: 7 | B307: 40 m | C307: 20 m | D307: 800 t | E307: 4 | F307: of:="Max height "&[.B307]&", mass "&[.D307]&", Athletics +"&[.E307] -> Max height 40 m, mass 800 t, Athletics +4
A308: 8 | B308: 60 m | C308: 30 m | D308: 2,700 t | E308: 4 | F308: of:="Max height "&[.B308]&", mass "&[.D308]&", Athletics +"&[.E308] -> Max height 60 m, mass 2,700 t, Athletics +4
A309: 9 | B309: 100 m | C309: 50 m | D309: 12,000 t | E309: 5 | F309: of:="Max height "&[.B309]&", mass "&[.D309]&", Athletics +"&[.E309] -> Max height 100 m, mass 12,000 t, Athletics +5
A310: 10 | B310: 200 m | C310: 100 m | D310: 100,000 t | E310: 5 | F310: of:="Max height "&[.B310]&", mass "&[.D310]&", Athletics +"&[.E310] -> Max height 200 m, mass 100,000 t, Athletics +5
A312: of:=HYPERLINK("#A1"; "Top 🡅") -> Top 🡅
A313: Haste
A314: of:=HYPERLINK("#HASTE_CHART"; "HASTE_CHART") -> HASTE_CHART
A315: Level | B315: Multiplier | C315: Text
A316: 1 | B316: x100 | C316: of:=[.B316]&" multiplier" -> x100 multiplier
A317: 2 | B317: x200 | C317: of:=[.B317]&" multiplier" -> x200 multiplier
A318: 3 | B318: x500 | C318: of:=[.B318]&" multiplier" -> x500 multiplier
A319: 4 | B319: x1,000 | C319: of:=[.B319]&" multiplier" -> x1,000 multiplier
A320: 5 | B320: x2,000 | C320: of:=[.B320]&" multiplier" -> x2,000 multiplier
A321: 6 | B321: x5,000 | C321: of:=[.B321]&" multiplier" -> x5,000 multiplier
A322: 7 | B322: x10,000 | C322: of:=[.B322]&" multiplier" -> x10,000 multiplier
A323: 8 | B323: x20,000 | C323: of:=[.B323]&" multiplier" -> x20,000 multiplier
A324: 9 | B324: x50,000 | C324: of:=[.B324]&" multiplier" -> x50,000 multiplier
A325: 10 | B325: x100,000 | C325: of:=[.B325]&" multiplier" -> x100,000 multiplier
A327: of:=HYPERLINK("#A1"; "Top 🡅") -> Top 🡅
A328: Motivations
A329: of:=HYPERLINK("#MOTIVATION_CHART"; "MOTIVATION_CHART") -> MOTIVATION_CHART
A330: of:=HYPERLINK("#MOTIVATION_LIST"; "MOTIVATION_LIST") -> MOTIVATION_LIST
A331: Motivation | B331: In Opposition To | C331: Text
A333: Adventure | B333: Security | C333: The character has an adventurous spirit and rarely turns down a quest.
A334: Asceticism | B334: Materialism | C334: The character practices severe self-discipline and avoids all forms of indulgence, typically for spiritual reasons
A335: Audacity | B335: Subtlety | C335: The character is an adrenaline junkie driven by a desire to experience thrills and risk.
A336: Community | B336: Individualism | C336: The character believes that the greatest measure of an individual is in their value to society.
A337: Compassion | B337: Wrath | C337: The character wants to protect others and alleviate their suffering, particularly the innocent and the helpless.
A338: Control | B338: Freedom | C338: The character detests the chaos of human society, and seeks to impose order.
A339: Courage | B339: Fear | C339: The character chooses and is willing to confront agony, danger, and uncertainty.
A340: Curiosity | B340: Faith | C340: The character lives and breathes to solve the world's mysteries.
A341: Detachment | B341: Responsibility | C341: The character seeks to avoid any emotional entanglements on a personal or professional level.
A342: Enlightenment | B342: Secrecy | C342: The character's true calling is education and enlightenment, both their own and others'.
A343: Exploration | B343: Isolation | C343: The character lives to seek out new places and new ideas.
A344: Faith | B344: Curiosity | C344: The character believes in something which is not supported by empirical evidence.
A345: Fear | B345: Courage | C345: The character makes every effort to avoid injury, danger, and uncertainty.
A346: Fellowship | B346: Nobility | C346: The character seeks to eliminate artificial barriers between individuals, such as socioeconomic status or political influence.
A347: Freedom | B347: Control | C347: The character detests the rigid structure of society, and seeks to escape any imposed order and discipline.
A348: Humility | B348: Pride | C348: The character strives to maintain a healthy perspective regarding their own importance in the universe.
A349: Idealism | B349: Pragmatism | C349: The character would die to protect or uphold some cause or ideology.
A350: Individualism | B350: Community | C350: The character believes that the rights of the individual hold the highest moral value.
A351: Isolation | B351: Exploration | C351: The character seeks to avoid exposure to new places and new ideas, preferring the comfort and safety of the known.
A352: Justice | B352: Vengeance | C352: The character seeks to ensure that misdeeds are met with appropriate punishment.
A353: Materialism | B353: Asceticism | C353: The character wants to amass great wealth.
A354: Mercy | B354: Ruthlessness | C354: The character practices benevolence, forgiveness, and kindness.
A355: Nobility | B355: Fellowship | C355: The character was born to rule and command the respect of their lessers.
A356: Passion | B356: Serenity | C356: The character has a visceral, perhaps even savage, nature.
A357: Pragmatism | B357: Idealism | C357: The character believes that practical accomplishments are more important than ideas and philosophies.
A358: Pride | B358: Humility | C358: The character seeks to personify the ideal of something, whether a culture, nationality, social class, or profession.
A359: Rebellion | B359: Traditionalism | C359: The character doesn't fit into the larger society.
A360: Responsibility | B360: Detachment | C360: The character is burdened by the responsibility of their powers.
A361: Ruthlessness | B361: Mercy | C361: The character will allow no personal feelings or squeamishness to cloud their judgment.
A362: Secrecy | B362: Enlightenment | C362: The character strives to hide information from those who are unworthy of it, or from those who are unready to hear it.
A363: Security | B363: Adventure | C363: The character strives to minimize risk, despite the potential reward or excitement.
A364: Serenity | B364: Passion | C364: The character seeks freedom from the mistakes or tragedies of their past.
A365: Subtlety | B365: Audacity | C365: The character seeks to achieve their goals without attracting attention.
A366: Traditionalism | B366: Rebellion | C366: The character believes in structure, tradition, and the chain of command.
A367: Vengeance | B367: Justice | C367: The character seeks revenge for some past wrong done to them or their loved ones.
A368: Wrath | B368: Compassion | C368: The character exults in causing death and destruction, particularly when the target is guilty or despicable.
A370: of:=HYPERLINK("#A1"; "Top 🡅") -> Top 🡅
A371: Movement
A372: of:=HYPERLINK("#MOVEMENT_CHART"; "MOVEMENT_CHART") -> MOVEMENT_CHART
A373: of:=HYPERLINK("#MOVEMENT_CHART_INDEXES"; "MOVEMENT_CHART_INDEXES") -> MOVEMENT_CHART_INDEXES | B373: of:=HYPERLINK("#MOVEMENT_CHART_BASES"; "MOVEMENT_CHART_BASES") -> MOVEMENT_CHART_BASES | C373: of:=HYPERLINK("#MOVEMENT_CHART_BASES_TEXT"; "MOVEMENT_CHART_BASES_TEXT") -> MOVEMENT_CHART_BASES_TEXT | D373: of:=HYPERLINK("#MOVEMENT_CHART_SPRINTS"; "MOVEMENT_CHART_SPRINTS") -> MOVEMENT_CHART_SPRINTS | E373: of:=HYPERLINK("#MOVEMENT_CHART_SPRINTS_KMH"; "MOVEMENT_CHART_SPRINTS_KMH") -> MOVEMENT_CHART_SPRINTS_KMH
A374: 1 | B374: 2 | C374: 3 | D374: 4 | E374: 5
A375: Level | B375: Base (m) | C375: Base Text | D375: Sprint (m) | E375: Sprint (km/h)
A376: -2 | B376: 0 | C376: 0 m | D376: 0 | E376: 1
A377: -1 | B377: 0 | C377: 0 m | D377: 0 | E377: 1
A378: 0 | B378: 1 | C378: 1 m | D378: 6 | E378: 2
A379: 1 | B379: 1.5 | C379: 2 m | D379: 9 | E379: 5
A380: 2 | B380: 3 | C380: 3 m | D380: 18 | E380: 10
A381: 3 | B381: 6 | C381: 6 m | D381: 36 | E381: 20
A382: 4 | B382: 15 | C382: 15 m | D382: 90 | E382: 50
A383: 5 | B383: 30 | C383: 30 m | D383: 180 | E383: 100
A384: 6 | B384: 60 | C384: 60 m | D384: 360 | E384: 200
A385: 7 | B385: 150 | C385: 150 m | D385: 900 | E385: 500
A386: 8 | B386: 300 | C386: 300 m | D386: 1800 | E386: 1000
A387: 9 | B387: 600 | C387: 600 m | D387: 3600 | E387: 2000
A388: 10 | B388: 1500 | C388: 1,500 m | D388: 9000 | E388: 5000
A389: 11 | B389: 3000 | C389: 3,000 m | D389: 18000 | E389: 10000
A390: 12 | B390: 6000 | C390: 6,000 m | D390: 36000 | E390: 20000
A391: 13 | B391: 15000 | C391: 15 km | D391: 90000 | E391: 50000
A392: 14 | B392: 30000 | C392: 30 km | D392: 180000 | E392: 100000
A393: 15 | B393: 60000 | C393: 60 km | D393: 360000 | E393: 200000
A394: 16 | B394: 150000 | C394: 150 km | D394: 900000 | E394: 500000
A395: 17 | B395: 300000 | C395: 300 km | D395: 1800000 | E395: 1000000
A396: 18 | B396: 600000 | C396: 600 km | D396: 3600000 | E396: 2000000
A397: 19 | B397: 1500000 | C397: 1,500 km | D397: 9000000 | E397: 5000000
A398: 20 | B398: 3000000 | C398: 3,000 km | D398: 18000000 | E398: 10000000
A400: of:=HYPERLINK("#A1"; "Top 🡅") -> Top 🡅
A401: Multiplier
A402: of:=HYPERLINK("#MULTIPLIER_CHART"; "MULTIPLIER_CHART") -> MULTIPLIER_CHART
A403: of:=HYPERLINK("#MULTIPLIER_CHART_LIST"; "MULTIPLIER_CHART_LIST") -> MULTIPLIER_CHART_LIST | B403: of:=HYPERLINK("#MULTIPLIER_CHART_INDEXES"; "MULTIPLIER_CHART_INDEXES") -> MULTIPLIER_CHART_INDEXES | C403: of:=HYPERLINK("#MULTIPLIER_CHART_MULTIPLIERS"; "MULTIPLIER_CHART_MULTIPLIERS") -> MULTIPLIER_CHART_MULTIPLIERS
A404: x1 | B404: 0 | C404: 1
A405: x10 | B405: 1 | C405: 10
A406: x100 | B406: 2 | C406: 100
A407: x1,000 | B407: 3 | C407: 1000
A408: x10,000 | B408: 4 | C408: 10000
A409: x100,000 | B409: 5 | C409: 100000
A410: x1,000,000 | B410: 6 | C410: 1000000
A411: x10,000,000 | B411: 7 | C411: 10000000
A412: x100,000,000 | B412: 8 | C412: 100000000
A413: x1,000,000,000 | B413: 9 | C413: 1000000000
A414: x10,000,000,000 | B414: 10 | C414: 10000000000
A416: of:=HYPERLINK("#A1"; "Top 🡅") -> Top 🡅
A417: Origin
A418: of:=HYPERLINK("#ORIGIN_CHART"; "ORIGIN_CHART") -> ORIGIN_CHART
A419: of:=HYPERLINK("#ORIGIN_LIST"; "ORIGIN_LIST") -> ORIGIN_LIST
A420: Name | B420: Description
A422: Alien | B422: The character is a visitor from another world or reality.
A423: Altered | B423: The character has been mutated by an experiment or an accident.
A424: Artificial | B424: The character is a created being, such as a robot or a replicant.
A425: Aspect | B425: The character is the avatar or embodiment of a force or concept.
A426: Engineered | B426: The character was born human but has been extensively and carefully modified.
A427: Equipped | B427: The character is a human with extraordinary equipment.
A428: Gifted | B428: The character was born with strange and powerful abilities.
A429: Natural | B429: The character was born ordinary and has stayed that way.
A430: Zenith | B430: The character was born human but has transcended their own humanity.
A432: of:=HYPERLINK("#A1"; "Top 🡅") -> Top 🡅
A433: Powers
A434: of:=HYPERLINK("#POWER_CHART"; "POWER_CHART") -> POWER_CHART
A435: of:=HYPERLINK("#POWER_CHART_NAMES"; "POWER_CHART_NAMES") -> POWER_CHART_NAMES
A436: of:=HYPERLINK("#POWER_CHART_NAMES_IN_UP"; "POWER_CHART_NAMES_IN_UP") -> POWER_CHART_NAMES_IN_UP | C436: of:=HYPERLINK("#POWER_CHART_RANGES"; "POWER_CHART_RANGES") -> POWER_CHART_RANGES | D436: of:=HYPERLINK("#POWER_CHART_AREAS"; "POWER_CHART_AREAS") -> POWER_CHART_AREAS | E436: of:=HYPERLINK("#POWER_CHART_TYPES"; "POWER_CHART_TYPES") -> POWER_CHART_TYPES | F436: of:=HYPERLINK("#POWER_CHART_ATTACKS"; "POWER_CHART_ATTACKS") -> POWER_CHART_ATTACKS | G436: of:=HYPERLINK("#POWER_CHART_ACTIONS"; "POWER_CHART_ACTIONS") -> POWER_CHART_ACTIONS | H436: of:=HYPERLINK("#POWER_CHART_PREREQ_1"; "POWER_CHART_PREREQ_1") -> POWER_CHART_PREREQ_1 | I436: of:=HYPERLINK("#POWER_CHART_PREREQ_2"; "POWER_CHART_PREREQ_2") -> POWER_CHART_PREREQ_2 | J436: of:=HYPERLINK("#POWER_CHART_PREREQ_3"; "POWER_CHART_PREREQ_3") -> POWER_CHART_PREREQ_3 | K436: of:=HYPERLINK("#POWER_CHART_INDEXES"; "POWER_CHART_INDEXES") -> POWER_CHART_INDEXES | L436: of:=HYPERLINK("#POWER_CHART_DESCRIPTIONS"; "POWER_CHART_DESCRIPTIONS") -> POWER_CHART_DESCRIPTIONS
A437: 1 | B437: 2 | C437: 3 | D437: 4 | E437: 5 | F437: 6 | G437: 7 | H437: 8 | I437: 9 | J437: 10 | K437: 11 | L437: 12
A438: Name | B438: Sort By | C438: Range | D438: Area | E438: Type | F438: Attack | G438: Action | H438: Prerequisite 1 | I438: Prerequisite 2 | J438: Prerequisite 3 | K438: Index | L438: Description
A439: Absorption | B439: Absorption | E439: Personal | G439: Constant | K439: 1 | L439: Whenever the character is successfully attacked with a normal attack, they gain a +3 bonus
A440: Alteration Resistance | B440: Alteration Resistance | E440: Resistance | G440: Constant | K440: 2 | L440: Allows the character to withstand attacks which would transform them or damage any of their abilities
A441: Alternate Form | B441: Alternate Form | E441: Personal | G441: Standard action | K441: 3 | L441: Grants the character a second independent identity, with its own skills, gifts, and powers
A442: Ambient Awareness | B442: Ambient Awareness | E442: Personal | G442: Anytime action | K442: 4 | L442: Permits the character to perceive equally well in every direction simultaneously
A443: Astral Travel | B443: Astral Travel | E443: Personal | G443: Standard action | K443: 5 | L443: Permits the character's consciousness to travel to anywhere on Earth, to alternate realities, and to divergent time streams
A444: Blast | B444: Blast | C444: Ranged | E444: Normal | F444: true | G444: Standard action | K444: 6 | L444: A ranged normal attack which deals points of Health damage
A445: Blindsight | B445: Blindsight | E445: Personal | G445: Anytime action | K445: 7 | L445: Permits the character to sense symbols, shapes, and textures, but without the ability to distinguish color
A446: Bulletproof | B446: Bulletproof | E446: Personal | G446: Constant | K446: 8 | L446: Permits the character to ignore most attacks from ordinary weapons
A447: Clairvoyance | B447: Clairvoyance | E447: Personal | G447: Standard action | K447: 9 | L447: Permits the character to perceive things at a distance
A448: Clinging | B448: Clinging | E448: Personal | G448: Anytime action | K448: 10 | L448: Permits the character to move along walls, ceilings, and other surfaces as if they were level
A449: Combination | B449: Combination | E449: Personal | G449: Standard action | K449: 11 | L449: Permits several characters to merge into a single larger and more powerful character
A450: Command [Subject] | B450: Command [Subject] | C450: Ranged | E450: Mental | F450: true | G450: Standard action | K450: 12 | L450: Allows the character to animate and/or mentally control one or more inanimate or non-sentient subjects
A451: Damage Resistance | B451: Damage Resistance | E451: Resistance | G451: Constant | K451: 13 | L451: Allows the character to withstand normal attacks
A452: Damaging Aura | B452: Damaging Aura | C452: Hand-to-hand | E452: Normal | F452: true | G452: Quick action | K452: 14 | L452: Hurts anyone who touches the character
A453: Danger Sense | B453: Danger Sense | E453: Personal | G453: Anytime action | K453: 15 | L453: Permits the character to sense danger and avoid being surprised
A454: Darkness | B454: Darkness | C454: Ranged | D454: Area | E454: Environmental | G454: Standard action | K454: 16 | L454: Makes an area opaque to all sight
A455: Dazzle | B455: Dazzle | C455: Ranged | E455: Alteration | F455: true | G455: Standard action | K455: 17 | L455: Renders the target unable to see clearly
A456: Density Control | B456: Density Control | E456: Personal | G456: Quick action | K456: 18 | L456: Permits the character to become denser and heavier than normal
A457: Dimensional Travel | B457: Dimensional Travel | E457: Personal | G457: Standard action | K457: 19 | L457: Permits the character to traverse dimensional boundaries, visiting alternate realities and divergent time streams
A458: Duplication | B458: Duplication | E458: Personal | G458: Quick action | K458: 20 | L458: Permits the character to make identical copies of themselves
A459: [Element] Form | B459: Element Form | E459: Personal | G459: Quick action | K459: 21 | L459: Permits the character to physically transform their body into a force or substance
A460: [Element] Immunity | B460: Element Immunity | E460: Personal | G460: Constant | K460: 22 | L460: Provides complete immunity against the damage from a specific force or substance
A461: [Element] Wall | B461: Element Wall | C461: Ranged | D461: Area | E461: Environmental | G461: Standard action | K461: 23 | L461: Permits the character to create walls and simple geometric shapes
A462: Emotion Control | B462: Emotion Control | C462: Ranged | E462: Mental | F462: true | G462: Standard action | K462: 24 | L462: Allows the character to influence a target's behavior by controlling their emotional state
A463: Endurance Drain | B463: Endurance Drain | C463: Hand-to-hand | E463: Alteration | F463: true | G463: Standard action | K463: 25 | L463: A hand-to-hand alteration attack which deals points of damage to the target's Endurance
A464: Endurance Theft | B464: Endurance Theft | C464: Hand-to-hand | E464: Alteration | F464: true | G464: Standard action | H464: Endurance Drain | K464: 26 | L464: A hand-to-hand alteration attack which deals points of damage to the target's Endurance and boosts the attacker's Endurance
A465: Environmental Control | B465: Environmental Control | C465: Ranged | D465: Area | E465: Environmental | G465: Standard action | K465: 27 | L465: Allows the character to alter the temperature, humidity, and illumination within the affected area
A466: Environmental Immunity | B466: Environmental Immunity | E466: Personal | G466: Constant | K466: 28 | L466: Permits the character to survive in environments and conditions that would impair or even kill normal people
A467: Extra Actions | B467: Extra Actions | E467: Personal | G467: Quick action | K467: 29 | L467: Permits the character to move or take one additional standard action during their turn
A468: Flight | B468: Flight | E468: Movement | K468: 30 | L468: Permits the character to move freely in three dimensions
A469: Growth | B469: Growth | E469: Personal | G469: Quick action | K469: 31 | L469: Permits the character to become bigger and heavier than normal
A470: Haste | B470: Haste | E470: Personal | G470: Constant | K470: 32 | L470: Permits the character to perform everyday tasks extraordinarily quickly
A471: Healing | B471: Healing | C471: Hand-to-hand | E471: Alteration | G471: Standard action | K471: 33 | L471: Restores lost Health to another character
A472: Health Drain | B472: Health Drain | C472: Hand-to-hand | E472: Alteration | F472: true | G472: Standard action | K472: 34 | L472: A hand-to-hand alteration attack which deals points of damage to the target's Health
A473: Health Theft | B473: Health Theft | C473: Hand-to-hand | E473: Alteration | F473: true | G473: Standard action | H473: Health Drain | K473: 35 | L473: A hand-to-hand alteration attack which deals points of damage to the target's Health and boosts the attacker's Health
A474: Hold | B474: Hold | C474: Ranged | E474: Alteration | F474: true | G474: Standard action | K474: 36 | L474: Makes it difficult for a target to move or take any actions
A475: Hyperacuity | B475: Hyperacuity | E475: Personal | G475: Quick action | K475: 37 | L475: Permits the character to sense details too small, faint, or distant for ordinary human senses to detect
A476: Illusion | B476: Illusion | C476: Ranged | D476: Area | E476: Environmental | G476: Standard action | K476: 38 | L476: Permits the character to create realistic three-dimensional phantasms, complete with all associated sensory accompaniment
A477: Immortality | B477: Immortality | E477: Personal | G477: Constant | K477: 39 | L477: The character will never grow old or die from "natural causes"
A478: Intangibility | B478: Intangibility | E478: Personal | G478: Quick action | K478: 40 | L478: Permits the character to move through solid matter as though through water
A479: Invisibility | B479: Invisibility | E479: Personal | G479: Quick action | K479: 41 | L479: Makes the character difficult to perceive with ordinary human senses
A480: Mental Resistance | B480: Mental Resistance | E480: Resistance | G480: Constant | K480: 42 | L480: Allows the character to withstand withstand mental attacks and unnatural coercion
A481: Mind Blast | B481: Mind Blast | C481: Ranged | E481: Mental | F481: true | G481: Standard action | K481: 43 | L481: A ranged mental attack which deals points of damage to the target's Health
A482: Mind Control | B482: Mind Control | C482: Ranged | E482: Mental | F482: true | G482: Standard action | K482: 44 | L482: Allows the character to influence a living creature's behavior, forcing the target to obey the character's commands
A483: Mind Hold | B483: Mind Hold | C483: Ranged | E483: Mental | F483: true | G483: Standard action | K483: 45 | L483: Makes it difficult for a target to move or take any actions
A484: Night Vision | B484: Night Vision | E484: Personal | G484: Anytime action | K484: 46 | L484: Permits the character to see in pitch darkness as clearly as in daylight
A485: Personal Immunity | B485: Personal Immunity | E485: Personal | G485: Constant | K485: 47 | L485: Makes the character immune to any undesirable effects of their own powers
A486: Possession | B486: Possession | C486: Ranged | E486: Mental | F486: true | G486: Standard action | K486: 48 | L486: Allows the character to seize control of a target, making the target a passenger in their own body
A487: Power Drain | B487: Power Drain | C487: Hand-to-hand | E487: Alteration | F487: true | G487: Standard action | K487: 49 | L487: A hand-to-hand alteration attack which deals points of damage to the target's Power Level
A488: Power Mimicry | B488: Power Mimicry | C488: Hand-to-hand | E488: Alteration | F488: true | G488: Standard action | K488: 50 | L488: Allows the character to temporarily copy another character's power and use it themselves
A489: Power Theft | B489: Power Theft | C489: Hand-to-hand | E489: Alteration | F489: true | G489: Standard action | H489: Power Drain | I489: Power Mimicry | K489: 51 | L489: A hand-to-hand alteration attack which deals points of damage to the target's Power Level and boosts the attacker's powers
A490: Probability Control | B490: Probability Control | C490: Ranged | E490: Personal | G490: Anytime action | K490: 52 | L490: The character can make unlikely events likely and likely events unlikely
A491: Radio Communication | B491: Radio Communication | E491: Personal | G491: Anytime action | K491: 53 | L491: Permits the character to send and receive signals over any standard radio frequency
A492: Reflection | B492: Reflection | C492: Ranged | E492: Normal | F492: true | G492: Anytime action | K492: 54 | L492: Permits the character to use an anytime action to reflect a ranged normal attack back at the attacker
A493: Regeneration | B493: Regeneration | E493: Personal | G493: Constant | K493: 55 | L493: Accelerates the healing process and allows the character to recover from injury more quickly
A494: Sense [Element] | B494: Sense [Element] | E494: Personal | G494: Quick action | K494: 56 | L494: Permits the character to perceive, locate, and analyze a substance, material, or energy
A495: Shapeshifting | B495: Shapeshifting | E495: Personal | G495: Quick action | K495: 57 | L495: Permits the character to change their shape, appearance, odor, etc., and they may increase or decrease their size by 50%
A496: Shrinking | B496: Shrinking | E496: Personal | G496: Quick action | K496: 58 | L496: Permits the character to become smaller and lighter than normal
A497: Space Travel | B497: Space Travel | E497: Personal | G497: Standard action | K497: 59 | L497: Permits the character to travel into space, visiting distant worlds and returning in a reasonably prompt fashion
A498: Speak With Objects | B498: Speak With Objects | E498: Personal | G498: Standard action | K498: 60 | L498: Permits the character to communicate with inanimate objects in ways that people normally can't
A499: Speed Drain | B499: Speed Drain | C499: Hand-to-hand | E499: Alteration | F499: true | G499: Standard action | K499: 61 | L499: A hand-to-hand alteration attack which halves the target's movement
A500: Speed Theft | B500: Speed Theft | C500: Hand-to-hand | E500: Alteration | F500: true | G500: Standard action | H500: Speed Drain | K500: 62 | L500: A hand-to-hand alteration attack which halves the target's movement and doubles the attacker's movement
A501: Strength Drain | B501: Strength Drain | C501: Hand-to-hand | E501: Alteration | F501: true | G501: Standard action | K501: 63 | L501: A hand-to-hand alteration attack which halves the target's ability to lift, throw, and jump
A502: Strength Theft | B502: Strength Theft | C502: Hand-to-hand | E502: Alteration | F502: true | G502: Standard action | H502: Strength Drain | K502: 64 | L502: A hand-to-hand alteration attack which halves the target's ability to lift, throw, and jump and doubles the attacker's ability to lift, throw, and jump
A503: Stretching | B503: Stretching | E503: Personal | G503: Quick action | K503: 65 | L503: Permits the character to deform their body and attenuate their extremities
A504: Strike | B504: Strike | C504: Hand-to-hand | E504: Normal | F504: true | G504: Standard action | K504: 66 | L504: An hand-to-hand attack which deals points of Health damage
A505: Super Endurance | B505: Super Endurance | E505: Personal | G505: Constant | K505: 67 | L505: Adds the character's Power Level to their Endurance
A506: Super Health | B506: Super Health | E506: Personal | G506: Constant | K506: 68 | L506: Adds the character's Power Level to their Health
A507: Super Reflection | B507: Super Reflection | C507: Ranged | E507: Normal | F507: true | G507: Anytime action | H507: Reflection | K507: 69 | L507: Permits the character to use an anytime action to reflect a ranged normal attack back at any target
A508: Super Running | B508: Super Running | E508: Movement | K508: 70 | L508: Adds the character's Power Level to their Athletics for the purpose of determining the character's base running and sprint
A509: Super Strength | B509: Super Strength | E509: Personal | G509: Constant | K509: 71 | L509: Adds the character's Power Level to their Athletics for the purpose of determining what the character can lift, throw, and jump
A510: Super Swimming | B510: Super Swimming | E510: Movement | K510: 72 | L510: Adds the character's Power Level to their Athletics for the purpose of determining the character's base swimming and swim sprint
A511: Telekinesis | B511: Telekinesis | C511: Ranged | E511: Normal | F511: true | G511: Standard action | K511: 73 | L511: Permits the character to grapple an object or character without touching them
A512: Telepathy | B512: Telepathy | C512: Ranged | E512: Mental | F512: true | G512: Standard action | K512: 74 | L512: Permits the character to communicate directly with the mind of another person
A513: Teleportation | B513: Teleportation | E513: Movement | K513: 75 | L513: Permits the character to travel from one point to another without traversing the intervening space
A514: Teleportation Attack | B514: Teleportation Attack | C514: Hand-to-hand | E514: Alteration | F514: true | G514: Standard action | H514: Teleportation | K514: 76 | L514: A hand-to-hand alteration attack which moves the target from one point to another without them traversing the intervening space.
A515: Time Travel | B515: Time Travel | E515: Personal | G515: Standard action | K515: 77 | L515: Permits the character to traverse the time stream, stepping into the past or the future
A516: [Transformation] Ray | B516: Transformation Ray | C516: Ranged | E516: Alteration | F516: true | G516: Standard action | K516: 78 | L516: Allows the character to use a personal power as an attack
A517: Tunneling | B517: Tunneling | E517: Movement | K517: 79 | L517: Permits the character to move through the earth as easily as other people move through water
A518: X-ray Vision | B518: X-ray Vision | E518: Personal | G518: Anytime action | K518: 80 | L518: Permits the character to see through objects
A519: Ultra-power | B519: zzUltra-power | E519: Personal | G519: Quick action | H519: Four theme powers | K519: 81 | L519: Permits the character to use any power, one at a time, as long as it belongs to the character's unifying theme
A521: of:=HYPERLINK("#A1"; "Top 🡅") -> Top 🡅
A522: Power Boosts
A523: of:=HYPERLINK("#POWER_BOOST_CHART"; "POWER_BOOST_CHART") -> POWER_BOOST_CHART
A524: Name | B524: Description
A525: Area | B525: The power affects everyone within a certain distance of the target.
A526: Ranged | B526: The power may affect a target up to a certain distance away.
A527: Seeking | B527: Allows a character to attack a second time if their first attack is unsuccessful.
A528: Selective | B528: Allows a character to choose who should be affected by an area power, and who shouldn't.
A529: xx10 Area | B529: The maximum area affected by the character's power is multiplied by ten.
A530: x10 Range | B530: The maximum range of the character's power is multiplied by ten.
A531: x10 Sprint | B531: The sprint distance of a character's movement power is multiplied by ten.
A533: of:=HYPERLINK("#A1"; "Top 🡅") -> Top 🡅
A534: Power Level
A535: of:=HYPERLINK("#POWER_LEVEL_CHART"; "POWER_LEVEL_CHART") -> POWER_LEVEL_CHART
A536: of:=HYPERLINK("#POWER_LEVEL_CHART_INDEXES"; "POWER_LEVEL_CHART_INDEXES") -> POWER_LEVEL_CHART_INDEXES | E536: of:=HYPERLINK("#POWER_LEVEL_CHART_RANGES"; "POWER_LEVEL_CHART_RANGES") -> POWER_LEVEL_CHART_RANGES | F536: of:=HYPERLINK("#POWER_LEVEL_CHART_RANGES_TEXT"; "POWER_LEVEL_CHART_RANGES_TEXT") -> POWER_LEVEL_CHART_RANGES_TEXT | G536: of:=HYPERLINK("#POWER_LEVEL_CHART_AREAS"; "POWER_LEVEL_CHART_AREAS") -> POWER_LEVEL_CHART_AREAS
A537: 1 | B537: 2 | C537: 3 | D537: 4 | E537: 5 | F537: 6 | G537: 7 | H537: 8 | I537: 9 | J537: 10 | K537: 11 | L537: 12 | M537: 13
A538: Power Level | B538: Damage | C538: R''3 | D538: R''4 | E538: Long Range (m) | F538: Long Range Text | G538: Area (m radius) | H538: Area Text | I538: Skill Bonus | J538: Min Height Text | K538: Max Height Text | L538: Max Mass Text | M538: Transformation Concat
A539: 0 | B539: 1d6 | C539: 0 | D539: 0 | E539: 60 | F539: 60 m | G539: 0 | H539: 0 m radius | I539: 0 | M539: of:=IF([.A539]=0; "none"; "min height "&[.J539]&"; max height "&[.K539]&", mass "&[.L539]&"; max bonus +"&[.I539]) -> none
A540: 1 | B540: 1d6+1 | C540: 1 | D540: 1 | E540: 100 | F540: 100 m | G540: 1 | H540: 1 m radius | I540: 1 | J540: 20 cm | K540: 3 m | L540: 340 kg | M540: of:=IF([.A540]=0; "none"; "min height "&[.J540]&"; max height "&[.K540]&", mass "&[.L540]&"; max bonus +"&[.I540]) -> min height 20 cm; max height 3 m, mass 340 kg; max bonus +1
A541: 2 | B541: 1d6+2 | C541: 2 | D541: 2 | E541: 200 | F541: 200 m | G541: 2 | H541: 2 m radius | I541: 1 | J541: 2 cm | K541: 4 m | L541: 800 kg | M541: of:=IF([.A541]=0; "none"; "min height "&[.J541]&"; max height "&[.K541]&", mass "&[.L541]&"; max bonus +"&[.I541]) -> min height 2 cm; max height 4 m, mass 800 kg; max bonus +1
A542: 3 | B542: 1d6+3 | C542: 5 | D542: 3 | E542: 300 | F542: 300 m | G542: 3 | H542: 3 m radius | I542: 2 | J542: 2 mm | K542: 6 m | L542: 2,700 kg | M542: of:=IF([.A542]=0; "none"; "min height "&[.J542]&"; max height "&[.K542]&", mass "&[.L542]&"; max bonus +"&[.I542]) -> min height 2 mm; max height 6 m, mass 2,700 kg; max bonus +2
A543: 4 | B543: 1d6+4 | C543: 10 | D543: 6 | E543: 600 | F543: 600 m | G543: 6 | H543: 6 m radius | I543: 2 | J543: 200 μm | K543: 10 m | L543: 12 t | M543: of:=IF([.A543]=0; "none"; "min height "&[.J543]&"; max height "&[.K543]&", mass "&[.L543]&"; max bonus +"&[.I543]) -> min height 200 μm; max height 10 m, mass 12 t; max bonus +2
A544: 5 | B544: 1d6+5 | C544: 20 | D544: 10 | E544: 1000 | F544: 1 km | G544: 10 | H544: 10 m radius | I544: 3 | J544: 20 μm | K544: 20 m | L544: 100 t | M544: of:=IF([.A544]=0; "none"; "min height "&[.J544]&"; max height "&[.K544]&", mass "&[.L544]&"; max bonus +"&[.I544]) -> min height 20 μm; max height 20 m, mass 100 t; max bonus +3
A545: 6 | B545: 1d6+6 | C545: 50 | D545: 20 | E545: 2000 | F545: 2 km | G545: 20 | H545: 20 m radius | I545: 3 | J545: 2 μm | K545: 30 m | L545: 340 t | M545: of:=IF([.A545]=0; "none"; "min height "&[.J545]&"; max height "&[.K545]&", mass "&[.L545]&"; max bonus +"&[.I545]) -> min height 2 μm; max height 30 m, mass 340 t; max bonus +3
A546: 7 | B546: 1d6+7 | C546: 100 | D546: 30 | E546: 3000 | F546: 3 km | G546: 30 | H546: 30 m radius | I546: 4 | J546: 200 nm | K546: 40 m | L546: 800 t | M546: of:=IF([.A546]=0; "none"; "min height "&[.J546]&"; max height "&[.K546]&", mass "&[.L546]&"; max bonus +"&[.I546]) -> min height 200 nm; max height 40 m, mass 800 t; max bonus +4
A547: 8 | B547: 1d6+8 | C547: 200 | D547: 60 | E547: 6000 | F547: 6 km | G547: 60 | H547: 60 m radius | I547: 4 | J547: 20 nm | K547: 60 m | L547: 2,700 t | M547: of:=IF([.A547]=0; "none"; "min height "&[.J547]&"; max height "&[.K547]&", mass "&[.L547]&"; max bonus +"&[.I547]) -> min height 20 nm; max height 60 m, mass 2,700 t; max bonus +4
A548: 9 | B548: 1d6+9 | C548: 500 | D548: 100 | E548: 10000 | F548: 10 km | G548: 100 | H548: 100 m radius | I548: 5 | J548: 2 nm | K548: 100 m | L548: 12,000 t | M548: of:=IF([.A548]=0; "none"; "min height "&[.J548]&"; max height "&[.K548]&", mass "&[.L548]&"; max bonus +"&[.I548]) -> min height 2 nm; max height 100 m, mass 12,000 t; max bonus +5
A549: 10 | B549: 1d6+10 | C549: 1000 | D549: 200 | E549: 20000 | F549: 20 km | G549: 200 | H549: 200 m radius | I549: 5 | J549: 200 pm | K549: 200 m | L549: 100,000 t | M549: of:=IF([.A549]=0; "none"; "min height "&[.J549]&"; max height "&[.K549]&", mass "&[.L549]&"; max bonus +"&[.I549]) -> min height 200 pm; max height 200 m, mass 100,000 t; max bonus +5
A551: of:=HYPERLINK("#A1"; "Top 🡅") -> Top 🡅
A552: Power Levels
A553: of:=HYPERLINK("#POWER_LEVELS_CHART"; "POWER_LEVELS_CHART") -> POWER_LEVELS_CHART
A554: Power Level | B554: Description | C554: Points
A555: 1 | B555: Precocious Child | C555: 10
A556: 2 | B556: Extraordinary Individual | C556: 15
A557: 3 | B557: Street Samurai | C557: 20
A558: 4 | B558: Neighborhood Hero | C558: 30
A559: 5 | B559: City Defender | C559: 40
A560: 6 | B560: National Icon | C560: 55
A561: 7 | B561: Global Guardian | C561: 70
A562: 8 | B562: Planetary Protector | C562: 85
A563: 9 | B563: Galactic Sentinel | C563: 105
A564: 10 | B564: Cosmic Entity | C564: 125
A566: of:=HYPERLINK("#A1"; "Top 🡅") -> Top 🡅
A567: Power Minimum Cost
A568: of:=HYPERLINK("#POWER_MIN_COST_CHART"; "POWER_MIN_COST_CHART") -> POWER_MIN_COST_CHART
A569: Level | B569: Cost | C569: 🡄 Based on power pyramid
A570: 0 | B570: 0
A571: 1 | B571: 1
A572: 2 | B572: 3
A573: 3 | B573: 6
A574: 4 | B574: 10
A575: 5 | B575: 15
A576: 6 | B576: 21
A577: 7 | B577: 28
A578: 8 | B578: 36
A579: 9 | B579: 45
A580: 10 | B580: 55
A582: of:=HYPERLINK("#A1"; "Top 🡅") -> Top 🡅
A583: Sexuality
A584: of:=HYPERLINK("#SEXUALITY_LIST"; "SEXUALITY_LIST") -> SEXUALITY_LIST
A586: Asexual
A587: Bisexual
A588: Heterosexual
A589: Homosexual
A590: Lesbian
A591: Pansexual
A592: Queer
A593: Unsure
A594: None
A596: of:=HYPERLINK("#A1"; "Top 🡅") -> Top 🡅
A597: Shrinking
A598: of:=HYPERLINK("#SHRINKING_CHART"; "SHRINKING_CHART") -> SHRINKING_CHART
A599: Level | B599: Height | C599: Athletics Bonus | D599: Text
A600: 1 | B600: 20 cm | C600: 1 | D600: of:="Min height "&[.B600]&", Athletics +"&[.C600] -> Min height 20 cm, Athletics +1
A601: 2 | B601: 2 cm | C601: 1 | D601: of:="Min height "&[.B601]&", Athletics +"&[.C601] -> Min height 2 cm, Athletics +1
A602: 3 | B602: 2 mm | C602: 2 | D602: of:="Min height "&[.B602]&", Athletics +"&[.C602] -> Min height 2 mm, Athletics +2
A603: 4 | B603: 200 μm | C603: 2 | D603: of:="Min height "&[.B603]&", Athletics +"&[.C603] -> Min height 200 μm, Athletics +2
A604: 5 | B604: 20 μm | C604: 3 | D604: of:="Min height "&[.B604]&", Athletics +"&[.C604] -> Min height 20 μm, Athletics +3
A605: 6 | B605: 2 μm | C605: 3 | D605: of:="Min height "&[.B605]&", Athletics +"&[.C605] -> Min height 2 μm, Athletics +3
A606: 7 | B606: 200 nm | C606: 4 | D606: of:="Min height "&[.B606]&", Athletics +"&[.C606] -> Min height 200 nm, Athletics +4
A607: 8 | B607: 20 nm | C607: 4 | D607: of:="Min height "&[.B607]&", Athletics +"&[.C607] -> Min height 20 nm, Athletics +4
A608: 9 | B608: 2 nm | C608: 5 | D608: of:="Min height "&[.B608]&", Athletics +"&[.C608] -> Min height 2 nm, Athletics +5
A609: 10 | B609: 200 pm | C609: 5 | D609: of:="Min height "&[.B609]&", Athletics +"&[.C609] -> Min height 200 pm, Athletics +5
A611: of:=HYPERLINK("#A1"; "Top 🡅") -> Top 🡅
A612: Skills
A613: of:=HYPERLINK("#SKILL_CHART"; "SKILL_CHART") -> SKILL_CHART
A614: of:=HYPERLINK("#SKILL_LIST"; "SKILL_LIST") -> SKILL_LIST
A616: Athletics | B616: Climbing, gymnastics, riding, running, swimming, throwing objects
A617: Computing | B617: Artificial intelligence, forensics, programming, security systems, sensor operation
A618: Culture | B618: Art, fashion, history, music, philosophy, politics, popular media, religion
A619: Deception | B619: Bluffing, disguise, lying, sales
A620: Diplomacy | B620: Carousing, conversation, etiquette, negotiation, streetwise
A621: Engineering | B621: Architecture, carpentry, cartography, cooking, demolitions, electronics
A622: Finesse | B622: Disabling a trap, forgery, lockpicking, pickpocketing, sleight of hand
A623: Gambling | B623: Card games, dice games, dominoes, formal combat, races, sporting events
A624: Hand-to-hand Combat | B624: Axes, clubs, hand-to-hand powers, spears, swords, unarmed strikes
A625: Investigation | B625: Analyzing evidence, collecting evidence, identifying clues
A626: Manipulation | B626: Bribery, fast talk, interrogation, intimidation, leadership, persuasion, seduction
A627: Medicine | B627: Diagnosis, field medicine, pharmacology, surgery
A628: Mental Combat | B628: Defending against mental attacks, phantasms, mind control, telepathy
A629: Occultism | B629: Analyzing artifacts, remembering obscure lore, deciphering ancient texts
A630: Performance | B630: Comedy, dancing, music, painting, theater, writing novels, writing poetry
A631: Piloting | B631: Aircraft, drones, ground vehicles, heavy machinery, spacecraft, watercraft; navigation
A632: Ranged Combat | B632: Bows, crossbows, pistols, ranged powers, rifles, shotguns, thrown weapons
A633: Science | B633: Anthropology, biology, chemistry, geology, mathematics, physics, psychology
A634: Self-control | B634: Abstinence, concentration, meditation, resisting unhealthy influences
A635: Stealth | B635: Hiding, shadowing, sneaking, stalking
A636: Survival | B636: Foraging, hunting, orienteering, scavenging, tracking
A637: Warfare | B637: Command and control, guerrilla warfare, logistics, military doctrine, strategy, tactics
A639: of:=HYPERLINK("#A1"; "Top 🡅") -> Top 🡅
A640: Skill Level
A641: of:=HYPERLINK("#SKILL_LEVEL_CHART"; "SKILL_LEVEL_CHART") -> SKILL_LEVEL_CHART
A642: of:=HYPERLINK("#SKILL_LEVEL_LIST"; "SKILL_LEVEL_LIST") -> SKILL_LEVEL_LIST
A643: Level | B643: Cost | C643: Description
A644: 0 | B644: 0 | C644: Unskilled
A645: 1 | B645: 1 | C645: Weak
A646: 2 | B646: 2 | C646: Typical
A647: 3 | B647: 3 | C647: Great
A648: 4 | B648: 4 | C648: Brilliant | D648: 🡄 Human Maximum
A649: 5 | B649: 5 | C649: Heroic
A650: 6 | B650: 6 | C650: Awesome
A651: 7 | B651: 7 | C651: Epic
A652: 8 | B652: 8 | C652: Legendary
A653: 9 | B653: 9 | C653: Unearthly
A654: 10 | B654: 10 | C654: Cosmic
A656: of:=HYPERLINK("#A1"; "Top 🡅") -> Top 🡅
A657: Skill Minimum Cost
A658: of:=HYPERLINK("#SKILL_MIN_COST_CHART"; "SKILL_MIN_COST_CHART") -> SKILL_MIN_COST_CHART
A659: Level | B659: Cost | C659: 🡄 Based on skill pyramid
A660: 0 | B660: 0
A661: 1 | B661: 1
A662: 2 | B662: 3
A663: 3 | B663: 6
A664: 4 | B664: 10 | C664: 🡄 Human Maximum
A665: 5 | B665: 15
A666: 6 | B666: 21
A667: 7 | B667: 28
A668: 8 | B668: 36
A669: 9 | B669: 45
A670: 10 | B670: 55
A672: of:=HYPERLINK("#A1"; "Top 🡅") -> Top 🡅
A673: Strength
A674: of:=HYPERLINK("#STRENGTH_CHART"; "STRENGTH_CHART") -> STRENGTH_CHART
A675: Level | B675: Lift (kg) | C675: Lift | D675: Example | E675: Throw 10 kg (m) | F675: Throw 10 kg | G675: Jump (m) | H675: Jump
A676: -2 | B676: 1 | C676: 1 kg | E676: 0 | F676: 0 m | G676: 0 | H676: 0 m
A677: -1 | B677: 3 | C677: 3 kg | E677: 0 | F677: 0 m | G677: 0 | H677: 0 m
A678: 0 | B678: 10 | C678: 10 kg | D678: small dog, mountain bike, used tire, case of beer | E678: 0 | F678: 0 m | G678: 0 | H678: 0 m
A679: 1 | B679: 30 | C679: 30 kg | D679: full suitcase, medium dog | E679: 2 | F679: 2 m | G679: 0.1 | H679: 0 m
A680: 2 | B680: 100 | C680: 100 kg | D680: large dog, manhole cover, medium adult, small safe | E680: 5 | F680: 5 m | G680: 1 | H680: 1 m
A681: 3 | B681: 300 | C681: 300 kg | D681: dumpster, large adult, medium motorcycle, oil drum, medium safe | E681: 10 | F681: 10 m | G681: 2 | H681: 2 m
A682: 4 | B682: 1000 | C682: 1,000 kg | D682: riding horse, touring motorcycle, telephone pole, small car | E682: 20 | F682: 20 m | G682: 4 | H682: 4 m
A683: 5 | B683: 3000 | C683: 3,000 kg | D683: large missile, granite monument, large meteor, large truck, Humvee | E683: 50 | F683: 50 m | G683: 10 | H683: 10 m
A684: 6 | B684: 10000 | C684: 10 t | D684: monster truck, elephant, school bus, cargo helicopter, garbage truck | E684: 100 | F684: 100 m | G684: 20 | H684: 20 m
A685: 7 | B685: 30000 | C685: 30 t | D685: spy satellite, passenger bus, dump truck, houseboat, private jet | E685: 200 | F685: 200 m | G685: 40 | H685: 40 m
A686: 8 | B686: 100000 | C686: 100 t | D686: fire truck, bank vault, battle tank, tanker truck, cargo plane | E686: 500 | F686: 500 m | G686: 100 | H686: 100 m
A687: 9 | B687: 300000 | C687: 300 t | D687: huge mining dump-truck, locomotive, brick house | E687: 1000 | F687: 1,000 m | G687: 200 | H687: 200 m
A688: 10 | B688: 1000000 | C688: 1,000 t | D688: hydro-electric generator, large passenger plane, yacht, drilling rig | E688: 2000 | F688: 2,000 m | G688: 400 | H688: 400 m
A689: 11 | B689: 3000000 | C689: 3,000 t | D689: small bridge | E689: 5000 | F689: 5,000 m | G689: 1000 | H689: 1,000 m
A690: 12 | B690: 10000000 | C690: 10,000 t | D690: nuclear submarine, Eiffel Tower, 10 story building, Brooklyn Bridge | E690: 10000 | F690: 10 km | G690: 2000 | H690: 2,000 m
A691: 13 | B691: 30000000 | C691: 30,000 t | D691: freighter, long train, large bridge | E691: 20000 | F691: 20 km | G691: 4000 | H691: 4,000 m
A692: 14 | B692: 100000000 | C692: 100,000 t | D692: huge nuclear submarine, aircraft carrier, tanker ship | E692: 50000 | F692: 50 km | G692: 10000 | H692: 10 km
A693: 15 | B693: 300000000 | C693: 300,000 t | D693: large office building, large tanker ship, cruise ship | E693: 100000 | F693: 100 km | G693: 20000 | H693: 20 km
A694: 16 | B694: 1000000000 | C694: 1,000,000 t | D694: Empire State Building, Ultra Large Crude Carrier, Golden Gate Bridge | E694: 200000 | F694: 200 km | G694: 40000 | H694: 40 km
A695: 17 | B695: 3000000000 | C695: 3,000,000 t | E695: 500000 | F695: 500 km | G695: 100000 | H695: 100 km
A696: 18 | B696: 10000000000 | C696: 10,000,000 t | D696: Great Pyramid of Khufu, Three Gorges Dam | E696: 1000000 | F696: 1,000 km | G696: 200000 | H696: 200 km
A697: 19 | B697: 30000000000 | C697: 30,000,000 t | E697: 2000000 | F697: 2,000 km | G697: 400000 | H697: 400 km
A698: 20 | B698: 100000000000 | C698: 100,000,000 t | D698: Great Wall of China | E698: 5000000 | F698: 5,000 km | G698: 1000000 | H698: 1,000 km
A700: of:=HYPERLINK("#A1"; "Top 🡅") -> Top 🡅
A701: Stretching
A702: of:=HYPERLINK("#STRETCHING_CHART"; "STRETCHING_CHART") -> STRETCHING_CHART
A703: Level | B703: Reach
A704: 1 | B704: 3 m
A705: 2 | B705: 4 m
A706: 3 | B706: 6 m
A707: 4 | B707: 10 m
A708: 5 | B708: 20 m
A709: 6 | B709: 30 m
A710: 7 | B710: 40 m
A711: 8 | B711: 60 m
A712: 9 | B712: 100 m
A713: 10 | B713: 200 m
A715: of:=HYPERLINK("#A1"; "Top 🡅") -> Top 🡅
A716: Telekinesis
A717: These values are referenced from Strength, above.
A718: of:=HYPERLINK("#TELEKINESIS_CHART"; "TELEKINESIS_CHART") -> TELEKINESIS_CHART
A719: Level | B719: Max Lift (kg) | C719: Max Lift | D719: Example | E719: Throw 10 kg (m) | F719: Throw 10 kg
A720: 0 | B720: 10 | C720: 10 kg | D720: small dog, mountain bike, used tire, case of beer | E720: 0 | F720: 0 m
A721: 1 | B721: 100 | C721: 100 kg | D721: large dog, manhole cover, medium adult, small safe | E721: 5 | F721: 5 m
A722: 2 | B722: 1000 | C722: 1,000 kg | D722: riding horse, touring motorcycle, telephone pole, small car | E722: 20 | F722: 20 m
A723: 3 | B723: 10000 | C723: 10 t | D723: monster truck, elephant, school bus, cargo helicopter, garbage truck | E723: 100 | F723: 100 m
A724: 4 | B724: 100000 | C724: 100 t | D724: fire truck, bank vault, battle tank, tanker truck, cargo plane | E724: 500 | F724: 500 m
A725: 5 | B725: 1000000 | C725: 1,000 t | D725: hydro-electric generator, large passenger plane, yacht, drilling rig | E725: 2000 | F725: 2,000 m
A726: 6 | B726: 10000000 | C726: 10,000 t | D726: nuclear submarine, Eiffel Tower, 10 story building, Brooklyn Bridge | E726: 10000 | F726: 10 km
A727: 7 | B727: 100000000 | C727: 100,000 t | D727: huge nuclear submarine, aircraft carrier, tanker ship | E727: 50000 | F727: 50 km
A728: 8 | B728: 1000000000 | C728: 1,000,000 t | D728: Empire State Building, Ultra Large Crude Carrier, Golden Gate Bridge | E728: 200000 | F728: 200 km
A729: 9 | B729: 10000000000 | C729: 10,000,000 t | D729: Great Pyramid of Khufu, Three Gorges Dam | E729: 1000000 | F729: 1,000 km
A730: 10 | B730: 100000000000 | C730: 100,000,000 t | D730: Great Wall of China | E730: 5000000 | F730: 5,000 km
A732: of:=HYPERLINK("#A1"; "Top 🡅") -> Top 🡅
A733: Teleportation
A734: These values are referenced from Movement, above.
A735: of:=HYPERLINK("#TELEPORTATION_CHART"; "TELEPORTATION_CHART") -> TELEPORTATION_CHART
A736: of:=HYPERLINK("#TELEPORTATION_CHART_INDEXES"; "TELEPORTATION_CHART_INDEXES") -> TELEPORTATION_CHART_INDEXES | B736: of:=HYPERLINK("#TELEPORTATION_CHART_BASES"; "TELEPORTATION_CHART_BASES") -> TELEPORTATION_CHART_BASES | C736: of:=HYPERLINK("#TELEPORTATION_CHART_BASES_TEXT"; "TELEPORTATION_CHART_BASES_TEXT") -> TELEPORTATION_CHART_BASES_TEXT | D736: of:=HYPERLINK("#TELEPORTATION_CHART_SPRINTS"; "TELEPORTATION_CHART_SPRINTS") -> TELEPORTATION_CHART_SPRINTS | E736: of:=HYPERLINK("#TELEPORTATION_CHART_SPRINTS_KMH"; "TELEPORTATION_CHART_SPRINTS_KMH") -> TELEPORTATION_CHART_SPRINTS_KMH
A737: Level | B737: Base (m) | C737: Base | D737: Sprint (m) | E737: Sprint
A738: 1 | B738: 3 | C738: 3 m | D738: 18 | E738: 18 m
A739: 2 | B739: 15 | C739: 15 m | D739: 90 | E739: 90 m
A740: 3 | B740: 60 | C740: 60 m | D740: 360 | E740: 360 m
A741: 4 | B741: 300 | C741: 300 m | D741: 1800 | E741: 1,800 m
A742: 5 | B742: 1500 | C742: 1,500 m | D742: 9000 | E742: 9,000 m
A743: 6 | B743: 6000 | C743: 6,000 m | D743: 36000 | E743: 36 km
A744: 7 | B744: 30000 | C744: 30 km | D744: 180000 | E744: 180 km
A745: 8 | B745: 150000 | C745: 150 km | D745: 900000 | E745: 900 km
A746: 9 | B746: 600000 | C746: 600 km | D746: 3600000 | E746: 3,600 km
A747: 10 | B747: 3000000 | C747: 3,000 km | D747: 18000000 | E747: 18,000 km
A749: of:=HYPERLINK("#A1"; "Top 🡅") -> Top 🡅
A750: End Of Sheet

Sheet: 'file:///D:/Documents/GitData/github.com/bblackmoor/kalos/Kalos-Mechanism-Character-Helper.fods/Kalos-Mechanism-Character-Helper.fods/Kalos-Mechanism-Character-Helper.fods/Kalos-Mechanism-Character-Helper.fods/Kalos-Mechanism-Character-Helper.fods/Kalos-Mechanism-Character-Helper.fods/Kalos-Mechanism-Character-Helper.fods/Kalos-Mechanism-Character-Helper.fods/Kalos-Mechanism-Character-Helper.fods/Kalos-Mechanism-Character-Helper.fods/Kalos-Mechanism-Character-Helper.fods/Kalos-Mechanism-Character-Helper.fods/Kalos-Mechanism-Character-Helper.fods/Kalos-Mechanism-Character-Helper.fods/Kalos-Mechanism-Character-Helper.fods/Kalos-Mechanism-Character-Helper.fods/Kalos-Mechanism-Character-Helper.fods/Kalos-Mechanism-Character-Helper.fods/Kalos-Mechanism-Character-Helper.fods/Kalos-Mechanism-Character-Helper.fods/Kalos-Mechanism-Character-Helper.fods/Kalos-Mechanism-Character-Helper.fods/Kalos-Mechanism-Character-Helper.fods/Kalos-Mechanism-Character-Helper.fods/Kalos-Mechanism-Character-Helper.fods/Kalos-Mechanism-Character-Helper.fods/Kalos-Mechanism-Character-Helper.fods/Kalos-Mechanism-Character-Helper.fods/Kalos-Mechanism-Character-Helper.fods/Kalos-Mechanism-Character-Helper.fods/Kalos-Mechanism-Character-Helper.fods/Kalos-Mechanism-Character-Helper.fods/Kalos-Mechanism-Character-Helper.fods/Kalos-Mechanism-Character-Helper.fods/Kalos-Mechanism-Character-Helper.fods/Kalos-Mechanism-Character-Helper.fods/Kalos-Mechanism-Character-Helper.fods/Kalos-Mechanism-Character-Helper.fods/Kalos-Mechanism-Character-Helper.fods/Kalos-Mechanism-Character-Helper.fods/Kalos-Mechanism-Character-Helper.fods/Kalos-Mechanism-Benchmarks.fods'#Official
A104: 16 | B104: 6000
A105: 17 | B105: 10000
A106: 18 | B106: 20000
A107: 19 | B107: 30000
A108: 20 | B108: 60000
A110: Top 🡅
A111: Equipment
A112: EQUIPMENT_OFFICIAL
A113: Armor
A114: Name | B114: Level | D114: (Blank Column) | E114: Cost | F114: Notes
A115: Industrial PPE | B115: 1 | E115: 400 | F115: Encrypted Radio
A116: Light Tactical Armor | B116: 1 | E116: 1600 | F116: Encrypted Radio, Night Vision
A117: Heavy Tactical Armor | B117: 2 | E117: 2000 | F117: Encrypted Radio, Night Vision
A118: Light Assault Armor | B118: 3 | E118: 4000 | F118: Encrypted Radio, Night Vision
A119: Heavy Assault Armor | B119: 4 | E119: 8000 | F119: Encrypted Radio, Night Vision
A120: Blast Armor | B120: 5 | E120: 16000 | F120: Encrypted Radio, Night Vision
A122: Armor Enhancements
A123: Name | B123: (Blank Column) | D123: (Blank Column) | E123: Cost | F123: Notes
A124: Environmental | E124: 300 | F124: Environmental Immunity
A125: Extreme Cold Adapted | E125: 600 | F125: Environmental Immunity, Cold Immunity
A126: Extreme Heat Adapted | E126: 600 | F126: Environmental Immunity, Heat Immunity

Sheet: 'file:///D:/Documents/GitData/github.com/bblackmoor/kalos/Kalos-Mechanism-Character-Helper.fods/Kalos-Mechanism-Character-Helper.fods/Kalos-Mechanism-Character-Helper.fods/Kalos-Mechanism-Character-Helper.fods/Kalos-Mechanism-Character-Helper.fods/Kalos-Mechanism-Character-Helper.fods/Kalos-Mechanism-Character-Helper.fods/Kalos-Mechanism-Character-Helper.fods/Kalos-Mechanism-Character-Helper.fods/Kalos-Mechanism-Character-Helper.fods/Kalos-Mechanism-Character-Helper.fods/Kalos-Mechanism-Character-Helper.fods/Kalos-Mechanism-Character-Helper.fods/Kalos-Mechanism-Character-Helper.fods/Kalos-Mechanism-Character-Helper.fods/Kalos-Mechanism-Character-Helper.fods/Kalos-Mechanism-Character-Helper.fods/Kalos-Mechanism-Character-Helper.fods/Kalos-Mechanism-Character-Helper.fods/Kalos-Mechanism-Character-Helper.fods/Kalos-Mechanism-Character-Helper.fods/Kalos-Mechanism-Character-Helper.fods/Kalos-Mechanism-Character-Helper.fods/Kalos-Mechanism-Character-Helper.fods/Kalos-Mechanism-Character-Helper.fods/Kalos-Mechanism-Character-Helper.fods/Kalos-Mechanism-Character-Helper.fods/Kalos-Mechanism-Character-Helper.fods/Kalos-Mechanism-Character-Helper.fods/Kalos-Mechanism-Character-Helper.fods/Kalos-Mechanism-Character-Helper.fods/Kalos-Mechanism-Character-Helper.fods/Kalos-Mechanism-Character-Helper.fods/Kalos-Mechanism-Character-Helper.fods/Kalos-Mechanism-Character-Helper.fods/Kalos-Mechanism-Character-Helper.fods/Kalos-Mechanism-Character-Helper.fods/Kalos-Mechanism-Benchmarks.fods'#Data
A14: -2 | B14: 1 | C14: 1 kg | E14: 0 | F14: 0 m | G14: 0 | H14: 0 m | I14: 1 | J14: 0 m (1 km/h) | K14: 0 | L14: 0 m | M14: 0 | N14: 0 m (0 km/h) | O14: 0 | P14: 0 m | Q14: 0 m
A15: -1 | B15: 3 | C15: 3 kg | E15: 0 | F15: 0 m | G15: 0 | H15: 0 m | I15: 1 | J15: 0 m (1 km/h) | K15: 0 | L15: 0 m | M15: 0 | N15: 0 m (0 km/h) | O15: 0 | P15: 0 m | Q15: 0 m
A16: 0 | B16: 10 | C16: 10 kg | D16: small dog, mountain bike, used tire, case of beer | E16: 0 | F16: 0 m | G16: 1 | H16: 1 m | I16: 2 | J16: 6 m (2 km/h) | K16: 0 | L16: 0 m | M16: 0 | N16: 0 m (0 km/h) | O16: 0 | P16: 0 m | Q16: 6 m
A17: 1 | B17: 30 | C17: 30 kg | D17: full suitcase, medium dog | E17: 2 | F17: 2 m | G17: 1.5 | H17: 2 m | I17: 5 | J17: 9 m (5 km/h) | K17: 0.3 | L17: 0 m | M17: 1 | N17: 2 m (1 km/h) | O17: 0.1 | P17: 0 m | Q17: 9 m
A18: 2 | B18: 100 | C18: 100 kg | D18: large dog, manhole cover, medium adult, small safe | E18: 5 | F18: 5 m | G18: 3 | H18: 3 m | I18: 10 | J18: 18 m (10 km/h) | K18: 0.6 | L18: 1 m | M18: 2 | N18: 4 m (2 km/h) | O18: 1 | P18: 1 m | Q18: 18 m
A19: 3 | B19: 300 | C19: 300 kg | D19: dumpster, large adult, medium motorcycle, oil drum, medium safe | E19: 10 | F19: 10 m | G19: 6 | H19: 6 m | I19: 20 | J19: 36 m (20 km/h) | K19: 1.5 | L19: 2 m | M19: 5 | N19: 9 m (5 km/h) | O19: 2 | P19: 2 m | Q19: 36 m
A20: 4 | B20: 1000 | C20: 1,000 kg | D20: riding horse, touring motorcycle, telephone pole, small car | E20: 20 | F20: 20 m | G20: 15 | H20: 15 m | I20: 50 | J20: 90 m (50 km/h) | K20: 3 | L20: 3 m | M20: 10 | N20: 18 m (10 km/h) | O20: 4 | P20: 4 m | Q20: 90 m
A21: 5 | B21: 3000 | C21: 3,000 kg | D21: large missile, granite monument, large meteor, large truck, Humvee | E21: 50 | F21: 50 m | G21: 30 | H21: 30 m | I21: 100 | J21: 180 m (100 km/h) | K21: 6 | L21: 6 m | M21: 20 | N21: 36 m (20 km/h) | O21: 10 | P21: 10 m | Q21: 180 m
A22: 6 | B22: 10000 | C22: 10 t | D22: monster truck, elephant, school bus, cargo helicopter, garbage truck | E22: 100 | F22: 100 m | G22: 60 | H22: 60 m | I22: 200 | J22: 360 m (200 km/h) | K22: 15 | L22: 15 m | M22: 50 | N22: 90 m (50 km/h) | O22: 20 | P22: 20 m | Q22: 360 m
A23: 7 | B23: 30000 | C23: 30 t | D23: spy satellite, passenger bus, dump truck, houseboat, private jet | E23: 200 | F23: 200 m | G23: 150 | H23: 150 m | I23: 500 | J23: 900 m (500 km/h) | K23: 30 | L23: 30 m | M23: 100 | N23: 180 m (100 km/h) | O23: 40 | P23: 40 m | Q23: 900 m
A24: 8 | B24: 100000 | C24: 100 t | D24: fire truck, bank vault, battle tank, tanker truck, cargo plane | E24: 500 | F24: 500 m | G24: 300 | H24: 300 m | I24: 1000 | J24: 1,800 m (1,000 km/h) | K24: 60 | L24: 60 m | M24: 200 | N24: 360 m (200 km/h) | O24: 100 | P24: 100 m | Q24: 1,800 m
A25: 9 | B25: 300000 | C25: 300 t | D25: huge mining dump-truck, locomotive, brick house | E25: 1000 | F25: 1,000 m | G25: 600 | H25: 600 m | I25: 2000 | J25: 3,600 m (2,000 km/h) | K25: 150 | L25: 150 m | M25: 500 | N25: 900 m (500 km/h) | O25: 200 | P25: 200 m | Q25: 3,600 m
A26: 10 | B26: 1000000 | C26: 1,000 t | D26: hydro-electric generator, large passenger plane, yacht, drilling rig | E26: 2000 | F26: 2,000 m | G26: 1500 | H26: 1,500 m | I26: 5000 | J26: 9,000 m (5,000 km/h) | K26: 300 | L26: 300 m | M26: 1000 | N26: 1,800 m (1,000 km/h) | O26: 400 | P26: 400 m | Q26: 9,000 m
A27: 11 | B27: 3000000 | C27: 3,000 t | D27: small bridge | E27: 5000 | F27: 5,000 m | G27: 3000 | H27: 3,000 m | I27: 10000 | J27: 18 km (10,000 km/h) | K27: 600 | L27: 600 m | M27: 2000 | N27: 3,600 m (2,000 km/h) | O27: 1000 | P27: 1,000 m | Q27: 18 km
A28: 12 | B28: 10000000 | C28: 10,000 t | D28: nuclear submarine, Eiffel Tower, 10 story building, Brooklyn Bridge | E28: 10000 | F28: 10 km | G28: 6000 | H28: 6,000 m | I28: 20000 | J28: 36 km (20,000 km/h) | K28: 1500 | L28: 1,500 m | M28: 5000 | N28: 9,000 m (5,000 km/h) | O28: 2000 | P28: 2,000 m | Q28: 36 km
A29: 13 | B29: 30000000 | C29: 30,000 t | D29: freighter, long train, large bridge | E29: 20000 | F29: 20 km | G29: 15000 | H29: 15 km | I29: 50000 | J29: 90 km (50,000 km/h) | K29: 3000 | L29: 3,000 m | M29: 10000 | N29: 18 km (10,000 km/h) | O29: 4000 | P29: 4,000 m | Q29: 90 km
A30: 14 | B30: 100000000 | C30: 100,000 t | D30: huge nuclear submarine, aircraft carrier, tanker ship | E30: 50000 | F30: 50 km | G30: 30000 | H30: 30 km | I30: 100000 | J30: 180 km (100,000 km/h) | K30: 6000 | L30: 6,000 m | M30: 20000 | N30: 36 km (20,000 km/h) | O30: 10000 | P30: 10 km | Q30: 180 km
A31: 15 | B31: 300000000 | C31: 300,000 t | D31: large office building, large tanker ship, cruise ship | E31: 100000 | F31: 100 km | G31: 60000 | H31: 60 km | I31: 200000 | J31: 360 km (200,000 km/h) | K31: 15000 | L31: 15 km | M31: 50000 | N31: 90 km (50,000 km/h) | O31: 20000 | P31: 20 km | Q31: 360 km
A32: 16 | B32: 1000000000 | C32: 1,000,000 t | D32: Empire State Building, Ultra Large Crude Carrier, Golden Gate Bridge | E32: 200000 | F32: 200 km | G32: 150000 | H32: 150 km | I32: 500000 | J32: 900 km (500,000 km/h) | K32: 30000 | L32: 30 km | M32: 100000 | N32: 180 km (100,000 km/h) | O32: 40000 | P32: 40 km | Q32: 900 km
A33: 17 | B33: 3000000000 | C33: 3,000,000 t | E33: 500000 | F33: 500 km | G33: 300000 | H33: 300 km | I33: 1000000 | J33: 1,800 km (1,000,000 km/h) | K33: 60000 | L33: 60 km | M33: 200000 | N33: 360 km (200,000 km/h) | O33: 100000 | P33: 100 km | Q33: 1,800 km
A34: 18 | B34: 10000000000 | C34: 10,000,000 t | D34: Great Pyramid of Khufu, Three Gorges Dam | E34: 1000000 | F34: 1,000 km | G34: 600000 | H34: 600 km | I34: 2000000 | J34: 3,600 km (2,000,000 km/h) | K34: 150000 | L34: 150 km | M34: 500000 | N34: 900 km (500,000 km/h) | O34: 200000 | P34: 200 km | Q34: 3,600 km
A35: 19 | B35: 30000000000 | C35: 30,000,000 t | E35: 2000000 | F35: 2,000 km | G35: 1500000 | H35: 1,500 km | I35: 5000000 | J35: 9,000 km (5,000,000 km/h) | K35: 300000 | L35: 300 km | M35: 1000000 | N35: 1,800 km (1,000,000 km/h) | O35: 400000 | P35: 400 km | Q35: 9,000 km
A36: 20 | B36: 100000000000 | C36: 100,000,000 t | D36: Great Wall of China | E36: 5000000 | F36: 5,000 km | G36: 3000000 | H36: 3,000 km | I36: 10000000 | J36: 18,000 km (10,000,000 km/h) | K36: 600000 | L36: 600 km | M36: 2000000 | N36: 3,600 km (2,000,000 km/h) | O36: 1000000 | P36: 1,000 km | Q36: 18,000 km
A42: 1 | B42: 200 kg | C42: +1
A43: 2 | B43: 500 kg | C43: +1
A44: 3 | B44: 1,000 kg | C44: +2
A45: 4 | B45: 2,000 kg | C45: +2
A46: 5 | B46: 5,000 kg | C46: +3
A47: 6 | B47: 10 t | C47: +3
A48: 7 | B48: 20 t | C48: +4
A49: 8 | B49: 50 t | C49: +4
A50: 9 | B50: 100 t | C50: +5
A51: 10 | B51: 200 t | C51: +5
A57: 1 | B57: 2
A58: 2 | B58: 5
A59: 3 | B59: 10
A60: 4 | B60: 20
A61: 5 | B61: 50
A62: 6 | B62: 100
A63: 7 | B63: 200
A64: 8 | B64: 500
A65: 9 | B65: 1,000
A66: 10 | B66: 2,000

Sheet: 'file:///D:/Documents/GitData/github.com/bblackmoor/kalos/Kalos-Mechanism-Character-Helper.fods/Kalos-Mechanism-Character-Helper.fods/Kalos-Mechanism-Character-Helper.fods/Kalos-Mechanism-Character-Helper.fods/Kalos-Mechanism-Character-Helper.fods/Kalos-Mechanism-Character-Helper.fods/Kalos-Mechanism-Character-Helper.fods/Kalos-Mechanism-Character-Helper.fods/Kalos-Mechanism-Character-Helper.fods/Kalos-Mechanism-Character-Helper.fods/Kalos-Mechanism-Character-Helper.fods/Kalos-Mechanism-Character-Helper.fods/Kalos-Mechanism-Character-Helper.fods/Kalos-Mechanism-Character-Helper.fods/Kalos-Mechanism-Character-Helper.fods/Kalos-Mechanism-Character-Helper.fods/Kalos-Mechanism-Character-Helper.fods/Kalos-Mechanism-Character-Helper.fods/Kalos-Mechanism-Character-Helper.fods/Kalos-Mechanism-Character-Helper.fods/Kalos-Mechanism-Character-Helper.fods/Kalos-Mechanism-Character-Helper.fods/Kalos-Mechanism-Character-Helper.fods/Kalos-Mechanism-Character-Helper.fods/Kalos-Mechanism-Character-Helper.fods/Kalos-Mechanism-Character-Helper.fods/Kalos-Mechanism-Character-Helper.fods/Kalos-Mechanism-Character-Helper.fods/Kalos-Mechanism-Benchmarks.fods'#Calc
C47: Osmium